Rating,Title,Review Description,Pro,Con,Job Title,Status,Region,Date
4,NTUC FP,nan,Stable job helpful colleagues nice office,slow progression overworked at times mundane,Anonymous Employee,Current Employee,nan,01/09/2020
1,Part timer,nan,the staff working there are friendly and the job is manageable,Given a lower salary for parttimer compared to the other similar jobs,Retail Assistant,Current Employee,nan,06/03/2021
3,nan,nan,Friendly and nice people to work with,Can be quite routine after a while,Trolley Boy,Former Employee,nan,10/01/2021
1,Part time,nan,the only pro is that there is a salary,overworked underpaid coworkers are toxic and selfish,Part Time Retail Assistant,Former Employee,nan,04/03/2021
3,Not bad,nan,A stable job U got to see different kinds of peoples,It depends on individuals,Customer Service,Former Employee,Sengkang New Town,23/12/2020
3,Its boring,nan,Easy relaxing job can explore products,Boring low paying job and legs tiring,Retail Associate,Former Employee,nan,04/01/2021
5,Parttime,nan,Good work balance and great people,Very busy and need to carry heavy loads,Retail Sales Associate,Former Employee,nan,08/08/2020
1,,nan,Having a CEO from bank doesnt brings you anywhere,Turning into a bank sector,Branch Manager,Former Employee,Singapore,11/03/2021
3,Place with Nice Working Level Colleagues,nan,Nice Working Environment Great Colleagues Exposure to Retail Environment,Confused by Upper Stakeholders Direction Over Demanding Insensitivity Job gets pushed around Salary below Market Rate,Marketing Manager,Former Employee,Singapore,13/11/2020
4,great,nan,Excellent work place and great company,Working everyday and nothing much to say,Associate Machine Operator,Current Employee,Tuas,27/07/2020
2,low salary bad management a lot of work,nan,nice colleagues to work with,overwork and stretch people even when not enough staff expect ppl to perform better durng covid when we have a lot more things to do nv do well they say ur performance nt good only blame us for nt finishing things but nv see that we also dont have enough ppl alr,Team Leader,Current Employee,Singapore,25/07/2020
5,Recruit First,nan,Great people and understanding staff,Its a small environment thats all,Retail Assistant,Current Employee,Singapore,14/07/2020
3,Benifits,nan,You wont get retrance by companie,Festive season you are not able to take leaves,Retail Assistant,Former Employee,Bedok New Town,02/12/2020
5,fairprice,nan,good company to work long term,there is not much cons,Anonymous Employee,Current Employee,Singapore,05/07/2020
1,Bad Employer,nan,Additional rebate but must join as a NTUC member,No career prospect lower than market pay and basic benefits,Senior Manager,Former Employee,nan,15/12/2020
3,good,nan,good employee benefits and salary,cannot think of anything bad,Executive,Current Employee,Singapore,23/11/2020
2,Do not apply unless you really have to,nan,honestly i cant think of any Lucky to have colleagues who i can share the pain with,Lack of structured career progression Zero work life balance,Anonymous Employee,Former Employee,nan,30/09/2020
1,Poor Management Culture,nan,Big brand Government big brand,FMCG industry Must be able to adapt well,Executive,Former Employee,nan,14/01/2021
3,good,nan,fun learn alot of things,dont really have any cons,Part Time Cashier,Former Employee,Singapore,09/11/2020
1,Low paid,nan,None at all Cannot think of one,Poor management The management cannot spell simple words,Sales AssociateCashier,Current Employee,Singapore,26/12/2020
5,Good,nan,Good staff benefit for overall,Good leadership and management leader,Retail Assistant,Current Employee,Bishan New Town,17/09/2020
5,Decent place,nan,Flexible shift good working benefits,Long working hours low pay,Retail Assistant,Former Employee,Singapore,12/09/2020
2,From best employer to worst,nan,Used to have good benefits and bonus,Everything changed after the consultants came in,Category Manager,Former Employee,Geylang Serai,01/07/2020
2,Dead end as dead end can get,nan,Autonomy to complete task when given,Little to no career progression,Sales Associate,Former Employee,Singapore,25/08/2020
2,NIL,nan,Get to gain a lot of experience with handling customers,Would prefer to not share it now,Retail Assistant,Former Employee,nan,02/09/2020
4,Generally stable workplace,nan,Comfortable very secured generally friendly work colleagues,Slowpaced middleaged group slow pay progression,Senior Executive,Current Employee,nan,03/09/2020
4,NTUC FP,nan,Stable job helpful colleagues nice office,slow progression overworked at times mundane,Anonymous Employee,Current Employee,nan,01/09/2020
3,Not bad,nan,Staff are friendly and willing to guide you,Salary is actually quite low,Anonymous Employee,Former Employee,nan,20/08/2020
5,Parttime,nan,Good work balance and great people,Very busy and need to carry heavy loads,Retail Sales Associate,Former Employee,nan,08/08/2020
2,slow progression,nan,Good colleague but still with politics with other department,baised very slow progression Only focus on certain people,Team Leader,Former Employee,Singapore,26/07/2020
2,overloaded,nan,good colleagues and ok location,overloaded as there under manpower,Customer Service,Former Employee,Singapore,15/08/2020
4,great,nan,Excellent work place and great company,Working everyday and nothing much to say,Associate Machine Operator,Current Employee,Tuas,27/07/2020
5,Recruit First,nan,Great people and understanding staff,Its a small environment thats all,Retail Assistant,Current Employee,Singapore,14/07/2020
5,fairprice,nan,good company to work long term,there is not much cons,Anonymous Employee,Current Employee,Singapore,05/07/2020
1,average experience,nan,gives a good exposure to the retail industry,have to know how to handle bad customers and mean staff,Retail Assistant,Former Employee,Bukit Batok New Town,27/08/2020
2,So much potential but so much lost through senior level politicking,nan,1 Workinglevel teams in generally are cordial when collaborating with each other 2 Brand name It wont be easy to find a Singapore resident who hasnt heard of FairPrice before 3 So much potential in terms of influencing the retail scene in Singapore given its physical footprint and growing online presence,1 Too much politicking at senior management level Each one seems to be interested only in pushing their own agenda and building their own empire by surround themselves with allies Working level staff becomes the collateral damage 2 Undergoing digital transformation but proper change management is severely lacking ie Accept the new systems and processes Take it or leave it Where are the change agents 3 Lots of talk but Wheres the walk Lots of highlevel strategic discussion and projects but it seems that the people who are integral to it all the teams that will execute these initiatives are not consulted much,Executive,Current Employee,Singapore,12/03/2019
2,NTUC Fairprice Selling at a Good Price,nan,You get to meet interesting albeit frustrated people who like to preserve status quo Also they tend to put the staff in fairly good hotels for overseas trips No expenses are spared if you are on overseas business,Change is not something that is encouraged They will do alot of research to prove this and cling onto the old ways of doing things Also expansion and growing a third wing is just a corporate presentation catch phrase with little or no committment Also quite a fair bit of internal strife and tension between the various departments,Manager,Former Employee,Singapore,21/04/2009
4,A good parttime job in a lowstress environment,nan,Friendly people you get to work with middleaged people who are generally more amiable Trainings provided Trainings are provided even for parttime staff Positive working environment working schedule can be quite flexible for parttime staff need discussion with supervisors Get to meet alot of people within branch,Very busy during branch peak hours Rather strict internal audits and inspections failing which would receive warnings shorthanded at times and staff have to take up more than one role Different branches have different styles of management,Retail Assistant PartTime,Former Employee,Singapore,08/01/2011
4,,nan,1 the staff there is really friendly and guide you along pleasant working enviornment 2 for a part timer 10H is pretty good 3 the team leader was understanding and let me take breaks on specific days where i had other commitments,1 the team leader used a paper to hit my butt amongst other questionable things he did and im pretty sure that counts as s3xual harrassment LOL 2 depending on your raceability to speak dialectthe racial makeup of your store you may face some communication barriers as some of them can only speak chinese speak mainly in dialect,Retail Assistant,Current Employee,nan,30/04/2020
1,Lack of working system,nan,I used to work in ntuc fairprice But dissapointed with the working system,My wife working as cheif cashier in northpoint city fairprice Force to do so much work with no team role play Lack of working system Need to do overtime everyday without fail with no overtime payment Manager there lack of experience on managing the branch all team leader force to stay extra hours with no payment no claim of extra hours make people stay overtime as if staff have no family no kids people do OT to have extra income for family but if stay extra hours everyday without fail with nothing to claim then its better to be on time and clock out on the dot Dont force people to stay extra hours as if people have no family,Anonymous Employee,Current Employee,Yishun New Town,20/05/2018
3,Used to be good,nan,This does not apply to all outlet as I worked other outlets before as well but for my current one I have a rather understanding Team Leader Both my parents have several medical check up to attend from time to time and I have to accompany them There were times where I could only work like twice a week due to that and my Team Leader understands If other workplace even if I show those appointment dates and take picture of me and parents and clinic theres no guarantee that they will accept such excuse for my absence Aside from that work wise if we talk about work only not mentioning the type of people we work with the work is fun to do Frankly speaking I enjoy such active job like getting stocks from store or new delivery and then display them accordingly I really enjoy that it gives this accomplish type of feeling and when get to assist those nice customers really can make my day,First joined this company back at 2007 From 2007 all the way till 2015 really nice place to work at despite the rude toxic and troublesome colleagues that likes to take advantage and intentionally cause us trouble just to feed their ego not to make anything better the management back then were great problem solvers They will hear you out properly and do whats needed as soon as possible 2016 onwards till present is pure crap The rude inconsiderate and arrogant started to rule from then on Management didnt even take any action against them at all and when some of us provide feedback in the most professional way possible the only response they can give is the person character is already like that different people different character and many other rubbish explanation Not only did they not take action against such people they even promote them So what happened is these type of people got more big headed Funny thing is as for the ones who I see are usually good polite approachable guide others considerate mindful and helpful does a mistake by accident which is really seldom the management will point it out and confront the person for it The good ones get more and more pressured while the ones who are selfish inconsiderate and disrespectful gets to do as they please,Retail Assistant,Current Employee,Singapore,19/08/2019
1,HR is not good,nan,The job actually is easy to learn,Not good at all for the whole process,Cashier,Current Employee,Singapore,03/04/2018
5,Good times and bad times but mostly good times in general A pinch of bad times,nan,Friendly nice enjoyable convenient attractive happy joyful incredible interesting captivating communicative responsible funny I will take this job over any other job if given a choice between something I do not like and this very very progressive job There was a time when I did not enjoy the work but it was a brief fleeting moment that disappeared,Busy but it is also not entirely so Yet it could be depending on what you are actually doing So everything boils down to something that is not exactly explainable,Anonymous Employee,Former Employee,nan,09/01/2014
2,ExecutiveSpecialist cant wait to get out of here,nan,theres always people around to help u because its a teams effort convenient transport,no work life balance stressful environment team is too big hard to do things faster need a more streamline way of doing things expected to work during weekends,Anonymous Employee,Current Employee,nan,04/12/2019
3,Moving stock and Displaying it,nan,The pay is good and the working environment is quite good as well for a first job The people there are really friendly in teaching you everything,The job is kind of tiring and working hours cannot stretch till 12 hours You can only work up to a total of 7 hours a day as a part timer,Anonymous Employee,Former Employee,nan,17/01/2018
4,Challenging and new experience,nan,This job is almost like any other retail jobs that requires you to interact with customers and to check out their items for them Those who are looking for new experiences can try it out,Those whose physical health which cannot sustain long standing during work hours might not be suitable as this job requires you to stand for long hours During peak hours you might not even have time to take a breather,Cashier,Former Employee,Tampines New Town,07/05/2015
3,lack of growth if you are junior,nan,team work and company benefits bonus are not too bad either it is one of the biggest local company in singapore,not much difference between one who is performing vs another who is not performing well when it is time for rewards etc both get it,nan,Former Employee,Singapore,14/01/2011
4,A comfortable place but that also means its not very exciting,nan,Management can be very accommodating to meeting the needs of staff in intangible arrangements There is very little politics at the lower and midmanagement levels Colleagues are generally very understanding and cooperative,Innovation and the push for it can be very slow The culture can be quite limiting for high achievers especially for those with bold ideas,Purchasing Manager,Current Employee,Singapore,12/08/2012
2,Some tweaks and itd be wonderful,nan,Good learning ground for job seekers with entry level skills where they provide much needed trainings and guidance,has poor career progression my colleagues who worked very hard for 5 years but was not promoted at all,Inventory Controller,Former Employee,Singapore,16/06/2014
4,Customer Service Executive,nan,Large Organization with standards dealing with various business working with people and filling customers needs in different ways Well known for Insurance Fair Price Comfort Delgro etc,At Fair price is the competition in prices a little reduction would help Certain Outlets are open 24hrs but most veg items are not there,Customer Service Executive,Current Employee,Singapore,23/11/2016
5,Full Time Temporary Admin Assistant,nan,nice colleagues and supervisors I really mean it pretty good benefits given there were quite a few department celebrations during my entire stay nice facilities as well,youre either super busy or super free nothing in between,Administrative Assistant,Former Employee,nan,10/01/2017
4,Normal job nothing exciting but not shabby either,nan,Slow paced job most of the time Simple job scope,Long timers usually aunties may bully you at times Workload may be hectic during certain hours especially peak hours,Retail Assistant,Former Employee,nan,30/01/2014
4,Work life balance,nan,Friendly and caring people Great welfare,Long hour during peak period,Anonymous Employee,Current Employee,nan,12/01/2016
4,The culture of FairPrice HQ,nan,The work benefits Work Life balance Supports government implemented work benefits initiatives,Very far location for people not staying in the west,Executive,Former Employee,Singapore,16/08/2017
4,NAME,nan,NAME,NAME,Retail Associate,Former Employee,nan,10/12/2019
4,Learnt a lot,nan,Helpful friendly colleagues Learning experience to work in fast paced environment,Tiring long standing hours Have to deal with all kinds of customers some are demanding Extremely busy during peak hours,Part Time Cashier,Former Employee,Paya Lebar,30/05/2020
4,learn more thing in my life,nan,have fun and communicate well with customers and staff,some bad customers must be handle it,Cashier,Current Employee,Tampines New Town,09/09/2012
4,Work like a family,nan,Best place to work less politic friendly colleague long annual leave annual retreat,increment too slow Salary Adjustment only do it yearly instead of quater,IT Engineer,Current Employee,Singapore,30/11/2016
4,Supportive environment,nan,Stable work life balancing nice colleagues reward good performers,Outdated staff benefits bit slow in deploy changes,Senior Manager,Current Employee,Singapore,28/04/2020
2,ExecutiveSpecialist cant wait to get out of here,nan,theres always people around to help u because its a teams effort convenient transport,no work life balance stressful environment team is too big hard to do things faster need a more streamline way of doing things expected to work during weekends,Anonymous Employee,Current Employee,nan,04/12/2019
3,work non stop,nan,good enviroment good people relationship good service,a lot of over time and need to work for 7 days need to see boss face everytime,nan,Former Employee,nan,08/07/2010
5,Full Time Temporary Admin Assistant,nan,nice colleagues and supervisors I really mean it pretty good benefits given there were quite a few department celebrations during my entire stay nice facilities as well,youre either super busy or super free nothing in between,Administrative Assistant,Former Employee,nan,10/01/2017
1,FT Staff,nan,Colleagues are nice and office is huge,Bonus and payout yearly is pathetic Management team take forever to decide and give you and ans leaving working level at a lost No top level people wish to make decision Processes all in a mess and confusing to new staff whom does what job as no one want to do extra if that is not their job,Anonymous Employee,Current Employee,Singapore,06/05/2019
4,Normal job nothing exciting but not shabby either,nan,Slow paced job most of the time Simple job scope,Long timers usually aunties may bully you at times Workload may be hectic during certain hours especially peak hours,Retail Assistant,Former Employee,nan,30/01/2014
4,Work life balance,nan,Friendly and caring people Great welfare,Long hour during peak period,Anonymous Employee,Current Employee,nan,12/01/2016
2,talk abt simplification no walls at executive levels but in actual fact no one practices that,nan,pro family provides company transport some colleagues are easy going,political some management are lousy quick to claim credits and disorganised,nan,Current Employee,nan,09/04/2017
3,Cashier,nan,it is definitely a good experience but i suggest you work with friends to make it more interesting and not boring,Long working hours Short lunch time Some times there are long queue Might need to work on public holidays some times,Cashier,Former Employee,Singapore,12/02/2013
2,Negative,nan,Used to have good benefits and welfare,Strong politics noncondusive environment to work,Anonymous Employee,Former Employee,nan,04/06/2018
2,management culture,nan,from the top they say they want to innovate,Organisation chart has changed but no process improvements have been done,Manager,Current Employee,Singapore,11/02/2018
4,The culture of FairPrice HQ,nan,The work benefits Work Life balance Supports government implemented work benefits initiatives,Very far location for people not staying in the west,Executive,Former Employee,Singapore,16/08/2017
3,Best place Friendly and team work,nan,Knowledge to know product learning the item,Friendly teamwork helpful be patient,Retail Assistant,Current Employee,Singapore,21/11/2015
4,NAME,nan,NAME,NAME,Retail Associate,Former Employee,nan,10/12/2019
4,Learnt a lot,nan,Helpful friendly colleagues Learning experience to work in fast paced environment,Tiring long standing hours Have to deal with all kinds of customers some are demanding Extremely busy during peak hours,Part Time Cashier,Former Employee,Paya Lebar,30/05/2020
4,learn more thing in my life,nan,have fun and communicate well with customers and staff,some bad customers must be handle it,Cashier,Current Employee,Tampines New Town,09/09/2012
4,Work like a family,nan,Best place to work less politic friendly colleague long annual leave annual retreat,increment too slow Salary Adjustment only do it yearly instead of quater,IT Engineer,Current Employee,Singapore,30/11/2016
2,Family culture but changing too fast and not taking care of its people as much,nan,Family culture Good benefits and discounts,Changing too fast and not taking care of its people as much,nan,Former Employee,nan,18/01/2018
2,Inventory,nan,Good and Friendly working environment,slow promotion for those who start low even if you got your paper qualification done,Anonymous Employee,Current Employee,Jurong West New Town,19/02/2019
4,Supportive environment,nan,Stable work life balancing nice colleagues reward good performers,Outdated staff benefits bit slow in deploy changes,Senior Manager,Current Employee,Singapore,28/04/2020
4,Positive working experience,nan,Very friendly working environment Eyeopener,NAME,Cashier,Former Employee,Singapore,21/12/2016
4,Branch Executive,nan,Nice team mates and cohesive environment within ops group Bonus was pretty good,Poor leadership from middle management and directions were unclear,Anonymous Employee,Former Employee,nan,05/08/2019
3,Purchasing department Average,nan,Friendly and helpful colleagues and supervisors Good working environment and facilities,NAME,nan,Former Employee,nan,08/07/2016
3,friendly environment,nan,people are friendly and helpful like their clan culture environment is stress free,the tasks are repetitive and boring,Retail Assistant,Former Employee,Singapore,29/09/2013
5,Quite a good employee in Singapore,nan,Full exposure to the field of retail sales,Local employer not good enough payment,nan,Former Employee,nan,02/03/2015
3,Team Leader,nan,Good bonus and Work life balanced job alot of fieldtrips however depending on performance,slow career progression People who can bootlick gets better opportunities,nan,Former Employee,nan,28/05/2017
4,Branch executive,nan,Good bonus have control in branch,Unrealistic Budget and old school management,Branch Executive,Current Employee,Singapore,11/05/2019
3,Quality Assurance Executive,nan,Good staff benefits Reasonable working hours,NAME,Quality Assurance,Former Employee,Singapore,20/01/2020
3,LOW MORALE,nan,good working condition and environment helpful staff nice benefit,listen more to the ground low increment low bonus,Engineering,Current Employee,Singapore,26/10/2015
2,Average Workplace,nan,Majority of the colleagues working there are very nice people,No point of bringing up your grievances as it wont get resolved,Team Leader,Former Employee,nan,14/01/2017
4,Executive,nan,Family Culture Good WorkLife Balance Staff Rebate on Groceries,Salary at lower end for fresh graduates Can be slow at times,Anonymous Employee,Current Employee,nan,06/05/2018
3,Cashier,nan,Easy work task May be called to do packaging or restocking,May be called to work suddenly to take over another person,Anonymous Employee,Former Employee,nan,29/11/2018
3,Not too bad for a short run,nan,Family like environment with colleagues,Unrealistic targets when times are bad and need to be rational,Anonymous Employee,Former Employee,nan,04/03/2019
4,Profamily culture with great colleagues,nan,Great colleagues Certain amount of pride in working with Singapores biggest retailer,Progression can be a little slow,Executive,Former Employee,nan,24/03/2019
4,Feedback on working experience,nan,Staff there are friendly and willing to help whenever in need,Very busy with little time to rest,Cashier,Current Employee,Marine Parade,07/05/2020
4,Working hours are decent,nan,Good benefits nice staff managers are alright,Sometimes it can get a bit messy,Store Staff,Former Employee,nan,08/06/2020
4,Cashier of NTUC Fairprice,nan,Good for experience in the retail sector,Very busy during the peak period,Anonymous Employee,Former Employee,nan,01/02/2017
4,Storekeeper,nan,Crossed training and and upgrade training skills through NTUC TRAINING CENTRAL,Control Stock levels from suppliers,Storekeeper,Former Employee,Singapore,27/02/2017
5,NTUC Fairprice,nan,great benefit friendly and social able work environment,alot of work to do can affect work life balance,Anonymous Employee,Current Employee,nan,29/09/2017
3,PartTime Cashier,nan,NAME,NAME,Anonymous Employee,Former Employee,nan,15/11/2017
4,Quick and fast jobs,nan,Fun and simple learning experience for people first entering the workforce,Not many benefits provided for employees,nan,Current Employee,nan,06/07/2018
4,An overall good working experience,nan,Work friendly conducive environment and there is work life balance,Nothing major that I personally experienced,Administrative Assistant,Former Employee,Singapore,25/08/2018
4,Decent Part Time Job,nan,Flexible with school schedule Wage rates change depending on peak periods,A lot of Back room politics involved,Anonymous Employee,Former Employee,nan,15/07/2019
4,cashier almost 1 year,nan,like a enviroment work and place,share a good moments with friends,Anonymous Employee,Current Employee,Jurong East New Town,18/04/2015
