Rating,Title,Review Description,Pro,Con,Job Title,Status,Region,Date
5,Nice coworkers,nan,Very nice and patient coworkers,It is tiring to work for long hours,Cashier,Current Employee,White Sands NM,17/08/2022
5,Good,nan,The workmates at fairprice is very helpful,There is no downsides when working at fairprice,PT Temp Cashier,Former Employee,nan,11/07/2022
2,average experience with shady staff members,nan,location it was close to home,shift timing it was based on an 8hour work shift so morning 8am4pm afternoon 12pm8pm and evening 3pm11pm Plus we only had one day off per week which was insane for a parttime job and the contract was three months long but many left the job after a week Racial discrimination on the first day I met my colleagues who were Malay Our supervisor was a Chinese middleaged woman and she assigned them to the temperature screening station which was literally our job scope and separated me from the rest She spoke to me in mandarin and asked me if I was Chinese Im Indonesian Chinese and then said that I should do work that can benefit me and gain some skills along the way implying that the temp screening job was for nobrainers My new job was at the selfcheckout counter where she ensured me that I could work my way up to cashiering but it was not what I wanted Plus when they took me off of that station because I was underage and couldnt sell people alcohol cigs etc inconvenient the Chinese ladies at that station were denigrating me and mocked my situation Really fun working environment Anyways I hated that job and the environment Left after a month because I needed cash,Part Time Temperature Screener,Former Employee,Choa Chu Kang New Town,19/02/2023
5,Solid Working Environment Friendly Superiors,nan,Employers are friendly and approachable,Difficult to catch a break but due to short hours generally dont need them so often,Retail Packer,Former Employee,Bukit Timah,27/03/2023
3,used to work,nan,very ok to work there,nope the company is ok,Anonymous Employee,Former Employee,Bukit Merah Estate,24/03/2023
4,Nice company to work for,nan,Flexi working hours Flexi benefits,Need to work on weekends and odd hours too,Sr Manager IT,Current Employee,Singapore,20/03/2023
4,ntuc job review,nan,the supermarket is well organised work is straightforward,picky supervisor and rude colleagues,Restaurant Staff,Current Employee,nan,22/03/2023
3,Local enterprise,nan,One of the largest employers in Singapore,not much work life balance a lot of meetings siloed decision making,Deputy Director,Former Employee,Singapore,20/03/2023
4,Nil,nan,Friendly and good working environment,Not bad working environment at ntuc,Part Time Sales Associate,Current Employee,Singapore,19/03/2023
4,Engaging job,nan,Cashiering is very engaging and will not bore you out,Standing for long hours could be tiring for some people,Sales AssociateCashier,Former Employee,Singapore,14/03/2023
0,nan,nan,nan,nan,nan,nan,nan,
2,No work life balance,nan,Earn new friendship during stay,No worklife balance and kept on changing GOALS,Executive,Former Employee,Singapore,14/03/2023
5,Awesome,nan,Good and helpful people around,6 days per week instead of 5 days,NTUC JOB PACKER,Former Employee,nan,15/03/2023
5,Work life balance,nan,Work life balance Decent pay and benefit,Lack of communication When having project need to keep on tight timeline,Senior Executive,Current Employee,Singapore,12/03/2023
4,Good place to start,nan,Good starting pay Family culture Performance bonus Retention bonus,Have to work some weekends Unreasonable customers sometimes May have shift work depending on store,Pharmacist,Current Employee,nan,09/03/2023
4,Meaningful experience that made me respect the workers there,nan,Friendly older workers who are willing to guide and help you along 1 hour lunch break given Learn how the supermarket shelfing system works,6 days work weeks and work is tiring Pay was higher due to festive season but regular pay is really not much for the full or part timers Huge respect to all the workers there,Retail Assistant,Former Employee,nan,20/02/2023
4,Tired but fun,nan,Lucky to have good colleagues who made environment fun,Long hours and shift work,Team Leader,Former Employee,Singapore,12/03/2023
4,Good stable place to work,nan,You make a direct impact on the community and it is the most trusted brand in Singapore,Excessive stakeholder alignement management required that slows down decision making,Lead UX Researcher,Current Employee,Singapore,06/03/2023
3,Apply if u can handle it,nan,Good pay flexible hours can work whenever you want,1 Supervisors are rude and dismissive 2 Long standing hours,NTUC JOB PACKER,Former Employee,nan,08/03/2023
1,Retail,nan,Team is friendly Supported by direct bosses and nice colleagues,Minimal work life balance very long hours working on very lean manpower at belowmarket pay,Executive,Current Employee,Singapore,15/03/2023
4,Good place,nan,Work life balance is there,Growth options are less for employees,Data Engineering Manager,Former Employee,Singapore,09/03/2023
4,Not a bad employer,nan,Nice office and friendly colleagues,Lacks some flexibility and creativity,Marketing Executive,Former Employee,Singapore,28/02/2023
4,Retail Associate Cashier,nan,Friendly working environment and its easy to work not too taxing,Some of the customers can be very demanding,Retail AssociateCashier,Current Employee,Clementi New Town,20/02/2023
4,An okay job,nan,Competitive Pay Simple to get hang of,6 day work week standing job,Sales AssociateCashier,Former Employee,Bedok New Town,24/02/2023
4,Nice company to work,nan,Good la good and friendly colleagues,Nothing can think of at the moment,Cashier,Former Employee,Singapore,22/02/2023
2,No work life balance,nan,Earn new friendship during stay,No worklife balance and kept on changing GOALS,Executive,Former Employee,Singapore,14/03/2023
4,Part Time NTUC,nan,NAME,NAME,NTUC JOB PACKER,Current Employee,Singapore,17/02/2023
4,Good for short term job,nan,Application process was straightforward with helpful and kind full time staff to work with,Rigid work schedule unable to choose preferred days,Cashier,Former Employee,nan,09/02/2023
4,Good,nan,Quit good hahahahaha got good,Busy busy busy busy busy,Cashier,Former Employee,Ang Mo Kio New Town,16/02/2023
3,Apply if u can handle it,nan,Good pay flexible hours can work whenever you want,1 Supervisors are rude and dismissive 2 Long standing hours,NTUC JOB PACKER,Former Employee,nan,08/03/2023
1,Retail,nan,Team is friendly Supported by direct bosses and nice colleagues,Minimal work life balance very long hours working on very lean manpower at belowmarket pay,Executive,Current Employee,Singapore,15/03/2023
5,Good,nan,I like to work supermarket beacause i got experince online ecommarce before this at foodpanda online store in malaysia,Friendly enviroment can learn new things,WAREHOUSE STOREKEEPER,Current Employee,nan,03/02/2023
5,fabulous,nan,it has very flexible working hours,work environment was not very friendly,Anonymous Employee,Current Employee,nan,11/02/2023
1,HR does not even do the bare minimum,nan,People are friendly and chill Its a retirement home literally and figuratively,Team and scope changes without consulting employee business verticals get shut down and HR leaves people without roles and ignores junior employees If you are looking to join this place at your start of your career please do not,Executive,Current Employee,nan,28/02/2023
4,Nice place to work,nan,Nice vibes learned a lot from the superior,sometimes things go bit rigid,Administrative,Current Employee,nan,07/02/2023
3,Nil,nan,Good still not bad people,Stil ok salary low side,Anonymous Employee,Former Employee,Clementi New Town,08/03/2023
4,Relaxed but repetitive,nan,Not much skill needed was able to learn what I needed to do on the first day,Average or below average pay,Retail Assistant,Former Employee,nan,28/01/2023
2,Average,nan,NAME,NAME,Part Time Cashier,Former Employee,nan,05/03/2023
5,ntuc,nan,higher hourly wage than average,extremely hectic throughout the day,Sales AssociateCashier,Former Employee,Serangoon,03/02/2023
3,1,nan,a typical day at work what you learned,Standard working hours Might need to do overtime,Operation Assistant,Former Employee,nan,02/03/2023
5,Environment,nan,Friendly colleagues good working environment,not much need to project leave,Salesperson,Current Employee,nan,01/02/2023
5,fabulous,nan,it has very flexible working hours,work environment was not very friendly,Anonymous Employee,Current Employee,nan,11/02/2023
4,Nice place to work,nan,Nice vibes learned a lot from the superior,sometimes things go bit rigid,Administrative,Current Employee,nan,07/02/2023
1,Work at your own caution,nan,Pay was great during periods of holidays 3 allocated workshifts,Employer at the particular branch was extremely rude and demeaning not just to me but other packers and the fulltime staff were scared of him too,PickerPacker,Former Employee,Hougang New Town,03/02/2023
4,Relaxed but repetitive,nan,Not much skill needed was able to learn what I needed to do on the first day,Average or below average pay,Retail Assistant,Former Employee,nan,28/01/2023
3,help restock goods on shelves,nan,flexible hours and you can choose when is a convenient time to work,takes a toll on your back if you are not cautious with how you carry your items can be tiring during festive seasons,Grocery Stocker,Former Employee,Singapore,19/01/2023
5,ntuc,nan,higher hourly wage than average,extremely hectic throughout the day,Sales AssociateCashier,Former Employee,Serangoon,03/02/2023
5,Environment,nan,Friendly colleagues good working environment,not much need to project leave,Salesperson,Current Employee,nan,01/02/2023
5,Gud,nan,Friendly co workers and supervisor Aircon working space,Required to stand up for the whole shift,Retail Assistant,Former Employee,nan,28/01/2023
2,ok good exposure,nan,goood exposure learn alot of things,unfair treatment and bad culture,Team Leader,Current Employee,Bedok New Town,30/01/2023
3,happy,nan,happ to be part of a big team,too many people there yes,Clerk,Former Employee,nan,26/01/2023
5,Good Management and able to learn a lot,nan,Learnt a lot of different skills Made a lot of great interpersonal relationships,Working hours may get long,Part Time Administrative Assistant,Former Employee,nan,02/01/2023
5,Job,nan,Delightful Interesting Insightful Reassuring Descriptive,Disgusting Not knowledgable Sad Jose Lol,ServerWaiter,Current Employee,nan,12/01/2023
4,Was very tiring,nan,Very fun and tiring at same time,Got to know how filthy they keep the food food safety is horrific,Temp Staff,Current Employee,Singapore,02/01/2023
4,Exec,nan,Good work culture and team,Good environment but lower benefits,Executive,Current Employee,nan,08/01/2023
4,Cashier,nan,Fast pace when festive season,Mundane need strength for packing,Part Time,Former Employee,nan,05/01/2023
4,No complaints,nan,NAME,NAME,Senior Software Engineer,Current Employee,Singapore,30/12/2022
1,Work at your own caution,nan,Pay was great during periods of holidays 3 allocated workshifts,Employer at the particular branch was extremely rude and demeaning not just to me but other packers and the fulltime staff were scared of him too,PickerPacker,Former Employee,Hougang New Town,03/02/2023
3,help restock goods on shelves,nan,flexible hours and you can choose when is a convenient time to work,takes a toll on your back if you are not cautious with how you carry your items can be tiring during festive seasons,Grocery Stocker,Former Employee,Singapore,19/01/2023
4,Good for part times,nan,Work can be easily adapted and stressfree and managers are friendly if you have the right working attitude,Sometimes workload can be heavy always have to be on your feet persistence is the key,Service Crew,Current Employee,Yishun New Town,06/12/2022
4,Great work life balance but indecisive management,nan,Flexible great work life balance and team camaraderie,Management keeps changing goals Rapidly shifting goals is disorienting and wastes time,Business Development,Current Employee,nan,08/12/2022
3,NTUC Review,nan,worklife balance stable for tech,the management is not open to suggestions treat employee as resources instead of as assets,Data Analyst,Current Employee,Singapore,23/12/2022
4,Cashier,nan,Fast pace when festive season,Mundane need strength for packing,Part Time,Former Employee,nan,05/01/2023
4,No complaints,nan,NAME,NAME,Senior Software Engineer,Current Employee,Singapore,30/12/2022
4,Good for part times,nan,Work can be easily adapted and stressfree and managers are friendly if you have the right working attitude,Sometimes workload can be heavy always have to be on your feet persistence is the key,Service Crew,Current Employee,Yishun New Town,06/12/2022
2,Culture,nan,Good HR benefits and perks,Bad culture no team spirit selfcentered leaders superficial colleagues,Anonymous Employee,Former Employee,nan,05/12/2022
4,Great work life balance but indecisive management,nan,Flexible great work life balance and team camaraderie,Management keeps changing goals Rapidly shifting goals is disorienting and wastes time,Business Development,Current Employee,nan,08/12/2022
3,Sales,nan,Ok for customer experience so fat,Tiring work day shifting sched,Retail Sales Associate,Former Employee,nan,13/12/2022
5,very good,nan,The management is very good in handling their employees welfare,Working hours is quite long I work 12hrs everyday except on Sunday which is my time off,Outlet Executive,Former Employee,nan,27/11/2022
5,Good place to work,nan,Great place to work with great colleagues,Long working hours but still manageable Its all worth it though,Retail Assistant,Former Employee,nan,02/12/2022
4,QA,nan,NAME,NAME,Anonymous Employee,Current Employee,nan,26/11/2022
3,NTUC Review,nan,worklife balance stable for tech,the management is not open to suggestions treat employee as resources instead of as assets,Data Analyst,Current Employee,Singapore,23/12/2022
5,good experience,nan,straightforward and nice people around,tiring at times and rude customers,Grocery Replenishment Clerk,Former Employee,nan,16/11/2022
4,Environment,nan,Still exist number of friendly and grateful customers who shows their appreciation Direct supervisor can be flexible sometimes which is helpful to students who wants to work part time job while studying This may differ from outlet to outlet,Stressful environment with demanding customers Due to internal conflicts sometimes supervisors may not be as willing to help staff who are not directly under themor in their department,Cashier,Former Employee,nan,07/08/2022
5,Part Time Retail Assistant,nan,No prior experience is required,Fixed monthly schedule with 6 day work week,Part Time Retail Assistant,Current Employee,Singapore,11/11/2022
5,The good and bad,nan,nice other cashiers that help you once if youre confused,temp cashiers are kinda looked at less so,Temp Cashier,Former Employee,nan,03/11/2022
5,Good,nan,Good culture and nice place to work,Long hours at certain peak times,IT Manager,Current Employee,nan,10/11/2022
4,Executive,nan,Different campaigns to handle Friendly colleague,Pay is alright but could be higher,Executive Assistant,Current Employee,nan,02/11/2022
4,OK not too bad,nan,Areas for growth Benefits good,Management micromanaging Overworked at times,Executive Assistant,Former Employee,nan,18/10/2022
4,Got to earn quick cash,nan,Great for earning quick cash during school term breaks,May be a bit rigid but if you get a nice team lead things can be quite flexible,Anonymous Employee,Former Employee,nan,12/10/2022
4,So far so good,nan,Good bonuses ok working environment,Red tapes after red tapes,Category Manager,Current Employee,nan,26/10/2022
2,Culture,nan,Good HR benefits and perks,Bad culture no team spirit selfcentered leaders superficial colleagues,Anonymous Employee,Former Employee,nan,05/12/2022
5,Good place to work,nan,Family oriented Inclusive Nurturing Work life balance,Traditional Hard to climb Big organisation Lack communication,Executive,Current Employee,London England,17/10/2022
5,Very good,nan,Good company and nice working environment,Island wide distribution and long working hour,Anonymous Employee,Former Employee,nan,18/10/2022
3,Sales,nan,Ok for customer experience so fat,Tiring work day shifting sched,Retail Sales Associate,Former Employee,nan,13/12/2022
5,IT Specialist,nan,Work life balance Work From Home,Due to big organization your role is only limited to limited areas hence learning is slow,IT Specialist,Current Employee,nan,05/10/2022
3,Undesirable management behaviour,nan,1 Worthy corporate cause to moderate cost of essentials in Singapore 2 Good teamwork amongst team,1 Organisation is too large hence internal controls are weak 2 Silos exist in a large department 3 Chasing of targets which tires the ground staff out,Manager,Former Employee,nan,06/07/2022
3,Good,nan,Benefits and salary are decent for those who joined from other wellknown organizations Slowpaced,There are many employees who have worked many years with FP and they are not open to new ideas There are not many opportunities to develop yourself in terms of exposure and growth as everything is wellstructured,Ops Manager,Current Employee,Singapore,04/11/2022
4,Good working culture,nan,Excellent working culture and learning opportunities,Slow progression and slower pace in working environment,Executive,Current Employee,nan,05/10/2022
2,dont work part time thr,nan,nth good about it honestly,only gave 15mins break for 6 hr shift,Cashier,Former Employee,Jurong West New Town,24/11/2022
5,Worklife balance,nan,Friendly environment teamworkdriven colleagues and stressfree even though the work is hard,Low salary but feasible amount as i did not have prior experience in the field,Retail Assistant,Current Employee,Punggol,09/09/2022
4,Team Leader for NTUC online,nan,Worked with nice people and decent work benefits,The pay for working hours can be better 8hr shift work 6 days a week there is OT pay but sometimes you have to work full day which becomes a 1315hr work shift,Team Leader,Former Employee,nan,18/08/2022
3,Parttime cashier,nan,NAME,NAME,Cashier,Former Employee,Pioneer,28/10/2022
3,Long hours of standing,nan,people there are friendly and accommodating,not enough training was understaffed during the pandemic,Cashier,Former Employee,nan,15/11/2022
3,good part time job,nan,high salary compare to competitors and low work hours,6 days work week and language barrier,Retail Assistant,Former Employee,nan,12/11/2022
5,Friendly Staff,nan,Able to communicate with supervisors and manager easily,Some shifts might have too little staffseg closing shift,Retail Assistant,Former Employee,nan,11/09/2022
5,Company Culture,nan,Great team culture made some lasting friends during my time there Work is very teamoriented so everyone helps each other out,Nothing that I can think of now,Anonymous Employee,Former Employee,nan,23/08/2022
3,Cashier,nan,Its good to work as a part timer good colleagues,Nasty customer and manager wont side you,Part Time Cashier,Former Employee,nan,09/11/2022
4,Low pay,nan,Friendly people to work with,Have to work with little pay,Delivery Driver,Former Employee,nan,05/09/2022
4,Cashier,nan,Stable income and near to home,Crowd can spike and there may be last minute OT requests,Cashier,Former Employee,nan,30/08/2022
4,NTUC STOCKTAKER,nan,You wont be under constant supervision,Interacting with difficult customers daily,Grocery Stocker,Former Employee,nan,08/09/2022
4,Great working environment,nan,Able to work with friends and decide job scope between staff,Was made to stand for more than 4 hours at safe entry,Part Time Retail Assistant,Current Employee,Yishun New Town,21/08/2022
5,RA,nan,friendly people they are quite helpful,sometimes having to do other peoples job in a sense,Retail Assistant,Former Employee,nan,19/08/2022
3,Narcissistic Superior,nan,Good perks and allowances on top of basic salary,Typical Middle Aged Office Drama,Fruit Packer,Former Employee,Sengkang New Town,29/10/2022
4,nan,nan,Great company with good benefits,Working hours longer than other similar companies,Analyst,Current Employee,Tuas,27/08/2022
5,Associate,nan,Employee Benefits and shopping vouchers,Not really much downside to it,Anonymous Employee,Former Employee,nan,23/08/2022
5,Good culture growth industry,nan,Fast paced and aggressive growth,Conventional and traditional management style,Talent Acquisition Manager,Current Employee,nan,18/08/2022
5,Retail Associate,nan,Good and friendly Coworkers to work with,Reuqire lots of strength to take stock,Retail Associate,Former Employee,nan,14/08/2022
3,Nil,nan,Not bad good pay good colleagues,Nothing to share much on this,Area Manager,Current Employee,Singapore,22/10/2022
2,Good,nan,Ok to work with them,Expectation high Expect you as a full timer,Part Time Cashier,Former Employee,nan,11/10/2022
5,Permanent part timer at NTUC,nan,working environment is really great,rush hour is very busy,Retail Assistant,Current Employee,nan,29/07/2022
5,RA,nan,friendly people they are quite helpful,sometimes having to do other peoples job in a sense,Retail Assistant,Former Employee,nan,19/08/2022
2,Traditional Company with traditional benefits,nan,Environment is forgiving to mistakes and departments you work with are relatively supportive,Lack of learning opportunities Most people who are in the company are either there for very long which means they prefer to stick to old ways OR new people who have no experience in improving the business You will end up having no guidance or learning,Senior Marketing Executive,Current Employee,Singapore,31/01/2022
4,nan,nan,Great company with good benefits,Working hours longer than other similar companies,Analyst,Current Employee,Tuas,27/08/2022
5,Associate,nan,Employee Benefits and shopping vouchers,Not really much downside to it,Anonymous Employee,Former Employee,nan,23/08/2022
5,Good culture growth industry,nan,Fast paced and aggressive growth,Conventional and traditional management style,Talent Acquisition Manager,Current Employee,nan,18/08/2022
5,Retail Associate,nan,Good and friendly Coworkers to work with,Reuqire lots of strength to take stock,Retail Associate,Former Employee,nan,14/08/2022
3,Overall Work Environment Sup Par,nan,Provides AWSPBV bonuses which not many companies do nowadays No politics in work culture Freedom of remoteHybrid Other company benefits Yearly NTUC gift card company outings prices given during online townhalls Crash courses provided,Hierarchical bosses colleagues Micromanagers Extremely slow opportunities for growth Overall mental health support bad even with incompany counselling Workload does not match the salary given Salary is lower than market rate,Team Leader,Current Employee,nan,25/01/2022
5,Permanent part timer at NTUC,nan,working environment is really great,rush hour is very busy,Retail Assistant,Current Employee,nan,29/07/2022
3,There are better part time jobs out there,nan,Flexible Working Hours PTs get bonus too,Depending on management at outlets staff welfare may not be the best Standing for long hours,Retail Assistant,Current Employee,Singapore,13/07/2022
5,Environment,nan,Friendly and helpful colleagues and bosses,Can be improved salary package and yearly increment,Anonymous Employee,Former Employee,nan,27/07/2022
5,Na,nan,Free time can play gamea,Low pay and money and people,Cleaner,Current Employee,nan,07/07/2022
5,Good,nan,Comfortable environment structured work goals,Lack of progression repetitive work,Cashier,Former Employee,nan,29/06/2022
4,,nan,airconditioned and simple tasks to complete,quite tiring to stand for long hours,Cashier,Former Employee,Sengkang New Town,06/07/2022
