Rating,Title,Review Description,Pro,Con,Job Title,Status,Region,Date
3,a typical day at work what you learned,Good collaboration with supportive team members Good work culture Opportunity to work on cutting edge technologies Management highly encourages employees to learn and take certifications Good benefits No micromanagement Flexible working arrangements Challenging project,a typical day at work what you learned,a typical day at work what you learned,Project Engineer,Former Employee,Singapore City Hall,5/2/2022
4,Good part timer colleagues but aunties a bit toxic,Need to deal with many types of annoying customers Part timer colleagues around the same age will most likely be the only sane people around Some aunties who have been working with ntuc for over 1020 years love to say how senior they are,nan,nan,Cashier Parttime,Former Employee,Singapore,27/02/2023
4,Not bad,good working experience Employers are good and i had wonderful colleagues manage to also celebrate different occasions and attended companys dinner and dance as an itnern,nan,nan,Intern,Former Employee,Singapur PR,20/02/2023
3,Fast Paced,Shift work can be at erratic timings and during holidays and peak period it can get very crowded and congested Additionally customers can be very rude but work is easy to pick up quickly,nan,nan,Cashier Parttime,Former Employee,Tampines,20/02/2023
4,Easy and Flexible,Working at Fairprice as a parttime grocery shopper was a good experience simple job scope just need to pick items according to the list given Lots of walking though,nan,nan,Grocery Shopper,Former Employee,CBP,15/02/2023
5,Easy jobs,Was employed at the ntuc for a short period of time Abt one month Job was a little boring just restocking and checking the foods expiring date Quite chill job Nice supervisors,nan,nan,Retail Assistant,Former Employee,Woodlands,14/02/2023
3,Fast paced and efficiencycentric,Its all about the paced you work and how fast you can clear the stocks from newly arrivals and the ones in the backstore Occasionally got told off just because was engaging with customer inquiries,nan,nan,Store Assistant,Former Employee,Singapore,13/02/2023
3,Rewarding but tiring,Nid to stand for long hours pay was good but need to work for 42 hrs per wk most people are quite friendly and patient as well customers are generally quite nice,nan,nan,Temporary Staff,Former Employee,Tampines,6/2/2023
3,Stressful environment,I worked there for a few months postlockdown periods I was part of the online ecommerce part for NTUC and it was a hectic and stressful environment There were numerous orders a day which forced all the staff to work constantly Inventory is often not stocked due to the constant stream of orders advance orders that need to be cleared before each delivery time slot,nan,nan,employee,Former Employee,Yishun Orchid Country Club,4/2/2023
4,Relaxed but repetitive,I did the same thing everyday Main job scope was to replenish and mostly did replenishing for the whole shift It is a very repetitive job so you will need to get used to it,nan,nan,Retail Assistant,Former Employee,Tiong Bahru Road,28/01/2023
1,productive and fun,it is a office hour job work with min stress less stress means aslo less return But it is all good for low stress job task can do part time study,nan,nan,Admin Assistant,Current Employee,Singapore,23/12/2022
5,Good workplace,Had fun working there understanding how tough the supermarket line work is but it is an essential service fast paced Physical work but with teamwork is fine,nan,nan,Team Leader,Former Employee,Singapore,5/12/2022
4,Demanding job but rewarding and rather fun,I worked as part time cashier 5 days a week 5 hours a day I enjoyed working with my colleagues to serve customers We worked as a team And often helped each other out like reminding each other or helping in various ways Overall it was a rewarding experience,nan,nan,Cashier,Former Employee,Vivocity,29/11/2022
5,Great workplace and colleagues,Typically have to restock goods and answer customers questions when available Also have to order and place stock according to planogram as well as help with other areas when peak time hits,nan,nan,Retail Associate,Former Employee,Kallang,20/10/2022
4,Fun working environment,Simple Job but need to be more alert when handling cashvouchers and other terms of payment made by customers Be patient to every customer needs character especially complaints Need to face stress when it comes to festives seasons,nan,nan,Cashier,Current Employee,Singapore,17/10/2022
4,productive and fun,i get to know friends there the supervisor there is quite friendly and will guide u patiently and whenever u ask them anything they will be glad to help u,nan,nan,restocker,Former Employee,zhong shan,17/09/2022
3,Fun and Convenient,I went to work as a PT at Fairprice Everything was fine job wasnt stressful coworkers are friendly supervisors too until i was dismissed as they found a new permanent staff to replace me I was shocked to hear that it was my last on that day I would not reccomended others to work here for shortterm sch holidays They can just kick you whenever they want to,nan,nan,Restocker,Former Employee,Yew Tee,5/9/2022
5,Very nice people,Coworkers are very friendly and wont hesitate to help you when in need although they like to gossip about others,nan,nan,Cashier Parttime,Former Employee,white sands,17/08/2022
4,Slow paced but can be tough and tiring,Currently working as a replenisher and it is enjoyable if working with people you get along with However their management staff can be very demanding and unhelpful so got to depend on yourself at times,nan,nan,Replenisher,Current Employee,Yishun,16/08/2022
5,Great company and colleagues but tiring,Work here as a part time staff at unity pharmacy by fairpice for 2 years during my studies now currently a full time staff My expirence here is good friendly colleagues family oriented working environment and always supportive Only downside is shift work is tiring work many days then off 1 day and the cycle begins Otherwise everything else is good,nan,nan,Retail Assistant,Current Employee,City square mall,30/07/2022
5,Very Good Company,It is good pay with good benefits i think it is one of the few companies with good benefits and pay that is very very very good and living for the hours,nan,nan,Kitchen Helper,Former Employee,Kovan,23/07/2022
4,Fun Working environment,Family Orientated great culture and many opportunities to learn as individuals However career progression may be limited as there is quite competitive on promotion,nan,nan,Team Leader,Former Employee,Jookoon,13/07/2022
4,Friendly coworkers no work life balance,Coworkers are friendly and helpful Taught me how to do the stuff in the beginning and very thoughtful and understanding Worked 6 days a week as a packer is tiring,Friendly coworkers and boss,6 days a week,Temporary Packer,Former Employee,Yishun,30/05/2022
4,fun place to work at,great environment need learn cashiering and counting own cashiering money before end work most enjoyable is to talk to friends and have lunch together help each other when in need or dealing with difficult customers,nan,nan,cashier,Former Employee,parklane shopping mall,5/5/2022
4,Encouraging,Dependent on manager and team you work with Fast paced and stressful with many transactions to go through Have to learn to deal with difficult customers and to address their demands,nan,nan,Cashier Parttime,Former Employee,Chinatown,28/04/2022
4,Retailer with a heart for customers,The supermarket places emphasis on customer service and prides itself as a social enterprise with the mission to moderate the cost of living Depending on the store the experience can be different,nan,nan,Retail Assistant,Former Employee,Singapore,26/03/2022
5,Good environment,Have different outlet nearest to our home fun environment able to meet different types of people must good in communication must be alert have different job scope weekly,nan,nan,Cashier,Former Employee,Singapore,22/03/2022
5,Very productive and enjoyable,I really enjoyed working with NTUC Its really great experience 🙂 very productive and enjoyable The reason for leaving this Job is just I cant continue permanent night shift Love this company ❤️,nan,nan,Team Leader,Former Employee,Potong Pasir,6/3/2022
3,Stressful but good benefits,The hours are rostered which shows their no regard to employees life outside of work Have to pay for every small cashier miscount Most team leaders are nive and friendly but ther are a lot of annoying and naggy indivualds running the store,nan,nan,Cashier Parttime,Former Employee,Senja,21/02/2022
5,Productive n fun place to work,It’s a easy job but stressful as the job you do never ends unless you stop n take break too many heavy things to carry not good for health but I still enjoyed the job because time flys n some colleges are very friendly,nan,nan,Parttime retail assistant,Former Employee,Shaw plaza,16/02/2022
5,more learning about customer relationship and productive sales,learning about custòmer service rekation with them about feed back what they need if possible inorder to building better service to them about their conplain inorder to improvement to our comoany system and build close relation with customer inorder ti get more support from them in coming future inorder to increase our salesmore friendly and helpfull person toward them with giving a policy face of smile,nan,nan,promoter,Former Employee,singapore,18/01/2022
3,good learning experience,learned many things get to meet different people daily interaction with customer If you are active then will be ok in a fast paced environment and multitasking,nan,nan,Retail Supervisor,Former Employee,Singapore,23/12/2021
5,Productivity and fun,U work hard and work smart Ntuc will take care of you and your payfree upgrade to higher post if u work hard and show them that u are capable and reliable enough to lead a team,nan,nan,Retail Sales Assistant,Former Employee,Singapore,29/11/2021
5,Good working environment,Supportive managers good working environment nice colleagues and good remuneration which made my experience at the NTUC fairprice a good experience,nan,nan,Assistant,Former Employee,Singapore,25/10/2021
5,This is the place of your life changing place bring you to higher level,Everyday you have something to learn and new experience in your workA very good team workif you love the job theres no harder things for youGood teams with full supportbonuses are incredible no idea 😍,nan,nan,Cashier Parttime,Former Employee,Hypt hyper JURONG POINT,18/10/2021
5,Stable job,Its fun working A very big family but you must be able to work together with seniors Cause they tend to be abit grumpy Other then that i experience there is fun,nan,nan,CashierService Crew,Former Employee,Singapore,10/10/2021
4,Ok,Care of staff good environment The hardest part is carrying stock due most of elderly staff Have a chance to learn how to use computer n knowledge,nan,nan,Part Time Service Crew,Current Employee,Thomson,22/07/2021
1,Nothing good,Terrible management Unstructured Only good thing is the freebies from the about to be expired food OT a lot work a lot but pay is very miserable and little,nan,nan,Cashier,Former Employee,Changi,9/7/2021
5,Challenging but Rewarding Environment,Working in NTUC Fairprice has taught me numerous things that helped improve my current skills Management is very good and fair to each and everyone Healthy work environment with good and hardworking colleagues,nan,nan,Team LeaderRetail Supervisor,Current Employee,Singapore,3/3/2021
3,Productive Fun work place,Fast stessful but get to learn more knowledge about fruits arrange the space for incoming new stocks for easier replenish where the space area is limited,nan,nan,Fresh Department Retail Assistant,Current Employee,Hougang A,28/12/2020
1,Tiring and unpleasant work environment,Quite tiring because I was in nonfood department The team leader is absolutely unreasonable and impatient She blames me that I told the manager that the roster had not been released yet during my second dayby right my roster should be released on first day She scolds her department members for unreasonably and ridiculously On the other hand there is also a lazy NTUC boy who walks around use mobile phone and always talks to the merchandisers unnecessarily I had been doing most of the replenishing work and he did little He has bad temper and terrible attitude by yelling toward his colleagues and merchandisers Quite a number of temp staff left because of these two black sheep Overall it has been a disaster in NTUC Marine Parade nonfood department,nan,nan,Temporary Staff,Former Employee,Marine Parade,19/08/2020
3,productive fun working place,a good place to work Sometime difficult to handle stock during CNY Christmas because a lot of incoming stock promotions good benefits for workers in term of training,birthday celebration for individual staff,no fix hours breaks for staff,store keeper,Former Employee,Serangoon,23/06/2020
4,Suitable for people of all ages,Working well with elderly colleagues made me become more caring of the surrounding and working equipment as safety is always important This would be a good starting point for youngsters to experience the working world and at the same time make new friends and learn life experiences from the elderly as to how one should treat the people and things around you,nan,nan,Retail Assistant PartTime,Former Employee,Sembawang,29/05/2020
1,Worst company to work with,I need to take customer temperature and scanning of identity card under the sun I have to guide customer how to qr code download Apps help them to key in their information Too many work to do at this outlet and have to work under the sun,nan,nan,Temporary Staff,Former Employee,Blk 202 Hougang,21/05/2020
3,Nil,Management and staffs in tanglin mall are great Having alot of fun working there However with a toddler i dont have enough time to spent with my kid especially when i have to work in the afternoon shift,nan,nan,Team Leader,Former Employee,Tanglin,20/05/2020
2,Production issues,Always a problem with production due to cable thefts Generator was not able to power all major machinery Staff was demotivated due to poor salary payments,nan,nan,Factory Supervisor,Former Employee,Nancefield Gauteng,3/4/2020
3,Productive and Fun Place,Helpful colleagues Good work culture fast paced Dynamic retail setting Work life balance Fun culture Autonomy in decisions Sales driven,nan,nan,Community Pharmacist in Unity Pharmacy,Current Employee,East Singapore,20/02/2020
4,Excellent,This is a part time job It is through the agency that the job is engaged The cashiering team is very friendly and take care of each other Team work is demonstrated,nan,nan,Festive Temp Cashier,Former Employee,East Singapore,2/2/2020
5,Experience,It was a learning journey for me Throughout my time there I was exposed to different work ethics and the true definition of team spirit It was indeed an eye opener and a memorable experience,nan,nan,Cashier and Customer Service,Former Employee,Singapore,22/01/2020
4,Fast paced,Fast paced and major management rotation annually Review of strategy and realignment required for every change in management Poor flexi benefits No flexi dollars,nan,nan,Minion,Former Employee,Store,5/1/2020
5,fun work place,nice enviroment and friendly co workers i love to work there i did night shift we have 3 dffnt shifts i mostly took night shift most secure place,nan,nan,Retail Assistant,Former Employee,Yew Tee,30/12/2019
5,fun and excellent team mates,Very nice to work and good workmates Good team leader and enjoyed by working different shifts Some days are busy Customers are nice and friendly Updating ourselves by attending various training,nan,nan,Retail Asst,Former Employee,Singapore,12/12/2019
5,Good working environment,Verry good Company benefits and working Environment the best place to work Fresh food have a fod safety standards can learn more about food safety and other training,nan,nan,Lead Associate,Former Employee,Singapore,20/11/2019
4,Productive and fastpaced,A fastpaced work culture with good learning and growth opportunities Management are knowledgable and good guidance are provided for new hires Most enjoyable part of the job will be the satisfaction received after a launch of a successful campaign,nan,nan,Marketing Executive,Current Employee,West Singapore,13/11/2019
4,Facilities Working Systems,The facilities provide by the employers are very useful The working systems used by the employers really helps the employees to have some work life balance,nan,nan,Retail Supervisor,Former Employee,Ang Mo Kio,15/10/2019
3,Good,Ntuc is very good but the outlets chief cashier not happy each other and the never do thing go out and they never said give warranty letter and the outlets admiralty two months already many people resign also about two chief cashier same staff always take mc they never scolded,nan,nan,Cashier,Former Employee,Singapore,5/10/2019
5,Good respect good good difficult customers pay day,Typical day month end I learn customer service managing apply rules always Work place was enjoyable hardest when u meet difficult customers month,nan,nan,Sales Consultant,Former Employee,Boksburg north,30/09/2019
4,Fun more relaxed workplace,Has a more open culture Employees are allowed to work at their own time and target as long as they finish their task promptly before the set timeline Colleagues are friendly and approachable willing to help one another,nan,nan,Business Operations Assistant Purchasing Systems,Current Employee,Singapore,4/9/2019
3,Less time in office,Pick up Chairman from his resident and proceed to his meeting events and functions location as per schedule Ensure arriving early and pick up on time Driving at the best comfortable mode and safe Attend to vehicle servicing and and inspection as per schedule Vehicle must be well kept clean and odour free,nan,nan,Chairman Driver,Current Employee,Singapur PR,4/9/2019
3,Fun working environment,Overall is a good place to earn some allowances good culture do not have any politics supervisors and colleagues are helpful and nice overall good experience,nan,nan,Temporary Contract,Former Employee,Jurong West,29/08/2019
4,Productive and Fun Workplace but can be quite challenging,A good place to work as colleagues is generally quite nice due to the existing values and culture set up in the organisation However depending on which department you are in the working hours can be quite long and prone to everchanging challenges due to the scale and size of the company,nan,nan,Team Leader,Current Employee,Singapore,25/08/2019
3,A Stress full job,A good place to earn a lot more but no room to grow for foreign workers A very stress full job Difficulty in acquiring new staff Management care less about the foreign workers and favor the locals despite of their wrong doings A place where I find a lot of friends with different cultures,nan,nan,Team Leader,Former Employee,Singapore,22/08/2019
5,I really enjoyed my job,The staff were very kind and patient when it comes to teaching and would gladly help whenever help was needed It was a really great experience since it was chinese new year period with the crazy amount of people buying lots of goods for chinese new year,nan,nan,Cashier Parttime,Former Employee,Singapore,13/08/2019
3,temporary job,Just personal view Short period at the job so not able to give comment Every job is similiar which is mutitasking of jobs very busy tight schedule for duties Need to be very hard working to deliver the task on time Academic qualification plays an important role,nan,nan,Administrative Assistant,Former Employee,Singapore,28/07/2019
5,Nice place to wrk,Friendly placeCan enjoy Work there enjoy working there Friendly place to work college alate friendly and help fulIf we face any problem the manager and leader Al help to settle the problems,nan,nan,Cashier,Former Employee,Jurong point,14/07/2019
4,Good place to work,Some of senior staff not interested with new stuffand not willing to guidebut management staff and manager are good I cant work with people who are not friendlythat the reason i resigned,nan,nan,night filler,Former Employee,Serangoon,9/7/2019
2,Peaceful,Usually work alone but I made friends along the way I topped up dairy products like milk cheese and yogurt etc The pay is OK but sometimes it is too tiring as you need to keep on topping up thing,nan,nan,Retail Assistant PartTime,Former Employee,Changi,13/03/2019
5,Saw how a supermarket is run,This job provided me an opportunity to see the innerworkings of how a supermarket is run from preparing the supermarket for opening to its customers to shutting down the supermarket for the night while prepping it for the next day,nan,nan,Retail Assistant,Former Employee,Singapore,10/3/2019
3,An alright workplace,I work at one of the branches I would say that all of the people there are friendly However there was some miscommunication and misunderstandings that should not have happened in the first place due to payroll but this is also solely because of the agency I went to Overall I learnt a lot but I would not commit for that long,nan,nan,Sales Assistant,Former Employee,Singapore,3/3/2019
4,Productive,Well the organization is big everybody is busy including the CEO who is also an MP for SerangoonWe talk less Long day 1012 hrs Friendly Waiting expose to many intereting place such as Parliament House,nan,nan,Personal Driver,Former Employee,Jurong,18/01/2019
4,Great Job Experience,A typical day at work included serving customers at the checkout counter and managing the money in your own cash drawer What I learned from the job were customer service skills which included how to manage customer queries and difficult customers Head cashiers in charge of me are great people who made me feel welcomed and valuable The hardest part of the job was the long hours and it was physically demanding to stand for long periods of time Most enjoyable part of the job was definitely interacting with the older and experienced coworkers who were all friendly and patient in guiding me to do my job well,nan,nan,Cashier Parttime,Former Employee,Tanjong Pagar,21/12/2018
3,Social Enterprise with split personality,Working level culture is cordial and friendly Politicking happens a lot at the senior management level which leads to roadblocks and slows down progressinnovation Senior management is unable to align vision and expectations in order to drive the company forward as a team Recent talent acquisition seems to have been overly focused on personnel from the banking and management consultancy sector which leaves the organisation topheavy and shortstaffed to carry out the actual work,nan,nan,Manager,Current Employee,Singapore,5/12/2018
5,FairPrice management,FairPrice is a very well managed and established organization in Singapore Being the largest local grown retail company it has gained acceptance in the society frequently holding social events to benefit the community working hand in hand with government and non profit organizations It has also several sponsorship programs to help the needy Staff welfare benefits are also very well received including flexi work hours medical and dental coverage etc All in all FairPrice is one of the best local organizations to work with,nan,nan,Executive Customer Relations,Former Employee,Singapore,7/11/2018
3,Family working style,A typical day at work would be monitoring projects andor meeting project managers to understand projects workplace Culture is more like family The hardest part of the job is convincing project managers to do documentation The most enjoyable part of the job is speaking to people from all works of life in the profession,nan,nan,IT Program Executive,Current Employee,Singapore,28/10/2018
5,Company culture,Jobs arent just a paycheck and given the amount of time spent working its important for me to make sure theres a good fit This company has good culture and I learned a lot,nan,nan,Team leader,Former Employee,Singapore,23/10/2018
5,Fun workplace,Cashier collecting money and packing Help out in the training new Cashier on the Job Management was good Had good relation with colleagues supervisor,nan,nan,Cashier,Former Employee,Queenstown,24/08/2018
4,Retail,o Trained new cashiers on procedures customer service and sales techniques o Created attractive displays to promote items o Responded to customer requests and directed to merchandise,nan,nan,Cashier,Former Employee,Farrer Park,19/08/2018
4,busy,a typical day is always busy cashiering and handle customer no comment for management good learning place would send for training long standing hour fun part is team player,nan,nan,Cashier Parttime,Former Employee,Choa Chu Kang,15/08/2018
4,Working style,Good worklife balance Company going through transition from traditional retail to digitization Trying to create an omni channel experience Hardest part of the job is about staff management,nan,nan,Senior Branch Executive,Former Employee,Tuas,26/07/2018
3,working,everyday we doing multitasking that everything we need to know how do cashiering topping up of items cut fish frozen and etc always overtime must do finish the work before going back,nan,nan,Retail Assistant PartTime,Former Employee,lorong limau,25/07/2018
3,Fun,Handle cash Sales Smile Punctual Friendly Helpful Acknowledge Hardworking Always help Promote sales Give helping hands for pioneers Have passion for others,nan,nan,Cashier Parttime,Former Employee,Singapore,25/07/2018
