Rating,Title,Review Description,Pro,Con,Job Title,Status,Region,Date
3,My opinion and experiences,The work is straight forward and simple to handle However the remuneration is very low and the working hour is long We are required to work on most public holidays without any double compensation Most of the staff are cooperative except for a few Nothing is too difficult except for some people who gets impatient when there is a sudden influx of customers in the queue for delivery services Nothing is too difficult except for some unreasonable or difficult customers who loves to complaint even for some minor issues or when they could not get a replacement or refunds These customers requires our tactfulness and soft skill to handle At all times do not offend them even though they may be nasty Just avoid any argument and quickly get a fellow colleague to assist you in handling the customer so as to appease himher However giving the best services to the customers is the most enjoyable always serves with a smile showing that you care,Nothing,Long hours,Customer Service Officer,Former Employee,Thomson plaza,19/07/2018
5,management,The management works hand in hand with employee of the company to ensure that employee has the benefit and company has meet with the profit benefit More involvement of employee in CSR and other programe,better staff benefit,short breaks,Manager,Former Employee,Singapore,6/7/2018
4,fun place,learn how to restocking stock and how to maintain good personal hygiene and was able to get along with some good colleage and had a good experince in working there,nan,nan,Retail assistant,Former Employee,bishan,23/06/2018
3,Workplace and interactions,I get to interact with walkin consumers all the time I learnt to serve them with a smile no matter how difficult they are to deal with I learnt to compose myself with a gentle voice and humble attitude even if they are in the wrong and serve them The typical day at work as a retailer and a cashier was to make every customer who walk into the store and leave with the impression that they are important to us so that they will come back to shop with us again This was my first job and out on the field with customers i get to learn how to serve them talk to them suggest and help them with their choices make them feel special to us to the storecompany,nan,nan,Retail Assistant,Former Employee,Singapore,21/05/2018
4,enjoy workplace,shift working learn how to use the credit card point card good management and about the culture is good hardest part is long queue when make a payment and is also enjoyable part,nan,nan,Cashier,Former Employee,West Singapore,14/05/2018
3,a good learning experience,a good learning experience Was often moved to different departments so had to learn from scratch within a limited time which helped improve my adaptability,nan,nan,Sales Assistant,Former Employee,Singapore,7/3/2018
4,pleasant,Typically a day at work involves bringing out merchandise and display them Sometimes there is delivery and I have to check the DO Occasionally I have to do housekeeping There are other duties too like wrapping the magazines,nan,nan,Sales Assistant,Former Employee,Bedok,5/3/2018
2,secured and simple job at NTUC Fairprice Colleague at Fairprice are fun characters but not motivated because most of them are retire,Fun working environment No career prospects Management system is worse Stuff not getting updated Can damage backside cause most the time carry the heavy items,nan,nan,Sales Assistant,Current Employee,Gove County KS,28/02/2018
5,Fun workplace,Learn something new everyday peak hours only in afternoon good company culture Everyone is fun to work with Great job benefits and jobs are easy,nan,nan,Sales Assistant parttime,Former Employee,Bukit Batok,26/02/2018
5,productive company,First thing is to thank God and love your work ived learned to interact with people follow managements rules be part of the company as a family and enjoy every single and moments the work,nan,nan,Cashier,Former Employee,Singapore,19/02/2018
5,supportive work environment,I was personally comfortable working here Seniors and supervisors were helpful and guided me It was overall a pleasant working environment and i was able to learn new skills The job became tiring when there were overwhelming customers due to promotions or holidays but it was manageable as most customers were understanding and patient the seniors also taught me ways to work faster without getting annoyed or angry,nan,nan,Cashier,Former Employee,Thomson,15/01/2018
4,Learn a lot of things,Clean the area of replenishing First in first out the stock before replinish I Learned how to handle staff and customers also ordering and recieving of stocks Hardest part when I forget to order the stocks Most enjoyable is to served the customers what they need,nan,nan,Retail Assistant,Former Employee,Singapore,11/12/2017
2,Fun place to work,I worked just below my blook Was a part timer there I packed food and do cashering The pay was to low and i wanted to study So i had to keace NTUC,nan,nan,Retail Cashier,Former Employee,Depot Rd,3/12/2017
2,join only if you ran out of option,go find other job like usher or some event better pay and more enjoyableHere your carry heavy stuff and some time you may injured yourself so join if you wanna work out and get paid at the same timeYou will need to have a flexible mind if not you might be hard on youAlso some team leader will be more biased base on if you are ite or olevel same goes to the seniorSo ya working is never a good thing but no choice need money Some senior although they are fierce but they still guild you well just that you have to get use to their gangster attitude Others you might get back stab control around and sometime split vulgar by the old seniors there in hokkien usually which i understand Team leader is OK OK as in normal attitude arrogant and strict but just that he carry customer ball too much during selling orange until they climb over his headUnlike some other company i worked they have the right to ignored customer if they gone too much,nan,nan,Sales Assistant Parttime,Former Employee,Ang Mo Kio,23/11/2017
5,Loved to work as team,Loved to work as a cashier as I got a lot experience in this linenot only work with NTUC but used to work with 711 for more then 10years n giant for 2 yearsnot been working since last 2 yearscoz my kids are still young n need more attentionnow my kids are big enough to look after the themself,nan,nan,Cashier Parttime,Current Employee,Bukit Merah Central NTUC Fairprice,14/11/2017
3,Fun but can be tiring during festive period,Overall good experience Fun but can be tiring at times Especially during festive period such as Chinese New Year Teach you the skills to handle responsibility and upset customers,nan,nan,Cashier Parttime,Former Employee,Ang mo kio hub,7/11/2017
4,Good work environment,Good place to work at Typical day at work included shelving up stock serving customers and operating the tills The job helped develop my work related skills,nan,nan,Part time Member,Current Employee,Bellshill,16/10/2017
4,Productive and fun place,Refreshing at the end of work Team work is actually group of people Lenient who understand our weakness Coordinate to interact with people to share the same view Fun in work,nan,nan,Storekeeper,Current Employee,680 upper thomson rd,16/10/2017
5,Good team work and communicationhappy work environment,Team work and good communication is most important during work Good benefit The management is more care employee I can free warm and happy Job training provided I can improve and keep daily up,nan,nan,Department supervisor,Former Employee,Jurong Port and expo branch,25/09/2017
3,Good,Work scoped set up ice bed display for seafoodpricing tagserving customer cut fishdisplayed of packed seafood and help out other displayed or replenish of other fruitsvegetables and others,nan,nan,Fish Cutter,Former Employee,Thiong Bahru,24/08/2017
3,Fun,You get to work with friendly people and you get to learn the basics of customers service even though sometimes customers can be tough at times but nothing that can be settled,nan,nan,Retail Assistant,Former Employee,Tampines,26/07/2017
4,NTUC Fairprice is a good company to work for,Working in NTUC Fairprice is fun You get to interact with a lot of people that includes fellow colleagues and different types of customers Aside from that management is real good too Its like working with your family,nan,nan,Retail Assistant PartTime,Current Employee,Bukit Merah,22/07/2017
5,only partrtime job,Handling customers performing cashier job need to be patient tolerate customers Handle difficult customers must be vigilant accuracy and cheerful,nan,nan,Cashier,Former Employee,Rivervale Drive,18/07/2017
5,organised work culture,I was attached in this company for six months as an intern and i certainly enjoyed my experience there as i managed to be apart of every of their departments from being a cashier to storekeeping and stock counting I was also given the opportunity to become a team leader and experience what was it like to supervise and manage a team Overall it was a worthwhile experience,nan,nan,SIP attachment,Former Employee,Pasir Ris,13/07/2017
4,learning with excitement,good company to work with perfect work life balance part time as per availability and salary was descent lots of perks for employees overall it was a learning opportunity,nan,nan,CUSTOMER SERVICE REP,Former Employee,Singapore,25/06/2017
4,Challenging and a learning experienced which is a value added for job progression,A typical day at NTUC as a Designer is comprised of designing and generating working drawings for approved new upcoming supermarket We will have department meeting for an overview of the ongoing projects to give ideas on how to improve working capacities to problem solves issues like on the administrative side as well as problematic technical matters Designer will also conduct project meeting with the internal and external parties for sharing of important information During the ongoing project Designer has to monitored and coordinated the work on site for smooth flowing The management will keep in touch with all the other departments involve to have a meet up once a week and the Head of Department will address some important issues or for employee bonding session Its a very accommodating and conducive working place for anyone who wants to strike a balance of work and life practice,nan,nan,Designer Senior Executive,Former Employee,Singapore,31/05/2017
3,NTUC retail assistant,I was assigned as retail assistant to earn my monthly allowance to support myself during my schooling days My jobs mainly replenish goods and assist the customer,nan,nan,Assigned as Retail Assistant,Former Employee,Singapore,25/05/2017
5,Retails packer or store,Im Rafy Im 21 yeasr oldi have a lot of experience but retail is my best part I can work if people guide me Im realy need to workfor support my family And i work be positif,nan,nan,Retail Assistant,Current Employee,Serangoon Garden Estate,12/5/2017
5,Working life as a Retail Assistant,Over the years I learned to better multitask and organise my work Our typical day at work includes forwarding and replenishing of goods before waiting for new stocks to arrive on certain days i will have to do ordering of stocks to be arrived for the next day During my spare time i will do the checking of expiry of goods Fortunately for us our outlet branch manager is okay Hence there is not much issues with the management here The working culture here emphasises on working together as a team and always helping one another The hardest part of this job is attending to difficult customers however that being said i still find the joy while doing my job as i get to interact to customers and having small conversations with them The best part of all is seeing those smiles and thank you when i go the extra mile attending to customers needs,nan,nan,Retail Assistant,Current Employee,Katong V Mall,25/04/2017
5,Productive,Fun to work with the aunties at Khatib Fairprice They are welcoming Friendly and easy to work with Welfare and safety are always the priority whilst working there,nan,nan,Sales Assistant,Former Employee,Khatib Central,4/4/2017
3,Repetitive job,As a part time cashier theres nothing more to it Just repetitive scanning of items asking customers for their membership card etc It would be difficult to be a fulltimer due to long standing hours,nan,nan,Part Time Cashier,Current Employee,Singapore,1/3/2017
2,Hard working,I have learnt hw to put the product at shelves I have learnt how to check expire date I know hw to check the items Be confident,nan,nan,Sales Assistant,Current Employee,Tampines,28/02/2017
4,Still working fine,Working at my part time job at NTUC as a cashier is still alright The working hours is by shift which is good The management is very friendly at the outlet I worked at The hardest part of the job probably would be to handle the long queue of customer flow We need to be quick and precise at times Settling customers doubt on products etc But it is still a good job which gets me permanent salary flow as i only able to commit weekends during schooling days,nan,nan,Cashier,Current Employee,Choa Chu Kang,14/02/2017
4,fun workplace,Its something new Good experience Get to know new people The team was helpful and friendly Got to learn how to handle situation with different people,nan,nan,Retail Assistant,Former Employee,Bukit Merah,1/2/2017
5,Best and fun workplace,Best salary and also like very much my cashier work And good guideness Best high bonuses Very professional and good challenges in the work,nan,nan,Cashier,Former Employee,Bishan j8,22/01/2017
4,It was an interesting and new experience,The whole experience was enriching and challenging Though it was new and demanding at first the senior workers assisted me and made me more comfortable and as time pass I became more ok with all the work load passed to me,nan,nan,Ntuc food packer,Former Employee,Hougang mall,16/01/2017
4,fun workplace,interesting and fun job i got a chance to feel what its like in a grocery store its all hardwork i learnt that i should be thankful for what i have,nan,nan,Fresh Department,Former Employee,Toa Payoh,9/1/2017
1,I have experience more thing and new things but the salary is not enough,I have experience new things in this company and I have learned more from it but the only problem is that the salary is not reasonable to my needs,nan,nan,General assembler,Former Employee,Burgersfort,6/1/2017
4,Good start,I pretty enjoy working there as colleagues there are all friendly not even so I have a friendly boss who do not give up on me when i was about to fall Till then I finally finished my 2 months there as a temporary staffs,nan,nan,Admin Assistant,Former Employee,Pioneer,8/12/2016
5,stylish and clean workplace,When i was working at Fair Price on the Mothers day holiday I was so excited to see womens happy because there were lower prices for materials for them,nan,nan,Shop Assistant,Former Employee,Vryheid KwaZuluNatal,7/11/2016
4,challengingfun,Working for fair price is a challenging job as productivitycustomer handling and good communication skills need to be applied as its good for the growth of the company and customer satisfactiontherefore hard work needs to be put while working for fair price Its fun working with people who give you the ability to wake up and put you in the mood for work,nan,nan,Warehouse Supervisor,Former Employee,Clayville Gauteng,15/09/2016
3,Enjoy working with many people and happy to help elderly customers,when you handle difficult fussy customers you have to identified their feeling either unhappy or sad shopping experieced management very understanding the problems facing by all cashiers at the counter Coworkers all are supportive and team work Hardest part are when get scolded by customers because of promotion items wrong price or customers get rotten fruits spoil items The most enjoyable part is when you get friendlygood customer,Annual Dinner and Dance,short breaks working hour till midnight,Part time Cashier,Current Employee,Bukit Panjang Plaza,13/09/2016
3,dangger workplace,I learn a lot of thing at this working place like SAP system Ordering stock control I am happy I got at good teachermanager team leader to teach me But at this working place no enough staff to operate,nan,nan,retail assitant Ateamleader,Current Employee,Singapore,4/9/2016
5,Okay,A typical day would be quiet during day and crowded during night especially weekends and public holiday Learned a lot of stuff but mostly about retail Stock ordering is the hardest sometime it sell fast because there is an offer sometime it just stuck in your backstore seeing those stock being sold i feel some sense of achievement Co worker are friendly mostly older than me able to talk about stuff that i have no idea some in the past some in other industry and some slice of life For hardest part of the work before i promoted to retail supervisor i thought that it was ordering but after i was promoted i found out that coordinating and arrange stock is the hardest such as every thursday advertise special and weekly fairoffermustbuypurchase with purchase and sometime new stock that have been launched we have to arrange into normal shelf without breaking the previous arrangement grouping The enjoyable part of the job would be seeing customer able to get what they want to buy and happily head off to the counter for example few occasion when customer asked me location of the items they want and i was able to show it to them and they thanked me and head off to the counter some even came from faraway just to get the stuff of course nice versa if after i showed customer the product location and its out of stock i would feel a bit remorse especially if i was in charge of the lane that the product was,nan,nan,Retail Supervisor,Current Employee,Punggol waterway point,15/08/2016
5,good,Good benefits great team members excellent company I enjoy working here and am currently looking for new challendges,nan,nan,Sales Representative,Current Employee,Jem Jurong Gateway,2/7/2016
3,part time job work in weekend,Parttime retail assistant in NonFood department which mostly work in weekend the objective is to enhance my social experience and also to earn some pocket money,nan,nan,Parttime retail assistant,Former Employee,Bukit Timah,25/05/2016
4,Work,I learn how to handle customer and now in savills I learn how to manage residence enquiry in this MA line I seen many type of people and their view on each of them,nan,nan,Team Leader,Former Employee,Bedok,12/2/2016
4,Fun and interesting workplace,I learnt to be more detailed and attentive to the demands of the customers The management was easy to talk to easy to relate to and I can go to the supervisors anytime I feel uncomfortable I also learnt to be patient and understanding the coworkers are easy to get along with and the camaraderie between coworkers supervisors and managers,nan,nan,Cashier Customer Service Officer,Former Employee,Bukit Timah Plaza,5/1/2016
3,Confortable with friendly colleagues around,Ive learnt how to manage customers wants needs Even handle their complains over a product Communication among the Chief Cashiers is down with the staffs too CoWorkers are friendly and always make my day And the most enjoyable part of the job is to see my customers smilelaugh with the service provided,nan,nan,Cashier PT,Current Employee,Clementi Mall,15/09/2015
4,Overall Culture,The best part about working in FairPrice is the kind of family feeling that u will get when u work there Everyone treats each other like a family member and it is very enjoyable working in this company despite its low pay and long hours at time depending on the season,nan,nan,Purchasing Manager,Former Employee,Mountbatten Square,7/3/2015
4,Place where I learn a lot about working life,The typical day at work start with quality checking all the goods displayed in the store and remove any goods which has gone bad or look bad Then replenish the goods if those displayed is depleting very quickly Soon we will get ready for the arrival of the stocks And this is where team work will happen my coworkers and I will move the stocks together because they are really heavy and we will be assigned to replenish different goods to speed things up Basically team work is key and also being able to attend to customers queries Some times customers would not be able to find certain products and they will ask any staff they see So even though the product is not under your section you need to be able to know where exactly it is placed to help customer Thus I also learn that we should be fully aware of our working environment The hardest part of this job is definitely unloading the goods because each box of apples are of multiple kgs and we do not have proper equipment which can help unload the goods easier And hence most of the time we might end up hurting ourselves Most enjoyable part of the job is being to work with a group of people who are passionate of their job and is willing to take care of you and teach you their great wealth of knowledge,nan,nan,Retail Assistant,Former Employee,Buangkok,5/3/2015
4,Allows me to identify and recommend what needs to be done,The management structure has too many layers Meaning that if anything needs to be done then there is many layer of approval that need to be gotten before the project can move forward Work life balance is not that great as many times work was required to be done on off days and also outside working hours The good thing is that in my role I can identify areas that need improvements and recommend corrective actions in the form of training programs that can be conducted Though not all the programs are approved I can work around them to arrive at alternative solutions,nan,nan,Manager Training Development,Former Employee,SIngapore,24/02/2015
4,Fair treatment to all staff from management,Enjoying work and continuous learning on my daily duties I have improved further my skills in training and multi tasking Management has been very fair with their employees regardless of their race and religion My colleagues are supportive and have respect with one another Language barrier is my greatest challenge since I dont know how speak mandarin I always feel very happy seeing my staff climbing up the corporate ladder,nan,nan,Sales Team Leader,Current Employee,Jurong East Mall,14/11/2014
5,they are selling everythings,i have been worked in fair price singapore as a cashierso i got a lot of experience about central cash and big amount of money exchange voucher gift voucher refund voucher cash machine and how to use credit machine offline machine how to sell to the mobile card,nan,nan,Cashier,Former Employee,singapore,15/08/2014
3,Create and maintain a loyal customer base,Over 6 years’ extensive Salesman experience within diverse retail settings• Adept at operating cash register Busy functions ok good week days lunch time,nan,nan,Retail Sales Associate,Former Employee,Mumbai MH,4/8/2014
5,Happy and Fun Workplace,Life is short and just worked in a place full of happiness will do,nan,nan,HR Officer,Former Employee,Thomson,22/04/2014
3,Fastpace environment,For a typical day of work I will be preparing quotations for major customers or coordinating with warehouse representatives or purchasers for bulk discountsFrom time to time I also handle escalated customer issues Minimal coworkers with friendly deposition politics is terrible in the company Hardest part of my job will be managing difficult customers Most enjoyable part of the job is that is it everchallenging and fast pace There is rarely a moment for resting,nan,nan,Online Store Executive,Former Employee,Singapore S00,5/3/2014
5,fun with the collegue,everybody in NTUC Fairprice are very friendly fun to work with because they are aunties that are very energetic and very concern towards each other,nan,nan,cahier,Former Employee,Bishan,15/10/2012
4,Best Place to work,A typical day at work is very challengingeveryday is considered as a new day where surprises arise and you need to adopt everything that is happening from customer compliments to their complaints and questionsI learned to supervise and manage a store being manned by staff of different nationalityVarying in culturebeliefs and attitudes even agesThe management is supportive in providing training and educating its staff in order to upgrade in terms of efficiency towards work and have a positive mind setMy coworkers and I practices teamwork for us to attain our common goal for the store and as often as needed we practice professionalism and respect regardless of racesThe hardest part of my job is when you need to cope up with the manpower shortages and you need to help all the staff on their day to day activityWhen you need to reach out beyond your duty in order to make things done as needed and when it is needed The most enjoyable part of my job is the learning that this kind of work has brought me that made me improve as an employeeleader and as a person,nan,nan,Retail Supervisor,Current Employee,Rochor Center,21/09/2012
1,Supervisor,Bpp branch 的人事上有很大的问题。 1，小题大做 2，喜欢在客户前苛刻大声指责你。 3，必须早去15分钟和晚回3040分钟。结账，但不包括工作时间。No OT 4，多数员工的素质有问题。喜欢大声嚷嚷，推卸责任。,nan,nan,Cashier Parttime,Current Employee,Bukit Panjang,10/1/2020
