Rating,Title,Review Description,Pro,Con,Job Title,Status,Region,Date
10,Part time,,the only pro is that there is a salary,overworked underpaid coworkers are toxic and selfish,Part Time Retail Assistant,Former Employee,nan,Mar 4 2021
30,Not bad,,A stable job U got to see different kinds of peoples,It depends on individuals,Customer Service,Former Employee,Sengkang New Town,Dec 23 2020
30,Its boring,,Easy relaxing job can explore products,Boring low paying job and legs tiring,Retail Associate,Former Employee,nan,Jan 4 2021
50,Parttime,,Good work balance and great people,Very busy and need to carry heavy loads,Retail Sales Associate,Former Employee,nan,Aug 8 2020
10,,,Having a CEO from bank doesnt brings you anywhere,Turning into a bank sector,Branch Manager,Former Employee,Singapore,Mar 11 2021
30,Place with Nice Working Level Colleagues,,Nice Working Environment Great Colleagues Exposure to Retail Environment,Confused by Upper Stakeholders Direction Over Demanding Insensitivity Job gets pushed around Salary below Market Rate,Marketing Manager,Former Employee,Singapore,Nov 13 2020
40,great,,Excellent work place and great company,Working everyday and nothing much to say,Associate Machine Operator,Current Employee,Tuas,Jul 27 2020
20,low salary bad management a lot of work,,nice colleagues to work with,overwork and stretch people even when not enough staff expect ppl to perform better durng covid when we have a lot more things to do nv do well they say ur performance nt good only blame us for nt finishing things but nv see that we also dont have enough ppl alr,Team Leader,Current Employee,Singapore,Jul 25 2020
50,Recruit First,,Great people and understanding staff,Its a small environment thats all,Retail Assistant,Current Employee,Singapore,Jul 14 2020
30,Benifits,,You wont get retrance by companie,Festive season you are not able to take leaves,Retail Assistant,Former Employee,Bedok New Town,Dec 2 2020
50,fairprice,,good company to work long term,there is not much cons,Anonymous Employee,Current Employee,Singapore,Jul 5 2020
10,Bad Employer,,Additional rebate but must join as a NTUC member,No career prospect lower than market pay and basic benefits,Senior Manager,Former Employee,nan,Dec 15 2020
30,good,,good employee benefits and salary,cannot think of anything bad,Executive,Current Employee,Singapore,Nov 23 2020
20,Do not apply unless you really have to,,honestly i cant think of any Lucky to have colleagues who i can share the pain with,Lack of structured career progression Zero work life balance,Anonymous Employee,Former Employee,nan,Sep 30 2020
10,Poor Management Culture,,Big brand Government big brand,FMCG industry Must be able to adapt well,Executive,Former Employee,nan,Jan 14 2021
30,good,,fun learn alot of things,dont really have any cons,Part Time Cashier,Former Employee,Singapore,Nov 9 2020
10,Low paid,,None at all Cannot think of one,Poor management The management cannot spell simple words,Sales AssociateCashier,Current Employee,Singapore,Dec 26 2020
50,Good,,Good staff benefit for overall,Good leadership and management leader,Retail Assistant,Current Employee,Bishan New Town,Sep 17 2020
50,Decent place,,Flexible shift good working benefits,Long working hours low pay,Retail Assistant,Former Employee,Singapore,Sep 12 2020
20,From best employer to worst,,Used to have good benefits and bonus,Everything changed after the consultants came in,Category Manager,Former Employee,Geylang Serai,Jul 1 2020
20,Dead end as dead end can get,,Autonomy to complete task when given,Little to no career progression,Sales Associate,Former Employee,Singapore,Aug 25 2020
20,NIL,,Get to gain a lot of experience with handling customers,Would prefer to not share it now,Retail Assistant,Former Employee,nan,Sep 2 2020
40,Generally stable workplace,,Comfortable very secured generally friendly work colleagues,Slowpaced middleaged group slow pay progression,Senior Executive,Current Employee,nan,Sep 3 2020
40,NTUC FP,,Stable job helpful colleagues nice office,slow progression overworked at times mundane,Anonymous Employee,Current Employee,nan,Sep 1 2020
30,Not bad,,Staff are friendly and willing to guide you,Salary is actually quite low,Anonymous Employee,Former Employee,nan,Aug 20 2020
50,Parttime,,Good work balance and great people,Very busy and need to carry heavy loads,Retail Sales Associate,Former Employee,nan,Aug 8 2020
20,slow progression,,Good colleague but still with politics with other department,baised very slow progression Only focus on certain people,Team Leader,Former Employee,Singapore,Jul 26 2020
20,overloaded,,good colleagues and ok location,overloaded as there under manpower,Customer Service,Former Employee,Singapore,Aug 15 2020
40,great,,Excellent work place and great company,Working everyday and nothing much to say,Associate Machine Operator,Current Employee,Tuas,Jul 27 2020
50,Recruit First,,Great people and understanding staff,Its a small environment thats all,Retail Assistant,Current Employee,Singapore,Jul 14 2020
50,fairprice,,good company to work long term,there is not much cons,Anonymous Employee,Current Employee,Singapore,Jul 5 2020
10,average experience,,gives a good exposure to the retail industry,have to know how to handle bad customers and mean staff,Retail Assistant,Former Employee,Bukit Batok New Town,Aug 27 2020
20,So much potential but so much lost through senior level politicking,,1 Workinglevel teams in generally are cordial when collaborating with each other 2 Brand name It wont be easy to find a Singapore resident who hasnt heard of FairPrice before 3 So much potential in terms of influencing the retail scene in Singapore given its physical footprint and growing online presence,1 Too much politicking at senior management level Each one seems to be interested only in pushing their own agenda and building their own empire by surround themselves with allies Working level staff becomes the collateral damage 2 Undergoing digital transformation but proper change management is severely lacking ie Accept the new systems and processes Take it or leave it Where are the change agents 3 Lots of talk but Wheres the walk Lots of highlevel strategic discussion and projects but it seems that the people who are integral to it all the teams that will execute these initiatives are not consulted much,Executive,Current Employee,Singapore,Mar 12 2019
20,NTUC Fairprice Selling at a Good Price,,You get to meet interesting albeit frustrated people who like to preserve status quo Also they tend to put the staff in fairly good hotels for overseas trips No expenses are spared if you are on overseas business,Change is not something that is encouraged They will do alot of research to prove this and cling onto the old ways of doing things Also expansion and growing a third wing is just a corporate presentation catch phrase with little or no committment Also quite a fair bit of internal strife and tension between the various departments,Manager,Former Employee,Singapore,Apr 21 2009
40,A good parttime job in a lowstress environment,,Friendly people you get to work with middleaged people who are generally more amiable Trainings provided Trainings are provided even for parttime staff Positive working environment working schedule can be quite flexible for parttime staff need discussion with supervisors Get to meet alot of people within branch,Very busy during branch peak hours Rather strict internal audits and inspections failing which would receive warnings shorthanded at times and staff have to take up more than one role Different branches have different styles of management,Retail Assistant PartTime,Former Employee,Singapore,Jan 8 2011
40,,,1 the staff there is really friendly and guide you along pleasant working enviornment 2 for a part timer 10H is pretty good 3 the team leader was understanding and let me take breaks on specific days where i had other commitments,1 the team leader used a paper to hit my butt amongst other questionable things he did and im pretty sure that counts as s3xual harrassment LOL 2 depending on your raceability to speak dialectthe racial makeup of your store you may face some communication barriers as some of them can only speak chinese speak mainly in dialect,Retail Assistant,Current Employee,nan,Apr 30 2020
10,Lack of working system,,I used to work in ntuc fairprice But dissapointed with the working system,My wife working as cheif cashier in northpoint city fairprice Force to do so much work with no team role play Lack of working system Need to do overtime everyday without fail with no overtime payment Manager there lack of experience on managing the branch all team leader force to stay extra hours with no payment no claim of extra hours make people stay overtime as if staff have no family no kids people do OT to have extra income for family but if stay extra hours everyday without fail with nothing to claim then its better to be on time and clock out on the dot Dont force people to stay extra hours as if people have no family,Anonymous Employee,Current Employee,Yishun New Town,May 20 2018
30,Used to be good,,This does not apply to all outlet as I worked other outlets before as well but for my current one I have a rather understanding Team Leader Both my parents have several medical check up to attend from time to time and I have to accompany them There were times where I could only work like twice a week due to that and my Team Leader understands If other workplace even if I show those appointment dates and take picture of me and parents and clinic theres no guarantee that they will accept such excuse for my absence Aside from that work wise if we talk about work only not mentioning the type of people we work with the work is fun to do Frankly speaking I enjoy such active job like getting stocks from store or new delivery and then display them accordingly I really enjoy that it gives this accomplish type of feeling and when get to assist those nice customers really can make my day,First joined this company back at 2007 From 2007 all the way till 2015 really nice place to work at despite the rude toxic and troublesome colleagues that likes to take advantage and intentionally cause us trouble just to feed their ego not to make anything better the management back then were great problem solvers They will hear you out properly and do whats needed as soon as possible 2016 onwards till present is pure crap The rude inconsiderate and arrogant started to rule from then on Management didnt even take any action against them at all and when some of us provide feedback in the most professional way possible the only response they can give is the person character is already like that different people different character and many other rubbish explanation Not only did they not take action against such people they even promote them So what happened is these type of people got more big headed Funny thing is as for the ones who I see are usually good polite approachable guide others considerate mindful and helpful does a mistake by accident which is really seldom the management will point it out and confront the person for it The good ones get more and more pressured while the ones who are selfish inconsiderate and disrespectful gets to do as they please,Retail Assistant,Current Employee,Singapore,Aug 19 2019
10,HR is not good,,The job actually is easy to learn,Not good at all for the whole process,Cashier,Current Employee,Singapore,Apr 3 2018
50,Good times and bad times but mostly good times in general A pinch of bad times,,Friendly nice enjoyable convenient attractive happy joyful incredible interesting captivating communicative responsible funny I will take this job over any other job if given a choice between something I do not like and this very very progressive job There was a time when I did not enjoy the work but it was a brief fleeting moment that disappeared,Busy but it is also not entirely so Yet it could be depending on what you are actually doing So everything boils down to something that is not exactly explainable,Anonymous Employee,Former Employee,nan,Jan 9 2014
20,ExecutiveSpecialist cant wait to get out of here,,theres always people around to help u because its a teams effort convenient transport,no work life balance stressful environment team is too big hard to do things faster need a more streamline way of doing things expected to work during weekends,Anonymous Employee,Current Employee,nan,Dec 4 2019
30,Moving stock and Displaying it,,The pay is good and the working environment is quite good as well for a first job The people there are really friendly in teaching you everything,The job is kind of tiring and working hours cannot stretch till 12 hours You can only work up to a total of 7 hours a day as a part timer,Anonymous Employee,Former Employee,nan,Jan 17 2018
40,Challenging and new experience,,This job is almost like any other retail jobs that requires you to interact with customers and to check out their items for them Those who are looking for new experiences can try it out,Those whose physical health which cannot sustain long standing during work hours might not be suitable as this job requires you to stand for long hours During peak hours you might not even have time to take a breather,Cashier,Former Employee,Tampines New Town,May 7 2015
30,lack of growth if you are junior,,team work and company benefits bonus are not too bad either it is one of the biggest local company in singapore,not much difference between one who is performing vs another who is not performing well when it is time for rewards etc both get it,nan,Former Employee,Singapore,Jan 14 2011
40,A comfortable place but that also means its not very exciting,,Management can be very accommodating to meeting the needs of staff in intangible arrangements There is very little politics at the lower and midmanagement levels Colleagues are generally very understanding and cooperative,Innovation and the push for it can be very slow The culture can be quite limiting for high achievers especially for those with bold ideas,Purchasing Manager,Current Employee,Singapore,Aug 12 2012
20,Some tweaks and itd be wonderful,,Good learning ground for job seekers with entry level skills where they provide much needed trainings and guidance,has poor career progression my colleagues who worked very hard for 5 years but was not promoted at all,Inventory Controller,Former Employee,Singapore,Jun 16 2014
40,Customer Service Executive,,Large Organization with standards dealing with various business working with people and filling customers needs in different ways Well known for Insurance Fair Price Comfort Delgro etc,At Fair price is the competition in prices a little reduction would help Certain Outlets are open 24hrs but most veg items are not there,Customer Service Executive,Current Employee,Singapore,Nov 23 2016
50,Full Time Temporary Admin Assistant,,nice colleagues and supervisors I really mean it pretty good benefits given there were quite a few department celebrations during my entire stay nice facilities as well,youre either super busy or super free nothing in between,Administrative Assistant,Former Employee,nan,Jan 10 2017
40,Normal job nothing exciting but not shabby either,,Slow paced job most of the time Simple job scope,Long timers usually aunties may bully you at times Workload may be hectic during certain hours especially peak hours,Retail Assistant,Former Employee,nan,Jan 30 2014
40,Work life balance,,Friendly and caring people Great welfare,Long hour during peak period,Anonymous Employee,Current Employee,nan,Jan 12 2016
40,The culture of FairPrice HQ,,The work benefits Work Life balance Supports government implemented work benefits initiatives,Very far location for people not staying in the west,Executive,Former Employee,Singapore,Aug 16 2017
40,NAME,,NAME,NAME,Retail Associate,Former Employee,nan,Dec 10 2019
40,Learnt a lot,,Helpful friendly colleagues Learning experience to work in fast paced environment,Tiring long standing hours Have to deal with all kinds of customers some are demanding Extremely busy during peak hours,Part Time Cashier,Former Employee,Paya Lebar,May 30 2020
40,learn more thing in my life,,have fun and communicate well with customers and staff,some bad customers must be handle it,Cashier,Current Employee,Tampines New Town,Sep 9 2012
40,Work like a family,,Best place to work less politic friendly colleague long annual leave annual retreat,increment too slow Salary Adjustment only do it yearly instead of quater,IT Engineer,Current Employee,Singapore,Nov 30 2016
40,Supportive environment,,Stable work life balancing nice colleagues reward good performers,Outdated staff benefits bit slow in deploy changes,Senior Manager,Current Employee,Singapore,Apr 28 2020
20,ExecutiveSpecialist cant wait to get out of here,,theres always people around to help u because its a teams effort convenient transport,no work life balance stressful environment team is too big hard to do things faster need a more streamline way of doing things expected to work during weekends,Anonymous Employee,Current Employee,nan,Dec 4 2019
30,work non stop,,good enviroment good people relationship good service,a lot of over time and need to work for 7 days need to see boss face everytime,nan,Former Employee,nan,Jul 8 2010
50,Full Time Temporary Admin Assistant,,nice colleagues and supervisors I really mean it pretty good benefits given there were quite a few department celebrations during my entire stay nice facilities as well,youre either super busy or super free nothing in between,Administrative Assistant,Former Employee,nan,Jan 10 2017
10,FT Staff,,Colleagues are nice and office is huge,Bonus and payout yearly is pathetic Management team take forever to decide and give you and ans leaving working level at a lost No top level people wish to make decision Processes all in a mess and confusing to new staff whom does what job as no one want to do extra if that is not their job,Anonymous Employee,Current Employee,Singapore,May 6 2019
40,Normal job nothing exciting but not shabby either,,Slow paced job most of the time Simple job scope,Long timers usually aunties may bully you at times Workload may be hectic during certain hours especially peak hours,Retail Assistant,Former Employee,nan,Jan 30 2014
40,Work life balance,,Friendly and caring people Great welfare,Long hour during peak period,Anonymous Employee,Current Employee,nan,Jan 12 2016
20,talk abt simplification no walls at executive levels but in actual fact no one practices that,,pro family provides company transport some colleagues are easy going,political some management are lousy quick to claim credits and disorganised,nan,Current Employee,nan,Apr 9 2017
30,Cashier,,it is definitely a good experience but i suggest you work with friends to make it more interesting and not boring,Long working hours Short lunch time Some times there are long queue Might need to work on public holidays some times,Cashier,Former Employee,Singapore,Feb 12 2013
20,Negative,,Used to have good benefits and welfare,Strong politics noncondusive environment to work,Anonymous Employee,Former Employee,nan,Jun 4 2018
20,management culture,,from the top they say they want to innovate,Organisation chart has changed but no process improvements have been done,Manager,Current Employee,Singapore,Feb 11 2018
40,The culture of FairPrice HQ,,The work benefits Work Life balance Supports government implemented work benefits initiatives,Very far location for people not staying in the west,Executive,Former Employee,Singapore,Aug 16 2017
30,Best place Friendly and team work,,Knowledge to know product learning the item,Friendly teamwork helpful be patient,Retail Assistant,Current Employee,Singapore,Nov 21 2015
40,NAME,,NAME,NAME,Retail Associate,Former Employee,nan,Dec 10 2019
40,Learnt a lot,,Helpful friendly colleagues Learning experience to work in fast paced environment,Tiring long standing hours Have to deal with all kinds of customers some are demanding Extremely busy during peak hours,Part Time Cashier,Former Employee,Paya Lebar,May 30 2020
40,learn more thing in my life,,have fun and communicate well with customers and staff,some bad customers must be handle it,Cashier,Current Employee,Tampines New Town,Sep 9 2012
40,Work like a family,,Best place to work less politic friendly colleague long annual leave annual retreat,increment too slow Salary Adjustment only do it yearly instead of quater,IT Engineer,Current Employee,Singapore,Nov 30 2016
20,Family culture but changing too fast and not taking care of its people as much,,Family culture Good benefits and discounts,Changing too fast and not taking care of its people as much,nan,Former Employee,nan,Jan 18 2018
20,Inventory,,Good and Friendly working environment,slow promotion for those who start low even if you got your paper qualification done,Anonymous Employee,Current Employee,Jurong West New Town,Feb 19 2019
40,Supportive environment,,Stable work life balancing nice colleagues reward good performers,Outdated staff benefits bit slow in deploy changes,Senior Manager,Current Employee,Singapore,Apr 28 2020
40,Positive working experience,,Very friendly working environment Eyeopener,NAME,Cashier,Former Employee,Singapore,Dec 21 2016
40,Branch Executive,,Nice team mates and cohesive environment within ops group Bonus was pretty good,Poor leadership from middle management and directions were unclear,Anonymous Employee,Former Employee,nan,Aug 5 2019
30,Purchasing department Average,,Friendly and helpful colleagues and supervisors Good working environment and facilities,NAME,nan,Former Employee,nan,Jul 8 2016
30,friendly environment,,people are friendly and helpful like their clan culture environment is stress free,the tasks are repetitive and boring,Retail Assistant,Former Employee,Singapore,Sep 29 2013
50,Quite a good employee in Singapore,,Full exposure to the field of retail sales,Local employer not good enough payment,nan,Former Employee,nan,Mar 2 2015
30,Team Leader,,Good bonus and Work life balanced job alot of fieldtrips however depending on performance,slow career progression People who can bootlick gets better opportunities,nan,Former Employee,nan,May 28 2017
40,Branch executive,,Good bonus have control in branch,Unrealistic Budget and old school management,Branch Executive,Current Employee,Singapore,May 11 2019
30,Quality Assurance Executive,,Good staff benefits Reasonable working hours,NAME,Quality Assurance,Former Employee,Singapore,Jan 20 2020
30,LOW MORALE,,good working condition and environment helpful staff nice benefit,listen more to the ground low increment low bonus,Engineering,Current Employee,Singapore,Oct 26 2015
20,Average Workplace,,Majority of the colleagues working there are very nice people,No point of bringing up your grievances as it wont get resolved,Team Leader,Former Employee,nan,Jan 14 2017
40,Executive,,Family Culture Good WorkLife Balance Staff Rebate on Groceries,Salary at lower end for fresh graduates Can be slow at times,Anonymous Employee,Current Employee,nan,May 6 2018
30,Cashier,,Easy work task May be called to do packaging or restocking,May be called to work suddenly to take over another person,Anonymous Employee,Former Employee,nan,Nov 29 2018
30,Not too bad for a short run,,Family like environment with colleagues,Unrealistic targets when times are bad and need to be rational,Anonymous Employee,Former Employee,nan,Mar 4 2019
40,Profamily culture with great colleagues,,Great colleagues Certain amount of pride in working with Singapores biggest retailer,Progression can be a little slow,Executive,Former Employee,nan,Mar 24 2019
40,Feedback on working experience,,Staff there are friendly and willing to help whenever in need,Very busy with little time to rest,Cashier,Current Employee,Marine Parade,May 7 2020
40,Working hours are decent,,Good benefits nice staff managers are alright,Sometimes it can get a bit messy,Store Staff,Former Employee,nan,Jun 8 2020
40,Cashier of NTUC Fairprice,,Good for experience in the retail sector,Very busy during the peak period,Anonymous Employee,Former Employee,nan,Feb 1 2017
40,Storekeeper,,Crossed training and and upgrade training skills through NTUC TRAINING CENTRAL,Control Stock levels from suppliers,Storekeeper,Former Employee,Singapore,Feb 27 2017
50,NTUC Fairprice,,great benefit friendly and social able work environment,alot of work to do can affect work life balance,Anonymous Employee,Current Employee,nan,Sep 29 2017
30,PartTime Cashier,,NAME,NAME,Anonymous Employee,Former Employee,nan,Nov 15 2017
40,Quick and fast jobs,,Fun and simple learning experience for people first entering the workforce,Not many benefits provided for employees,nan,Current Employee,nan,Jul 6 2018
40,An overall good working experience,,Work friendly conducive environment and there is work life balance,Nothing major that I personally experienced,Administrative Assistant,Former Employee,Singapore,Aug 25 2018
40,Decent Part Time Job,,Flexible with school schedule Wage rates change depending on peak periods,A lot of Back room politics involved,Anonymous Employee,Former Employee,nan,Jul 15 2019
40,cashier almost 1 year,,like a enviroment work and place,share a good moments with friends,Anonymous Employee,Current Employee,Jurong East New Town,Apr 18 2015
50,Its great,,fun nice colleagues enjoyable overall great,tiring really heavy loads 20kg occasionally,Anonymous Employee,Current Employee,nan,Feb 25 2017
30,Being a cashier at NTUC Fairprice,,Air conditioned much interaction with colleagues,Low salary and long queues of customers to serve,Anonymous Employee,Current Employee,nan,Apr 2 2018
50,Team Leader,,Learning Opportunities in retail with individual hardwork to achieve,Competitive and downturn industry that tighten the benefits,Supply Chain,Former Employee,Singapore,Sep 18 2019
