Rating,Title,Review Description,Pro,Con,Job Title,Status,Region,Date
10,Horrible Treatment,,I really wish I can have something to say about this,Too many I am being very serious about this matter I would like to share my parttime experience at Fairprice Ang Mo Kio Branch This is actually to elaborate on the mistreatment of part time staff behind closed doors So I actually was hired through a recruitment agency online The advertisement for the part time job states the timing to be 7am to 3pm 3pm to 10pm The job description was “Event Roadshow Helper” Prior to accepting the job I called up the agent to understand more I specifically mentioned that I will not want a cashiering job because I am not experienced and that I do not wish to make compensation for any cashiering mistakes The agent told me that the event helper will probably have some light cashiering on the roadshow area orand some stockup items on rack at the roadshow area With that I accepted the offer On the first day of work I was assigned to a fullon cashiering job at the main counter not that of the roadshow area The part timers were told that we are supposed to come at least 15 minutes earlier to count our float money and get briefing which will not be payable The shift starts from 9am to 5pm not as per the advertiment post with a break time of 45 minutes starting at 3pm We are all blamed rudely for not preparing our own pen for work despite there was no prior instruction I believe that if the stationery is needed for work it should be provided by the company I was assigned under a senior cashier We both went to one main counter and the queue never stopped None of us part timers were given any prior cashiering training So we are tagged to a senior cashier for the first day to learn as we work There are actually many promotional items that needed to be memorised and it is not automated inside the scanning system or printed in hardcopies for cashier to remember So any mistake made or shortage of cash beyond 5 will be payable by the cashier During my lunch break I was instructed to go into the office with the cashbox after logging off I was told to count my money and make necessary calculations to prepare for the float amount for tomorrow The float amount should total up to 600 but it has to consist very specifically how many numbers of 10 notes 5 notes 2 notes and so on coins included So it took around 10 minutes to count and we have to do it because 3pm is one of the timeslot to make exchanges with the chief cashiers We also have to queue up at the chief cashier counter to exchange our money at 3pm So if you can imagined every cashier who have a lunch break at 3pm will be waiting in queue to make necessary exchanges This will take up around 5 minutes We are told to be back 10 minutes earlier for our break Hence the real break time is around 20 minutes That is not quite sufficient to buy a proper meal and consume We are also instructed by the chief cashiers to not pack any food into the office There is no selfinitiative on my end that I can make this break time situation better The chief cashiers are extremely rude to parttimers and also the senior staff as well They are bullies They exercise their ranks to intimate those who report to them and they never teach us anything They held the seniors responsible for all the parttimers despite it is their manpower management issue to begin with The senior I was assigned to is a responsible hardworking staff who worked for many years But it is unreasonable to expect her to coach me efficiently if the queue is never stopping And I was only “coach” for one day and I was on my own the second day Every morning the chief cashiers will brief the cashiers in a rush They will show many promotional items over a small computer screen They will not be printing any hardcopies of these items for the cashiers They will warn every cashier that it is our responsibilities to memorise these items Specifically one chief cashier warned us not to ring the bell to ask her for help despite this is part of her job to assist the cashiers at the counter should it be necessary She warned us that we have to bear the consequences of any mistakes for these promotional items It is nearing Hari Raya and the items are easily more than 4050 products on different sales packages discounts promotional cards date duration of items There is no way a person can remember all these details in a short briefing of less than 5minutes The chief cashier also shouts rudely many times at parttimers and fulltimers exercising a bullying culture across the whole department For example on one cashier briefing the chief cashier asked if any cashier was not on duty yesterday and my senior was signalling to me that I need to tell her I was not on duty yesterday and the chief cashier shouted at my senior who is a good and responsible staff and has worked for over 7 years “KEEP QUIET” This is unacceptable and no human being should be treated in this manner Even if a person makes a mistake this is still not how a managing personnel should be dealing with it The chief cashiers are extremely rude to the staff They will shout and scold us for every little mistake or if they simply feel so For example I was serving a customer at the counter and when there is a specific music that plays at over the speaker at fixed timings it is actually a signal for counter cashiers to wipe the counter tops So the chief cashier was waiting impatiently for me to make that cleaning so she can snap a photo My senior whispered to me to clean the counter so I took the cloth and wipe for the chief casher to snap the photo The chief cashier immediately walked over and scolded me in front of the customer saying that I should serve him first I am very confused why I was scolded I simply followed the instructions Then right after I took the cloth and wipe but I need to know if she has snapped the photo So I looked up and she shouted again “WIPE Do not look up at me” On the second day I was on my own at a cashier counter I was barely trained The queue never stopped My agent told me I cannot get my salary if I did not serve my notice but I have still decided to go because there is a very high chance I would make a mistake with all the promotional items which will be bearable by my own pocket Despite voicing out to the manager that I wanted to change to a jobscope the request was rejected at the reason that NTUC can assign their parttimers however they deem fit although this is not inside the contract I signed This is absolutely unfair to me because this was not told by my recruitment agency I did explain the miscommunication but it is not accepted or discussed by the NTUC manager at all,Cashier,Former Employee,nan,Jul 7 2022
50,great place to work,,nice colleagues fulfilling work scope moderate work load,overfocus on specific KPI on some dept resulting in losing sight of big picture,Senior Marketing Executive,Current Employee,nan,Jun 11 2022
30,Festive season,,Cool Chill Fun Relax Free,Boring and heavy workload but ok,Packer,Former Employee,nan,Sep 14 2022
50,nic eplace,,much to learn in terms of retail,some leaders are not the best,Graduate Student,Former Employee,nan,Jun 27 2022
40,Not bad,,Easy job scope pretty fun,There is definitely some favouritism from the higher ups,Online PickerPacker,Former Employee,nan,Jun 16 2022
40,Good,,Friendly people over for work,Hard to progress actually for career,IT Specialist,Current Employee,nan,Jun 20 2022
40,Good culture,,Family culture Teamwork is strong,Promotion and staff development are to be improved,Anonymous Employee,Current Employee,nan,Jun 12 2022
50,Good,,Comfortable environment structured work goals,Lack of progression repetitive work,Cashier,Former Employee,nan,Jun 29 2022
40,,,airconditioned and simple tasks to complete,quite tiring to stand for long hours,Cashier,Former Employee,Sengkang New Town,Jul 6 2022
50,great place to work,,nice colleagues fulfilling work scope moderate work load,overfocus on specific KPI on some dept resulting in losing sight of big picture,Senior Marketing Executive,Current Employee,nan,Jun 11 2022
50,nic eplace,,much to learn in terms of retail,some leaders are not the best,Graduate Student,Former Employee,nan,Jun 27 2022
10,bad,,experience front line friendly co workers customer service,minimal wages bad management stand long hours,Cashier,Former Employee,nan,Aug 6 2022
40,Not bad,,Easy job scope pretty fun,There is definitely some favouritism from the higher ups,Online PickerPacker,Former Employee,nan,Jun 16 2022
10,Toxic work culture,,Rapport between work peers is generally good,Middle management will keep taking on more work and more projects to please upper management which means the team will struggle to cope Expectations to work on weekends without compensation Minimal training provided to new staff,Anonymous Employee,Former Employee,nan,Jun 20 2022
40,Good,,Friendly people over for work,Hard to progress actually for career,IT Specialist,Current Employee,nan,Jun 20 2022
40,Good culture,,Family culture Teamwork is strong,Promotion and staff development are to be improved,Anonymous Employee,Current Employee,nan,Jun 12 2022
40,What’s a headline,,Good benefit high bonus generally,Red tape and too general,Pharmacist,Current Employee,Singapore,Jun 17 2022
50,Nice experience working at NTUC,,Fun and interesting at the beginning able to do rotating shifts,Tiring supervisors may not be accomodating at times,PartTime Cashier,Former Employee,Singapore,May 4 2022
40,Not too bad,,family orientated depends on boss can be good,can be a bit too big too many things,Senior Executive,Former Employee,nan,May 14 2022
30,Overall Work Environment Sup Par,,Provides AWSPBV bonuses which not many companies do nowadays No politics in work culture Freedom of remoteHybrid Other company benefits Yearly NTUC gift card company outings prices given during online townhalls Crash courses provided,Hierarchical bosses colleagues Micromanagers Extremely slow opportunities for growth Overall mental health support bad even with incompany counselling Workload does not match the salary given Salary is lower than market rate,Team Leader,Current Employee,nan,Jan 25 2022
40,NTUC FairPrice review,,Good colleagues lateral movement possibilities and considerate bosses,Long working hours no one to cover during vacations,Business Development Manager,Current Employee,Pioneer,May 1 2022
40,Worked at NTUC for 2 years,,Nice colleagues and supervisor and customers,Low pay tiring work long standing hours,Cashier Temperature Screener,Former Employee,nan,May 9 2022
50,Decent working place,,standard hours expected for base salary pay,none to be specifically mentioned,Retail Sales Associate,Current Employee,Punggol,May 9 2022
30,There are better part time jobs out there,,Flexible Working Hours PTs get bonus too,Depending on management at outlets staff welfare may not be the best Standing for long hours,Retail Assistant,Current Employee,Singapore,Jul 13 2022
40,OK place,,Not a bad place for an IT professional supportive management,too much old legacy applications,Cloud Engineer,Former Employee,Singapore,May 5 2022
30,Work environment,,Good working environment not bad salary for part time,Working hours can be quite long,Retail Assistant,Former Employee,nan,Jul 27 2022
40,Okay,,Okay salary for part time,It is extremely busy for the location,Sales Promoter,Former Employee,Jurong West New Town,May 6 2022
50,Analytics,,Great leave benefits Understanding managers yet they challenge you to explore beyond,It can get stressful at times,Executive,Current Employee,nan,Apr 24 2022
40,its exactly what you envisioned it to be,,NAME,doing the same thing continuously for hours,Cashier,Former Employee,Singapore,Apr 17 2022
40,good experience,,nice warm friendly colleagues and exposure to FMCG industry,hectic work environment reporting to different teams and supervisors,Intern,Former Employee,nan,Apr 24 2022
50,Retail assistant,,Friendly working environment Friendly colleagues Alot of things to learn if you are keen in learning OTC Medicine and healthcare products,Not Applicable NA NIL,Pharmacy Retail Assistant,Former Employee,nan,Apr 12 2022
20,Really old school and biased,,There is a lot of work to do and lots of way to collaborate with other parts of Business,It is extremely messy and disjointed The direction for diff departments are in conflict with one another plus the system and marketing department as a whole is very biased,Senior Manager,Former Employee,nan,May 17 2022
20,Branch Manager,,Benefit is better than many company,Too many issue from top down Not convenient to share,Store Manager,Former Employee,Jurong East New Town,Jul 19 2022
40,Average,,Work life balance in the company,Career progression opportunities are hard to come by,Internal Auditor,Current Employee,nan,Apr 27 2022
50,Work life at ntuc,,friendly manager relatively stressfree work environment,unfriendly customers and can be physically straining sometimes,Anonymous Employee,Former Employee,nan,Apr 21 2022
40,Good place to learn,,Lots of changes ongoing can learn,Need to able to handle uncertainty and find your own way,Human Resource Employee,Current Employee,Singapore,Apr 4 2022
40,Not a bad place to be,,Good team members Good nonmonetary benefits Good place to grow,Compensation still below market rate Weak overall leadership Internal stakeholders may be easy or difficult to work with,Human Resources,Current Employee,nan,Mar 24 2022
20,,,Nice employees that were very helpful,Supervisors are very demanding and very hard labour work,NTUC,Former Employee,Woodlands New Town,May 24 2022
40,Not too bad,,family orientated depends on boss can be good,can be a bit too big too many things,Senior Executive,Former Employee,nan,May 14 2022
40,NTUC FairPrice review,,Good colleagues lateral movement possibilities and considerate bosses,Long working hours no one to cover during vacations,Business Development Manager,Current Employee,Pioneer,May 1 2022
30,Marketing,,MNC structured good for portfolio development,Too many layers within a department Overlapping task,Anonymous Employee,Former Employee,nan,May 16 2022
30,Friendly and Long work hour,,Friendly colleagues and colleague willing to teach,Long working hour and distance,Retail Assistant Sales Floor,Former Employee,Singapore,May 13 2022
40,Worked at NTUC for 2 years,,Nice colleagues and supervisor and customers,Low pay tiring work long standing hours,Cashier Temperature Screener,Former Employee,nan,May 9 2022
20,Normal company but not for ppl who look for high pay,,nice colleague and can work from home,low pay and no progression,Category Manager,Current Employee,Jurong West New Town,May 2 2022
50,Decent working place,,standard hours expected for base salary pay,none to be specifically mentioned,Retail Sales Associate,Current Employee,Punggol,May 9 2022
40,OK place,,Not a bad place for an IT professional supportive management,too much old legacy applications,Cloud Engineer,Former Employee,Singapore,May 5 2022
30,Good working environment,,Good working environment hu eade,we we we we we,Retail Assistant,Former Employee,nan,May 13 2022
40,Part time cashier during festive period,,friendly work environment and fairly good hourly rates for temporary staffs,work can be repetitive at times busy during festive periods,Cashier,Former Employee,nan,Mar 8 2022
50,Good,,NTUC staff are very friendly and helpful Got the job immediately with no interview,Slow replies once finished task for the day there is nothing to do,Retail Assistant,Former Employee,Punggol,Mar 3 2022
50,Great place to work,,Good working place Have work life balance,Pressure can get to you times,Anonymous Employee,Current Employee,nan,Mar 18 2022
50,good,,It was a good experience,there is no cons working here,Cashier,Former Employee,nan,Mar 21 2022
10,Toxic work culture,,Rapport between work peers is generally good,Middle management will keep taking on more work and more projects to please upper management which means the team will struggle to cope Expectations to work on weekends without compensation Minimal training provided to new staff,Anonymous Employee,Former Employee,nan,Jun 20 2022
50,Enjoy working at Fairprice,,good people culture nontoxic conducive environment good benefits,NAME,Anonymous Employee,Current Employee,nan,Feb 20 2022
50,Really good,,Friendly employer and employees no problem at all,Need to stand no stool for casheir,Part Time Cashier,Current Employee,Woodlands New Town,Feb 26 2022
10,No OJT Provided,,Fellow part timers willing to help,Work is doable but team leaders are demanding Show bias to own race Expect girls to lift heavy cartons and stack above high heightened shelves Not professional,Stock Replenisher,Former Employee,nan,May 21 2022
30,Cashier,,Friendly staff and interact with peolle,Not great pay and can be tiring,Cashier,Former Employee,Singapore,Jun 14 2022
40,good,,pay is reasonable environment is good,6 days work week tiring,Retail Assistant,Former Employee,nan,Mar 20 2022
40,Good place to learn,,Lots of changes ongoing can learn,Need to able to handle uncertainty and find your own way,Human Resource Employee,Current Employee,Singapore,Apr 4 2022
40,Not a bad place to be,,Good team members Good nonmonetary benefits Good place to grow,Compensation still below market rate Weak overall leadership Internal stakeholders may be easy or difficult to work with,Human Resources,Current Employee,nan,Mar 24 2022
50,Good Work Culture,,Friendly Environment where everyone works well together,Long hours and a lot of standing,Retail Assistant,Former Employee,nan,Apr 10 2022
30,Long jours,,Super duper easy and laid back job,Long hours and days with low pay,Retail Sales Associate,Current Employee,nan,Apr 21 2022
50,Good company,,Great co workers Average salary for a part timer,Nothing much to say here,Retail Assistant,Former Employee,nan,Apr 14 2022
20,No Work Life Balance,,Great Bonus Friendly Operational Staff Learning opportunities 5 years there Other departments are okay except Integrated Support Join if you don’t want to have a life and mental health,No Career growth Basic employee benefit Bosses in that department will gaslit you when you try to quit Clueless on management style and expect staff to keep telling them that they are a micromanager on a yearly basis,Executive,Former Employee,nan,Dec 10 2021
50,Wonderful environment,,Over stock during festive season,Chearful team up and great place,Retail Assistant,Current Employee,Singapore,Feb 2 2022
30,Fun,,Low entry requirements so easy access,Packing all day is really tiring,Sales AssociateCashier,Former Employee,nan,Apr 14 2022
40,Good for student who want to work part time,,learn the cashflow and account balance statement,cannot choose the time to work by rotated shift,Cashier,Former Employee,nan,Mar 24 2022
50,Best PLace,,One of the best places to work,I didnt feel there is anything wrong with the company,Software Engineer,Former Employee,Singapore,Mar 31 2022
40,Friendly coworkers,,Friendly staff from a diverse age group,Can be mundane and tiring,Cashier,Former Employee,nan,Apr 4 2022
50,Fun environment,,Pay was nice 10hr There were a bunch of students working parttime so it was quite easy to blend in and clique when I first started Managers ensured that new staff had a buddy to work with them on the first day Buddies are parttime students,Unpaid 1hr break Cashier duties require long standing hours literally stood the whole shift except during breaktime Sometimes when there are too many workers doing the same role it left me with nothing to do So I would walk around the supermar,Retail Assistant,Former Employee,Jurong East New Town,Jun 22 2021
30,Friendly staffs,,everyone there is fun to work with,endless work daily and mental healthy must be strong to work there,Cashier,Former Employee,nan,Mar 22 2022
40,Quite ok,,AC environment so quite a comfortable environment,Nothing too extreme of a con,Temporary Retail Assistant,Former Employee,nan,Mar 30 2022
30,Great place to learn and grow,,NTUC Fairprice is a great place to learn to get out of your comfort zone and branch out to people to socialize,The fulltime workers there are arrogant,Retail Assistant,Current Employee,Pasir Panjang,Feb 27 2022
40,Part time cashier during festive period,,friendly work environment and fairly good hourly rates for temporary staffs,work can be repetitive at times busy during festive periods,Cashier,Former Employee,nan,Mar 8 2022
50,Good,,NTUC staff are very friendly and helpful Got the job immediately with no interview,Slow replies once finished task for the day there is nothing to do,Retail Assistant,Former Employee,Punggol,Mar 3 2022
30,Decent Part Time Job,,Aircon Can choose the nearest outlets to your home,Crowds during peak hours Long Standing,Retail Assistant,Former Employee,nan,Mar 15 2022
50,Great place to work,,Good working place Have work life balance,Pressure can get to you times,Anonymous Employee,Current Employee,nan,Mar 18 2022
30,Alright,,They treat parttimers really well,Can occasionally be dangerous eg high shelves etc,Retail Assistant,Current Employee,Singapore,Mar 24 2022
50,good,,It was a good experience,there is no cons working here,Cashier,Former Employee,nan,Mar 21 2022
50,Enjoy working at Fairprice,,good people culture nontoxic conducive environment good benefits,NAME,Anonymous Employee,Current Employee,nan,Feb 20 2022
20,Join if you like walking,,you can do your job my yourself good if you like working alone,they make you wear a vest so random people will ask you where things are need to walk ALOT very physically tiring supervisors not very nice but coworkers are generally friendly,PickerPacker,Former Employee,nan,Jan 26 2022
50,Really good,,Friendly employer and employees no problem at all,Need to stand no stool for casheir,Part Time Cashier,Current Employee,Woodlands New Town,Feb 26 2022
20,Culture,,You get what you sow,political environment Very hard to get simple task done as there lot of escalation to different departments,IT Manager,Current Employee,Jurong West New Town,Mar 7 2022
30,student part time,,flexible schedule maybe because student,alot of gossiping between aunties,Retail Assistant,Former Employee,Singapore,Mar 21 2022
20,Lack of Salary parity,,Arguably better Work life balance,Slow to change and is constantly hiring high management from external to change and many have left shortly Substantial pay gap within the same rank and file and are willing to pay more from external,Anonymous Employee,Former Employee,nan,Feb 1 2022
40,good,,pay is reasonable environment is good,6 days work week tiring,Retail Assistant,Former Employee,nan,Mar 20 2022
40,Good learning experience,,Supportive colleagues good learning experience,long standing hours work on weekends,Cashier,Former Employee,Singapore,Mar 16 2022
50,Nice colleagues,,Family like culture with people looking out for part timers,Not many downsides other than it gets very busy during chinese new year period,Retail Assistant,Current Employee,Singapore,Feb 22 2022
40,NIL,,people are nice and learn what goes on behind the scenes when receiving food stocks,quite physically demanding and busy,Packer,Former Employee,nan,Jan 23 2022
30,Good ideas but unclear instructions from management,,Free food food taster nice colleagues,Littleno direction from top management overpromise low paying little promotion opportunities,Quality Assurance,Current Employee,Singapore,Apr 23 2022
50,Giid,,Nice work environment Caring boss And good friendly coworkers,Cold room freezer very cold,Retail Assistant,Former Employee,nan,Feb 2 2022
40,Good,,The higher ups are good,A lot of gossips in between other aunties,Cashier,Former Employee,nan,Feb 2 2022
40,Good company,,Learnt a couple of new stuff,It is a toxic working environment,Administrative,Former Employee,nan,Jan 26 2022
30,,,Friendly leaders Comfortable working environment,Long hours of walking around,Order Picker,Former Employee,nan,May 11 2022
40,Transforming to better company,,Good career growth tons of interesting works to do and things keep on changing,No documentation on the work,Executive,Current Employee,nan,Jan 12 2022
50,Good working environment,,Most colleagues are friendly and bosses are understanding towards their team members good worklife balance,Not much room for progression,Anonymous Employee,Former Employee,nan,Jan 12 2022
30,Supervisor lazy,,Convenient since it is near to my house,supervisor keep slacking and going home during working hours while the rest of us was busy working all day long,Retail Assistant,Current Employee,Jurong East New Town,Mar 2 2022
40,good job,,good job for part timers,long hours and not good management,Retail Assistant,Former Employee,nan,Jan 20 2022
40,good,,i think it has a nice environment,i think it is stressful at times,Anonymous Employee,Former Employee,nan,Jan 21 2022
50,Ok for part time,,The per hr rate for the job,Standing for many hrs during cashier duty,Cashier,Former Employee,nan,Jan 11 2022
30,Long jours,,Super duper easy and laid back job,Long hours and days with low pay,Retail Sales Associate,Current Employee,nan,Apr 21 2022
50,Good overall,,Good bonus Long time staff working,High workload Management level walking the grounds often,Anonymous Employee,Former Employee,nan,Jan 17 2022
50,ntuc,,flexible work timing and good pay,boss may be abit noisy at times,Part Time Cashier,Current Employee,nan,Jan 16 2022
40,NTUC fairprice,,Bonus is good Can learn many store operations Good mentors,Shorthanded cut costs and job scope keeps increasing Need to tank more and more work,Pharmacist,Current Employee,nan,Dec 2 2021
40,Good working environment,,Great benefits and colleaguesstable job,A lot of ad hic duties,Anonymous Employee,Current Employee,nan,Jan 16 2022
50,Good Part Time Job,,Friendly Staff comfortable air con environment,Need alot of physical labour,Anonymous Employee,Former Employee,nan,Jan 13 2022
