,Rating,Title,Pro,Con,Job Title,Status,Region,Date
946,2.0,low salary but good exposure,"good exposure, good technologies, bad mgt","low salary, 15% stock option buy",Assistant Manager,Current Employe,"San Jose, CA","Sep 20, 2022"
947,5.0,Great Company to learn and great people to learn from,"Great work life balance for junior level positions, L10-12. Flexibility in what you want to pursue and learn.
Senior Leadership always ready to teach and help with your growth",Annual pay raise are not significant (2 to 5%).,Consulting Development Analyst,Current Employee,"New York, NY","Aug 6, 2022"
948,4.0,Great Company,"Great company, a lot of perks, and great culture. I enjoy our work, the change we make and the people we work with.",Salary could be higher to meet with the rest of big consulting firm.,Associate Manager,Current Employee,"Tampa, FL","Aug 25, 2022"
949,4.0,Good place to learn,"Learned a lot but once I decided I had no desire of becoming a MD, I knew I had to leave. CoVid decided 2020 would be the year",HR Leadership needsto get more organized.,Manager,Former Employee,"Florham Park, NJ","Aug 25, 2022"
950,5.0,IT operation,Great company with many projects,Lots of management and loops to get things done,IT Operations,Current Employee,"Reston, VA","Aug 8, 2022"
951,4.0,Promotion/Salary,Accenture allows for mid-year promotions given that you are eligible. Each individual is responsible for acquiring their own feedbacks from their projects managers and team members.,"Your promotion and salary is based solely on your People Lead and the Talent Leads. The compensation is determined based on your bonus and annual increase, which is based on the average Accenture % increase for your particular area/sector as well as your talent priority (i.e. distinctive achievement).",Application Manager,Current Employee,"Chicago, IL","Aug 3, 2022"
952,1.0,Bad,Bad environment to work with,Bad salaries nothing is good,Customer Service Representative,Former Employee,"New York, NY","Nov 18, 2022"
953,3.0,Company pays well,Company pays well; good clients to work with,Finding right project is difficult,Technology Delivery Lead,Current Employee,"Minneapolis, MN","Oct 12, 2022"
954,5.0,Great Company,All the help and resources you can ask for.,"Being on the bench, like most consulting companies when you are on the bench it sucks.",Associate Softeware Engineer,Current Employee,"Nashville, TN","Jul 18, 2022"
955,1.0,Wasted Talent.  Self first culture. Fake HR.,"Pays well.
Great Research and Tools. 
Quality Online Videos to learn from (but all in your own time)
20% of the MD’s actually care about people.
60% of MD’s actually care about their clients.
Hires Great People who believe in Accenture","Actuality is nothing like the Employee Experience touted during Onboarding and Hiring. You are just a number.
HR can’t handle the truth.
20% Turnover of staff annually.
60% of staff are always looking to leave.
80% of MD only care about themselves.
Individuals set up to fail. Intense. Combative.
16 hours days expected but told charge only 8 hrs.
80% PowerPoint / 20% Add-Value. Pedantic.
Minimal support, mentoring or coaching. 
Prepared to let great people sit on the bench unused for 90 days. 
Treats new associates and new hires badly. No assignment pipeline.
Internal Assignment marketplace is a complete failure. Not used to actually assign staff. But a very nice and shiny system nevertheless.
The HR function believes their own hype. Won’t see / Can’t see that Accenture values are not valued. 
CHRO is too self-absorbed to hire from within because front line consultants know the truth. HR says the right things but reality is fake.",Executive Director,Former Employee,"Los Angeles, CA","Aug 4, 2022"
956,5.0,Really cares about their People,Invested in training and people development,I had no cons while thete,Senior Director,Former Employee,"Boston, MA","Aug 5, 2022"
957,5.0,Good,"Strong, creative, loyal, good conpany",A lot of hours but solid,Accountant,Current Employe,"South San Francisco, CA","Aug 11, 2022"
958,4.0,Varied work,Large company with wide exposure,Can get lost in the numbers of such a large corporation,Management Consultant,Current Employe,"Orlando, FL","Oct 11, 2022"
959,5.0,Good experience so far,Training was helpful and clear overall.,No clear guidance on projects for new hires,Tech Architect Analyst,Former Employe,"Minneapolis, MN","Aug 3, 2022"
960,5.0,Amazing,"Culture
People
Professional growth
Work-life balance",There are no cons at Accenture!,Summer Intern,Former Employe,"New York, NY","Aug 11, 2022"
961,2.0,Overworked,Average benefits compared to industry,Long hours and high expectations. Poor work-life balance,Senior Manager,Current Employee,"Miami, FL","Oct 10, 2022"
962,4.0,Good overall,Lots of experience. Lots of opportunities for improving training and skillset. Really care about diversity and plus one engagements within the community,Can be difficult to get promotions if not near the top of your peers. You really need to drive your career progression. Can be long hours expected to work at last minute. Told to submit overtime but can be shamed by some supervisors if don't get approval first which can be difficult,Tester,Current Employee,"Austin, TX","Aug 4, 2022"
963,5.0,Great company,"Overall, leadership steps up to improve work culture. If you’re not happy on one project, you can be proactive and find another.",Lower pay for AFS than Accenture,Technology Manager,Current Employe,"Washington, DC","Jul 16, 2022"
964,4.0,Accenture,You get to work from home. You also get pto days.,I done have any at the moment,Business Analyst,Current Employee,"San Antonio, TX","Oct 7, 2022"
965,5.0,Accenture,Cool people and family oriented,I don’t have any worries,Procurement Specialist,Current Employee,"Austin, TX","Aug 8, 2022"
966,5.0,Strong team,Great company to work in your 20s and 30s,Some projects may require travel,Senior Manager,Current Employee,"San Francisco, CA","Aug 1, 2022"
967,3.0,Consultant,Lots of variety to learn,Cold heartless machine that wants maximum,Consultant,Current Employee,"Chicago, IL","Oct 14, 2022"
968,5.0,Excellent learning opportunities,Many opportunities to learn work; can do certifications,Night shifts for Non IT,Anonymous Employee,Former Employee,"Hyder, AK","Jul 31, 2022"
969,5.0,Great company and great benefits!,"- work with very smart people
- always learning something new","- none, great culture, great people, great resources",Business and Arch Integration Analyst,Current Employee,"Chicago, IL","Jul 22, 2022"
970,5.0,Smb workflow,So much opportunity when you put your best foot forward,Not enough remote opportunity now days,Team Lead,Current Employee,"Austin, TX","Jul 19, 2022"
971,4.0,Good company to work for,"Easy going. free breakfast, lunch, and microkitchen with snacks and drinks, room to go to different projects",HR takes for ever to respond or assist you. You don't know who to turn to for help because you have assigned people wo just pass you around to the next person when they don't know how to help.,BI Agent,Current Employee,"Austin, TX","Aug 17, 2022"
972,4.0,Good place to work,Good people and good management,Only client Accenture had in town,Manager,Former Employee,"Huntsville, AL","Oct 3, 2022"
973,4.0,Solid company to work for,"- Great diversity
- Great coworkers and culture
- Good pay compared to competitors","- Difficult projects and client demands
- Long hours at times leading to below average wlb
- Not a lot of ways to connect and network with other teams outside of your project (partially due to wfh)",Analyst,Current Employee,"Washington, DC","Aug 28, 2022"
974,5.0,Very good company to especially start career with,"No micromanagement
Very good guidance",Your commission is capped although you can exceed the normal 100% bonus.,Sales Development Representative,Current Employee,"Atlanta, GA","Jul 19, 2022"
975,4.0,Good work life balance,Work life balance is good compared to other consulting firms,Pay is a bit lower than other consulting firms,Senior Analyst,Current Employe,"Philadelphia, PA","Sep 29, 2022"
976,5.0,Great company,"Good people, great culture, competitive pay",need to retire older computers and send out newer models with better specs,Strategy Consultant,Current Employee,"Boston, MA","Jul 22, 2022"
977,4.0,Good company,"Great perks, good culture, people are helpful, work is decent, learning is decent","Work projects can be better, less work life balance",Management Consultant Business Analyst,Current Employee,"New York, NY","Sep 22, 2022"
978,1.0,ok,not much to say about.,digital worker to say the least.,Manager,Former Employee,"Chicago, IL","Nov 10, 2022"
979,4.0,Great place to work if you have the right team!,"- culture: My team is the absolute best at Accenture and I couldn’t be happier with the culture and caring nature of my coworkers!
- great starting pay (may be dependent on team) 
- great atmosphere, with opportunities for growth
- great work life balance with flexible work hours, ability to leave for appointments; other life events with ease 
- no micromanaging or rude behavior (may be dependent on team)","- Bimonthly payments 
- Not a ton of holidays a year. Client tended to have 2x the amount of paid holidays a year",Technical Project Manager,Current Employee,"Philadelphia, PA","Jun 27, 2022"
980,4.0,Great place to work,Flexibility with work from home and good benefits,Hard to advance with few promotions,Anonymous Employee,Current Employee,"San Antonio, TX","Oct 3, 2022"
981,2.0,Accenture Employeers: Dumb Culture Around Drinking,some projects you can skate by only doing 10 hours of work a week and still making 100k+,"everyone in the company is kind of dumb, culture around drinking, and everyone counting down their days until the weekend lol",Senior Consultant,Current Employee,"Detroit, MI","Sep 1, 2022"
982,5.0,Great Company,Leadership is great about training classes and helping you move forward in your career.,The con is finding your own work.,Tech Arch Delivery Specialist,Current Employee,"Atlanta, GA","Jul 18, 2022"
983,4.0,Great Company,"Culture
Senior Management Team
Potential to be involved in other aspects of the business",Caters too much to hiring primarily young professionals,Executive Assistant,Former Employee,"Atlanta, GA","Sep 28, 2022"
984,4.0,Hard work but smart people,Structure and stable job with good upward mobility,Long hours and can be a lot of travel,Analyst,Former Employe,"Washington, DC","Sep 28, 2022"
985,5.0,Awesome company to work for,"What has kept me at Accenture 10+ years is the Opportunities they offer. As a global company, there is always something new. Your project can change much more often than other companies, and that keeps me challenged & continuously learning. I have been able to accumulate tons of experience, all with the same company. They look for similar skills that can be applied in different areas, which allows for that growth. Most companies will not do that, and expect you to have exact experience to try new roles/areas. But with that old school methodology, you'd essentially have to start at the bottom with any change of industry. At Accenture they look for the likenesses they can apply for you to be successful in the new role, which is quite different. I also love their initiatives and engagement events aimed towards Inclusiveness & Diversity. It's a real thing at our company, and I see the programs and the initiatives to push for equal opportunity.","The con's that people may see with our company are the immense amount of learnings required. Accenture is very big on continuous learning and ensuring their employees are up to date on Technology and the 'next big thing', like AI and Block Chain. That may not be a priority for everyone in the world and that may not fit well with a person's mind set when looking for a job. But it's important for all of us to stay relevant in our industry and we know we have to continuously grow with our skills and ideas. It is something I explain to anyone I interview externally.",Senior Manager,Current Employee,"San Antonio, TX","Mar 17, 2022"
986,4.0,Awesome,"Great place to work for, super friendly coworkers",N/A pretty good overall i would say,Program Analyst,Former Employee,"Phila, PA","Oct 4, 2022"
987,4.0,Excellent,Various domain to choose; various technology to choose,None that I can think of,Senior Manager,Current Employee,"San Diego, CA","Oct 5, 2022"
988,2.0,Okay company to start career with,"- Great Pay
- Better work/life balance since covid","- No real culture
-On your own type of work environment
- Constant change in leadership and work structure",Business Integration Specialist,Current Employee,"Houston, TX","Sep 20, 2022"
989,4.0,Easy work,"Easy work, your peers are typically around your age, supportive team, and non-hostile environment.","The day to day work is actually quite easy, what makes it quick for many people to burn out is their slow processes and constant ad-hocs you need to do to correct other people's errors to make your data clean. The analyses required for this job are quite simple, so there's not much room for growth to gain additional transferrable skills, but its worth learning on your own to improve your own analyses. This role is not client facing, but you present to executives in your portfolio but depending on the project you are on you may not know what your client's work is, so explaining variances can be a shot in the dark.",Client Financial Management Senior Analyst,Current Employee,"Arlington, VA","Feb 10, 2022"
990,2.0,Not worthy,May be benefits are attractive,"Bad Management 
Biased 
learning development is there, but no respect in some projects
way too unprofessional leaders in some projects",Associate Manager,Current Employee,"Chicago, IL","Sep 21, 2022"
991,3.0,Great start to a career,Great when you are fresh out of school and need a job to gain experience. Good money and benefits.,Lots of travel depending on the project. Can be in the red zone if you don't have a project.,Management Consultant Analyst,Current Employee,"Atlanta, GA","Aug 23, 2022"
992,4.0,Large Company with Endless Rescources/Possibilities,Accenture will enable you to have the most expansive network if you really work it. Engagement and plus one opportunities are all around which enable you to never feel like you can only work on one passion project. Each account is of course different but working at Accenture is a great place to start and continue with career since its a well respected.,Jumping from level to level is pretty difficult if your on a team where one's career mobility is determined by someone else getting promoted so you can fulfill that role. A lot of Accenture is very structured so you wont be getting the freedom and flexibility of a smaller company/startup.,Senior Analyst,Current Employe,"Washington, DC","Jun 1, 2022"
993,5.0,Great Company,"Great pay, great people, great work.","There are 700,000 people working for the firm, so it takes a while to get your name know.",Management Consultant,Current Employee,"Sacramento, CA","Jul 12, 2022"
994,5.0,"Get work culture, very inclusive","Very inclusive and diverse culture, good general WLB in my experience so far","May not pay as much as big four, there are pockets of projects where the culture is not as great, but general still pretty good work culture",Operations Analyst,Current Employee,"Washington, DC","Jun 17, 2022"
995,3.0,Everyone is jumping ship,"1. Work with great companies
2. Work with senior leaders at clients (C suite) 
3. Work with really smart multi year decade of experience
4. Used to be able to accelerate promotion","1. Everyone smart has left for industry 
2. The pay is terrible compared to tech salaries
3. Hours are horrible
4. Senior leadership is disconnected from younger generations",Manager,Current Employee,"San Francisco, CA","Jun 2, 2022"
996,4.0,Ayn Rand - Eat your heart out,"Within my first three years I've been promoted twice, +50% hourly wage, travel weekly halfway across the US delivering great solutions in a niche industry, potential job security for decades, competitive salary and great benefits. I've worked in Oil & Gas, Aerospace & Defense, I now have a rolodex of engineers and developers from this job alone.","I got lucky, almost none of my coworkers hired alongside me are even still working here, and those that are aren't doing what they want. And that's not meant as a brag, there's no special sauce that kept me afloat in chargeability, I was simply selected for some internal job and bounced up from there. Take the ""Pro"" section as the potential here, not the standard.

Accenture demands your networking skills, your weekend hours, and part of your sanity. Your hours will be spent putting out manager's fires, you will hear ""well, it has to be done by Monday"" Friday at 4PM a lot. Your resume will sparkle but it will bleed you dry. Use it for networking and hope you find a nice project.",Consultant,Current Employee,"Seattle, WA","Feb 25, 2021"
997,5.0,Great company,There is a lot of room to grow and explore your interests with each project you join. Management is really interested in helping you grow and develop your skills.,I wish Accenture put more effort into helping teams in remote projects develop relationships. Monthly lunches should be encouraged in projects especially if they're remote and team members rarely speak to each other besides giving work updates.,Management Consulting Analyst,Current Employee,"Los Angeles, CA","Apr 20, 2022"
998,2.0,Underpaid!!!,Nice coworkers. The team I was on was why I stayed for as long as I did.,Extremely underpaid for the work I was doing. That paired with some micromanaging from higher ups and all the ridiculous processes they continue to implement that just fill the day with busy work lead to some MAJOR burn out. So glad I got out of here!,Business Development Representative,Former Employee,"Atlanta, GA","Jul 11, 2022"
999,5.0,Diverse and Growth-Driven,"1) Diverse talent pool across consulting, strategy, technology, interactive, and operations arms
2) Wide reach across industries in client portfolio - great place to learn how different businesses operate
3) Career progression is encouraged and supported - People Lead program helps provide dedicated support and counselling in career advancement and skill focus areas","1) Can be difficult to navigate the large organization - individual practices and groups often feel like siloed pods
2) Overall experience within Accenture can be highly varied depending on project, team, and engagement",Senior Manager,Current Employee,"San Francisco, CA","Mar 3, 2022"
1000,2.0,rat race,"fast paced, otherwise no pros",work life balance is at risk,Data Scientist,Current Employe,"Seattle, WA","Oct 7, 2022"
1001,4.0,Accenture,Great people to work with.,Hard to get staffed on jobs if you do not know anyone in firm.,Business Analyst,Current Employee,"Los Angeles, CA","Sep 27, 2022"
1002,4.0,"Overall, Pretty Great","This role provides the opportunity to do some real good work for people all over the world. Accenture really prioritizes their people and their working experience, this is truly reflected in the services and opportunities they provide.","This company has close to a million employees so everything moves at a glacial pace. They are also extraordinarily rigid when it comes to HR policies so most decisions in regards to pay, bonuses, raises, etc... are completely out of the hands of your supervisors and managers.",Protective Services Senior Analyst,Current Employe,"San Antonio, TX","Jul 10, 2022"
1003,4.0,good place to work,diverse workforce and numerous ways to interact with the seniors and juniors,work extremely hard and know the right people to move up,Consulting Senior Manager,Current Employe,"New York, NY","Sep 19, 2022"
1004,5.0,Great place to work!,Competitive salary. Good health benefits. Interesting projects (depending on assignment),No paid holidays (Accenture Flex),Data Engineer,Current Employee,"San Francisco, CA","Jul 18, 2022"
1005,3.0,"Overall, good place","Decent pay, great benefits, promotes work life balance to employees",Hard to advance even when you go above and beyond. Going above and beyond required duties just to maintain employment,Transaction Processing Associate,Current Employee,"Louisville, TN","Sep 13, 2022"
1006,4.0,Great large size firm,Total compensation package is top tier.,Work hours can be long with little recognition at times.,Senior Manager,Current Employee,"Arlington, VA","Sep 26, 2022"
1007,4.0,Wonderful company to work for!,"Benefits, work/life balance, 40 hour work week, competitive pay",No remote work for LSAs,Location Services Analyst,Current Employee,"Cincinnati, OH","Sep 27, 2022"
1008,4.0,Solid Work Environment,Good work-life balance and low key work assignments.,Difficult to move roles for low level employees.,Senior Technology Analyst,Former Employee,"Washington, DC","Sep 16, 2022"
1009,5.0,Great place to learn,Easy to advance and learn more skills,Low pay and not easy to do Work on what you want,Senior Analyst,Current Employe,"San Antonio, TX","Jul 12, 2022"
1010,5.0,Good company and good benefits,Good company and good benefits,difficult to move from project to project sometimes.,Cloud Solution Architect,Current Employe,"Washington, DC","Sep 2, 2022"
1011,5.0,Amazing Career,"Great people, great technology, great leadership, great company.","Work/life balance at times, but has gotten better. Scope of role is very broad.",Senior HR Partner,Current Employee,"Minneapolis, MN","Aug 26, 2022"
1012,2.0,"Major improvements needed, don't waste your valuable career time here.","Experience on high profile projects, when enough quotas are filled, otherwise expect low impact roles.","HR and benefits claim benefits but lousy on delivery. Be careful when attempting to exercise parental leave or any disability related workplace assistance. They discriminate on employees with disabilities and gender on most projects and promotions. It is very sad to watch. HR will also block promotions and project assignments if you do not fit into their quota - despite project leadership / teams / even clients asking for you as a specific named resource. A lot of ppl quit early or get indefinitely placed on the bench, until they quit, so HR won't have to technically fire you.  It is very unprofessional and unethical. Mostly about saving money or supply enough minorities so as to win bids / contracts.",Consultant,Current Employee,"Chicago, IL","Feb 16, 2022"
1013,5.0,Fair workplace,Smart people and always interesting opportunities.,Can be tough hours during projects.,Principal Director,Current Employee,"Tampa, FL","Sep 6, 2022"
1014,3.0,HR,Good spf training hmo and work very rewarding,"Hr not helpful esp when you have question regards assistance on emergency (hospitalization, zero net pay without prior notice) depends on ticketing system like speaking to new agent all the time without resolving the issue",Associate Manager,Current Employee,"Manila, UT","Aug 4, 2022"
1015,4.0,N/A,Not applicable to internship experience,"Overworking, long hours, and lack of boundaries",Intern - Hourly,Current Employe,"New York, NY","Sep 8, 2022"
1016,4.0,Application Engineering,Good work life and balance,No special recognition from anyone,Applications Engineering,Current Employee,"New York, NY","Sep 9, 2022"
1017,3.0,Good to start a career in a different industry but after a while better move out,The allow me working form home during the pandemic and got 2 little bonus. Over all I got some very good experience and now I am ready for the next step of my career.,The mentality of my colleagues doesn't show more than 20 years old and get promoted is close to Impossible thinking about the competition. To get promoted people has to study and prepare a presentation nearly like am interview in an other company. I any company a promotion should should come easily without any interview,Social Media Agent,Current Employee,"Dublin, CA","May 16, 2022"
1018,1.0,Great Gig,"1. Great gig for someone who's just starting a career in tech.
2. I worked at the Google campus in Mountain View so there are great amenities.",No career path. Terrible benefits like none or you have to pay out of pocket with huge contribution.,Content Review Analyst,Former Employee,"Mountain View, CA","Sep 6, 2022"
1019,3.0,Salary,Good WLB and no brainer projects since NGGM,Too much fight between MDs on revenue sharing. This has gone from bad to worst since the firm implemented MU model. Promotions are not by merit but mostly decided by how much time you spend in the firm.,Director,Current Employee,"New York, NY","Jul 15, 2022"
1020,4.0,Rewarding,Work is rewarding and challenging,You're career and ability to remain staffed depends more on how well you network than your actual competency,Manager,Current Employee,"Chicago, IL","Aug 20, 2022"
1021,4.0,AFS,Work Life Balance is great,Promotion and upwards movement in the company can be difficult,Analytics Analyst (Accenture Federal Services),Current Employee,"Washington, DC","Sep 2, 2022"
1022,4.0,Great place,They invest heavily in you. You must find your own role.,Always feel like you’re interviewing,Product Manager,Former Employee,"Atlanta, GA","Aug 30, 2022"
1023,5.0,Good,Good place to work in my experience,Can be a lot as a new person.,Associate Software Engineer,Current Employee,"Nashville, TN","Aug 31, 2022"
1024,5.0,So far so good,"Competitive pay + Benefits
Company culture 
Pay for upskilling ( certificates)",Idk I having passed first week yet lol,Advanced Applications Engineering Analyst,Current Employee,"Atlanta, GA","Aug 24, 2022"
1025,3.0,VP,"good company, bad politics. Tread carefully","good company, bad politics. Tread carefully. Too big, fiefdoms and politics",Director,Former Employee,"Raleigh, NC","Aug 12, 2022"
