,Rating,Title,Pro,Con,Job Title,Status,Region,Date
0,5.0,Great place to work,"Large company, lots of support, good parental leave","Raleigh is small office, fewer local clients than other offices, so travel may be necessary, but great company regardless",Management Consultant,Current Employee,"Raleigh, NC","Oct 24, 2022"
1,5.0,Analyst role review,People are smart and fun. Learned a lot.,Hours and intensity of work.,Analyst,Former Employee,"New York, NY","Mar 24, 2023"
2,5.0,Alot of Jobs One Home,"There are a lot of pros working for Accenutre. They have great career opportunities, a never ending supply of interesting work, competitive compensation, wonderful benefits, great people, wonderful training programs, a tremendous number of brilliant professionals in their fields ready to help, and great core values.",This is not an opportunity for those that do not want to work. At Accenture everyone has a load of work to do and often times under very tight customer time lines. It is a challenge that I enjoy but many might find it stressful.,Infrastructure Manager,Current Employee,"West Lafayette, IN","Sep 21, 2015"
3,1.0,"Toxic, Incestuous and Suck-Up culture !","I was a lateral senior hire from another firm into Accenture’s Strategy Consulting practice. And boy oh boy, I had no idea what a toxic place a work environment could be in todays times, and in the US, especially amongst supposedly well educated and composed folks. I was in for the rudest shock I have experienced in my 15 year career. The other ‘senior managers’ were rude, unwelcoming, abrupt, closeted and down right hostile. The partners to whom they had sworn their loyalty to, sheparded them, coddled, and ‘protected’ them, gave them the choicest billable roles, while I was the black unwanted sheep. It took a few months to realize, the toxic, inbred, incestuous culture was one of ‘BROWN NOSING YOUR WAY UP’ ! The way to cling to and climb the ladder was purely based on this one vital ability ! A lateral hire, though more qualified and creative, was a threat, to the insecure incestuous bunch. I was later told during my exit interview, ‘yes, it’s difficult to assimilate as a senior lateral hire !” !!! HA ! So, if you want to go jump into a toxic hole, then be my guest. To me, it was one of the worst experiences in my life ! Ever wonder where these genes came from ? Look just back to the deceptive ‘Anderson Consulting’ days….the Apple doesn’t fall far from the tree. And look for their breed implanted in other companies, which is traditional practice in consulting, for them to ferry and curry out consulting deals to their heathen !",See pros above for your creative process to imagine what the cons could possibly be !,Senior Manager,Former Employee,"New York, NY","Mar 7, 2023"
4,2.0,They need to take more responsibility to give new hires real opportunities,"Smart people, good resources, great client base","There isn't any time to learn on the job and everyone assumes you will know exactly what to do on day one, so be careful what level you come in at. Lower levels are safer because analysis work is pretty standard and managers and senior managers will give you templates and more guidance. Senior managers are basically screwed because managing directors don't have time to show them the ropes and the rest of the team is depending on them to already know how to do it a certain way the team is used to. When trying to get on projects, senior managers and managers will also find out that managing directors already have their favorite ""go to"" people they have worked with for years, so they will ONLY pick you if those people are unavailable. Because of the fast nature of everything, if you make one wrong misstep, it will be assumed it is because you are incompetent, not that you misunderstood the ask or something else was the cause.",Senior Manager,Current Employee,"Chicago, IL","Feb 21, 2023"
5,3.0,Rat Race!,Smart people and great offerings. Very diverse environment which is good to see. People willing to help if you ask and if they have time.,"The Accenture system and culture is not conducive of helping new hires scale and succeed. After 2 week orientation, you get sucked into politics, everyone trying to meet their numbers and massive internal competition which can really slow you down. You either need someone to look out for you and help you as a mentor. Conflicting approach given by multiple managers you report into. Peers in sales teams seem to be part of a rat race. No help/time to understand, shadow and learn. Tuff place for newbies but hopefully once you find your home and stride..things might be different.",Sales Capture Manager,Current Employee,"San Francisco, CA","Mar 23, 2023"
6,3.0,"Mediocre, disorganization is hard to get past","Values learning and teaching Good ppl to work with Nice PTO, 17 days PTO as an apprentice Cool discounts I guess Meet international clients","-Too big and incredibly disorganized to the point where it’s hard to do your job -I joined as an apprentice for project management then they gave me a completely different role -Didn’t pay me enough to care, you’re just a number there -Office is built into and over a train station -No company culture even when you go into the office, hard to feel comfortable -You pay $15+ daily for parking to go into an office where your desk is just a table. -Everything is new but they only give you free water and coffee. Smaller companies offer more in terms of office comfort (free snacks, occasional lunch, etc.)",Project Management Apprentice,Former Employee,"Chicago, IL","Mar 23, 2023"
7,5.0,Supportive managers and challenging projects,"-great managers who will support and make sure that you reach that next level in your career -peers and managers who want to see you grow in your projects as well as internally at Accenture -everyone I have worked with are amazing individuals who are willing to help each other out; they do not hesitate to answer your questions or provide guidance if you have questions or concerns -leadership team takes in feedback well and strive to continually improve the business group -overall, I feel like I am always supported by my seniors as well as my peers, which is something that is so beautiful to experience at such a large company!","-not that I can think of as of now. So far, my time at Accenture has been extremely amazing. no complaints",Business and Integration Arch Senior Analyst,Current Employee,"San Francisco, CA","Mar 10, 2023"
8,2.0,Program not suitable for those who have coding experience and passion,The pay and work-from-home options are great for starting out in the tech field.,"They usually recruit from coding bootcamps and place you in non-coding positions or positions that rarely get exposure to any coding language. For example, my entire cohort at Accenture was placed in design or testing roles. Then, after a year of doing mindless busy work, you have to apply for other projects, but you won't be matched to or hired into any position but the ones you started with because you are matched to certain roles and get a score for your skills with the company.",Software Engineer Apprentice,Former Employee,"Austin, TX","Mar 23, 2023"
9,4.0,Great Overall But Easy To Be Overworked,100% Work from home --- Encourages constant learning / Great place to earn certifications --- Incredibly broad range of clients you can potentially work for --- Good place to build experience quickly --- Typical benefits --- Travel for work is possible,"Meeting the demands of both the client(s) and Accenture internally can put a strain on your work-life balance. They mean it when they say they encourage a healthy balance (not punished for setting boundaries), but your career progression will be quite slow unless you are overworking constantly. At least in regards to software developers, the pay is lower than you could receive elsewhere, especially if you have specialized knowledge and experience. Travel sometimes required / not optional",Business and Integration Arch Senior Analyst,Current Employee,"Nashville, TN","Mar 4, 2023"
10,2.0,Lots of marketing little substance,Good flexibility and wide variety of engagements across many solutions and industries,"They are almost exclusively turning into a sales organization rather than client value. Contracts are poorly sold, understaffed, and underbaked. What's worse is that they preach equality, sustainability, and inclusion as loud as they possibly can but my experience has been the opposite and I ran into some incredibly unprofessional and borderline discriminatory dynamics during the short time I was there (ex. leaders not knowing my name and calling me other names yet still feeling comfortable enough to submit a review on my work without consulting my direct manager for an evaluation)",Tech Strategy Consultant,Former Employee,"Chicago, IL","Mar 21, 2023"
11,4.0,Great professional experience,"If you want to learn a lot, you'll have the opportunity. People have been very friendly and supportive. All things considered, the compensation is decent. The hours aren't bad either.","If you really want to grind and put in the hours while you're young, Accenture Federal might not give you that chance, at least in my experience. It's a very comfortable career that would be a great fit for lots of people, but if you're looking to really push yourself then the corporate, lockstep promotion cycle might grate on you",S&amp;C senior analyst,Current Employe,"Washington, DC","Mar 23, 2023"
12,4.0,First job outta college. Low expectations. Lower pay.,- The work isn't very challenging and you can probably climb the ladder with a low-to-medium amount of effort. - The people are really nice and supportive. - Tons of insurance and benefit packages to choose from when you're hired.,"- Low pay. I live in a low cost of living city, and after my bills and other necessities I don't have much to save, invest, or have fun. - Boring work (but maybe it's just not for me) - Seems far behind other tech companies in terms of utilizing new / innovative technology",SAP ABAP Developer,Current Employee,"San Antonio, TX","Mar 20, 2023"
13,4.0,Good work life balance,- good work - life balance - Plenty of things to learn - Coworkers are enjoyable - Supported by management - Good benefits,- Can be slow during down periods - Sometimes management won’t communicate expectations - there is a lot of self learning or figuring out how things work in the beginning.,Quality Engineering Analyst,Current Employee,"San Antonio, TX","Mar 21, 2023"
14,3.0,"Supportive, people-first environment but significantly less pay","This company has a great culture, supportive people-first management with tons of resources for career advancement, certification, and growth. If you are not happy with your current office you can apply internally to other jobs all over the US and overseas. If you're ""let go"" from your current office they'll place you ""on the bench"" with pay until you can find another office to take you.","Accenture knows it has a great culture and employee support so it can pay you significantly less than the competition. Since the type of work it conducts is mostly B2B and gov't contracts, it is constantly looking to cut costs to win bids. When asking for a raise it can be an immense struggle, almost like shopping for a car at a dealership.",Analyst,Current Employe,"Austin, TX","Mar 6, 2023"
15,4.0,Disappointing Practices,For the most recent years the company has boasted about their focus on their people and how well they treat them. This has been true.,"When other big name, multi national corporations were transparent when they let a lot of people go...Accenture did it small waves but essentially let a very large portion of the US workforce go, keeping it out of the news.",Program Manager,Former Employee,"Chicago, IL","Mar 19, 2023"
16,5.0,Supportive managers and challenging projects,"-great managers who will support and make sure that you reach that next level in your career -peers and managers who want to see you grow in your projects as well as internally at Accenture -everyone I have worked with are amazing individuals who are willing to help each other out; they do not hesitate to answer your questions or provide guidance if you have questions or concerns -leadership team takes in feedback well and strive to continually improve the business group -overall, I feel like I am always supported by my seniors as well as my peers, which is something that is so beautiful to experience at such a large company!","-not that I can think of as of now. So far, my time at Accenture has been extremely amazing. no complaints",Business and Integration Arch Senior Analyst,Current Employee,"San Francisco, CA","Mar 10, 2023"
17,4.0,Great place to challenge yourself,"Accenture is a great place to challenge yourself and grow, whether you are an experienced hire or someone who is just starting their career. I have been a fresh-out-of-college analyst, a consultant, a rehire and a senior manager at this company and my experience is overall positive and I generally recommend it.","This is less a con, and more just the nature of things. In the Consulting arm of the business the career progression can be cutthroat, sometimes opaque, and experiences at the firm can be very different from person to person. It is not for everyone, but it is great for certain people at certain times in their lives. I recommend talking to someone who works at Accenture candidly if you can.",Senior Manager,Former Employee,"Houston, TX","Mar 7, 2023"
18,4.0,So far so good,I’ve been at Accenture since September 2022 and so far I have enjoyed my experience. I am apart of their first strategy and consulting apprenticeship so there has definitely been a lot of changes made since the beginning.,Project work is hard to come by and after the apprenticeship ends you will be expected to find your own project work if offered a full time position.,Consulting Development Analyst,Current Employee,"Chicago, IL","Mar 22, 2023"
19,3.0,If you must,Nice offices. Up-to-date systems that work. Smart people. Their company name looks good on a resume.,"Don't get too used to working with one account manager, as they only seem to last one or two years before leaving or getting promoted. Company talks a lot about work-life balance but when a client wants your team to work 24/7 on a hot project, they will not say no.",Marketing Specialist,Former Employee,"Dallas, TX","Mar 20, 2023"
20,5.0,Very calm and flexible environment,- Very flexible with work flow - Tasks that are easy to understand - A great place to start in the tech industry - Salary is decent for the amount of work,- Somewhat repetitive. - You have to do a lot of tests that require studying certain material or watching very long videos.,Platform Experience Associate,Former Employee,"San Jose, CA","Mar 22, 2023"
21,1.0,No deployment ownership and you are at the risk of firing.,Salary is lucrative however you must read the cons,"1. When you join you land as part of huge bench pool, and you will be asked to find the job yourself with networking. No support system will support you. 2. You will join for a salary but will end at firing risk (specially in USA) 3. Please go for a Indian pure play with few dollars' salary cut but never join Accenture. Highly unsecure environment.",Senior Solutions Architect II,Former Employee,"Dallas, TX","Mar 10, 2023"
22,3.0,DIGITAL INSIDE SALES,"Accenture just acquired N3 and they offer a lot of training, There are several clients to work for internally so if you don't love your current assignment you can eventually change","The leaders don't do well with managing client's expectations, which causes the contracts to end early",Inside Sales Opportunity Manager - Senior Analyst,Current Employee,"Atlanta, GA","Mar 13, 2023"
23,2.0,"Good place to start, but beware of limited opportunities","Accenture is a large company a vast amount of resources, which can be taken advantage of further your career path and interests. There is a culture of collaboration, and people are generally happy to assist and combine efforts with regard to project work. Opportunity for travel and benefits.","High rate of turnover of associates. Some people have left and returned several times. Leads to apathetic responses at some points, and can make it hard to build and maintain a strong network. Some projects require more time and effort than others, which may result in working late nights and weekends.",Management Consultant,Former Employee,"Washington, DC","Feb 23, 2023"
24,5.0,Love the challenges and opportunities,You have access to so many tools and resources to make your programs and projects successful - it's amazing.,"Lots of travel, but that can also be a pro ;)",Senior Manager,Former Employee,"Pittsburgh, PA","Mar 23, 2023"
25,2.0,Work-Life Balance,"Remote work, no crazy over time.","Pay is too low (lower than 80% of peers), growing very difficult.  Constant company re-orgs make it nearly impossible to get promote or grow past your level because you keep getting moved laterally.

Full of management that are non-technical and don't know about what they are doing.  This leads to making uninformed and incoherent decisions.  They are not receptive to constructive criticism and suggestions on how to do things.  It's only their way.  Ideas have to come from them exclusively.

Company is invasive with your data.  For example, they require that you use your personal phone for work and they must manage it by installing a profile instead of providing you a company issued device.",Software Engineering Sr. Analyst,Current Employee,"Arlington, VA","Feb 21, 2023"
26,4.0,N/A,Good working environment. Provided opportunity to work in office location in other countries,"overall, the company is good and employees are professional",Associate Manager,Former Employe,"Chicago, IL","Mar 24, 2023"
27,3.0,Agile Environment Requires Excessive Hours,"You are currently permitted to work remotely from anywhere in the US. The benefits are standard for a large corporation (6% matching 401K, ESPP of 10% of your salary, standard health care benefits and vacation hours - to be used for sick days as necessary).",Never ending pressure to work on evenings and weekends. Agile environment is a technique used to justify never ending pressure / over scheduled committments.,Senior Anayst,Current Employee,"Austin, TX","Feb 24, 2023"
28,5.0,Great company,"Good company, great benefits and great pay","Very less growth opportunities , leadership is poor and negligent",Human Resources Assistant,Former Employe,"Houston, TX","Mar 24, 2023"
29,5.0,Great place to work,"Flexible, decent starting pay, room for growth",None that I can think of,Customer Success Manager,Current Employee,"Charlotte, NC","Mar 24, 2023"
30,5.0,Great place to work!,"The Culture, People, and Flexibility in work schedule.","Accenture is a great place to work; the only downside, which is unavoidable, is you have to travel sometimes.",Managing Director,Current Employee,"Cleveland, OH","Mar 19, 2023"
31,5.0,good company,good company to start career,too long hours to work,Software Develpper,Current Employe,"New York, NY","Mar 22, 2023"
32,5.0,"""Unlock Your Potential with Accenture: Achieving Success Through Professional Services""","1. Competitive salary and benefits: Accenture offers competitive salaries and benefits packages to its employees. This includes health insurance, retirement plans, and other perks. 2. Flexible work hours: Accenture offers flexible work hours, allowing employees to work when it is most convenient for them. 3. Professional development: Accenture provides employees with the opportunity to develop their skills and knowledge through training and development programs. 4. Global presence: Accenture has offices in more than 120 countries, giving employees the opportunity to work in different countries and gain international experience.","1. Long Hours: Accenture is known for its long hours, which can be difficult to manage if you have a family or other commitments outside of work. 2. High Stress: Accenture is a fast-paced environment and can be quite stressful at times. 3. Limited Career Progression: Accenture is a large company and it can be difficult to move up the ranks quickly. 4. Low Pay: Accenture is known for paying lower salaries than other consulting firms.",Applications Developer,Former Employee,"Seattle, WA","Jan 6, 2023"
33,5.0,Good place to work,"Company resource is easy to aquire, help service is online and quick with live chat, the culture makes colleagues treat each other well.",Consultant life style and work style is not for most people,Associate Manager,Current Employee,"Chicago, IL","Mar 17, 2023"
34,5.0,"Great Pay, Great Benefits","The clients are great for bragging rights, the pay was amazing, and the attitude of everyone was really friendly. Lots of opportunity.","Kind of a ""boys club"" atmosphere. You have to be able to really get involved outside of regular work to get a good network. Being shy really held me back because I was unsure of what the right questions to ask were and had trouble understanding the vast variety of avenues. I ended up being siloed for most of my time there",Consulting Senior Analyst,Former Employee,"San Diego, CA","Feb 9, 2023"
35,5.0,Thank you,"The staff was great. The receptionists were very helpful and answered all our questions. The room was clean and bright, and the room service was always on time. Will be coming back",got a pair of boots from store X and I’m very satisfied. They are high-quality and worth the money. The store also offered free shipping at that price so that’s a plus!,Research Assistant,Former Employee,"Los Angeles, CA","Mar 9, 2023"
36,4.0,So far so good,I’ve been at Accenture since September 2022 and so far I have enjoyed my experience. I am apart of their first strategy and consulting apprenticeship so there has definitely been a lot of changes made since the beginning.,Project work is hard to come by and after the apprenticeship ends you will be expected to find your own project work if offered a full time position.,Consulting Development Analyst,Current Employee,"Chicago, IL","Mar 22, 2023"
37,3.0,If you must,Nice offices. Up-to-date systems that work. Smart people. Their company name looks good on a resume.,"Don't get too used to working with one account manager, as they only seem to last one or two years before leaving or getting promoted. Company talks a lot about work-life balance but when a client wants your team to work 24/7 on a hot project, they will not say no.",Marketing Specialist,Former Employee,"Dallas, TX","Mar 20, 2023"
38,5.0,Meaningful work with great work life balance,Feel excited about my projects and can walk away from the computer at the end of the work day without having to check emails or catch up on assignments.,"Large companies tend to lose visibility into individual performance, so alot of it is relying on word of mouth. Getting people to praise you can be tough when everyone is looking out for themselves!",Management Consulting Manager,Current Employee,"Columbus, OH","Mar 7, 2023"
39,5.0,Great company overall!,The benefits are great. The culture (US) is also great on my team.,Several team members have left for higher salaries. The backfilling of those positions aren't quick and sometimes non-existent.,Sr. Sourcing Analyst,Current Employe,"Atlanta, GA","Mar 13, 2023"
40,5.0,Great firm,Great projects and good teams,Lots of travel and several projects,Consultant,Current Employe,"Los Angeles, CA","Mar 21, 2023"
41,5.0,Great experience,"Remote work, commitment to work-life balance,","understaffed teams, pay is lower in comparison to other firms",Strategy Analyst,Current Employe,"Washington, DC","Mar 20, 2023"
42,5.0,great,so good would recommend to all,big company networking is hard,Consultant,Current Employe,"DC Ranch, AZ","Mar 21, 2023"
43,5.0,"Looking for PMO Lead, Analyst and any kind of related role",To explore new areas in PMO and develop good rapport with Peers,Work Alcoholics by nature and punctuality,PMO Lead,Former Employee,"India, TN","Mar 17, 2023"
44,5.0,Great place to grow,"Growth, Promotions, Mentorship, Certifications, Events",None that I can think of,Test Engineer,Former Employee,"San Antonio, TX","Mar 20, 2023"
45,5.0,Great place to work,"Friendly colleagues, many training resources, network sessions, and various project opportunities","Long work hours sometimes, no free food",Data Science Senior Analyst,Current Employee,"Seattle, WA","Mar 17, 2023"
