,Rating,Title,Pro,Con,Job Title,Status,Region,Date
456,3.0,Good Company but growth too fast,Great pay and benefits. Good executive track. Must be able to forge relationships at the top and be protected. Flexible once in management.,Disorganization. competing against others and not collaborative. Diversity is lacking especially among Senior leadership.,Sales Director,Current Employee,"Miami, FL","Dec 5, 2022"
457,3.0,Good place to start,Ok place to start a career.,"* Accenture acquires a lot of companies, and they have a bloated staffing model. * Pay is probably the worst out of all the professional services firms * Leadership doesn't listen and have huge egos",Senior Manager,Current Employee,"New York, NY","Nov 13, 2022"
458,1.0,crappy place to work,this place has no real pros,"thinking about whittling your life away, that is everyday here",Managing Director,Former Employee,"New York, NY","Jan 23, 2023"
459,2.0,Sales Based role,Diverse & inclusive staff Stock PTO Benefits,Lack of organization in management Constantly changing practices Low salary,Program,Former Employe,"Atlanta, GA","Jan 3, 2023"
460,5.0,Leadership,Good leadership and growth direction,some inconsistency with compensation across same levels,Manager,Current Employe,"New York, NY","Dec 9, 2022"
461,5.0,Great place to start,"Good pay, good client exposure",Easy to get caught working by yourself,Manager,Current Employee,"Minneapolis, MN","Dec 7, 2022"
462,4.0,"Great projects, highly technical coworkers, too much big company bureaucracy","Very intelligent coworkers on strategy projects. Definitely more operationally focused. Most project scopes are internal efficiency ""strategy"" or new product development that drive efficiencies. Been a lot of fun work though; significantly better than my time at a Big 4 consulting firm. Most people have a technical or STEM background so it's nice that most decisions are data-driven.","Too much bureaucracy to get things that make sense approved. The typical type of place where you have to be seen doing the right work by the right people for any of your hard / good work to get actually recognized. Not the type of place to applaud you for working well humbly. The people who send the most emails and set up the most meetings get the most plaudits, not the ones actually focusing on successful client-value delivery.",Technology Strategy Consultant,Current Employee,"Los Angeles, CA","Jul 17, 2022"
463,5.0,Great,Great place to work as long as managers like you,"Not a whole lot, it is a huge company so easy to feel lost",Senior Analyst,Current Employe,"Chicago, IL","Nov 28, 2022"
464,3.0,Amazing place for a career in cyber,"Amazing technology, cloud adoption, unlimited learning resources",Mostly growing through acquisitions so there's slight disorganization but the management is actively working through it. Please be patient.,Service Delivery Manager,Former Employee,"New York, NY","Jan 8, 2023"
465,5.0,cyber security,"Work with clients to review security requirements and assess the security posture to identify gaps or improvements • Consulting on and conception of solution modules for the secure design of applications, products and solutions of Accenture clients worldwide • Participates in designated projects, developments or business initiatives, advising on information security risks",Long hours and laptop delivery,Security Consultant/Analysis,Current Employe,"New York, NY","Oct 21, 2022"
466,5.0,Great Consulting Company,"Great work enviroment. Looks out for their employee's, even during difficult times.",No COns. Great company to work for.,Technical Recruiter,Current Employee,"Atlanta, GA","Nov 29, 2022"
467,4.0,Software Engineer,great company to work for new grads,limited tech stack so not much for career development,Associate Software Engineer,Current Employe,"San Francisco, CA","Jan 17, 2023"
468,4.0,Good Company,- Normal Advantages of being at a Large Company - Culture - Network - Projects - Perks - Pay,- Lack of One-on One Interaction - Normal Disadvantages of being at a Large Company - Some projects may not be to your liking,Technology Analyst,Former Employee,"Arlington, VA","Dec 29, 2022"
469,4.0,"3.5 stars. Overall interesting work, good people at all levels but pay not competitive and promotion path ambiguous","Opportunities to upskill when you have extra time, interesting work in emerging tech, opportunity to switch career focus but will require lots of work and finding a leader to go to bat for you over over a long stretch","Compensation not competitive, advancement appears to be set on a timetable regardless of contribution, focus is on time-at-level which isnt attractive, insurance premiums are high deductible too, more so than previous companies",Consultant,Current Employe,"New York, NY","Oct 26, 2022"
470,5.0,Good company,"The people, events, and vertical growth opportunity.",It can be very competitive.,Tech Arch Analyst,Current Employe,"Austin, TX","Dec 5, 2022"
471,5.0,great,I really enjoy working there,No cons in my mind,Strategy Analyst,Current Employe,"New York, NY","Dec 7, 2022"
472,4.0,Great Opportunity,The firm has a great reputation. Many opportunities for entry-level employees to learn on the job.,Work-life balance. Projects often require a lot of travel.,Technology Analyst,Former Employee,"Chicago, IL","Jan 10, 2023"
473,2.0,Pay is not competitive,"Good benefits. 6% 401K match, 100% vested from the start.","Pay is not competitive. We lost many good people to better pay, often double what Accenture was paying. Pay is also not level, i.e., same work does not receive same pay. I suspect much of this is due to dinosaur-like internal systems that no one seems to be able to update so that like work is assigned all the same title which then drives same pay within the system. For myself, I was given a raise then they took it away! Said it was a ""system glitch."" I resigned.",Collections Manager,Former Employee,"Austin, TX","Sep 22, 2022"
474,5.0,great work enviroment,interesting work and fun queues,not much room for growth,Ad Risk Analyst,Current Employe,"Austin, TX","Dec 5, 2022"
475,5.0,Great company!,Great start to my career,Work Life balance can be challenging,Consultant,Former Employe,"Charlotte, NC","Dec 5, 2022"
476,5.0,Choose your own adventure,"You don’t have a formal manager in consulting, so you have the flexibility to choose projects that meet your skills and interests. I am constantly surrounded by incredibly intelligent and driven professionals who really bring the best of Accenture everyday. We also have great LOA opportunities for those who need it.","Some leaders are drivers and can be challenging to work for, there is little to no funding for community development, so much is done side of desk",Anonymous Employee,Current Employee,"Chicago, IL","Sep 12, 2022"
477,3.0,Accenture Senior Analyst,Nice pay. Fellow employees are competent and generally down-to-earth.,"You have to actively work to get yourself onto projects that work for you and are in your field of expertise. It helps to know leads/managers personally and be in demand as an asset. Taking work home is accepted and even expected on some projects, if not explicitly then as mandated by workload/deadlines.",Application Developer Senior Analyst,Former Employee,"Philadelphia, PA","Dec 13, 2022"
478,5.0,"Prioritizes inclusion, diversity, and mental health","Clear leadership prioritization of inclusion, diversity, and equity. Intends to support mental health as well, but there is still a culture of overworking.","In a company this large, it's hard not to feel like an expendable resource.",Strategy,Current Employe,"Seattle, WA","Nov 8, 2022"
479,4.0,"Highly dependent on group, like most big firms","Pay, scale of projects, growth opportunities when people excel","Adminastrivia, red tape, and bureaucracy",Business &amp; Integration Architecture Specialist,Current Employee,"Chicago, IL","Jan 13, 2023"
480,4.0,Flat Hierarchical Organization,"In reality, a flat hierarchical organization is great when you need to cut the red tape and quickly resolve issues.","The bad thing is, most took advantage and jump over their immediate superior to a higher managerial post to voice their concerns, and that for me cause a lot of issues, including chaos when simple things that could be solved within the team, gets bigger than it should.",Application Development Specialist,Former Employee,"Reno, NV","Nov 7, 2022"
481,5.0,Best remote job,Remote Good leadership Teamwork Good pay,Hard to move up without guidance,Software Engineer,Current Employee,"San Antonio, TX","Nov 26, 2022"
482,5.0,Great place to start your career!,-Learning Resources -Networking -Different Exposure to different technologies -Health Benefits -100% Paid STD for 8 Weeks,-Pay -No Tuition Reimbursement -Eyecare insurance,Senior Security Analyst,Current Employee,"Arlington, VA","Nov 17, 2022"
483,5.0,Great company to Break Into Tech,-amazing management -team cooperation -data entry experience -great work/life balance,-sometimes takes a while to progress up the ladder,Messenger Assistant New Associate,Current Employee,"Fremont, CA","Nov 24, 2022"
484,4.0,Great Company,Good opportunities and interesting projects,Difficult projects and time constraints typical to consulting,Consultant,Former Employe,"Chicago, IL","Jan 17, 2023"
485,5.0,Too big to move around,"Great pay and benefits and people to work with overall. Firm knows how to treat you well and make you feel special with team events. Strong group of analysts, very easy to make some good friends",Can feel so large that it is easy to get stuck in a practice. Even though you don’t have to specialize into a group until consultant if an MD likes you it’s very difficult to get off their projects. Got sucked into a practice group without wanting to and did not feel like a choice.,Senior Associate,Former Employee,"Los Angeles, CA","Aug 24, 2022"
486,1.0,Poor Communication,Nothing to really write home about. The benefits are decent.,"Management does not communicate. If you move to a new position inside the company, they will expect you to work two jobs. Also, you have to work at a new job for 1 year before they bump your pay up. So you'll always be behind your peers hired off the street.",Project Manager,Current Employe,"Oklahoma City, OK","Jan 5, 2023"
487,4.0,Accenture,you get to learn new things,I do not have any downsides of working with Accenture.,Application Development Analyst,Current Employe,"Saint Petersburg, FL","Jan 10, 2023"
488,5.0,Great Team and Culture,"- Excellent culture and team, from local management down to new hires.
- Fair pay
- Manageable workload
- One of the most diverse teams I've worked with.
- Ability to learn and take your career where you'd like with a variety of +1 opportunities.","- Can be a bit slow sometimes and one of those jobs where you have to find work to keep busy during those times.
- Required to use PTO to take sick time/time off during office closures.",Locations services associate,Current Employee,"Tampa, FL","Sep 24, 2022"
489,4.0,Find the right people and projects,"Great people depending on where you end up, lots of people will be open to mentoring. Great big-city offices and office culture. During Covid there has been little to no pressure to come in to the office but coming in voluntarily has been great and it has been easy to make friends.
Projects CAN be very interesting but you have to choose your path wisely, make sure it aligns to what you are interested in.","Work-life balance can vary significantly by project
Navigating internal politics within practices is never fun
Pay is below-par, particularly from Analyst level to Consultant
As an entry-level person, it can be tough to find where you would sit best in such a mammoth organization.",Strategy Consultant,Current Employe,"New York, NY","Aug 14, 2022"
490,3.0,Pressure,A lot to learn in a short period of time,Too much pressure in the operations.,Devops Engineer,Current Employee,"Milwaukee, WI","Jan 15, 2023"
491,5.0,Good company.,Really good company to work for. Pay is pretty good. They understand the inflation issues going on and are very progressive and understanding with life issues.,Like every company it has its down falls with moving people up and advancing further into the career.,Content Reviewer,Current Employee,"Austin, TX","Nov 2, 2022"
492,2.0,A little fake,"Decent pay, good work-life balance.",Fake leadership that don't care about anyone else in the company.,Engineering Consultant,Current Employee,"San Francisco, CA","Jan 3, 2023"
493,5.0,Great Experience so far.,The benefits are pretty good.,The Federal side of the house can sometimes get lost in the sauce.,Cloud Engineer,Current Employee,"Arlington, VA","Nov 20, 2022"
494,5.0,Great company,Really Good group of people,Sometimes the work can be redundant,Manager,Current Employe,"Boston, MA","Dec 1, 2022"
495,5.0,Great company,"Good benefits, inclusive, supports learning",Takes time to grow. Average of 2 to 3 years depending on the project,Trust and Safety,Current Employee,"Austin, TX","Nov 1, 2022"
496,5.0,ASE,Good Condition and better perks,No work life balance exist,Assistant Software Engineer (ASE),Former Employe,"India, MS","Dec 2, 2022"
497,4.0,Accenture pay,Good benefits and good pay,You must find projects yourself,Software Engineer,Current Employe,"Virginia Beach, VA","Jan 16, 2023"
498,1.0,Stressful conditions and treated as second class citizens,"Work was easy and repetitive. It didn't take much skill to understand how to do things, anyone could learn how to do the work.",-Constant fear of losing job -Micromanagement -Treats the employees like children -Zero trust in employees,Platform Experience Associate,Former Employee,"Austin, TX","Dec 18, 2022"
499,5.0,Great place to work,Great place to work .,Slow growth. good for laterals .,Associate Manager,Current Employee,"Portland, OR","Nov 28, 2022"
500,5.0,Great company,Best company ever. People there are incredible.,There are really not any cons.,Location Services Analyst,Current Employee,"San Antonio, TX","Dec 24, 2022"
501,4.0,"Great Company, benefits are limited or difficult to get","Challenging roles to play, great learning","difficult to elevate, have to do many additional responsibilities other than the client/project delivery role",Project Manager,Current Employee,"Phila, PA","Dec 13, 2022"
502,1.0,Very Shady and  Sketchy Company Culture,"Opportunity to work at client companies such as Google, Facebook...etc. 
(or you could also be forced into working at a client that is undesirable)","- Very Shady and Sketchy Company Culture both toward employees and toward clients 

- accenture (HR) forces employees to sign documents to give up their benefits rights, and most employees don't even realize that they are signing (the document was dressed as something else), as this is also against the law, we had to file official complaint to the city government to get things fix.

- Shady, impolite middle management team (mostly indians), with no integrity;  treats employees like slaves, employees are constantly treated with no manner, and with no respect.

- Employees constantly being asked to work overtime after work hours (another employee said he was held at client site past 11pm daily) and sometimes even on weekends, while denied any rightful compensation that was supposedly promised (his was told by his manager to log in the system he never work over-time). 
- Every time I was at the accenture office, i just hear multiple different employees complain about their poor treatment by the company or at their project. 

- Although, it was communicated that employees have the choice to accept or decline projects, however, a lot of employees are forced into undesirable projects not at-will, and will be retaliated against if employees decline the project. 

- Company retaliates when employees brings forward issues or complaints, retaliation in every possible way (eg. denial of bonuses, fake/poor performance review regardless of actual performance) 

- accenture hides information from client, accenture has access to much of client's data, when they discovered any new source or information, they hide and withheld those info from the client for their own benefits (and these are actually client's own data), and accenture refused to share any role info to client's other vendors/contractors outside of accenture. 

- Employees are constantly reminded to up accenture's benefits as the first priority even at the expense of the client's, or even if it harms the client. 

- There are so much politics and teams would complain and escalate complaints against each other, it's a hostile environment where collaboration is difficult.

- The list could go on and on... accenture is really a discouraging and depressing place to work at!",Senior Analyst,Former Employee,"Mountain View, CA","Nov 5, 2022"
503,5.0,"Awesome Company to work for, Great Management and Coworkers","Management, coworkers were all wonderful to work with",No cons at this time,Junior Cloud Engineer,Current Employee,"Arlington, VA","Dec 15, 2022"
504,3.0,Mixed Signals,Some leadership seems to mean well and care about the people. Good training opportunities. Good internal infrastructure. Great health benefits.,"Some of the leadership only care about their bottom line and how they can get the best bonus for themselves. A lot of senior managers and above are not on board with work/life balance. They preach it, but don't follow through.",Business Operations Specialist,Current Employee,"San Antonio, TX","Nov 15, 2022"
505,3.0,Good company for non-techies,"- US MNC culture. People are polite and do hear your opinion (when they are in a good mood, that is).
- Management Consulting of Accenture is great. I've heard good stories about that vertical. Technical Consulting is usual service organization type.
- Project can be good, bad or extremely bad, depending on the vertical you are getting into. For instance, if it is Telecommunications, then expect rude bosses, low bonuses and crappy work; Banking is good, but comes with short shelf life; Healthcare & Insurance are going to be bureaucratic but with OK work. 
- Good company to travel abroad and around
- Salaries have become competitive lately due to high attrition","- Very watered down technical environment. Leadership and upper management are mostly non-techies so learn to explain your technical problems like you are explaining a 10 years old
- Kiss up and kick down culture, especially in lower ranks (below Senior Manager levels)
- As you climb up the corporate ladder, you'd be expected to work less technically, and more on sales and RFP (proposal) work
- Against all odds, if you stay techie and do less RFP work, promotions will be few and far between
- Manager/boss is everything in Accenture. Keep him impressed.
- Accenture HRs are all powerful entities. Never. Ever. confront an HR.
- Appraisals, promotions and moderations are all fixed. Managers target who is going to be promoted and who is not, regardless of your good work. Bonuses, however, depends on your work, but in big accounts they'll be rationed.
- Middle management in tech, especially in countries like USA and UK, are mostly south asians. They have their own code of life and work. Familiarize yourself with those if you need to rise.",Senior Software Engineer,Current Employe,"Dallas, TX","Jan 21, 2022"
506,5.0,Great company,"Great management, kind coworkers, good work life balance and pay",No cons at the moment,Junior Cloud Engineer,Current Employee,"Arlington, VA","Dec 15, 2022"
507,3.0,Mixed Bag,An Array of projects that you can be apart of,Federal Side is fairly limited,MC Delivery Analyst,Current Employee,"Arlington, VA","Dec 21, 2022"
508,3.0,Accenture,Great company for growth and skill Fast changing Can get laid off for no reason or redeployed out of nowhere,Can get laid off for no reason or redeployed out of nowhere,Associate Team Lead,Current Employee,"Austin, TX","Dec 8, 2022"
509,4.0,Great place to work,"I love my team, the flexibility, and I am challenged in my work.",The pay could be better.,HR Partner,Current Employee,"Denver, CO","Dec 12, 2022"
510,4.0,Its aight,Alot of resources for support and training,Can get lost in the cogs,Laboratory Informatics Associate,Former Employee,"Orlando, FL","Dec 19, 2022"
511,5.0,Diversified Experience,Huge opportunities and massive workforce with lot of talented people,"Long work hours, some time you get lost with in the crowd. Need to rely on strong nw skills.",Senior Manager,Current Employee,"San Francisco, CA","Dec 10, 2022"
512,5.0,salary for strategy,good pay and work life balance,dont always get staffed on the projects you want,Strategy Consultant,Current Employe,"Chicago, IL","Dec 20, 2022"
513,4.0,Great company,"Really care about you, great benefits, accomodating, want you to succeed",salary is a little lower than expected,Manager,Former Employee,"Raleigh, NC","Dec 19, 2022"
514,5.0,Great Culture,"Great culture, learning opportunities, mental health benefits","health insurance is expensive for families, low base pay",Senior Application Development Analyst,Current Employe,"Dallas, TX","Dec 19, 2022"
515,5.0,Good opportunity,Great company with fantastic benefits,Can be hard to move up,Customer Success Manager,Current Employee,"Atlanta, GA","Dec 21, 2022"
516,4.0,Great place to start,- competitive salary - better work life balance than other firms,- can be difficult to get on appealing projects,Business Analysis Sr Analyst,Current Employe,"San Francisco, CA","Dec 14, 2022"
517,5.0,Only good things to say,- constantly learning - great environment -,"none, great first job and good way to build a foundation",Strategy Consultant,Current Employee,"Washington, DC","Dec 14, 2022"
518,5.0,its good,there are all good things.,there are no bad things here.,Business Development Representative (BDR),Current Employe,"Atlanta, GA","Dec 21, 2022"
519,4.0,Accenture is a good company with terms and conditions,1. Policy oriented company 2. Good working culture,1. Not good at salaries 2. Hikes are less 3. Bonuses are peanuts,Associate Manager,Current Employee,"Los Angeles, CA","Dec 9, 2022"
520,4.0,"Great people, frustrating structure",+employee support +diversity&inclusion +remote work,-long hours -mid/low industry salary -confusing to navigate,"Senior Analyst, Business Architecture",Current Employe,"Los Angeles, CA","Jan 7, 2023"
521,2.0,High Pay but Long Hours,Opportunity to move to different projects if and not get locked into something you don’t like. The pay is good.,"Long hours and the fun work is few and far between. Work with offshore teams a lot, which makes your hours kind of stick. Huge company so you’re just a cog in the machine, and it also makes the promotion cycles sort of silly because you’re reviewed by people that don’t really know you or your actual work first hand.",Data Engineering Consultant,Current Employee,"Chicago, IL","Nov 10, 2022"
522,5.0,Review,Best place to work today,Okay to be work today,Applications Developer,Former Employe,"India Hook, SC","Nov 20, 2022"
523,3.0,Be prepared for anything/everything,"Time between projects for brief break, additional trainings/education in specific fields","Depending on Project, can be very emotionally draining.",Business Operations Associate,Current Employee,"Austin, TX","Dec 12, 2022"
524,3.0,Tons of opportunities,Many opportunities to work on different projects.,Very big company. May seem to big at times.,Technology Consultant,Former Employe,"Tampa, FL","Jan 6, 2023"
525,5.0,Great First Job,Large team Learn a ton of new things,Can get demanding and really busy,Strategy Analyst,Current Employee,"San Antonio, TX","Nov 3, 2022"
526,5.0,Excellent work environment,Flexible scheduling Big bonus Plenty of growth opportunity Plenty of training and advancement opportunites,Provide more clarity on the ways to advance and provide compensation to reflect the quality and caliber of work a person does.,Senior Cloud Engineer,Current Employee,"Washington, DC","Oct 11, 2022"
527,4.0,Overall a good place,"great people, very busy, strong place to build your career, looks great on a resume, benefits are good.","can be a high stress environment, have seen people burnout, have seen the value from benefits go down over the years, big company so may feel like a number.",Analyst,Current Employe,"Arlington, VA","Dec 5, 2022"
528,5.0,Great place to start out of bootcamp,Work life balance is great as well as company culture,If you are older you will be promoted after younger hires as well as paid 30k less at times.,Application Development Analyst,Current Employee,"Irving, TX","Oct 20, 2022"
529,4.0,pros and cons,trainings positive environment competetive salary,work loads long work hours,Associate Software Engineer,Current Employe,"Manila, UT","Jan 9, 2023"
530,5.0,Love it! Wish I'd started at Accenture way earlier in my career,"Opportunity to Grow and Evolve
Constant Learning Encouraged
Respect (and Expectation) of Clients to be THE EXPERTS
Positioned to Support and Influence Tech Future of Largest Global Companies
Global Citizenship and Volunteering strongly encouraged
Networking and Relationship Building is required to be successful","Huge company, might be daunting to some, proactive effort to connect is required",Omnichannel Technology Manager,Current Employee,"Florham Park, NJ","Sep 8, 2022"
531,4.0,Great Company,They do well in developing employees and promoting growth,"Once you get accepted you will go through a mini ""interview"" but not really a con, they make sure you get as much experience as possible!",Custom Software Engineering Sr Analyst,Current Employe,"Arlington, VA","Dec 22, 2022"
532,5.0,great,great opportunity for upward mobility,not many cons to date,Senior Analyst,Current Employe,"Denver, CO","Nov 23, 2022"
