,Rating,Title,Pro,Con,Job Title,Status,Region,Date
1395,2.0,Let Down - Not really for coders,"Positive corporate culture.
Diversity is championed.
Progressive technical policies.","You'll get sectioned off with a group and assigned a skill and role to learn (teach yourself).
In the role where you were told you'd be mentored, you are not. You are left to find the answers yourself.
The skill you learned is not necessarily coding, but low-code busy work. If you used to enjoy using your mind to solve problems and create programs, now it the time you will realize that this will never happen here. 
You have a people lead assigned to help you, but to get them involved is like pulling teeth. 
Poor management all around, or at least on the low end, from what I can tell.",Applications Development Associate,Current Employee,"Nashville, TN","Nov 7, 2021"
1396,5.0,So Fair Its Been Great,"-Everyone is really open to helping you.
-Great opportunities to learn new skills
-Early access to leadership positions","-It can be a little bureaucratically slow at times.
-Comp is still in pre-covid time. Hopefully, that will change after year 1.",Consultant Analyst,Current Employee,"Atlanta, GA","Apr 28, 2022"
1397,5.0,Great place to work,"Constant guidance from leads and leadership to help you grow in your career. 
Ability to move around to work in different organizations in the company. 
Great, inspiring, family oriented and open-minded people work here.","Depending on the organization umbrella you are in, it can be hard to advance to the next level",Specialist,Current Employee,"Atlanta, GA","Apr 7, 2022"
1398,4.0,Wide array of opportunities and valuable experience at global consulting firm,"Global opportunities, intelligent people, high levels of collaboration, broad type of work across industries and functional areas, fantastic benefits (6% 401K match, decent PTO, etc.), excellent corporate citizenship programs, continuous networking, outstanding place to start a career, opportunity to develop marketable skills and experience, well-recognized brand name","High level of competition (e.g., for promotions, raises, etc.), demanding work culture (getting better though), no tuition assistance program, and salary stagnation (e.g., long time Accenture people may get less compensation than those coming in from the outside).",Senior Manager,Current Employee,"Washington, DC","Feb 6, 2022"
1399,5.0,great place to work!,"- great culture
- company invests heavily into you
- promotion/pay raise within a 1.5 years",no cons so far -- really lovely place to start out!,Client Financial Management Analyst,Current Employe,"Atlanta, GA","May 16, 2022"
1400,4.0,Overall pretty,Culture is great in regards to inclusivity,Not the most freedom in project selection,Senior Analyst,Current Employe,"Washington, DC","Jul 5, 2022"
1401,3.0,"Good benefits, but everyone's experience is different","Cross-industry jobs available, good PTO, access to multiple heath insurance companies, annual raises and bonuses available. Strong skills and willingness to learn are often rewarded, as long as you are savvy enough to find the right people to talk to (don't rely only on your boss, as their networking abilities are hit or miss like any company). Many good employees get stuck in entry level positions because they don't talk to the right people on a regular basis.","Work from home is required right now in most positions. Job security depends on your project/client. Accenture tries to relocate people when projects end, but some people inevitably lose their job entirely. Work life balance is all over the map: some projects have a great balance, others don't ever hire enough people. Transferring to a new job is often slow, and will sometimes have you doing two jobs at once.",Senior Analyst,Current Employee,"Knoxville, TN","Dec 2, 2021"
1402,5.0,So far so good,"Really smart people, ambition is rewarded. Genuine desire to help clients. Big goals and big challenges to conquer. Amazing female mentors that are really good at their jobs!",Some administrative inefficiencies that can be expected for a company this size. We need to do some operational improvements on ourselves like we would for our clients.,Senior Manager,Current Employe,"San Francisco, CA","Feb 2, 2022"
1403,5.0,Amazing company with top notch human capital,"People: Accenture is about people and it shows
Talent: most of the people I worked with are extremely talented in one way or another
Network: you will always find someone within the company that can help you
Flexibility: to shape your career and grow in the direction you want to
Core values: The whole company lives by the same Core values and it shows","As a consulting company you need to be prepared to work hard to deliver challenging projects. 
This is usual for consulting companies but you should be someone who is not looking to work within your comfort zone, it's a perfect company for people who want to build a career.",Senior Manager,Current Employee,"Weston, FL","Aug 4, 2017"
1404,3.0,Not interesting - salary based with tremendous non-paid overtime hours,"- Good for first experience as you work with different technologies, often times in cross-functinal meetings and such","- The amount of itme and energy spent is never paid back in any form.
- salary is not inetersting along with bonuses
- very dry workspace 
- micromanaging was the key in our team
- terrible work/life balance",Senior Data Scientist,Current Employee,"Dallas, TX","Apr 16, 2022"
1405,5.0,Experience at Accenture,Good Culture and Employee growth,The Bench system is still lacking,Anonymous Employee,Current Employee,"Irving, TX","Apr 13, 2022"
1406,5.0,Good work,Good work but very boring,Management is very up and out,Management Consulting Analyst,Current Employee,"Chicago, IL","Apr 13, 2022"
1407,3.0,Technical Consultant,Good place to learn and career growth.,"Consulting culture, and undercutting salary",Technical Consultant,Former Employee,"New York, NY","Jul 8, 2022"
1408,4.0,10 years at AFS,"At AFS, work is challenging, rewarding and often at the cutting edge. Work on meaningful projects to help improve government agencies and share in transforming government services, ultimately aiding US citizens","Promotion cycle is difficult, years doesn’t equal promotion. Need right support and visibility. As a contractor, some of requirements can be burdensome as you’re asked to wear multiple hats",Consulting Manager,Current Employe,"Arlington, VA","Apr 29, 2022"
1409,4.0,Clear promotion structure but awkward environment for women,Lots of enthusiastic colleagues and open to new ideas,"They are obviously trying to improve their tech diversity but it's not a comfortable environment for women . Women often get promoted to leadership roles with little support, feeling of being set up to fail.",Applications Development Specialist,Former Employee,"Columbus, OH","May 16, 2022"
1410,4.0,Good firm,Can select project from a variety of opportunities,It may not be good to be a specialist in some area,Manager,Current Employee,"Japan, PA","Jun 26, 2022"
1411,4.0,"Great opportunities, little standardization","near infinite industry/function/tech opportunities. massive client network. friendly and intelligent co-workers, great work-life balance.","Experience will be different per project due to little standardization/formal Accenture methodologies and best practices being applied on projects, despite many already defined. At the mercy of the project lead.",Management Consultant,Current Employe,"New York, NY","Apr 17, 2022"
1412,4.0,"Enjoy the Job, Pay is Low","Fast paced environment 
Motivated, competent colleagues 
Opportunities for growth 
Lots of training support","I make less as an Accenture Federal Employee than Accenture LLP 
I make less as part of the Operations Capability compared to any other area 
PTO is both vacation & sick time; based on your level & tenure -> For me, that’s just 18 days a year. If I wasn’t working remotely, this would be even more stressful/limiting.",Business Operations Specialist,Current Employee,"Washington, DC","Feb 27, 2022"
1413,5.0,Great Place!,Learning a lot and smart people!,"Long hours at times, but part of the job and pay.",Design Ops Manager,Current Employe,"San Francisco, CA","Apr 5, 2022"
1414,3.0,Good Company overall work load is immense on certain projects,"Learning & development opportunities
Average benefits","Work load
Data analytics overload
trackers for everything",Training Manager,Current Employee,"Austin, TX","Jun 28, 2022"
1415,3.0,Lots of organizational changes,"Big network, global clients, diverse teams","Bureaucracy, organizational silos, lack of training and mentorship; like all consulting firms, YMMV depending on the client, project, and team",Senior Manager,Current Employee,"New York, NY","Jun 16, 2022"
1416,3.0,No work life balance,Great pay and Ben edits package strong,Never really off and men run the company.,Associate Director,Current Employee,"Atlanta, TX","Jun 30, 2022"
1417,4.0,Accenture Review,"Fully Remote, Career Experience, Access to trainings","Low pay, work experience varies widely based on project, can run into questionable management tactics",Associate Test Engineer,Current Employee,"Saint Louis, MO","Jun 22, 2022"
1418,5.0,Fast growth company,"In Strategy practice, my leadership is really supportive. 
Due to the covid, no travel is required.
Most of my client is based in the same timezone on the west coast.","Join the team in late 2021, the onboarding week overlap with client work.
The company has a ton of great tools, but it's not easy to navigate.",Consulting Manager,Current Employe,"Irvine, CA","Feb 1, 2022"
1419,5.0,Great place to work,I really like working at Accenture. It's an awesome place to grow your career and quickly advance your skillset. There is a lot of great experience to gain and people to learn from.,"It's important to always be staffed on a project, so that might mean taking a project you aren't super interested in vs. waiting for something you want to come along.",Security Consulting Senior Analyst,Current Employee,"Washington, DC","Jan 17, 2022"
1420,4.0,Good pay and culture,"Good compensation
Great culture and diversity","Benefits could be better
Slow movement up the chain 
Too much middle management to the point upper management only sees the numbers not the work",Platform Experience Analyst,Current Employee,"San Jose, CA","Mar 14, 2022"
1421,2.0,Good if you are looking for something temporary,It was a great job to get right out of college. I met some nice people there.,"Management is awful, horrible communication.",Business Development Representative,Current Employee,"Charleston, WV","May 11, 2022"
1422,4.0,Great for Entry Level Careers,"- Experience across various industries and functions 
- Worked with incredibly talented and creative individuals 
- Flexible working options 
- Great pay
- Non-hierarchical (i.e. valued the opinon of lower level employees)
- Plenty of leadership opportunities","- Long working hours 
- Varied experiences and working cultures across services (interactive, security, tech, etc) 
- Occasional verbal abuse from managers 
- Unequitable promotions (not all high acheiving employees received pay and promotions that mirrored their accomplishments)
- Horrible managers (I had more bad managers than good)",Consultant,Former Employee,"Seattle, WA","Feb 7, 2022"
1423,5.0,Friendly atmosphere,"Comfortable, flexible, faster improvement and worth working there.",Nothing at all for me,Data Analyst,Current Employee,"Mountain View, CA","May 18, 2022"
1424,5.0,People-Centric Firm,Accenture cares for its people.,Accenture is a very large firm.,Technical Consultant,Current Employe,"Boston, MA","Jun 2, 2022"
1425,3.0,Good place to get into the door,"Your quality of life is going to be entirely dependent on your project. But if you have no wear else to go, and want the Accenture brand on your resume. Then this place can be a great stepping stone.",Management seems stressed. Seems like they will hire anyone with an ounce of experience.,TDP Analyst,Current Employe,"Nashville, TN","Mar 24, 2022"
1426,5.0,g,everything was good and great company,nothing and its a good company to work for,Technician,Former Employe,"San Jose, IL","May 27, 2022"
1427,5.0,Great place,Very great work hours and decent pay and benefits,"Not enough pay, would also like more PTO",Technology Analyst,Current Employee,"Arlington, VA","May 24, 2022"
1428,5.0,Top company to work for in the world,Best company to work for,No downsides so far at Accenture,Senior Recruiting Analyst,Current Employee,"Raleigh, NC","May 24, 2022"
1429,5.0,I Have Found My Home,"- Great pay
- Good benefits
- Terrific promotional opportunities
- You are rewarded based on merit and performance
- Company cares about its employees
- Best company I have ever worked for during my 20+ year career",None really; Accenture is a services provider so you have to keep your clients happy.,Manufacturing and Supply Chain,Current Employee,"Philadelphia, PA","Mar 28, 2022"
1430,3.0,"Very focused on more, more, more",good pay and good people generally,very much a sales culture focused on hitting sales metrics to get promoted... and if you meet your metrics one year they just double them for the next year.,Senior Principal,Current Employee,"Washington, DC","May 24, 2022"
1431,4.0,ok,Interned over the summer and it was a good experience,Not much cons to the internship,Analyst Intern,Current Employe,"Los Angeles, CA","Jun 28, 2022"
1432,3.0,Not a bad place to work,"-excellent health insurance
-PTO
-WFH",-hard to navigate such a huge company,Associate Software Engineer,Current Employee,"Nashville, TN","Jun 29, 2022"
1433,5.0,"Great company, very people oriented","Nice work life balance, everyone is friendly and willing to help you, great culture and benefits.",Very fast paced which could be a positive thing as well. But the first month of training was extremely fast paced because the instructors were on a time crunch.,Applications Developer Associate,Current Employee,"Atlanta, GA","Jan 9, 2022"
1434,4.0,Good place to work at,"Good benefit , good pay scale",Have not found any yet,Full Stack Developer,Current Employee,"Atlanta, GA","Jun 27, 2022"
1435,5.0,Application Development Senior Analyst,Diversified and equality among all employees,Work location centric work culture,Applications Development Senior Analyst,Current Employee,"India, TN","Apr 3, 2022"
1436,4.0,Decent company to work for,Work/life balance. Great learning opportunities.,Pay is not that competitive,Consultant,Current Employee,"Arlington, VA","Jun 28, 2022"
1437,4.0,"Slow moving, good pay","Compensation package, PTO, upward mobility","Slow moving, long bench times for new joiners.",Strategy Consultant,Current Employee,"Phoenix, AZ","Jun 6, 2022"
1438,4.0,.,Provide good work life balance,A lot of uncertainty to career path,Consultant,Current Employe,"San Francisco, CA","Jun 30, 2022"
1439,5.0,Very nice,Great WLB and awesome people!,Sometimes not enough accountability so I wish there was that.,Front End Developer,Current Employe,"Los Angeles, CA","Mar 30, 2022"
1440,3.0,Good starter job,Lots of room to take direction the way you want.,"Big company, little guy problems",Software Engineer,Current Employee,"Washington, DC","May 25, 2022"
1441,5.0,Excellent Direct Leadership and lots of room for growth,"Pay is competitive, excellent benefits, a good feedback system for career growth, solid recognition of efforts, you have an actual idea of the progress your making improving the clients systems and processes, pretty decent collaboration between teams within the contract, and leadership supports work life balance as much as is possible in an operations environment.","Government bureaucracy/vague access request processes, office politics (client side) getting in the way of actual progress (leadership is mostly good at avoiding but every once in awhile is a fact of life in these kinds of jobs), and too many reports to different people basically saying the same information in slightly different ways.",Automation Team Lead,Current Employee,"Springfield, VA","Nov 3, 2021"
1442,5.0,Accenture Security Analyst,Great pay and lost of investment in entry level employees.,None as of summer '22,Security Analyst,Current Employe,"Minneapolis, MN","May 23, 2022"
1443,3.0,Good teams,Good benefits and team members.,Beware of your role being eliminated in the US and sent offshore if you're not in a client facing position.,Consultant,Former Employee,"Kansas City, MO","Apr 7, 2022"
1444,5.0,Good company to start career,"Great people, many locations, decent salary",Operations does not interface with Accenture,Analyst,Current Employe,"Austin, TX","May 23, 2022"
1445,4.0,pm,training to help career goals,it is a large organization you can get lost,Senior Project Manager,Current Employee,"Los Angeles, CA","May 27, 2022"
1446,5.0,Professional Organization,Growth and Learning Oriented Organization,Need to be more adaptive in employee relevant policies with Peer companies,Business &amp; Integration Architecture Specialist,Former Employee,"Saint Paul, MN","May 20, 2022"
1447,5.0,Great place to work,"Invest in their people and keep making it feel like a small company even though there are 700,000 employees.",Some clients can be difficult making work life balance difficult but the company does a good job trying to mitigate that,Senior Manager,Current Employee,"Miami, FL","Mar 31, 2022"
1448,5.0,I will love Accenture for sure.,I will love Accenture for sure.,"Not sure yet, I believe it is a good company.",Software Engineering Senior Analyst,Current Employee,"Boston, MA","May 11, 2022"
1449,3.0,Great place to start but you'll burn out,"competitive 401k, good variety of clients / industries","burn out is real and everyone ghosts hours to meet chargeability metrics, work is sold with unrealistic timelines and budgets that leaves everyone over worked - not sustainable",Consultant,Current Employee,"Boston, MA","Feb 7, 2022"
1450,5.0,Great Culture,Great Culture and people to work with,Very focused on chargeability at times,Interaction Designer,Current Employee,"Johannesburg, CA","May 25, 2022"
1451,4.0,Nice place to work,"Accenture is supportive of adding to employee's toolkits. Lots of online trainings available , and support from managers is good.","Environment can be chaotic at times, but that is more a reflection of the industry.",.NET Developer,Current Employee,"Jersey City, NJ","Apr 22, 2022"
1452,5.0,Great for fresh out of college,"It's a great place to come out of college to learn about various industries, functionalities, technologies, and practices in order to decide what you want to align to",It is so big of a company that it may be hard to navigate. It forces you to be proactive,Analyst,Current Employe,"Charlotte, NC","Mar 29, 2022"
1453,3.0,Not a good place,"Salary negotiations were smooth. 
Hours are simple.","Lies to you.
Withholds bonuses.
Aren’t transparent about bonuses.
Doesn’t comprehend reality or the word “no”.",CSM,Former Employee,"Charleston, WV","May 15, 2022"
1454,5.0,Yes,Great work life balance and pay,"Very big, sometimes feels like no cohesiveness",Management Consultant,Current Employee,"New York, NY","May 15, 2022"
1455,3.0,good,challenging to work all the time,pay per amount of work is low,Consultant,Current Employe,"New York, NY","May 26, 2022"
1456,4.0,Great career starter,Lots of opportunities. Lots of diversity.,Low salary increases for those that continue with the company. Need to look elsewhere for a salary bump.,Manager,Former Employee,"Boston, MA","May 3, 2022"
1457,4.0,Work Life Balance,"- Good work life balance, always under 50 hours
- Great teams
- Decent company culture",- A lot of heavy implementation work,Business and Technology Consultant,Current Employee,"Chicago, IL","May 13, 2022"
1458,5.0,Great company,"Talent and projects, culture career advancement","Travel, size of organization, hieararchy",Manager,Former Employee,"Houston, TX","May 20, 2022"
1459,5.0,Network is key,Finding a strong network within Accenture is invaluable,Can feel disconnected with coworkers during Covid when there isn’t much in person,Senior Manager,Current Employee,"Denver, CO","May 10, 2022"
1460,2.0,No direction,lot of work to be done and huge organization,"constant turnover, no direction and boring jobs",Program Manager,Current Employee,"Arlington, VA","Jun 22, 2022"
1461,5.0,Great Place,"Career Advancement, Salary, Experience, Top Notch Clients","Politics, Lack of technical aptitude",Manager,Current Employee,"Charlotte, NC","Mar 30, 2022"
1462,5.0,Good place to start a career,"Interesting work, travel, nice people, good growth until mid management level","bad hours, long hours, time zone differences, travel",Corporate Development Analyst,Current Employe,"Washington, DC","Mar 12, 2022"
1463,3.0,Still new to Accenture,"Overtime, Flexibility, Lots of training,","Worklife balance, pto, and pay",Application Development Analyst,Current Employee,"Nashville, TN","Jun 25, 2022"
1464,2.0,Not great place to start for coding bootcamp graduates,The company culture is great and people are friendly.,"They hire people straight out of coding bootcamps who are eager to code and slap them into QA, Tester, Functional team. All of which have nothing to do with coding that many graduates are eager to get into. Accenture states they have to stay in these roles for a year so they can get familiar with the project or system while their developer skills slowly die out. Majority of the Developers on my team are in India and there are little to no opportunity to transfer to Dev.",Software Engineer,Current Employee,"Austin, TX","Nov 29, 2021"
1465,4.0,"Broad Experience, Long Hours",Broad experience in many different area; some flexibility in career path and assignments; high responsibility early (if deserved); great benefits; strong career advocacy and mentoring,"High travel, some politics (although not pervasive), average pay with small bonus",Consultant,Former Employee,"New York, NY","May 17, 2022"
1466,5.0,Love working here!,"Good pay, great community, and flexible WFH",Huge company and it can be tough to connect to others at times,Management Consulting and Strategy,Current Employee,"Washington, DC","Mar 14, 2022"
1467,3.0,NA,Good perks for local hires,Low salary for GCP resources,Application Development Associate Manager,Current Employee,"Austin, TX","Jun 28, 2022"
1468,4.0,Good Company,Prestige in the name of the company,There isn't much work and life balance,Senior Manager,Former Employee,"Dallas, TX","Jun 20, 2022"
1469,4.0,Great company to start at,"Decent PTO(15-20 days), 10 holidays, healthcare for me is reasonably priced through the company for full PPO coverage. Work environment on my specific project is great, with minimal oversight and excellent trust models. YMMV here. I work remote/WFH indefinitely. Salary is good for me considering this is my first position in the field. Sign on bonus was good as well. They provide yearly bonuses and salary/career level review as well. I am CL-11 at AFS.","Lengthy hiring process, took me about 5 months from start to finish. They have set dates for new-hire roll-on that are hard dates, no negotiating. Another hoop to jump through is finding a project once you roll on, which for some can be difficult. I found one within a month. Sometimes WFH can be exhausting when you don't have social interaction, but AFS is slowly rolling return-to-office back for those that want it(not required, depending on project). Salary is slightly below market average for my location, but I am entry level right now. Time will tell if it catches up over time.",Software Developer,Current Employee,"San Antonio, TX","Jul 8, 2021"
1470,3.0,Great diverse opportunities,Very large company with many opportunities for advancement and exposure to different businesses,"In a large company, you can also get lost.",Senior Manager,Former Employee,"Atlanta, GA","Jun 9, 2022"
1471,4.0,Great place to start a career,"Smart, friendly people who are more than happy to collaborate and mentor.","Large company, at times very bureaucratic",Business Analyst,Current Employe,"Seattle, WA","Jun 9, 2022"
1472,4.0,Low salary,"Good vibe
Good benefits 
Flexibility","Low salary
No learning
Isolation",Sales Development Representative (SDR),Current Employe,"Atlanta, GA","Jun 29, 2022"
1473,4.0,Good company,You will work with the smartest people in the industry,Can be very demanding at times,Account Manager,Current Employe,"Phila, PA","Jun 13, 2022"
1474,3.0,Could better bay,"easy, decent benefits, lunch, laptop","pay, campaigns, no growth, stuck feeling",Anonymous Employee,Current Employee,"Atlanta, GA","Jun 22, 2022"
1475,5.0,Great company,"Opportunities, diversity and progressive. Offers a lot of opportunities in areas you’d like to grow.",Communication with management could be increased for team collaboration and goal setting.,Program Specialist,Former Employe,"Dallas, TX","Mar 4, 2022"
1476,4.0,Great place to start,Great flexibility and opportunity to grow,Hard to find your niche and stay in it,Analyst,Current Employee,"Seattle, WA","Jun 7, 2022"
1477,5.0,Exceptional Organization,"- Exceptional talent
- Innovative Culture","- Large organization, but not necessarily a negative for me",Manager,Former Employee,"New York, NY","Mar 22, 2022"
1478,3.0,Starter-kit Career,Great company to kickstart your career,Hard to achieve your desired path due to time on the bench means you'll do work you weren't necessarily hired to do,Applications Developer,Current Employe,"Atlanta, GA","May 28, 2022"
1479,3.0,A fair place to work if your ok with not advancing,Great team mates to work with for the most part.,"Internal Advancement is really slow! Unless you know senior leadership then its Really Quick.
You will see people get promoted to leadership positions in technical areas where they have actual knowledge.",Information Technology,Current Employee,"Washington, DC","May 2, 2022"
