,Rating,Title,Pro,Con,Job Title,Status,Region,Date
696,4.0,"Pretty good pay, tedious boring work","Good pay, flexible hours, easy to take time off.","Terrible work, some staff can be rude.",Warehouse Worker,Former Employee,"Swedesboro, NJ","Oct 9, 2022"
697,5.0,Great on boarding process,The on boarding process was well planned and very helpful to get me up to speed. Great team to work with. I am allowed to express ideas and opinion and even pilot new initiatives.,No free snacks and no freebies.,Commissioning Engineer,Current Employee,"Herndon, VA","Sep 14, 2022"
698,4.0,Overall good pay for requirements,flexibility on hours worked and ability to take on more hours,Everyone seemed very un motivated,Seasonal Warehouse Associate,Former Employe,,"Oct 10, 2022"
699,4.0,Work Life Balance,Great benefits for a full-time position.,The schedules are usually four day workweeks along with 10-12 hour shifts.,Tier III Process Assistant,Current Employe,,"Oct 10, 2022"
700,4.0,Good job,Good job overall. Decent pay,Long hours during holidays. Workload increases,Delivery Driver,Former Employe,,"Sep 25, 2022"
701,5.0,awesome,awesome awesome awesome awesome awesome,none none none none none,Anonymous Employee,Current Employee,,"Sep 26, 2022"
702,4.0,Great Oportunities,So much room for growth both within the company and professionally,Weird hours hard to line up with other companies,Whs Specialist,Current Employe,,"Sep 15, 2022"
703,5.0,Onboarding + Career Trajectory,"You will be set up for success at Amazon as long as you take your own career into your hands and be the driver. 
While rigorous, on-boarding offers a vast portal to training materials, Amazon culture, customer obsession and how to maintain success and growth","You will most likely experience impostor syndrome as you on-board in the first 3 months and it can be crippling. You have to own getting yourself through that. 
Finding all the correct self serve materials to answer questions can have you going in circles.",Senior Account Manager,Current Employee,"Seattle, WA","May 20, 2022"
704,4.0,Pretty chill job,Not to complicated of a job and a lot of room for moving up. Easy to learn and quickly find another job in the warehouse,Long 10 hours shifts standing can get difficult,Warehouse Worker,Former Employee,"Stone Mountain, GA","Aug 30, 2022"
705,4.0,Okay job,Flexible hours and easy job,Not a long term job,Fufillment Associate,Former Employee,"Fort Worth, TX","Sep 26, 2022"
706,3.0,Warehouse job,"Great benefits (health vision dental), also tuition reimbursement. PTO, vacation, upt. Weekly pay.",Labor intensive and overly repetitive. Can become boring. Prone to injuries. Personally don't like the 10 hours shifts / 4 days a week. Would rather work 8 hours a day 5 days a week.,Fulfillment Center Associate,Former Employe,,"Oct 13, 2022"
707,3.0,Bittersweet,Great pay and benefits. Sometimes schedule is okay.,My management is harassing me about my pay range.,Area Manager II,Current Employee,"Birmingham, AL","Nov 20, 2022"
708,2.0,3/10,Pay is the only pro,No time for anything else when you have mandatory 80 hour weeks. Unprofessional,Picker/Packer,Current Employee,"Breinigsville, PA","Nov 20, 2022"
709,3.0,Layoff limbo,I like my team a lot.,Not sure if I'll be laid off next year.,Software Engineer,Current Employee,,"Nov 20, 2022"
710,5.0,AWS,"Warm and pleasant atmosphere to work at, a lot of resources for growth and development, easy to collaborate, amazing culture and values",have not experienced any yet,Program Manager,Current Employee,"Seattle, WA","Sep 7, 2022"
711,3.0,Great for a first IT job terrible for professionals with some experience,"Depending on your schedule you can have 3 days off. It's possible to move to different roles virtually anywhere within the company if you have connections. For the most part, they are really nice and hard-working people.","Terribly low pay. Overworked culture. Company doesn't seem to value its employees. It's like they themselves say at Amazon, it's not for everyone.",IT Engineer,Former Employee,,"Sep 7, 2022"
712,4.0,Warehouse Associate,"Great Money, Benefits and easy work",Became a long drive when moved further south to take care of father.,Warehouse Associate,Former Employe,,"Sep 16, 2022"
713,3.0,"Easy work, but toxic environment...","4 day work week, voluntary overtime, very easy work. Immediate benefits (for full time), LOA very accessible. Most of the roles are very easy the comprehend/ master in really any department there is, & it is also easy to move up with time.","Not all, but some of the higher ups tend to be disconnected from their associates; micromanaging, not being fully knowledgeable about how their department actually operates, lack of empathy or healthy engagement with associates.",Outbound Order Picker,Current Employee,"Macon, GA","Sep 17, 2022"
714,4.0,"Great place, mixed experiences based on team","- Potential for positive impact
- Easy to change teams
- Diverse projects","- Compensation is always lacking, company seems to want to use stock growth against future compensation but ignores the reverse when stock plummets
- Experience is mostly team specific",Senior Software Engineer,Former Employe,,"May 17, 2022"
715,5.0,Love it here,Took some time to get used to. Everything moves too fast and changes in a split second. Once you get used to it things are great. Give it a chance.,Nothing stands out. If you are not good with speed and change you will learn quickly.,HR Specialist 3,Current Employee,"Charlotte, NC","Aug 12, 2022"
716,4.0,good temp job,"get to work by yourself, just you, the van, and your podcasts.",some routes are terrible. Not a good job if you get road rage.,Railroad Worker,Former Employe,,"Aug 31, 2022"
717,5.0,hello amazon,"well organized corporate culture, I am trying to make my space here","Diversity and Inclusion in Corporate Recruiting, Corporate Career climbing.",Warehouse Worker,Current Employe,,"Aug 31, 2022"
718,5.0,Great place to work!,"work/life balance, career growth, networking opportunities, keep learning and growing, ability to leave a lasting impact globally.",you get paid once a month,Anonymous Employee,Current Employe,,"Sep 8, 2022"
719,4.0,Meh,"Lots to learn and lots of opportunities, great career starter","Difficult to move up, learning is like working at a small startup (not always the best documentation)",Sr. Product Manager,Current Employe,"Atlanta, GA","Sep 8, 2022"
720,5.0,great place for products,product opportunities and opportunities for growth,none that i know of,Principal Product Manager,Current Employee,"Atlanta, GA","Sep 17, 2022"
721,4.0,Easy to get job,good pay and benefits for ease of getting hired,turnover rate among employees is very high,Amazon Associate Tier I,Current Employee,"Waukegan, IL","Sep 17, 2022"
722,1.0,Tiring,Bad pay bad managers bad everything,Evrytj8ng they had to offer was useless,Order Picker,Current Employe,,"Dec 19, 2022"
723,3.0,"Good Work Experience, Bad life Experience","Cross-cultural team workign, allot of areas to shine, very competitive, success recognition","Very intense workspace, little orgganization, not enough help from HR, Long hrs lots of extra time (level 3 ends up making much more than level 4 with MET)",Area Manager,Former Employee,"Greenfield, IN","Oct 24, 2022"
724,2.0,"Not bad but not good.  Little time off, no chances to move up. Rampant favoritism, sexism against men who do most work","Flexible schedule, you can clock out whenever you want if you have the hours, easy job if you are in an at least decent shape.","Very small chances to move up, some unprofessional managers and supervisors, favoritism of women over men, no appreciation for effort, clueless upper management to the point of being offensive. If you entertain the managers you get a chance to move up. If you flirt with managers you get a chance to work less.",Warehouse Worker,Former Employee,"Doral, FL","Jun 15, 2022"
725,3.0,It's whatever,A lot of learning to be had,Not sure why people haven't admitted that it's fully a cult.,Project Coordinator,Former Employee,"Seattle, WA","Sep 29, 2022"
726,5.0,IT Recruiter at Amazon,Big company/visibility. Well known name. Endless resources. Innovative practices and company is always striving for improvement.,Bad media stigma. High internal competition.,Technical Sourcing Recruiter,Current Employee,"Henderson, NV","Sep 1, 2022"
727,5.0,Good Experience,Learned alot of stuff and developed my AWS skills,Backbiting between employees which causes toxic environment,Consulting Software Engineer,Former Employee,"Germany, TX","Sep 18, 2022"
728,4.0,Decent gig!,"Great flexibility, decent part-time pay & benefits","No pay raises, not too many opportunities to move up",Warehouse Associate,Current Employee,"Miami, FL","Sep 18, 2022"
729,1.0,WHS Specialist,“Big name” company. Build resume,"At my level in my specific role, working with Operations is dreadful. Constant baby sitting and pulling of teeth to get simple tasks done. No partnership. Bad leaders who don’t care at all about safety. Also no work life balance. Broken system overall.",Whs Specialist,Current Employee,"Baltimore, MD","Nov 17, 2022"
730,3.0,Take your talent elsewhere,"Overnight shifts give you your whole day to do what you want
team could be amazing, you work with so many random people that you eventually find some great gems","overworked
underpaid 
sooo much work for the little pay. 
overtime is part of your regular shift",Area Manager,Current Employee,"Burlingame, CA","May 31, 2022"
731,3.0,Overpaid baby sitter,"Easy, almost too easy at times",Not great work life balance,Area Manager,Current Employe,"Bakersfield, CA","Oct 18, 2022"
732,5.0,Smazon,Awesone I love it so much,Ok this is so awesome,Software Engineer,Current Employe,"Seattle, WA","Oct 18, 2022"
733,4.0,Operations Manager,Lead and develop your own team/shift.,Work load can be excessive,Operations Manager,Current Employee,,"Oct 18, 2022"
734,2.0,Amazon Review,Good Salary Good PTO Good Benefits,Micro Management No Work Life Balance,Software Developer,Former Employe,,"Oct 19, 2022"
735,4.0,Review,It paid on time weekly,The job had tough hours,Warehouse Worker,Current Employe,"Middleborough, MA","Oct 20, 2022"
736,1.0,Incompetence To The Extreme,"Most people you meet working at Amazon are good people, and the pay is kind of nice. You can eat a lot of fast food if you wanted to with this money.","Chris Grindstaff is a lazy hypocrite who spouts about rates but doesn't do a single hour of hard work. You are stuck at a station with no one to talk to for ten and a half hours, or twelve hours during the holidays, managers that refuse to do a hard day of work will berate you about rates and how it's the easiest job in the world because the longest they'll do it is ten minutes to make you feel bad.",Warehouse Associate,Former Employe,,"May 11, 2022"
737,3.0,Non communication,The flexible  schedule was great,"Amazon leader ship has extremely poor communication!  They did not tell the truth when it came to transitioning Whole Foods shoppers to Amazon warehouse shoppers. They made it seem as if we may not have employment if we chose to go to the Amazon food warehouse. As a result, I'm barely getting eight hours a week with Whole Foods.",Whole Foods Shopper,Former Employe,,"Aug 19, 2022"
738,4.0,The hype is true,"Great compensation in the form of stock.
If you can get TT rating on review you get stock to compensate you to 80% of the existing salary range. This is awesome if you are an internal promote at the minimum.","Little work life balance.
Grueling pace of change.",Sr Operations Manager,Former Employee,"South Seattle, WA","Aug 19, 2022"
739,3.0,"AWS is a great place to learn, career advancement very slow past entry level","No better place to learn about distributed systems operations at scale, run securely. Generally excellent principal engineering culture and IC career tracks, although tends to be dominated by aggressive and outspoken people.","Teams are understaffed and overworked. Sustainability is based on managing high turnover. For senior people, promotions are extremely difficult to get, meanwhile new hires come in with less experience, more pay, and at higher levels.",Director,Current Employee,"Seattle, WA","Jun 23, 2022"
740,5.0,Great Job Especially for New Graduates or IT Enthusiast,"Many tools to advance internally, and externally from certificates, on job experience, to furthering education.
Financial and scheduling support for life changing events like going back to school, becoming a parent, death in the family and more. 
Pay is great and competitive especially in this market. 
Great people to work with, and very helpful especially when new to the IT environment or Amazon. 
Great benefits, and time off accumulation.
Overall a great environment to work, and very diverse and inclusive.","Must work onsite and be willing to work holidays and/or nights.
Sometime repetitive during downtime, mostly just fixing printers and/ or scanners.","IT Support Associate II, IT Services (L3)",Current Employee,,"Jun 27, 2022"
741,2.0,"No communication between departments, Inconsistent processes","Decent pay
4 day work weeks
Paid time off and good benefits
Easy job, weekly pay","They treat you like a robot
Inconsistent upper management and no communication between departments
They don't let you take breaks long enough to even use the bathroom
Everything is done through an app that is constantly crashing and under maintenance. There is no way to speak to anyone if you have a problem. Email or app. Resolution is rare.",Order Fulfillment Associate,Former Employee,"Las Vegas, NV","Mar 21, 2022"
742,1.0,RUN,The only good thing this company has is their medical benefits.,Poor leadership Limited growth opportunities Favoritism,FC Associate,Current Employee,,"Nov 15, 2022"
743,4.0,Benefits,"Benefits, work will keep you in great shape, a lot of new friendships!",Tier 1 employees are not respected enough.,Order Picker,Current Employee,"Redlands, CA","Sep 11, 2022"
744,5.0,Amazing place to work.,You have an amazing work environment. Great support amongst the company and encouragement for you to succeed.,Could take some time to understand how large the company is and how the business operates.,Executive Assistant,Current Employee,,"Sep 21, 2022"
745,4.0,Good gig,Pretty good benefits and mostly 4 days per week,Long shifts with barely a bathroom break,Manager,Current Employee,"Troutdale, OR","Oct 4, 2022"
746,2.0,I Didn't Want To Become Permanent,"Decent Salary
Remote Option
Extra OT during holidays","Policies are not the greatest.
Supervisors are great, but beyond them, upper management is not great at all.
A supervisor may send you home because you are sick, but they don't tell you that you'll need a doctors note to return in order for it not to count against you. Their methods for their Disability & Leave is atrocious.",HR Assistant,Current Employee,"Raleigh, NC","Jul 20, 2022"
747,2.0,Amazon Warehouse not  a place for  the faint,"Weekly pay, Good Benefits, Multiple schedules,  24 hour operation","Horrible working conditions (really hot all the time especially during the Summer), hard strenuous work  loads, pressure filled environment, horrible  management team, super strict business policy, horrible break system, subtle racism undertones with the management staff, very  hard to move up to higher position",Warehouse Associate,Former Employe,,"May 19, 2022"
748,2.0,"Great benefits, best suited for the young","Great benefits package starting your first day.

Generous paid and unpaid time off and flexibility.

Reasonably safe work environment.","The majority of production workers are young and immature, leading to a ""high school 2.0"" environment.

Management blatantly favors younger workers for cross-training and advancement, brushing aside older workers who have far more maturity and experience.

Production goals are often at odds with site capacity and capabilities, leading to demands on workers that can be impossible to meet.

Training is very inadequate at best.",Fulfillment Associate,Current Employee,,"Jun 13, 2022"
749,3.0,It's Ok,Great Benefits and Decent pay,work is repetitive should be paid more high injury rate hard on the body hr is horrible,FC Associate Tier I,Current Employee,,"Oct 7, 2022"
750,3.0,Good Opportunity/Life outside sucks,Growth in the company Work environment is positive,"Work/Life Balance ""everyday is day one""",Area Manager,Current Employe,,"Oct 7, 2022"
751,1.0,Don't Believe the HYPE!,"Money, and the benefits are good.",Bonus you will never get it!,Order Picker,Former Employee,"Moreno Valley, CA","Sep 23, 2022"
752,2.0,Dangerous,"Smart people, times goes quick","Violence, suicidal ideation is on us, unsafe the facilities are stacked with people that have not passed a true background check and carry long records. Rampant drug use.",LPS,Current Employee,,"Sep 5, 2022"
753,4.0,Everything good,It’s good job and good paid but I wanna something different a new experience,Nothing negative to say the Amazon,Driver Class B,Former Employe,,"Oct 8, 2022"
754,4.0,Worker,Benefits Hours Flexibility You're able to apply for different opportunites,Limited breaks and demanding physical work which I signed up for,Warehouse Worker,Current Employe,"Irvine, CA","Oct 8, 2022"
755,4.0,Hard work for average pay,simple tasks to sort items from a conveyer belt,becomes boring and draining after numerous hours,Warehouse Associate,Current Employe,"Pittsburgh, PA","Oct 9, 2022"
756,3.0,A to Z wasn't good to me,"Benefits
Pay
PTO
Flexible shifts
Safety is top priority","Long hours
Over employed leading to not enough stations for work
If you don't have enough paid time off (PTO) or unpaid time off (UPT) you can be terminated for missing work regardless of the reason. You get one exemption if you give a good enough reason after that you're on your own.
Sign on bonus is severely taxed.",Anonymous Employee,Former Employe,,"Apr 27, 2022"
757,5.0,Never a boring day!,Extremely supportive and welcoming team. I find what I'm working on super interesting. I'm happy I learn something new everyday. Amazon also does a great job with onboarding.,"My specific team doesn't go into the office. Depending on preferences, this could be a pro or con",Anonymous Employee,Current Employee,,"Sep 6, 2022"
758,2.0,Great Experience/ Poor Work Life Balance,This role opens you up to a wide variety of knowledge and pushes you to learn and develop fast,"Amazon WILL use you to make money. Compensation is nice out of college, but you will soon realize it is not worth the workload.",Operations Area Manager,Current Employee,"Memphis, TN","Sep 6, 2022"
759,1.0,"Toxic, and  evil company",Stability. Resume booster straight out of school,"Horribly toxic workplace. Worst software management and leadership of any 'tech' company. They frequently hire in incompetent managers or leaders who are so terrible, entire teams transfer to other orgs within Amazon. Most of the other sr devs and principle devs hired externally are well below the bar relative to other sde1 and sde2s I've worked with. Hyper political environment encourages toxicity and two faced behaviors. You will be negatively reviewed and punished for being critical of a design, not agreeing with management, or not sucking up to the right people. It's pretty common to see top tier rated employees be forced to another team or to leave the company strictly because they disagreed with the wrong person or otherwise got on someone's bad side. You can trust noone here.",Senior Software Engineer,Current Employee,,"Apr 24, 2022"
760,4.0,"Overall company is great, HR department needs to be revamped",Working at Amazon was a great learning experience in a very fast paced environment. Customer obsession in high demand by filling customer orders & a constant push to get the job done.,"HR Department at the warehouse I was at is horrible and needs to be revamped. As an area manager, you're treated as a grunt, managing grown adults that have more power than you do as a manager. Employees run the warehouse & if you are an area manager, then you had better look out, you'll have a target on your back regardless of how good you are to the associates.",Area Operations Manager,Former Employe,"Murfreesboro, TN","Jul 21, 2021"
761,3.0,Ok place to work,- Ok salary - A lot to learn and grow,- PIP - Bad culture,Software Development Engineer,Current Employe,"Arlington, VA","Oct 12, 2022"
762,5.0,Depends on group..,good opportunity and relatively easy to apply,Not many holidays compared with other companies,Software Development Engineer (SDE),Current Employe,,"Oct 13, 2022"
763,4.0,Pro vs cons,"Vast resources, working with talented people",Keeping up with platforms that trip over each other.,Area Maintenance Manager,Current Employe,"Shepherdsville, KY","Oct 12, 2022"
764,3.0,Good,It’s a good place to work if you like to talk to people,People yell at you alot,CSA - Customer Service Associate,Current Employee,"Lexington-Fayette, KY","Oct 13, 2022"
765,5.0,SLP Cluster,"Insightful, engaging, occupying relevant and productive time. Very strong culture and end-to-end digital path of learning with spurts of Instructor Led courses.",Seems overwhelming at beginning but very accommodative.,Sr Manager,Current Employee,,"Sep 26, 2022"
766,3.0,Design isn't seen in leadership roles,"-high impact
- fast moving","- some teams can be toxic
- new employees making much more than current ones
- frugrality",Senior UX Designer,Current Employee,,"Sep 7, 2022"
767,4.0,Good pay,Good pay Flexibility in hours,Long work days Track everything,Outbound Associate,Former Employee,"Jacksonville, FL","Oct 15, 2022"
768,4.0,Nice work flow,Chill and flexible hours. Nice people.,Picking up shifts can be challenging.,WFM Shopper,Former Employee,"Berkeley, CA","Oct 15, 2022"
769,5.0,Amazing onboarding program!,The onboarding process at Amazon is amazing. There is more resources and training available than what you will likely have time for.,"So far, I have no complaints.",Commissioning Engineer,Current Employee,"Denver, CO","Sep 27, 2022"
770,2.0,Tier 1,steady work with tons of overtime available,managers tend to lie and there is no forward movement. favoritism is rampant and tenure isn't recognized. Internal hire is completed prior to job posting so its a completely unfair practice and you won't get a promotion through this process.,Amazon Associate Tier I,Current Employe,,"Sep 7, 2022"
771,4.0,Good place to start your career,Easy access to various development tools & a lot to learn,Slow upgrade on salary; Promotion is 100% determined by your manager,Software Development Engineer (SDE),Current Employee,"Seattle, WA","Sep 8, 2022"
772,1.0,Wouldn't make a career of it,Schedule is really the only benefit. You get mirco managed like no tomorrow. It's all about manipulating numbers.,"THE PAY. Absolutely ridiculous how cheap this company is. They can't pay anyone enough for the work that is done, I have an associates degree and more schooling and I can't even squeeze a $1 out of them. They have snack day, its actually just expired snacks that we damage out. I mean how cheap can you get?",Amazon Associate Tier I,Current Employee,"Albuquerque, NM","Aug 24, 2022"
773,1.0,The horror stories are true,You will learn how to read data unlike anything else.,They will work you 18-20 hrs a day 6 days a week during the 14 week peak period without any additional compensation or time off.,Area Manager II,Former Employe,"Columbia, SC","Nov 28, 2022"
774,5.0,amazing company with huge upside,"amazing culture with incredible benefits. The job is demanding and busy, but the days go by fast.",attention to detail are a must and you must be punctual.,VP of Sales,Current Employee,"San Diego, CA","Aug 31, 2022"
775,4.0,Great position with tons of opportunity,Great position at Amazon with tons of opportunity to work on different multiple global products,Workload can be quite heavy working many weekends with no incentive pay etc.,Product Analyst,Former Employee,"Seattle, WA","Aug 31, 2022"
776,5.0,Good company if you don’t mind working hard,"Good company if you don’t mind working hard
Often offers salary incentives",Management can be challenging to work for,Warehouse Worker,Current Employee,"Wilmington, DE","Aug 31, 2022"
