,pros,cons,advice
262,"Once you know your job, your skillset is set","management is sparse, sometimes not even being in the building for weeks on end. staff shortage with no additional hiring in sight",nil
263,They have good health insurance. You don't have to ask permission to use your unpaid days or personal days. You start out at good hourly pay but once you hit 3 years you are topped out.,"They don't give you what you need to do your job (actual work, supplies, and functioning equipment), and then they constantly threaten you with automatic write-ups for rates. They don't want you to sit down for the 10 hours you're there. It's hot even in the winter.",nil
264,The pay is top tier.,"This is the worst place I've ever worked. From the first day I started, the expectations were ridiculous and the work-life balance is non-existent. I have worked every day for the last 3 months, including weekends. The shortest day I've had was 10 hours. People regularly yell at one another in chime meetings and are overtly hostile. I'm quitting the second I can afford to.",nil
265,I have enjoyed working at amazon,Working at amazon is not bad,nil
266,The company has a lot to offer and a lot of employees if you go in understanding it is a multi billion dollar company and nothing personal you’ll be very successful.,The job could be considered cutthroat to some.,nil
267,"There is high standard of every aspect of a product/feature release, you have to be operational excellence on everything. You are not only coding, but also need to understand and dive deep into all related topics and research to make a successful product.","Not a good place to help or learn a good coding practice, there is no time to do good coding design, delivery result and customer obsess require that you finish coding as fast as possible. Don't expect good work life balance, because Amazon would require you to make contributions to see the results from investment of you. Get used to on-call even if the team is not service on-call, there will still be many things/bugs to process, because there is not time to write good quality of code. You are always in the debt of someone else, or your own previous release, because there is no time to think about it well and thoroughly. So, need to priority or balance well to catch up with the speed of the company.",nil
268,"Internship experience was good. As applied scientist intern, you get to work on problems of significant impact.",No perks like food in office,nil
269,"Multiple shifts available, communicate via the app, benefits start at day 1, tuition assistance after 30days.","Job description states 50lbs max lift weight but throughout your shift you will pull, push and lift items over. Help is not always available.",nil
270,Great team Solid bonus package for the first 2 years,Leveling up can be difficult depending on your team,nil
271,Benefits are the best at Amazon,It requires a lot of physical work,nil
272,Health care benefits is pretty good Set schedule 4/10a with lots of OT options,"ISS department is a great dept to work in, however they are slowing replacing ISS Reps with Tier1 workers (less pay)",nil
273,Every person I work with is fantastic. I have been given room to grow as an engineer and work on challenging problems. Great pay.,The corporate machine instituted a return to office policy that completely contradicted the promise I was hired under. Moving near the office is not an option for my family and I am forced to leave a job I love.,nil
274,Very fast response from recruiter,Cover wide range of the leadership principle,nil
275,Payscale and benefits are great,Work pressure is too much,nil
276,Innovative culture; fast-paced environment; various opportunities,Lack of leadership training & coaching; lack of competitive compensations; lack of equitable processes (especially in promotions),nil
277,"Amazon has the absolute best Leadership Principles I have ever experienced. When they are followed, they produce the greatest results, and that is what makes Amazon so great. Amazon also has some of the most committed leaders I've ever had the pleasure of working with. There is a significant and noticeable difference between those that always do what's right, and those that just tell you what you want to hear. Most of the time, Ops will come around and make the necessary changes without putting up a fight. Know when to move on by transferring to another site. This is very site and Business Unit specific. The grass truly is greener at other sites.","When I started with Amazon, the principle ""You own your career"" was encouraging and motivating. Career opportunities are stunted by lack of shift rotation for proper exposure to the site leaders, and lack of experience level by managers that don't know how to recognize talent and Develop the Best. Req's are often filled before they are opened, and it has become about ""Who you know"" instead of what you have accomplished and what you have to contribute. This creates barriers for those that are ready to be promoted, relocating, looking to transfer, etc. Amazon needs to get back to the pre-Covid standards across the board. It's time for us to ""Return to Normal"" starting with the associate cell phones not being allowed on the FC floor. The increased number of rest periods is having an adverse effect and increasing rate of injury. Amazon has 20 years of operation prior to Covid and we need to use that data to drive the Safety Culture.",nil
278,"Work culture, salary , opportunity to learn and grow",work life balance takes a hit at times,nil
279,Good work life balance -- able to choose hours,Not a lot of room for professional development,nil
280,Working at amazon was a very memorable experience. I felt very accepted by my team and the workplace culture is great. I learned so much and I got a full-time offer after interning with them.,The work pace is intense.,nil
281,- Amazon offers a ton of internal courses which are awesome and can help expand your skill set - My role has become very focused to a particular task and therefore has more off-time,"- Unclear goals from leadership - High turnover of leadership - Requires losing time and salary to get a ""promotion"". It's ""putting you through the ringer"" in order to get a better promotion, but makes no sense to lose +10k in salary to take a role in leadership that doesn't stick around as it is.",nil
282,"- Lots of cutting-edge work being done in robotics/AI/simulation. Great place to work as a scientist in industry imo. - Impact of your work is very tangible. If you help build some advanced robotic solution, it would potentially be utilized in fulfillment centers across the US, and have a huge impact on Amazon's business. - Competitive tech compensation - (At the time of writing) a lot of teams allow working from home if your specific job duties allow it - Promotion process is very clear and well laid-out. Although some view it as onerous, I think the transparency and clearness will make promotions more equitable overall. - In general, very easy to reach out to and talk to people from other teams. Most people are happy to help out or share their thoughts if you are stuck on a problem. - Very few meetings (although I've heard this can vary with team).","- Some benefits are below FAANG pears (e.g. 401k match has max contribution of 4% of base pay) - If working fully remote, can be hard to meet and make connections with other employees unless you set aside the time to connect virtually or visit an office at some regular cadence. - Experience is very team-dependent (can be seen as pro or con I suppose, need to make sure you like your team and manager before joining). Some teams/business units will naturally be more stressful than others. Try to figure this out before applying/joining.",nil
283,"Days do fly by with a lot being thrown at you each day. You will have to learn a lot, but you have the time and resources to do it! Dedication and hard work on the LP's translate into better work days and you will find a natural order of getting everything done. Teamwork is amazing, but you have to do your part. Anyone is willing to help, but you have to know the channels and avenues to get the help you needed, so SPEAK up. Pay is excellent, benefits are premium.","With a lot to learn, you will feel overwhelmed, but don't worry everyone learns how and what ""working backwards"" means for them and applies it to be a better Amazonian. Duplicate work - you will find a lot of this, this is due to so many great ideas on how to do something! Therefore, be careful about TIME WASTERS and things taking you away from your individual goals. It is easy with the many things the company has to offer, but to succeed you have to get organized and FAST. Training is done quickly and you may have to figure out how to do a lot of your job primarily by yourself as a remote employee.",nil
284,"Fast promotions, based on other managers quitting. Decent salary, if you stick it out. Great payoff if you are not one of the many managers who quit.","Terrible working hours. No compensation for working hard or putting in extra time. No clear direction other than attempt to make or save more money. Amazon management revolves around playing the political game of gaining favor from people who are career greedy, and figuring out how you can get them a promotion so that you can also be considered for a promotion, or outlasting your counterparts.",nil
285,"-Every assigned task is simple. -Excellent benefits (medical, vision, dental, 401k, HSA plans, legal support) -College Tuition covered -Free technical training (Various IT and Business certifications) -4 days on, 3 days off",-Repetitive and boring work -Physically demanding -Occasionally stressful -Frequently have to deal with lazy colleagues -May have to provide support to rude third party vendors,nil
286,"Full time, part-time, flex shedules, and season positions Medical, dental, and 401k Every year you gain a $1 and some change until you cap out and every 5 years after that you get a bonus that increases with every 5 years and would have to move up a tier to earn more",Repetitive tasks can get boring,nil
287,"* Clear expectations * Good benefits, PTO, Overtime * Choose and/or change shifts monthly if you wish * Easy department transfers to get more experience","* Low pay * Repetitive work * Long hours * Hard physical labor * Difficult communication between departments, and hard to get needed systems to communicate properly.",nil
288,-get to meet and work with amazing people -gain experience in management & computer skills -increased pay with tenure -BENEFITS (seriously a life saver!) -most weeks 3 days off -VET/VTO,-sometimes you meet people that are incredibly hard to work with/for -hard work -long shifts -poor work/home life ratio -sometimes have to work mandatory 60 hour weeks -management is constantly changing,nil
289,"They have very high expectations. They expect employees to be high IQ, self-starters who will learn on-the-job. This means that all the people around you are... high IQ, self starters who will learn on-the-job. If you appreciate that kind of environment, this place is for you. Everyone understands that disagreement is how you arrive at a solution - not a criticism of a person. Hierarchy is seen as a mechanism for decision-making, not a sign of status. Even within the first few months of working here, the services you contribute to and write code for will be hit with more traffic than you could possibly imagine - in other words, if you like the idea of creating-at-scale, this job is for you.","If you like your job to just be a job, you won't like working at Amazon. You need to take pride in what you do and enjoy going above-and-beyond.",nil
290,Great company to work for,No cons as such. One of the best companies to work for,nil
291,"Work life balance, benefits, pay, and mostly low stress","A lot of rapid changes all of a sudden, constant reestablishing of trust between different business lines, can be extremely difficult to move up without bringing in your own individual skill sets developed elsewhere.",nil
292,"4 day work week, set schedule but ability to swap shifts easily, good management, great benefits.",It can be physically demanding. You are on your feet for 10 hours a day. Finding the right spot for you is important.,nil
293,Benefits are great from health to career choice,Someone with experience in the warehouse will be overlooked for someone who knows absolutely nothing,nil
294,"* Get to constantly worry if you are doing enough to keep your job * Get to Micro-manage all your subordinates, till they hate you * Get to Leverage all sorts of data to prove you can squeeze more from your subordinates * Get to monitor your co-workers output to make sure you aren't put on a performance plan. Remember the bottom 10% get PIPed","Amazon is one of the most cut-throat organizations I have ever worked for. While there are mixed reviews, I would avoid S3 at all cost. The leadership is toxic all the way down. They bank hard on metrics (even bad ones) to drive more performance and more output. If your co-workers work more than you, that actually affects your scores, as you will no longer be doing enough.",nil
295,"Work has tons of impact, exciting, challenging work. New technologies are used","10+ hours days, work on some weekends, on-call load is bad.",nil
296,The hours were good if the pay was better.,"The pay wasn’t the best , I like the hours but I’m looking for 17 an hour or higher",nil
297,"-If you love running 7 plus miles a day it's a good job to get in shape. -other employees are good, honest hard working people","-Amazons AI is retarded.. it has you drive back and forth in the same area and is not organized at all. -Customers are 50/50 nice or a.s.s hole -Amazon says they care about safety but they don't really, I believe they could do alot better.",nil
298,-Great benefits PTO-UPT-Vacation time-Maternity leave - Good coworkers and very helpful when needed (technical or non technical) - Career opportunities - Management is good too. Not all managers are good but most of them are really good.,"-No office, have to sit in the Noisy area - Shift and not much of Flex.",nil
299,"Amazon has incredible work life balance, growth opportunity, and structure to protect/nurture their employees. All my managers have been encouraging and supportive throughout my tenure.","It’s such a big company, it can feel difficult to stand out from the crowd, or feel connected to your job.",nil
300,"Fast pace environment. 4 to 5 hour shift goes by quick because you are so busy. Very diversified, get to work with people from all cultures and ages. They have vending machines with gear like gloves and orange safety vests in case you lose yours. because I scanned over 350-450 packages my picture was taken and I was rewarded with a Dunkin' Donuts card which I thought was funny considering we work for Amazon. But it was nice to be acknowledged since there were so many people working there. if you are a good worker you can pretty much work where you want or were you are most efficient but also be prepare to be pulled away if they need you somewhere else. especially if you are considered one of the more efficient workers.","It can be a toxic environment. A lot of complaining about the work load mostly from the younger generation. "" F this place N word"" was their mantra, heard it every morning. I would tell them ""just think of it as you are getting paid to workout!"" Because they have a vending machine with gear in case you lose yours, people tend to abuse this and not keep tracked of their equipment. Parking lot would get littered with gloves and vests. If you were a fast and efficient worker they would move you around to pick up the slack of the slower employees. Some of these people were barely working making it frustrating for the people like myself who were scanning 3x the packages they were for the same pay. Management or the leaders they had on the floor were mostly young and were not trained to be leaders or have a proper work etiquette. We all have name tags and one of these young punks kept saying ""hey you, yeah you"" to me on several occasions when I advised him my name is on the tag and to address me properly and respectfully or don't address me at all. He no longer called on me from that time on, nor did he apologies. I was a warehouse manager for 8 years before working in IT and never treated my workers like they were cattle. Another big problem is some of these people were not even competent enough to scan the freight onto the pallet. Normally first box gets scanned to the pallet it goes to and after that you can scan freight to the box already on the pallet. This process was challenging for some and if you are working with this person then you usually get pulled aside with them even though you weren't at fault. I would now have not only scan my freight but rescan their freight in. I tried to explain this to leadership and advise who was the problem but, they rather pull a whole group aside instead of the the individual making the mistake. Bottom line when you scan something in right, it has a different tone beep and goes green showing it was scanned successfully and it does the opposite if you don't scan it in properly. This is not rocket science!!!",nil
301,"Benefits, Full time, flexible hours, paid time off","Every second of your time is tracked to be held against you even if you complete your goals. The rules change constantly with no time given to adapt before you are held accountable. Almost every change that gets made is made to increase the bottom line without consideration to how it interrupts the employees actual job processes. We are often told to learn an entirely new process just to unlearn it when the systems finally get updated to match the new rules, those two things almost never happen simultaneously.",nil
302,Light duty maintenance. Many areas for growth.,Sensitive work environment. No room for error.,nil
303,I worked with cool people in a relaxed enviroment.,They do have metrics on each employee and how well they are doing.,nil
304,"Excellent benefits! Health insurance, vision, dental all from day 1! Career Choice is awesome. I was able to prep for a new career.","Working hard doesn't pay off. Everyone gets the same pay. It's physical labor, and injuries happen.",nil
305,Great teamwork and opportunities to be involved with different projects,"Lack of growth (you will be kept in role rather than pushed up/ you have to really work for your own growth), deadline driven work",nil
306,Pay is decent for this location.,"I was told when I was hired that I would be trained on the forklift. That never happened and I was given a dolly to walk around with refrigerator size items all night long for 12 hours. No safety straps. They tell you to use good body mechanics when lifting but that's impossible when throwing 150 pound boxes up high on pallets. So I basically stood waiting for someone to walk by and help me every time. It was annoying, especially since I was told I would be using a forklift. It's easier for big guys to do this job but naturally they hire anyone. Doesn't make sense to me.",nil
307,Flexible schedule. and extra time opportunities,Short breaks and lunch. Hard work,nil
308,Access to lots of opportunities and better work-life balance,do not have any cons to share,nil
309,I like to meet new people in my life,I want to learn a new Job,nil
310,No WLB at all in Amazon,Learning new tech and have opportunity to take big scope project,nil
311,Immediate benefits if you work 30 hours per week,10 hour shifts to get started,nil
312,Great pay and the benefits are Amazing,Very hands off when it comes to management,nil
313,Many opportunities within the company.,Not very flexible and very little work life balance.,nil
314,Pay is above average Lots of resources for new hires Great benefits,Working hours change constantly Salaried role so hours can vary greatly from week to week,nil
315,if you are full-time you get really good benefits. They pay for school too ! this benefit is available to ALL employees full-time and part-time.,But you have to work at least 36-40 hours to be full time and your schedule is crazy and all over the place . Also they claim your sorts will be 4 hours but it is alway 5 hours or 4. 30,nil
316,Good opportunity if you’re willing to work hard.,Work overload. They make you become a “yes” person and force you to do WAY too much.,nil
317,Fast paste Easy work has lots of benefits,Standing for long hours Short breaks,nil
318,"Career growth, become better thinker","Work life balance, yearly review process is cut throat",nil
319,Fun diverse team and promotion opportunities,Stock value fluctuates and affects your base pay,nil
320,3 month onboarding process makes you feel equipped to understand amazon and your role. Well connected virtually and lots of recourse's to do your job.,Company is very complex and can be very overwhelming in the beginning.,nil
321,"Fun work environment, flexibility, pay.",Nothing that I can think of so far.,nil
322,"Lots of opportunities for advancement, solid pay","Constant culture of focusing just on what needs to be done to get promoted, not focusing on making the business better",nil
323,"good benefits, multiple schedules to choose from, easy to transfer","long hours, some in management see you more like a number",nil
324,"* At Amazon (AWS) I have the best toolbox to learn and grow. People here are respectful and high achievers. They really abide by the Leadership Principles (LP) which can help you grow personally and professionally. * You can find many employee communities which makes it easier to belong and practice your culture. * Flexible: although there is a lot to do (Bias for Execution), there is flexibility which allows for work-life-balance. The LP of ""Hire and Develop the best"" means there is a lot of focus on employee well-being. * Compensation is competitive, but Total Comp is also dependent upon RSUs and therefore share price.","* Difficult to get promoted (not impossible). You have to build a body of work showcasing your impact outside of daily responsibilities. Since everyone here is a high achiever, the bar is set quite high. * Large company, can be difficult to get upwards visibility. * There seems to be too many services at AWS. It allows AWS to innovate quickly but can get confusing to learn.",nil
325,Great experience working at Amazon.,Too much work hours at Amazon.,nil
326,"+++ Amazonians live the leadership principles continuously raising the bar and more importantly those around them. +++ Nice onboarding period to acclimatize, learn and settle in to be successful. ++ Working with the latest technology on the market. + Compensation and benefits are good. PTO could use a boost especially with employers moving to unlimited plans giving hard working folks the most flexibility.",No cons at this time.,nil
327,Opportunity to work with really smart people and on very challenging projects.,Not a lot of opportunities to get promoted.,nil
328,"Good insurance, if you sign up for it, with immediate coverage. This is important because you're going to need it.","Unsafe work environment, repetitive lifting of weight above what the job description portrays for ten hour shifts, small confined area to perform the work, safety is not prioritized over ""rate,"" long shifts with insufficient break times, and a short lunch. The ""vending machines"" supply pain medication instead of management addressing the root cause of the ""pain"" is not soreness, but rather the job being unsafe and causing lasting muscle and skeletal injuries. The facility is usually either too hot during summer months, or too cold during the winter months. There is rampant favoritism on who gets placed in various roles above the starting roles of pick, stow or pack. It is who you know, not necessarily what you know. There is a lack of meaningful communication between management and associates and the work has no sense of purpose. The associate is left to feel they are expendable. God help you if you become injured at work because Amazon makes it almost impossible to get any help from them. Instead, you are placed into a never ending process of ""request for accomodation"" instead of workers comp so Amazon can cover up workplace injuries in their facilities. The accomodation is then continuously denied by site management until the associate runs out of leave and is terminated, or you say you are able to return to work to full duty without accomodation. This way Amazon avoids reporting injuries sustained by associates to OSHA and also avoids admitting there are systemic problems in their warehouses that are making the job unsafe.",nil
329,"Amazon has talented employees who truly embody the characteristics outlined in the leadership principles. Most of the people you encounter to solve problems will work diligently with you to solve the issue presented to them. You'll learn an extensive range of topics related to your role in a short period of time which may be used later in your tenure to assist a different team. Depending on the team, you will be pushed to learn as much as possible and challenged to dive deep with each concern.",You will be pulled in to support on going issues at any given hour dependent on the severity of the issue.,nil
