,pros,cons,advice
143,"40 hours a year of PTO Unlimited UPT with an accumulative maximum of 80 hours at a time Health and short-term disability benefits Vacations are almost always approved as long as you put the submission 24 before, except during freeze periods. School tuition reimbursement of up to 5,200 something a year for full-time employees in their approved schools","Terrible management Poor safety measures, and they only focus on not letting people use their earphones. HHRR would almost never help you Amcare would do absolutely whatever it can to not send you to the doctor or to not admit any work-related injuries. I have had friends work with broken ankles due to the task they were performing, and with dislocated knees working because the safety team said they were ""not work related"" and they would need to cover the time with their personal time and were not able to afford it. If you need to get health accommodations or you are close to 5 years with the company, there is a lot of harassment. Sexual harassment complaints are overlooked and never taken seriously unless is an assault already or a manager putting the complaint. Have very high productivity expectations but never productivity bonuses. and expectations were measured when the machinery ran smoothly, and now in 2022, nothing worked properly. At least in my area, it's the only warehouse that has not raised its salaries in comparison with the market for the same jobs.",nil
144,* Overall decent compensation * Talented coworkers * Can push for work/life balance and 40 hour weeks,"* Will try to sneak things into contract, such as RSUs vesting very far out * Have to actively push to ensure just 40 hour weeks * Promotion process is opaque and buerocratic - can overperform for years with no promotion * LPs can lead to a harsh culture",nil
145,"The only positive is the benefits, even the pay is below what it should be as a Warehouse worker","Micro Managing they monitor every single thing you do they treat you like a child and they do NOT care about your saftey despite what they claim, after working for over a year they put my LIFE in danger because they could not take the time to hire the proper people for a position i NEVER asked for and was NOT part of my job. I was a Customer Returns rep and not a STOWER, i never wanted/asked to be one they forced me into it even when i begged not to do it as i am afraid of heights and close spaces. I was stuck in the air and extremely terrified of the whole situation. They do not care about the safty of their employees just what they think they can get out of them.",nil
146,"Pay - if you survive long enough to get a decent raise Benefits - again, if they don't hunt for reasons to terminate you","Sometimes safety rules have good reason behind them, others are along the lines of ""because we said so"" which doesn't lend credibility Loss prevention is full of overpaid, self-important hacks that haven't made a single thing safe in that warehouse nor have they prevented thefts; they only exist to fire people There is NO work/life balance -- you will be too tired to do anything on your days off",nil
147,"Opportunity to work with the latest tech stacks, good salary, stocks and company outings every once in a while.","You'd find some of the worst management here. It doesn't matter if you grind yourself, if the manager doesn't like you for some reason, they'd likely put an end to your career at Amazon. At the end of the day, it's just a number game for them like many other tech companies out there. As Amazon is a huge employer, they also fire people in the same proportion. So, I'd say not to prefer this company unless you're out of other options.",nil
148,Great working environment and people,There is a lot of walking involved,nil
149,"The online reviews and media reporting on Amazon had me hesitant to join. I was won over by the interview loop, manager, recruiter, and peers I spoke to to give AWS a chance. I have been in tech for over 20 years and love to be challenged. Every day is a new challenge and problem to think through, question, and evolve. Peers I have met bring different experiences to the table. I find the environment collaborative and challenging.","I have witnessed people with a chip on their shoulder as they have been around a while and not promoted. This can be unfortunate and challenging if you are use to getting promoted based on time. This isn't true for AWS. To be honest, it isn't that way at any startup or software company. The other con is that the onboarding is geared for the lowest level, so if you come with deep experience in cloud and tech, it can be a chore as it feels like review addition and subtraction. Luckily, good managers adapt to get you the challenges you need early, which is awesome.",nil
150,"The pay is AMAZING! It’s genuinely hard to find companies that can match what Amazon pays. The benefits are also superb, and in those sectors they’re a great employer, but it takes more than benefits and wages to be the best.","Amazon doesn’t appreciate their employees, they believe in overworking and there isn’t a such thing as work life balance. They also purge (fire and layoff) very frequently. It’s horrid looking over your shoulder every year, wondering if you’re about to be laid off or demoted while upper management lies. I held a management title at Amazon and distinctively remember telling my manager, an Indian lady, that I would not be lying to my team about upcoming layoffs. I wanted everyone to be aware and prepared.",nil
151,"Lots of fields to go into, get you push yourself as a leader","Get moved shift very often, nights, weekends, holidays, etc with little notice as to when you will switch shifts and how long you will be on a shift. Makes it tough to organize a home life. Mandatory extra time (unpaid for salary obviously) during busy season or randomly when building is preforming poorly.",nil
152,Schedules are good A lot of shifts you can pick up if you really need it,Favoritism And they work you until they burn you out Some learning ambassadors don’t even know how to properly teach how the system works,nil
153,"Amazon favors self starters, high intelligence AND high effort. In that combination. Two out of three is not enough. But motivated, talented people can make a fine career there.","The cons are well publicized. Long hours, hard work, long ramp to promotion. It also takes faith in the company with a high percent of compensation coming via RSUs - much more than other companies at middle management. Also, being a good manager is not incentivized except that you don't want your people to quit because recruiting is difficult.",nil
154,"1. High pay, especially for college graduate 2. good WLB in my team and department 4. No-toxic culture or micro-management 3. coworkers are all friendly and open to help","1. Layoffs 2. Basic benefits, like free banana",nil
155,"Really, Amazon is better than people make it sound. Before coming here, many of my Software Engineering coworkers warned me that Amazon would work me 12+ hours a day, that it was cutthroat, and that if I slipped up even a little I'd be out. After arriving here, however, I see that's not the case. I work a normal 8 hour day, my coworkers and managers are incredible and personable. I've made mistakes and the company doesn't hold it against me. I love working on a first class team. I don't have to worry about whether somebody actually knows how to program, because I know that Amazon did their due dillegence in hiring the best. And it shows. When workplace issues DO arise, my manager handles them quickly and I'm left happy and able to focus on the technical issues.",Acronyms are everywhere and make very little sense. Be prepared to look them up often.,nil
156,"* You will almost definitely deliver production software if you program. * If you deliver software, you will see it work in Prod. * Looks really good on a resume. * Gets you experience in Ops.",* Not industry standard software tools and stack. * Work/life balance is skewed to work (see experience in Ops). * Lots of security and upgrade treadmill.,nil
157,Pushed to work hard and think outside the box. In my opinion it is worth it. You get high visibility for your work and your leaders will make sure you are rewarded well for it. This can happen when you are with a good mix of people. I cannot speak for other orgs or teams that might have a slightly different culture.,URA is high. Can force best of people to take unkind decisions. Grad hiring bar was low in the last few years. I think the company is looking into restructuring it.,nil
158,"- Remote position on a new growing fashion team - Supportive teammates, wonderful people who want to do great work - Able to create digital fashion experiences that positively impacted customers, bubble up innovative ideas to help grow a new service.","- Productivity expectations were unsustainable. All tasks were timed. 1-2 minute breaks in-between tasks (bathroom, getting water) were not actually able to be taken if daily goal was to be reached (you could physically take the break but the task clock would be running). Several teammates worked off the clock on the down-low to actually meet their goals to avoid being penalized, further inaccurately supporting managements productivity expectations. Goals for productivity and sales would change with little notice. Many members of the team were put on coaching plans to improve how fast they could work, or fired for not being fast enough. The more like a computer you were, the better. - Went from flexible hourly schedule to schedule-bidding based on stack-ranking. Teammates who were needing supplementary income (due to our low pay) had to leave part-time evening jobs and work odd shift times, or quit. - No internal growth opportunities after 3+ years on the team. Limited growth opportunities to move to other teams in different job functions (team was ranked as L3 but considered corporate). - Limited yearly raise for top performers, no raise for cost of living adjustment. Essentially, a pay-cut in the final years due to rising inflation and cost of living in one of the nation's most expensive cities. No severance packages (these specific attributes apply to THIS team, not Amazon teams as a whole). - Lack of communication from upper management on program direction or changes. There were quarterly All-Hands meetings and then silence in-between. Towards the end, team-wide meetings were postponed, a sure sign of something being wrong pre-layoffs.",nil
159,"Boss' were fair, easy to talk to. Hours okay. Pay also fair.","Physically exhausting, but I'm a bit older so may not have been the right job for me.",nil
160,Fast pace and chill staff,Far from home and lots of tolls,nil
161,The company gives support to new drivers,The driver is obliged to carry goods,nil
162,"Good benefits to deal with the crushing depression, stress, and excessive demands of a mindless job. It’s like getting your gym time in at work. Pay for school if you can fit it in and they don’t change the program covered just as you are about to start. They pay for composite toe work shoes.","Expected to perform like automation, but we are human. Zero work life balance. Never really get a chance to know who your coworkers or supervisors are. Soul crushing mindless work. 10 hours a day of silence and minimal human interaction even though there are people around you. Offer education benefits you are typically to exhausted to make good use of. The composite toe shoes are ugly and uncomfortable. Supervisors don’t take actual time to talk to you. They talk at you while you’re concentrating on working to make rate and mot make a mistake. You don’t really get appropriate break time to rest. You have to work without being paid in order to be prepared to start your shift in a timely fashion.",nil
163,"Straightforward, ad sales gig, have 40-50 clients and only really have to talk to half of them. Amazon sells itself so you're focus is really about selling specific ad products, don't really need to ""re-invent the wheel"" No micro-management really, you will find yourself relying on your peer team members much more than managers who are more so there to relay priorities from upper management and track your performance than to train you how to do the job.","The job will get boring, you talk to the same 30 or so ""brands"" and some of which have no clue how to run their business let alone what to do strategy wise within advertising You'll be forced to pitch certain ad solutions whether or not it's actually the right fit for their brand based on what they want to achieve, even if their performance is decreasing you will need to keep pitching certain upper funnel tactics if you want your bonus/payout commission.",nil
164,Benefits are day one Hard to get fired,Hard to promote Hard to get fired Overly optimistic about failure,nil
165,"- Lots of learning - Strong, talented engineers depending on the team","- Team dependent, some teams are great, others are disasters - Many teams have their own internal culture that is more facetious",nil
166,"good, WFH, full time, phone calls, see sufficient",getting yelled at by Employees due to Employees being hurt and wanting they're payment,nil
167,"Good benefits , growth and development",Long hours and working holidays,nil
168,- Good Pay - Set Hours,- Pretty Mindless Work - Lack of Transparency in advancement and day-to-day,nil
169,Because their was a productive system in where everyone would work and when anyone need help in the department they would help you .And Amazon had a charity foundation where costumers would pick their own choice of charity and amazon would give charity there.,That amazon had ended their charity foundation even though they are one of the biggest company's out there.,nil
170,Easy job and you get a workout at the same time,Seasonal so it was too short,nil
171,I got to pick my shifts; Easy to learn all tasks,"It was hard to get the shifts I wanted since there were so many workers, so I ended up having to take extra early shifts at times; No manager on-site which is annoying when you have question",nil
172,"Amazon is experiencing a rapid growth cycle and its efforts are planted in that growth. The deliverables and expectations are making the business more and more complicated at a site level. This creates opportunities to develop and grow as an individual with the company. There are lots of resources to take advantage of if you want to grow your professional skills. If you haven't had a position doing labor management, it's a good window to find out if you could make a career of it.","I left my position because I felt we were asked to execute poor plans and adhere to deliverables that made little sense and took a lot of time while hemorrhaging money away in labor. I worked at PDX5 and we often failed to meet quotas of things that would help our site (proper training and strict adherence of safety violations, and being forced to execute those plans with a smile on my face as associates would tell me I was wrong for it.)",nil
173,"Established corporate culture, leadership principles.",Fast hiring and fast layoffs.,nil
174,"During Covid, I was able to work from home.","After Covid, back to office plan kicked in.",nil
175,"The company takes good care of its employees, we receive benefits the first day of employment, also raises every six months. I was noticed by a manager right away to become a pallet supervisor and make sure nothing is expired or lost, and to put the products in the right area for them to be send to customers.","I was injured by a forklift and the manager chose not to help me or call an ambulance and put me right back to work. I suffered a concussion, and memory loss from this.",nil
176,The work was very easy. Training took under two days and was paid for. Hours are pretty much guaranteed and you can choose your shifts. You work at your own station and can just zone out for a few hours.,Close to no human interaction throughout your shift. Sometimes I went the entire day without saying a single word to anyone. It also takes a while to be noticed and promoted. Usually you are just transferred to another position.,nil
177,"Good Salary, and the opportunity to learn new things . Flexible to switch teams internally.","Long hours, too much pressure. you need to figure out everything by yourself, Nobody will help you. If you are looking for Worklife balance then this is not the company.",nil
178,"Never a dull day, non monotonous Great pay for entry level manager Room for growth Fun environment","Work-life balance isn't the best Long hours, (12-14hrs) each day Not much recognization unless you fall into being a true Amazonian and submit and not push back",nil
179,Every project is like a startup. Good learning curve,I do not have concern as far as now,nil
180,learn a lot about operational flow and processes. lots of opportunity if you are willing to relocate frequently. lots of training for path you are in.,management geared towards 20-30 year old people. They do not promote people with gray hair from hourly to management no matter how well you perform. I was at a Fulfillment Center and they always cut headcount but keep work volume heavy expecting you to work like a madman for 10 hours.,nil
181,Benefits and pay are the reason.,"Long hours, must be able to work for 14 hours straight no breaks.",nil
182,"- Lots of cutting-edge work being done in robotics/AI/simulation. Great place to work as a scientist in industry imo. - Impact of your work is very tangible. If you help build some advanced robotic solution, it would potentially be utilized in fulfillment centers across the US, and have a huge impact on Amazon's business. - Competitive tech compensation - (At the time of writing) a lot of teams allow working from home if your specific job duties allow it - Promotion process is very clear and well laid-out. Although some view it as onerous, I think the transparency and clearness will make promotions more equitable overall. - In general, very easy to reach out to and talk to people from other teams. Most people are happy to help out or share their thoughts if you are stuck on a problem. - Very few meetings (although I've heard this can vary with team).","- Some benefits are below FAANG pears (e.g. 401k match has max contribution of 4% of base pay) - If working fully remote, can be hard to meet and make connections with other employees unless you set aside the time to connect virtually or visit an office at some regular cadence. - Experience is very team-dependent (can be seen as pro or con I suppose, need to make sure you like your team and manager before joining). Some teams/business units will naturally be more stressful than others. Try to figure this out before applying/joining.",nil
183,"Days do fly by with a lot being thrown at you each day. You will have to learn a lot, but you have the time and resources to do it! Dedication and hard work on the LP's translate into better work days and you will find a natural order of getting everything done. Teamwork is amazing, but you have to do your part. Anyone is willing to help, but you have to know the channels and avenues to get the help you needed, so SPEAK up. Pay is excellent, benefits are premium.","With a lot to learn, you will feel overwhelmed, but don't worry everyone learns how and what ""working backwards"" means for them and applies it to be a better Amazonian. Duplicate work - you will find a lot of this, this is due to so many great ideas on how to do something! Therefore, be careful about TIME WASTERS and things taking you away from your individual goals. It is easy with the many things the company has to offer, but to succeed you have to get organized and FAST. Training is done quickly and you may have to figure out how to do a lot of your job primarily by yourself as a remote employee.",nil
184,Good pay and benefits and schooling and investment opportunities for those who want it,"Awful managers and HR. managers just don’t care about anything cause they are all paid way to much and just walk around shift with computers talking to one another, after working there for 3 years at multiple different buildings I’m convinced managers do nothing but organize on shift orgies with one another cause they never help with on floor problems besides the occasional jam or hiccup or conveyor malfunction, but they have entire off site hired departments dedicated to fixing the machinery so managers really do just about nothing on the ground and they don’t help unless your a new hire. HR is ruthless and refuses to help in most cases and will just suspend you or write you up. Or in my case force me to resign for small schedule issues.",nil
185,"-Every assigned task is simple. -Excellent benefits (medical, vision, dental, 401k, HSA plans, legal support) -College Tuition covered -Free technical training (Various IT and Business certifications) -4 days on, 3 days off",-Repetitive and boring work -Physically demanding -Occasionally stressful -Frequently have to deal with lazy colleagues -May have to provide support to rude third party vendors,nil
186,"Full time, part-time, flex shedules, and season positions Medical, dental, and 401k Every year you gain a $1 and some change until you cap out and every 5 years after that you get a bonus that increases with every 5 years and would have to move up a tier to earn more",Repetitive tasks can get boring,nil
187,-get to meet and work with amazing people -gain experience in management & computer skills -increased pay with tenure -BENEFITS (seriously a life saver!) -most weeks 3 days off -VET/VTO,-sometimes you meet people that are incredibly hard to work with/for -hard work -long shifts -poor work/home life ratio -sometimes have to work mandatory 60 hour weeks -management is constantly changing,nil
188,"They have very high expectations. They expect employees to be high IQ, self-starters who will learn on-the-job. This means that all the people around you are... high IQ, self starters who will learn on-the-job. If you appreciate that kind of environment, this place is for you. Everyone understands that disagreement is how you arrive at a solution - not a criticism of a person. Hierarchy is seen as a mechanism for decision-making, not a sign of status. Even within the first few months of working here, the services you contribute to and write code for will be hit with more traffic than you could possibly imagine - in other words, if you like the idea of creating-at-scale, this job is for you.","If you like your job to just be a job, you won't like working at Amazon. You need to take pride in what you do and enjoy going above-and-beyond.",nil
189,Flex so can schedule whenever and is relatively easy,Boring and requires usual lifting of heavy items,nil
190,Bid system to work when you want decent pay not doing other jobs,- Lots of work for hours on your feet - bid system also means if you don't pick when it opens you lose many hours instantly - management is wound up and pressured - breaks are a joke and start before you make it to the break room,nil
191,"Pay is competitive, and can work on challenging problems.","Worklife balance is poor, some managers just don't know anything and they put people in PIP and focus left and right.",nil
192,"With the toward culture it helps make sure we seek to understand prior to us implementing sanctions to employees. Leadership Principles, Tenets, etc are being driven and observed in day to day activities, it is not only something that is seen on the web pages nor posts in the office.",Hiring process could be made better if communication skills could be gauge a little more (e.g. scenario based questions through mock calls) where customer service skills aligned with tenets would also be observed as well as competitiveness and resourcefulness of the applicant would be rated.,nil
193,"Lots of opportunity for growth, travel, and benefits. Keeps you active with all the walking.",No training. Chaotic. Majority of direct reports are unprofessional so feels like baby sitting adults 60% of the time.,nil
194,I’m paid decently for what I do (though I also pay for it with poor work life balance).,Every system at Amazon is broken. Departments don’t talk to each other. More time is spent trying to figure out how to do something with other departments instead of actually getting things done. Always wasting time being my and my colleagues IT person than doing my job.,nil
195,Always a need for work so overtime is an option Pay is ok Music over the speakers Generally friendly associates Its a good place to work in the short term Weekly pay,Fast paced almost to a fault Metrics matter more than manpower Easy to get burned out Work/life balance could be improved,nil
196,Lots of overtime during busy season,Back-breaking job and no employee work security. Fire at will employer.,nil
