,pros,cons,advice
57,"Learning opportunities: As an SDE intern at Amazon, you will have the chance to work with and learn from some of the industry's top software developers. Amazon is known for its emphasis on innovation and technology, and you will have the opportunity to work on cutting-edge projects and technologies. Competitive compensation: Amazon is known for offering competitive compensation packages to its interns, including a competitive hourly rate, housing stipends, and other benefits. Professional development: Amazon offers a robust professional development program for its interns, including mentorship, networking opportunities, and access to various training resources. Company culture: Amazon is known for its dynamic and fast-paced work environment, which can be exciting and stimulating for those who thrive in such an environment. Potential for full-time employment: Amazon often hires SDE interns into full-time roles after graduation, providing a clear path for career growth and development within the company. Overall, working at Amazon as an SDE intern can be a great opportunity for those looking to develop their skills, gain experience in the industry, and potentially launch their careers at one of the most innovative and influential technology companies in the world.","Intense work environment: Amazon is known for its fast-paced and intense work environment, which can be overwhelming for some interns. High expectations: As an SDE intern at Amazon, you will be expected to perform at a high level and meet strict deadlines. This can be challenging for some interns, particularly those who are new to the industry. Limited work-life balance: Because of the fast-paced work environment and high expectations, some interns may find it difficult to maintain a healthy work-life balance during their internship. Limited autonomy: As an intern, you may have limited autonomy and decision-making authority, particularly in the early stages of your internship. Lack of diversity: Amazon has faced criticism in the past for its lack of diversity and inclusion, particularly in its technology and engineering departments.",nil
58,The leadership principles are woven into everything we do at amazon and I feel like it really does help to make the right decisions for the customer. I appreciate having a value system and it really informs the work that gets done. I love the size and focus of the teams as well. There is high ownership and empowerment to affect real change for your customer.,"The recent layoffs really sucked. Good people were laid off who didn't deserve it. I hope the business will take better care with decisions about when to grow and when to be conservative to avoid having to take these sort of workforce reduction measures. The high performing highly driven nature of this company can sometimes make it difficult to strike the right work/life balance which is critical to do because the company will take whatever time you are willing to give to it. As with any company, you have to set your own boundaries to strike that balance.",nil
59,I only worked Sat and Sunday and I was allowed to pick up extra days which was good for me. It allowed me to work more hours when needed and have days off when I needed.,A lot of the bins were over filled and the dog food bags would be constantly bursting. They changed management a lot and really didn’t have sympathy for me in the final months of my pregnancy.,nil
60,"depending on what position / warehouse you work at and who your managers are, this is an awesome place to work. they’re very inclusive, flexible and have lots of opportunities to move up within the company. they also have great benefits for part time employees and in my opinion amazon has a great work environment.","I don’t like that part time hours are capped off at 30 hours when it isn’t peak season. also, i’m now a “learning ambassador” which is a trainer of sorts and while I have multiple new responsibilities and am held to a higher standard than other associates I still receive the same pay.",nil
61,As an AM you get certain perks. You get paid decently and health care is cheap.,Every week there is some new arbitrary task the higher ups like the AM's to complete along with tasks before. Ultimately you will be tied between completing those tasks or engaging with your team. Numbers first.,nil
62,"The benefits are great, and they will pre-pay for 100% of your education (GE, high school diploma, certification, associate/bachelors/masters degree).","The work is fast-paced and labor intensive. The shifts are long with two thirty minute breaks. The work culture is toxic from management down. They do not care about safety, only about how fast your production rates are. They track every minute you're away from your workstation (bathroom, water, etc.). Communication at all levels sucks. Employees are not educated on company procedures, and PXT (HR) often provides misinformation. The managers on the floor scream at and berate employees and are constantly threatening to write people up as a means to control them and force them to do unsafe things. Safety is a complete joke. The equipment is very loud and is constantly breaking which makes the job harder.",nil
63,Gain experience Grow as a leader Internal transfers to other positions,"50 hour weeks, 65 hour mandatory overtime during busy season (peak) Too much responsibility, unrealistic expectations in the time you have. 2 managers, 140 people.... walking across a football field 1 30 minute break in 12 hour shift and you are catching up on computer work on break No training.",nil
64,"Good benefits to deal with the crushing depression, stress, and excessive demands of a mindless job. It’s like getting your gym time in at work. Pay for school if you can fit it in and they don’t change the program covered just as you are about to start. They pay for composite toe work shoes.","Expected to perform like automation, but we are human. Zero work life balance. Never really get a chance to know who your coworkers or supervisors are. Soul crushing mindless work. 10 hours a day of silence and minimal human interaction even though there are people around you. Offer education benefits you are typically to exhausted to make good use of. The composite toe shoes are ugly and uncomfortable. Supervisors don’t take actual time to talk to you. They talk at you while you’re concentrating on working to make rate and mot make a mistake. You don’t really get appropriate break time to rest. You have to work without being paid in order to be prepared to start your shift in a timely fashion.",nil
65,"Straightforward, ad sales gig, have 40-50 clients and only really have to talk to half of them. Amazon sells itself so you're focus is really about selling specific ad products, don't really need to ""re-invent the wheel"" No micro-management really, you will find yourself relying on your peer team members much more than managers who are more so there to relay priorities from upper management and track your performance than to train you how to do the job.","The job will get boring, you talk to the same 30 or so ""brands"" and some of which have no clue how to run their business let alone what to do strategy wise within advertising You'll be forced to pitch certain ad solutions whether or not it's actually the right fit for their brand based on what they want to achieve, even if their performance is decreasing you will need to keep pitching certain upper funnel tactics if you want your bonus/payout commission.",nil
66,"Amazon is experiencing a rapid growth cycle and its efforts are planted in that growth. The deliverables and expectations are making the business more and more complicated at a site level. This creates opportunities to develop and grow as an individual with the company. There are lots of resources to take advantage of if you want to grow your professional skills. If you haven't had a position doing labor management, it's a good window to find out if you could make a career of it.","I left my position because I felt we were asked to execute poor plans and adhere to deliverables that made little sense and took a lot of time while hemorrhaging money away in labor. I worked at PDX5 and we often failed to meet quotas of things that would help our site (proper training and strict adherence of safety violations, and being forced to execute those plans with a smile on my face as associates would tell me I was wrong for it.)",nil
67,Great pay I guess Meet new people Overtime PTO,"Terrible work conditions Limited time for breaks Terrible work conditions Having to clock out before you reach to a break station, which takes the same amount of time to take a break",nil
68,learn a lot about operational flow and processes. lots of opportunity if you are willing to relocate frequently. lots of training for path you are in.,management geared towards 20-30 year old people. They do not promote people with gray hair from hourly to management no matter how well you perform. I was at a Fulfillment Center and they always cut headcount but keep work volume heavy expecting you to work like a madman for 10 hours.,nil
69,Excellent benefits from day 1. I loved my job. The people were great. Technology was impeccable.,"I had difficulty transferring to an Amazon close to my home or remote. Only 46 hours/week but 2.5-hour commute per day. Once they get you to a location, they don't have to make it easy to leave. What they call hardship transfer did not apply to me. Upper management had their favorites. My manager told me I was not part of the girls club. Promises were made regarding promotions that did not happen. After one year and four months on days, I was forced to go to nights. I only lasted four months on nights. Unfortunately, I had to leave Amazon because I have a daughter who needs me home at night.",nil
70,"Great Manager Good Pay Work-life balance is good for a Salesforce Admin Charming colleagues, active on Slack, responsive and welcoming!","So much for the leadership principle ""Are Right A Lot"" that they ended up mis-calculating the great decision of crazy over-hiring over pandemic that they had to lay-off 18000 employees, this is just on Jan 18th, 2023 but there has been quiet firing happening all along. Unclear guidelines - Literally spent the first 9 months juggling here and there, stepping on each other's foot to form a basic workable team Too many frequent changes in the org chart.",nil
71,No company is perfect… but in my 27yr career Amazon has been my favorite! I love the autonomy and ownership I have over my work and the culture is great. I highly recommend Amazon!,Because Amazon has grown so fast the depth of experience of some in management is less than it probably should. This is not a deal breaker but can be frustrating at times for those who have been in this kind of work for many years.,nil
72,"Great medical benefits with Blue-cross. Promotion opportunities. New hire bonuses (If applicable when applying). Met a lot of great people and a few very good friends there. The culture can sometimes be lively but can feel completely depressing. It really depends what building you’re in, what department you’re stationed at, and what kind of atmosphere your manager brings to the team.",“Time-off-task” (TOT) - basically getting micromanaged or potential write-ups if you’re not scanning something every 5 minutes. Overtime is mandatory and there have been WEEKS during peak or holiday season where you work on average between 55-60 hour work weeks. There are promotional opportunities but it takes a LOT of work just to get from a tier 1 to a tier 3. HR “prides” themselves in caring for associates mental health but honestly they couldn’t care less about your problems. They’re just there to make a check. And don’t expect HR to have any answers for your questions 75% of the time even though that pertains to their job .,nil
73,You will learn world class procurement and a level of ownership that is hard to replicate. You will become very proficient in developing and driving the business and the KPIs associated and are given a lot of freedom in regard to supplier management. Your site is your business and good regional managers let you run it. Very rewarding work.,I firmly believe Amazon prefers a revolving door in regards to retention. It brings in fresh talent and ideas and Amazon does not have good retention benefits after year 4 and most will leave the company around this time (if not before). Very fast paced and you are always working (even on vacation you have to be available).,nil
74,"Career opportunities are amazing. This a fast paced business, you are NOT going to be looking at your watch all day. There is a diverse workforce in all aspects. You will mostly do work with challenge. World class benefits.","Work life balance can be an issue. Hasn't been yet for me, but can be. Training up front (online courses) are too heavy in the culture and not your actual job role. Must be a fast learner- most of my job primary job functions I've learned because someone told me; there were no guides or notes. They used to exist, but seems they are all two years or more old. Job is not as physically demanding as I thought, but I have gone 10-11 hours without sitting down. As other reviews have stated- this is not a job where someone is likely to come to you and tell you what a great job you are doing. If you are self motivated, you can not only do well at your site, but you likely are going to start networking to move onward in a career path that you can excel in. That job will be all on YOU.",nil
75,"Remote work is a big plus. Managers and the rest of the team are good at communicating and being there for you Plenty of opportunities to work overtime, but not required. Great job for gaining experience that looks attractive on applications.",Sometimes your metrics may be negatively affected by factors outside of your control (such as your customers not liking a policy change that was made at a corporate level.) and this will reflect poorly on you. This is however admittedly rare and managers will do everything they can to help you bounce back up.,nil
76,Great pay. Great benefits. Great stock. Great offices. Awesome ability to move around and learn new things.,"Some days the entitled personalities could be a little tough to deal with. We were provided everything we could possibly need to succeed, and there were still folks complaining about something. Also...Seattle is extremely expensive, and the housing quality is very poor even if you're spending like a million or more. It just wasn't for me, but I'm glad others like it!",nil
77,"Team Members and Management were intelligent, motivated, and supportive. The position required significant motivation and effort to accomplish multiple tasks successfully providing interest and a sense of accomplishment.",Compensation not comminserate with the level and challenge of the position.,nil
78,"learning something new everyday, working with new people",working overnights was hard at times.,nil
79,- Friendly and welcoming teammates - Work from Home - Great total compensation package,- Fast paced environment - Complex responsibilities,nil
80,"When you work as an Amazon delivery driver really you are working for a DSP, a delivery service partner, that isn't directly involved with Amazon. Though regardless of what you do the DSPs usually have more than enough work if you are willing to do it. The pay is alright for what you are doing and you only need to have a driver's license and only a light criminal record to get the job.","Driving for an Amazon DSP, in my experience, will always involve a level of uncertainty going into the day. You will not know how many packages you have to deliver in a day until you pull up into the warehouse to pick them up. This usually means you have no idea the number of hours you will pull in a day. You could be done in 5 or you are working 10-12 hours. You are basically on your own all day and if you are delivering in the city the headache of trying to get into buildings as well as walking several flights of stairs due to nonexistent or broken elevators is commonplace. Regardless of if you are in the city or a suburb, you are supposed to keep a set pace when delivering that is tracked by the app. DSPs are notoriously very all over the place when it comes to standards of work so really expect the worst when it comes to anything.",nil
81,"Flexible with time off when you need it, can request the day off and guarantee get it. Great place to work and endless opportunities to advance as long as you continue learning, building your skills, and growing/look within Amazons many other tech departments. You will learn a lot, it's a very fast paced environment","Lots of automation (like with other big companies), not much room to ""get your hands dirty"" with actual ""IT things"" In the IT org you have two options to move up - IT Manager route or IT Support Engineer II. Most people will learn cloud/cyber security or another specialization to move to another team. This way there is a lot of room to grow and advance your career this way, however if you stay within ""IT"" there isn't much room to grow or raise your pay. Not much work-life balance especially if you support multiple warehouses - OT is essentially mandatory since they keep their staff numbers low especially after recent layoffs.",nil
82,"During my time at Amazon, I had some amazing managers and worked on some really great programs. In the right situations, the company was great and I grew my skill set quickly in new ways. Medical benefits were good.","Your leader truly makes the difference at Amazon. If you get a bad manager, your time there will be difficult. There are times you feel like you are just a number. There are inconsistencies between departments and managers on how the promotion process and leveling guidelines are interpreted.",nil
83,"Amazon was a good place to grow in IT during the height of the pandemic, but things are currently changing with layoffs and potential restructuring.","If there's an issue with your manager or coworkers that requires HR, it's better to leave the company than stay. In practice, there's no real consequences for hostile or lazy employees unless it hurts the company's bottom line immediately or makes management look bad, so top performers are punished with more work and forgiven of hostility in exchange for performance. Hostile work environments aren't taken seriously by managers even if HR gets involved.",nil
84,You sign up for what you want to be paid Sometimes you can go home with pay as the warehouse runs behind Driving in the early morning there is no traffic,"Pay varies, usually between $20-40 and hour depending on your timing No guaranteed shifts for your time Package organization is up to you Building access on app is not always correct Some routing coordinators overpack your shift so you spend more time that you expect you would",nil
85,"Once you know your job, your skillset is set","management is sparse, sometimes not even being in the building for weeks on end. staff shortage with no additional hiring in sight",nil
86,They have good health insurance. You don't have to ask permission to use your unpaid days or personal days. You start out at good hourly pay but once you hit 3 years you are topped out.,"They don't give you what you need to do your job (actual work, supplies, and functioning equipment), and then they constantly threaten you with automatic write-ups for rates. They don't want you to sit down for the 10 hours you're there. It's hot even in the winter.",nil
87,The pay is top tier.,"This is the worst place I've ever worked. From the first day I started, the expectations were ridiculous and the work-life balance is non-existent. I have worked every day for the last 3 months, including weekends. The shortest day I've had was 10 hours. People regularly yell at one another in chime meetings and are overtly hostile. I'm quitting the second I can afford to.",nil
88,"There is high standard of every aspect of a product/feature release, you have to be operational excellence on everything. You are not only coding, but also need to understand and dive deep into all related topics and research to make a successful product.","Not a good place to help or learn a good coding practice, there is no time to do good coding design, delivery result and customer obsess require that you finish coding as fast as possible. Don't expect good work life balance, because Amazon would require you to make contributions to see the results from investment of you. Get used to on-call even if the team is not service on-call, there will still be many things/bugs to process, because there is not time to write good quality of code. You are always in the debt of someone else, or your own previous release, because there is no time to think about it well and thoroughly. So, need to priority or balance well to catch up with the speed of the company.",nil
89,"The pay is nice, there are plenty of opportunities for extra shifts, as well as time off.","The hours are long and the work is very repetitive. You are treated as a number, however if you just like to show up to work and not be bothered this could be seen as a plus.",nil
90,"Schedule is Set, Can leave whenever as long as you have the hours, 10 hour PTO bonus for starting.","Communication between low level employee and high level employee are not so well established, ridiculous expectations for performance of said job.",nil
91,"Stocks, Health Care, Innovation, Big Company, Good People","Zero Work Life Balance(even though they promote it), after pandemic very little growth opportunities in management. Very harsh work environment where there is no loyalty. Seniors leaders were promoted quickly to handle the burst of incoming business from the pandemic, but did not have the true skill sets needed to lead effectively, so there exists lots of panic in the leadership ranks. Promotions are not decided by merit or results, but by race and gender. Leaders are ranked and no matter how well you perform, if you are ranked last(usually determined by race & gender), it is their duty to get rid of you. I personally saw this happen many times. Amazon struggles to recruit L4/L5/L6 talent and the people they do are usually miss led to what the role really is and transfer out leaving very inconsistent leadership at sites.",nil
92,Pay is very very good,It’s a lot of moving around and lifting heavy things.,nil
93,My experience with Amazon was great. I learned a lot of things and re-used a lot of skills that I have learned in school.,"There are not many cons I have about Amazon. They run a good company and if you just manage your time wisely, you’ll do great.",nil
94,"-Good paying job -Great benefits in comparison to most companies (relocation support, amazing insurance) -Generous Relocation support if necessary -Quick moving, able to learn a ton in a short amount of time -Great networking opportunities if you are persistent and take initiative","-Management is hit or miss (I've had some of the worst managers in my professional career here) -HR is shady and unresponsive at times -Very little support/training for new hires, be ready to train yourself -Things can change in an instant and you have to be okay with abandoning your project at any point for little to no reason -Benefits don't compare to other FAANG companies -Have to pay back relocation stipend if you leave before 2 years -PIP culture is REAL -Lack of communication between L10s and mid-leadership -This layoff was an HR nightmare and was handled horrendously",nil
95,"Great salary, company, and flexibility","Too big, too much writing",nil
96,"The online reviews and media reporting on Amazon had me hesitant to join. I was won over by the interview loop, manager, recruiter, and peers I spoke to to give AWS a chance. I have been in tech for over 20 years and love to be challenged. Every day is a new challenge and problem to think through, question, and evolve. Peers I have met bring different experiences to the table. I find the environment collaborative and challenging.","I have witnessed people with a chip on their shoulder as they have been around a while and not promoted. This can be unfortunate and challenging if you are use to getting promoted based on time. This isn't true for AWS. To be honest, it isn't that way at any startup or software company. The other con is that the onboarding is geared for the lowest level, so if you come with deep experience in cloud and tech, it can be a chore as it feels like review addition and subtraction. Luckily, good managers adapt to get you the challenges you need early, which is awesome.",nil
