,pros,cons,advice
0,Lots of great people who work there,You'll usually have to pick up heavy boxes,nil
1,"Really smart people, a lot of opportunity for growth, always encouraged to be innovative, think big, and create something new. Competitive salary and benefits with other major tech companies. 100% self motivating work environment. No dress code and 4 legged friends are welcome.","You have to be self motivated. NO ONE will hold your hand and tell you that you're doing a great job. If you need constant affirmations from management, this company isn't for you.",nil
2,"Jeff Bezos and his ""S-Team"" are brilliant and continue to make great decisions for long-term growth.  

You work with smart people, you work on exciting projects, you are pushed to your limits...which can be rewarding when you accomplish great things.  The diversity of the potential work and innovation can be very alluring.  I've often called Amazon my ""Sexy Mistress...she's emotionally abusive, but she's so sexy that I go back for more punishment.""","The management process is abusive, and I'm currently a manager.  I've seen too much ""behind the wall"" and hate how our individual performers can be treated.  You are forced to ride people and stack rank employees...I've been forced to give good employees bad overall ratings because of politics and stack ranking.",nil
3,"Amazon is doing lot's of cool stuff...but lots of boring stuff too.  There are really well run teams...and very badly run teams.  The experience for software managers and engineers is all over the board, from really run low operational load teams to teams where people burn out after a year.

 - Amazon is built, quite deliberately, to be Darwinian.  You can generally expect that anyone who's been here for more than 2 years is competent and motivated or they wouldn't have survived.  You can count on them as long as your priorities are aligned.  There aren't many slackers here, and they don't survive long.
  - We work on so much stuff that there's always an opportunity to find amazing cool stuff to work on (note that it's an 'opportunity', one that you have to pursue)
  - A chance to make a huge difference
  - A place where you can learn a lot about all kinds of things, both technical and about yourself
  - Amazon encourages high mobility - even your manager can't prevent you from moving to another team within 6 weeks (normally, more than a few months under unusual conditions).
  - Your friends and family have actually heard of the place you work and have at least a vague notion of what Amazon does without you having to explain","- You're responsible for your own career progression and finding the places and teams that are doing the stuff you want to do. No one is going to take you by the hand and help you with that.
- Amazon is built, quite deliberately, to be Darwinian. The strong survive and the weak perish (metaphorically speaking) and the 'bar' is constantly increasing. The level of performance that would have been acceptable five years ago will get you canned today.  It's a kind of crucible that'll help you develop a harder edge, if you can survive, that can serve you well in your career and in life, but it's often not a pleasant experience.

I wouldn't recommend it as a place to work for just anyone.",nil
4,"I've been at Amazon for a month now, and I've seen none of the horror stories being communicated to the public, although Amazon is a large enough company that I'm sure there are good pockets and bad pockets. Everyone here is really smart, and wants to succeed both personally, and as a company. People collaborate and help each other, focus on data, and truly focus on the customer. Every company I've ever worked for talks about how important the customer is, but on day 2, they're forgotten. Amazon seems to genuinely focus on what's best for the customer, and it's awesome to be in meetings where people actually bring that up, and make decisions focused on long-term customer satisfaction.

The opportunities to learn here are literally unlimited, and the opportunity to take on new responsibility is as well. I honestly believe you can be as awesome as you want here.","No cons, so far - seriously. Like I said, I'm sure Amazon has some bad pockets in it here and there, but this is an amazing job, an amazing opportunity, and the biggest thing I have to complain about is that it's a little chilly in our building. I can live with that.

Does Amazon demand high quality, measurable results? Yes! Is it hard work? Yes! Is it rewarding? Yes! So I'm not calling that a 'con'. Work/life balance seems comparable to other places I've worked - not worse.",nil
5,"- You can learn a lot very quickly in a very short time
- Surrounded with nothing but incredibly smart and driven individuals.
- Compensation is well beyond my expectations, and more than suitable.
- Exciting projects all across the company that keep you interested and focused.
- Amazon is changing the world","- Can be overwhelming, very steep learning curve
- Can be difficult to keep up if you are not self motivated",nil
6,This company gets A list performance from C list employees.  The culture is quick and hard charging.  You are always working in relevant and meaningful projects.,"Maybe because the company recruits C listers who have neither merit (intelligence, strategic vision) nor pedigree (academic or professional accomplishments), most of those who become successful do so in treacherous, low cunning ways.

Imagine the Lannisters in Game of Thrones attacking the Starks in Game of Thrones; or Rawls and Burrell attacking McNulty and Daniels in The Wire; or Barrow and O'Brien attacking Mr Bates in Downton Abbey.  This is every day leadership behavior at Amazon.  The culture at Amazon is so infested with these middling talent weasels who have juked the stats and schemed their way to positions of power that new employees coming in actually start thinking that this behavior is normal and expected if you want to ""manage people.""

The work itself was stimulating and fulfilling, but the sneering condescension of the d bags that cheated and skated their way through high school and party colleges, then just converted their winky nod nod good 'ol boy shenanigans into a ""ask no questions, have no introspection"" company culture have made manifest some of the worst criticisms of capitalism.  Any left leaning political aspirant would look at this business organism and immediately have content to lash out against the corruption that can come in free enterprise where hard work is not rewarded, and the connected, incestuous, privileged class lounge their way to wealth while treating their employees and customers like some kind of filth their shoe picked up on the street.",nil
7,"Challenging sometimes fun work environment
Being part of a team
Doing great things
Great people to work with","Organization and communication can be a challenge to maneuver around 
Hours can become a challenge when managing a hectic schedule 
Having to be available for any shift in order to move up in certain positions
Work expectations and policies can change and can be confusing",nil
8,"Disclaimer: My opinions reflect that of an SDE in Amazon. Seems like some operational job functions are very tough.

I have read through some of the other Amazon reviews and it seems to me that everyone has a very different experience! This is so true. Within the same team, you can have both workaholics and slackers coexisting and coworking together. I think I am more of the balanced type as I try to stay sane. The Amazon experience is basically the entire spectrum and it is what you make it out to be.

Pros in Amazon certainly excludes great benefits, but compensation is competitive. Free food means average quality free coffee, once in a while free pizza for lunch where it is a working lunch, and free beer and finger food in special events. We get a free Orca card to take any bus in the Seattle area for free. $160 per month subsidy for office parking, which is better than nothing. Downtown monthly parking goes for about $200 per month. 401K contribution is 50% of what you put in, where you can put in max 4% of your salary. Not so great. Staff cafeteria food is average and not at all cheaper than outside food, or could be even more expensive. It is hard not to complain about the cafeteria. Vacation days are ok but note that there are no sick leaves. They count as part of your 5 personal days per year. Listing the benefits of Amazon is like listing the cons and not the pros.

Work life balance seems to be ok for the most part, and seems to be individually-driven. No one will tell you that you have to come in at what time and stay till what time. I have team mates working every night and weekend, and others getting in at 10am and leaving at 5pm, all in the same team. Managers will focus on your project deliveries instead of how much time you spend working. If you work 40-hour weeks productively, you can definitely outperform someone who works 60-hour weeks but don't deliver stuff. Working less than 40 hours per week is somewhat common, but I can't say how many people are working how long. The view on work life balance is a bit skewed. All it comes down to are the managers and what they think. Projects are always never-ending but I have found that deadlines are very realistic and reasonable, without counting your nights and weekends. Getting some slack time once in a while is probably a sign of a healthy work environment. Everyone needs a break.

On-call really really sucks. Basically all it comes down to is having SDEs double-duty as support operations engineers. Note that on-call does not improve the code quality of any team in any way. The on-call experience is particularly bad because you are using services from some other team, and their code is of low quality and fails for the wrong reasons. If the managers had given more time to up the quality, there would not be so many problems. Software is usually delivered with a tough deadline with code that meets the minimum quality bar and never gets improved for the next few years. The code review process does not seem to help improve the code but it really obstructs developers from making great changes as unconventional things will not pass code review in clumsy minds. Innovation and excellence are not the name of the game in Amazon. Searching through the Amazon code base is usually not going to turn up quality code that you can actually reuse.

Integration is the name of the game in Amazon. You will need to spend a lot of time to figure out how to integrate your code with another team's services. Whether these other people are cooperative is a hit-or-miss. I have found that most people are responsive and helpful, but there are also quite a number of jerks who are out to make trouble for everybody. It is not easy to work across teams but the experience is mostly positive.

Amazon is a huge behemoth and is hiring people like there is no tomorrow. This reflects well on a good growth momentum but also is worrying that the company is not turning much profit. If the company does not make money, where is our bonus going to come from? You can see new faces around the Amazon building almost everyday! Downside is that we are taking in a lot of average to above-average engineers and being an Amazonian SDE certainly does not share the same reputation as the top names. Amazon is a huge mixed bag of some very talented people and some very dumb people. I think the world is not turning up enough SDEs and the only way is for quality to go downhill.

As an SDE, expect to spend most of your time talking, writing emails and documents, and maybe around 20-30% of your time coding. In most of the teams, you can work on interesting projects, but probably not revolutionary ones. Note that Amazon is a very down-to-earth company and the work is very down-to-earth as well. You will work on real things that people have actually requested for, and that people will start using as soon as you are done. Work is challenging but not to expect highly technically complex stuff. Most of the work has to do with solving everyday problems. To me, this seems to make sense because I have ever tried working on experimental projects before elsewhere and I did not feel it was a good use of my time.

Internal mobility is a key strength of Amazon, and I am not sure which company has done better than Amazon in this aspect. Internal moves are easy. You only need to stay in your team for a year before moving to a different team. There is no easy way to tell which team is a good team to move to because they all have their different pros and cons and people and coming and leaving all the time!

Seattle is by much rumour an easier place to live than the Bay area.

Overall Amazon is a tough but yet sane place to work. The flexibility of this company is really its core strength. You have the freedom to excel as much as you want and also to slack as much as you want. Bummer. You shouldn't be slacking!","Beware of bad managers and horrible team mates. They are not specific to Amazon but they do exist in Amazon.

I have to admit that Monday is usually a blue day at Amazon and it is very tough to look forward to getting into office. I don't know anyone in Amazon who looks forward to getting in on Mondays.

Be realistic about SDE requirements. Coding skills are good to have but they are not the most important part of your job. I think we are hearing the same thing from every company.

Medical coverage is average or below average. Expect to pay about $60 per month for singles and about $240 per month for families. $240 per month for families gives you $3000 in medical fees before you have to pay (more) anything out-of-pocket.

SDE advancement is unreal difficult. They have about 6 levels total, SDE 1-4, then Senior Principal Engineer, and finally Distinguished Engineer. The number of SDE 1s and 2s are huge. Trying to get to SDE 3 seems to be all-of-a-sudden extremely difficult, but not impossible. So this essentially means that if you come to Amazon as a fresh grad SDE, expect to get about only one or two promotions in your entire career, which obviously is quite a lame expectation and reality. You will probably do much better in your career advancement anywhere else.

Employee retention is horrible. I am not sure why the philosophy seems to be trying to undercut existing employees and then hire from external sources. Management all say that they are trying to retain people, but actions don't seem to suggest anything better. Rumour has it that annual pay raises are horrible. This basically mean that either you are a superstar in the company before they will try to retain you, or if you are smart you should not stay in Amazon for too long.",nil
9,"Great starting pay and the ability to get raises very quickly. Full training in all areas are offered and if your willing to work hard and sweat everyday for 10 hours a day, 4 days a week, then this is the job for you. The 4 day weeks go by quick, it can be exhausting so proper rest and a healthy lifestyle will help you stay strong within this company. Beat benefits as well once you are a hired on as a full time employee.","After 3 years of working with the company you ""cap out"" at $15.75, meaning you can no longer make any more money than that as a tier 1 associate. Your expected to want to move up in the company and that is the only way to make a better hourly wage, by advancing into management and operations management positions if there are any openings.",nil
10,"- super smart people, the best of the best from schools
- if you get hired here, you will be hirable anywhere, recruiting process is tough
- the pay is above average, probably 1.5 times elsewhere (but the expected results are 150% of elsewhere too)
- lots of opportunities to work on new, innovative projects
- cool SLU campus, lots of options for food and drinks after work","- frugality is taken to the extreme, only 2 weeks vacation, parking takes a year or more to get, zero perks (not even free Prime), no fitness allowance, poor 401k
- your peers will stab you in the back, your manager will blame you for their errors, you can't trust anyone
- people who throw others under the bus and take credit for other people's work get promoted
- expectations 60 -70 hours a week, some teams expect Sunday to be an ""in the office day"", headcount never gets filled, teams are always short a few people but the work keeps piling on.",nil
11,You honestly can't beat there pros They provide tuition after 90 Days PTO and VTO can be acquired after your first week. There dress codes is to dress comfortably. They have an easy to use A to Z app which is great. It still has issues and one is a major con from my experience.,"Cons For one you must stay working at all times and minimize bathroom trips. Best way to maintain your production and achieve the fastest time is by waiting till break and never stop stowing The biggest Con for me was during my time of employment I was dealing with depression and mental health problems due to losing one of the greatest friends/mentor, my sister who left behind a beautiful daughter. Sense this was the most traumatic thing that's could possibly happen I took a medical leave for a mental health program at Bradford. Well after completing the course I uploaded my documents to return to work. And the ERC Kept requesting more info and my doctor wouldn't allow it says that's all the information they need so after 4 months of being off the schedule I finally got erc to accept it but then my a to z app never put me back on the schedule. Which obviously has nothing to do with me but they insisted that I missed over 30 days of work and said I must either resign or get fired",nil
12,"Amazon offers some decent benefits. Continuing classes, medical, vacation time and different types of unpaid leave for life circumstances.",Bias- Harassment- Sexist- Mildly racist-,nil
13,"- Getting Amazon on your resume - You have thousands of reviews warning you NOT to take a job here, be better than me and listen to them - Pretty decent health care","- Horrible leadership - people are only promoted if they don't push back which leaves you with spineless management with no real opinions or thoughts of their own - Constant turnover (both people being fired and quitting) leads to work being dumped on those who remain. I have been here well under a year and seen over 7 people leave on an 18 person team (50/50 quitting and firing) - Peers are completely unwilling to help you - and they're proud of that. I was told by my manager to prep myself for being ""Wikislapped"" which means you ask someone for help and they respond with just a link. This might be helpful if the links weren't always outdated or filled with so much jargon and so little context that they're incomprehensible - They tell you that you have the ability to move teams however this isn't true. I have seen two instances of people being fired after expressing interest in another team. - Benefits are absolute trash. - They constantly lie to partners and force you to maintain those lies.",nil
14,"The pay is great, and every six months you get a raise. Even if they are small, it still is better than no raise at all. You can access benefits from day one, and they are VERY good benefits. The same kind of benefits you would see for military or government employees. You can also get access for funded schooling, up to $5,250 per academic year. I paid $176 for 4 classes. Amazon is a great steppingstone to further your education and career. Lastly, there is no interview process for working at Amazon. Lowkey you submit an application and get the job lol. You just have to take a drug test.","It is horrendously boring. Do not expect to have fun doing your job, but it is worth it in the end because you make great money. Be wary of cross training because once you do, they will force you to do it when they need help in that area. If you like what you were hired on for, I would stick with that. It is also very hard to get promoted from within. For some reason Amazon likes to hire managers that have never worked at Amazon and don't know how to do things they are supposed to be trained for.",nil
15,scale of business to handle and influence if you can write great tech strategy docs. good chance to grow if the charter is clear and team is tenured and if you have good PE support good pay,"your leaders play a great role in if you break or win. if they are weak, no matter how good you are you will fail. most of the leadership don't care in helping you with any challenges but you will be under the mercy of tenured SDEs in the team. SDEs can leave you overnight to other teams or give you bad feedback through connections surveys if you try to improve their performance. There is no bottom line from team unless they are awaiting a promotion, else they can just leave the team anytime you have a challenging situation.",nil
16,"- tons of smart people and knowledge to be shared with you - once you are in the flow of things, it's a relatively low stress easy to manage job most days - great internal tooling - fully remote and very clear lines in work-life balance (assuming Jassy doesn't take this away) - (maybe team/domain specific) very transparent leadership communication and operational goals - career growth has pretty tangible and transparent requirements to get to the next promotion, but only within the org and short term","- metrics are the only real way you are measured for performance despite not being always accurate representations of how much work you're doing, and this is by far my biggest gripe with this role. Ex. you could spend days on a case or resolve a case, but because the customer reopens a chat, and then you lose all credit for the time and effort you put in. - The pay is ok but obviously uncompetitive compared to other tech roles in AWS. This leads to everyone looking for other opportunities and a general loss of knowledge/skill as a team due to attrition",nil
17,"Guaranteed 40 hours per week 3 days off Wonderful benefits - medical, dental, vision, etc. Amazon pays for CDL school, free-of-charge, which costs $8,000 per student Great TEAM atmosphere, especially if you work with a super group of people! Lots of free food, clothes, swag & snacks :P","Only real con is having to do OTR - at least 3 days a week - driver fatigue :( Dangerous! There should be fair job rotation, so that everyone on the Tom Team has to obtain their CDL & drive, not just a few, whilst the others get to almost do nothing in the guard shacks.",nil
18,"The company culture prides itself on being peculiar. While in principle it does provide a good framework to innovate, the company really just cares about maximizing profits at any cost (including harm to its employees and the planet).","Amazon is an absolutely terrible company that will absolutely treat you as disposable no matter what your work ethic or contributions to the company. The benefits are the worst I've seen in the entire industry. No 401k matching for 3 years, bare minimum company holidays, disingenuous review practices. This place sucks. Full stop. If you're reading this considering whether Amazon is worth it I strongly advise you to consider working for an employer with better ethics and benefits.",nil
19,-LPs are widely used and employees stay true to them -majority are like minded people that believe in making a change,"-bureaucratic structure - terrible comp for existing/tenured employees unless you're L7+/ in Tech role Been at amazon for 3 years, started as an accountant. I found out how much my peer makes and it was 30% of my TC. They had no prior experience, just a MBA degree from a good collage. It's been 9 months and she's still 'ramping up'. I moved through amazon's 'ranks' only to be paid peanuts compared to those hired during the covid boom. My RSUs were a good contributor to my TC but now with the stock at sub $97, I'm working at a loss. I've been a HV3 (one away from Top Tier) for 2 years and comp is embarassing compared to newly hired employees while I manager 2x their responsibilities.",nil
20,1. Work on large projects 2. Flexible WFH and PTO policies 3. Decent pay 4. Great insurance,"1. Stakeholders are vampires, they suck your intelligence and use it to their own benefits, (example when they ask for directions and recommendations on a large project, and don’t involve you at all afterwards). 2. Many stakeholders think they know it all and can do anyone’s work (with questionable quality). Think about PM/TPMs doing work of data scientists/BIE or engineers doing creative work. This not only erodes trust, but creates terrible experiences for the customer. 3. Data is messy. Managers don’t know their numbers, and don’t verify them. 4. Managers creates their own data points to their own advantage, nothing else (request headcounts, make sure their goals are green). 5. Depending on the org you are there are no having formal processes, lots of agreements then ghosting, which means leaders changed their mind. 6. Not fast paced as others would think. 7. Terrible resource management and old school tooling without QA processes. 8. If you want promotion, you have to be political. Results are not the main driver.",nil
