,Rating,Title,Pro,Con,Job Title,Status,Region,Date
276,5.0,Good Place to work,"Easy work load, generous breaks between shifts.","Short Shift length, not getting enough hours",FC Associate I,Current Employee,"Concord, NC","Sep 26, 2022"
277,5.0,Great place to work,"Competitive pay, great benefits, flexible scheduling","Very competitive work environment, sometimes difficult for growth",Team Lead,Current Employe,,"Sep 26, 2022"
278,5.0,Awesome,Amazing opportunities to advance in all departments.,a 40 hour week can feel like 60 or 80,Forklift Operator,Former Employee,"Phoenix, AZ","Sep 26, 2022"
279,3.0,The culture at the company sucks mostly,You find some good people and the work isn’t hard if you have a good trainer.,"Managers in positions they shouldn’t be in because they can’t manage, stressful environment, expect you to do other peoples work if you finished your task.",FC1 Associate,Former Employee,"Goodyear, AZ","Oct 13, 2022"
280,2.0,Bad management and atmosphere low pay,Easy to report pto use and weekly pay,"Low pay, management doesn't care about you or safety hazards, discrimination against people with disabilities, coworkers act like high schoolers, no training to prepare you. If you work hard you will be taken advantage of.",Sales Associate,Current Employee,"Fullerton, CA","Aug 11, 2022"
281,4.0,Does the job,-there’s flexible hours so you pick when to work,- management can be controlling and ask for the impossible with the least amount of time giving,FC Associate,Former Employe,,"Sep 26, 2022"
282,3.0,Declining culture,"For those that have been with the company for over 2 years, we have a lot of stock",Safety is quickly taking a back seat to metrics,Operations Manager II,Current Employee,"San Diego, CA","Sep 26, 2022"
283,5.0,Jeff Bezos rocks,Work for Jeff Bezos and creating quality software,You will hear a lot of Jeff Bezos,Software Engineer,Current Employee,"Los Angeles, CA","Oct 13, 2022"
284,3.0,"Great resume builder, Very political with promos","The pay is decent, benefits/coverage cannot be beat, experience and knowledge gained about operations, process improvements, labor planning/cost is above average.","Very fast paced, have never worked less than a 12 hour shift (sometimes 15 hour shifts) when they pay salary based on 10 hour expectation, promotions are given based on relationship with upper management and not actual performance, very high stress environment for managers and tier 1’s, managers and tier 1’s are treated as numbers and not people by site leadership",Area Manager II,Current Employee,"Charlotte, NC","Jun 22, 2022"
285,3.0,Honest review of 12 week data engineering summer internship,"1. Good quality and amount of work - you won't feel played or cheated in terms of the quality of work that is assigned to you. 
2. You get a lot of support and help from all the team members.
3. Opportunity to work on latest tools and technologies.","1. A lot of work and unrealistic deadline expectations.
2. I didn't get mentor assigned officially so had to bother a lot of people everytime I got stuck with an issue.",Data Engineer Intern,Current Employee,,"Aug 1, 2022"
286,3.0,"So many possibilities, but....","So many options to evolve in your career, from cars to space to retail to healthcare, and more.",Leadership is non-existent. Dog-eat-dog. Everyone is out for themselves and do not value what others bring to the table.,Marketing Leader,Current Employee,"Seattle, WA","Sep 27, 2022"
287,5.0,Earth's Best Employer,"Working for Amazon Web Services has been the best employment experience in my 25+ years of career. The team members care for each other and help each other, the processes are in place for you to innovate and learn constantly, company enables career progression by providing a defined path, provides for work life balance and rewards employees as the industry's best.",No negative experience so far.,Anonymous Employee,Current Employee,,"Aug 24, 2022"
288,5.0,Equally intense and awesome,"There are infinite resources provided on how to operate in Amazon's ""peculiar ways."" The capacity for innovation is endless, and they truly count on their employees to envision and execute. I, as a creative person, appreciate the structure and strategy guidelines. Everybody is extremely smart and open to exploring outside-the-box solutions to complex problems.","So far so good, I'm still getting the hang of it.",Content Manager,Current Employee,"Los Angeles, CA","Aug 24, 2022"
289,5.0,Great place to learn and grow!,Surrounded by talented people to learn and grow career.,Work life balance isn’t for everyone.,Business Analyst,Current Employee,,"Oct 16, 2022"
290,4.0,Amazon Fresh,"Flexible Schedule, Short shifts, weekly pay",It was difficult getting shifts as they opened weekly.,Seasonal Associate,Current Employee,"West Sacramento, CA","Sep 28, 2022"
291,5.0,Great company,"Great benefits 
work from home","can be very ambiguous
Lots of calls 
not in person",ACES Manager,Current Employe,,"Sep 28, 2022"
292,5.0,Good beginer job,Great for people with no experience,Pay is not the best long hours,Delivery Driver,Former Employe,,"Sep 28, 2022"
293,4.0,I dont regret it,"They have PTO, they have health benefits at around 30 hours a week, their pay is above minimum wage, I usually dont have a manager micromanaging me, almost everyone I have worked with is really nice and helpful, they are understanding of disabilities to an extent and have good leave policies. I also like how they give raises now with time.","They expect you to go way too fast, it takes a month to actually get hired, they do not have the best training and do not always update you to new rules, etc.",In Store Shopper,Current Employee,"Hillsboro, OR","Jun 11, 2022"
294,3.0,A huge variation of talent across the company,- Good focus on LPs and overall development,- Overhired incompetent management - Comp is not among the highest,Software Engineer II SDE2,Current Employee,"Nashville, TN","Nov 18, 2022"
295,4.0,Work at Amazon,"Flexible schedule, Nice co-workers, at work evens",Extended shifts randomly and short breaks,Warehouse Associate,Current Employe,,"Sep 29, 2022"
296,4.0,nice part time,can choose your own time to work,nothing its just a temp job,Asscoiate,Current Employe,"Los Angeles, CA","Sep 30, 2022"
297,3.0,Process Assistant Review,Benefits were amazing. Good pay as well.,Lack of Communication. Upward mobility is limited.,Process Assistant,Former Employee,"Chicago, IL","Nov 17, 2022"
298,5.0,Abundance of opportunities,"Pay, benefits, advancement opportunities, management.",There are a lot of things that are ambiguous. It can take some time to get used to working where there are not always right and wrong decisions to make.,Transportation Area Manager,Current Employee,,"Aug 13, 2022"
299,5.0,Best place,"Nice hours
Good coffee
Good boss
Air
Good co-worker","Commute
Gas
Food
Too many meetings 
Not many days off",Anonymous Employee,Current Employe,,"Sep 30, 2022"
300,4.0,Easy laid back job,Lots of oVertime and extra shifts,Work shoes are very uncomfortable,Warehouse Worker,Former Employe,,"Sep 30, 2022"
301,4.0,"Simple job, but hard work.","The job itself is very easy, though can be physical depending on what you're doing. You may be lifting packages that are up to 50 lbs... and they can be awkward to carry as well, though you can slide them on the floor or ask for a ""team lift"" if you need help. There are different sections of the warehouse that have you do different things so you aren't always doing the same thing ideally. You might be scanning and palletizing, or you might be unloading a truck, or sorting packages to go to a certain lane. I liked using pallet jacks to move pallets around because it takes very little effort compared to lifting boxes and moving them.","You definitely feel like a number. They keep track of you by scanning your badge which feels very impersonal, though most managers/supervisors do learn your name or get to know you a bit. Upwards mobility offers very few perks and is limited.",Warehouse Associate I,Current Employee,"Brooklyn Park, MN","Feb 16, 2022"
302,3.0,Chill but management problems,Very friendly and supportive teamates,Poor management and fleet's vehicle condition,Delivery Associate,Former Employe,"Riverside, CA","Nov 26, 2022"
303,2.0,Working In Operations,None that I can think of,"Lack of training or no training at all
Very low pay for the amount and time and work needed to be successful 
No help (everyone is only there to help themselves) 
Upper leadership never come on the floor
There is no team work at all",Area Manager,Current Employee,,"Oct 1, 2022"
304,4.0,Easy work flow,"Job is simple and easy, and doesn't require any intensive work if you can shoulder more than 75 pounds.",The pay could be a little higher. Work would be more serviceable if it started a bit earlier.,Delivery Helper,Current Employee,,"Sep 2, 2022"
305,4.0,Overall great culture!,"Learning opportunities
Leadership Principles are really the guiding lights
Flexibility to switch different roles or departments
Appreciation for your work","Work Life Balance - results speaks for you, so have to work some extra hours to maintain or exceed expectations",Senior PM,Current Employee,"Austin, TX","Sep 2, 2022"
306,5.0,Hard but fulfilling work,"There is always something new to learn
Very Flexible work hours
Free paid collage after one year as full time","Standing for 10 hours a day
You must reach certain benchmarks",FC Associate Tier I,Current Employee,"Elizabeth, NJ","Sep 11, 2022"
307,5.0,Extremely Satisfied!,"Tons of opportunity for growth and success, incredibly smart people to surround yourself with, tons of autonomy to make decisions, work-life balance has a bad rep at Amazon, but it has been excellent in my experience!","Pay could be a little better, but there are way more opportunities to grow/develop/advance at Amazon than just about anywhere else. Peak season can be very stressful, so it is important to carve out time for breaks and time off.",Recruiter I,Current Employee,"Seattle, WA","May 5, 2022"
308,2.0,Late nights but simple work,- straightforward work - independent - good benefits,"- late nights can cause mental and physical health problems - lots of manual labor, prone to injury",Warehouse Associate,Former Employee,"American Canyon, CA","Nov 15, 2022"
309,2.0,Overworked underpaid,Lots of opportunities for experience,No training. Pay was terrible always understaffed. Expected to do the job at the next level for months before even being eligible for promo,Area Manager,Former Employe,,"Nov 16, 2022"
310,5.0,Good,Good people to work around,Shift was not well for me,Warehouse Associate,Former Employe,,"Oct 2, 2022"
311,4.0,Good company to work for personal career growth,"- Challenging but exciting work environment 
- Opportunities to develop your own skills and move up
- Helpful and welcoming team members to work with
- Great benefits",- Large organization which can be confusing to navigate and communicate. With so many teams and people owning different things it can occasionally be hard to be the answer you need.,Design Assistant,Current Employee,,"Aug 3, 2022"
312,5.0,Great Company,the pay was good and seemed pretty fair for each level,"not too many cons, just regular work complaints type stuff",Anonymous Employee,Former Employe,,"Sep 20, 2022"
313,2.0,PA,"Benefits, Fast Pace, Quick Advancement","Low pay for Floor Lead, expectations are always increasing, low advancement opportunities into L4",Process Assistant,Current Employee,"Beaumont, CA","Nov 25, 2022"
314,2.0,Stay Away,3 days off 4 days on,Nobody seems to enjoy their job just working for the next opportunity. Amazon does not really care about you as an individual they just want your time and as much of it as possible. I was promoted in the company and was only given a 10% increase to become a manager. Very little training with even less people in positions of tenure. Turnover is insanely high. Comp may seem nice but you work crazy hours for it and they will chew you up and spit you out. Everyone is burnt out there.,Area Manager,Former Employe,,"Jul 29, 2022"
315,4.0,They don’t pay enough,"It is a four day work week,",They do not compensate for holidays worked and the pay is to low.,Area Manager,Current Employee,"Pontiac, MI","Sep 11, 2022"
316,3.0,Great experience starting out,You learn alot and get experience in a industry you previously probably never had,"Work life / social life. I gave up my life to be working this position. The pay is not the best if you're internal. I have great experience now, but gave up too much of my life for it. Prepare to work days and night at business will",Area Manager II,Current Employe,,"Aug 27, 2022"
317,5.0,great place to wirk,great pay and time off opptions,"long 10hr days, and only 2 half hr breacks",Counter,Current Employee,,"Sep 21, 2022"
318,3.0,Consistent moving,Very simple work and does not require any brain power to do.,Consistent walking and standing as one would find in a warehouse. This biggest con for this company is the MET (mandatory extra time). If there is an influx in product shipment they can require you to work an extra shift a week to where you have to use your time off if you do not want to go.,Warehouse Associate,Current Employee,"Channahon, IL","Oct 4, 2022"
319,3.0,It was ok,"the pay was ok, the employees are ok, the give pto","too long hours, bad management",Stow,Current Employee,"Cleveland, OH","Nov 24, 2022"
320,3.0,Lot of challenges,"Complex, constantly moving, new products are constantly built.",BIE turnover is too high.  Work is repetitive and can get boring.  Due to high turn over teams are constantly under staffed resulting in low morale.  They don't follow what they preach.  Most decisions are treated like one way door and you are punished heavily if you make a mistake.,Senior BIE,Current Employe,,"Aug 21, 2022"
321,2.0,"Flex-PT Packer, it was mid","The job was simple, I was a packer and because I was part-time and flex schedule, I only had to make up a minimum of 4 hours a week which was easy. I never got trained or asked to do another function because I was rarely there so days I did work were chill and easy. I had the option of doing full shifts (8 hours, or 10 at some) or half shifts (3 hours and 30 mins, or 4 hours and 30 mins, and in some 5 hrs). I generally did about 12-20 hours every week and it came with 401k benefits, PTO, and an 8 point attendance system. They also offer premiums of 2-5 dollars on some shifts which is a good way a making lots of money but with shorter shifts.","They only offer good flexible hours during peak, outside of that season you only get hours of shifts that you typically pick, (so if you generally do nights, they’ll only start offering night shifts but if you wanted to switch to mornings, which being flex you should have the ability to do so, you won’t be able too because they do not give you the option too. It’s vice versa for days). They also try to make you vto on days you do come in even though you are already doing the least amount of hours possible, if you don’t, they illegally try to force you to do another function. You have to take care of your of your attendance for carefully because they try to give you a point for everything even if it is not a violation, and when you try to get it fixed, HR takes forever and sometimes does not even understand, or refuses to read cases. They will close your case without fixing anything, then you have to go back and open it again and basically keep doing that until they fix your issue. And they are suppose to update you if you hit 8 points which qualifies you for termination, but they do not always do that, (I was fired because I was not warned that I had 8 points, and because they did not even give me a week to deal with it, it boot me out of A to Z and making a case was the hardest thing ever). If you are there a lot, management will take advantage of you and try to harass you in the most subtle ways possible, they really try to condescend you. A MAJORITY OF HR PEOPLE DO NOT KNOW AMAZON POLICY OR STATE LABOR LAWS, and will break them consistently. Break times are really short and managers will make petty comments if you take to long to get back even though TOT is not an issue in the state of California.",AA(Amazon Associate),Former Employe,,"Sep 4, 2022"
322,5.0,"Deserves title as ""Best Place to Work""","- Amazing pool of talented people
- Ridiculous level of scale and interesting projects to work on
- Highly collaborative environment",- It's a BIG company and not the easiest to navigate,Director,Current Employee,"Seattle, WA","Sep 4, 2022"
323,4.0,Amazon warehouse,very friendly and flexible with schedule,"new warehouse at the time, not everyone was as working as efficiently as possible",Associate,Current Employe,"Wilmington, IL","Sep 22, 2022"
324,2.0,OK,"Smart people, interesting work and big projects","micromanagement, tight timelines, limited support",Senior Program Manager,Current Employe,,"Dec 1, 2022"
325,3.0,It ok,Nice break big break room,Bad manager they picky ok,Project Manager,Former Employe,"Atlanta, GA","Dec 1, 2022"
326,2.0,Fun but too much control and,"*Benefits good, easy to take time off if you have enough time, weekly pay. * Pay for Career Choice school","*Too much control on your speeds, don't care the obstacles you have when performing your jobs( get ladder to reach to the high items, missing items, barcode doesn't work...) * Feel mental harassment by one of the staffs ( J Park at UCA4 location)",FC Associate I,Current Employe,,"Oct 8, 2022"
327,4.0,Amazon,Great Benefits and a good place to get started.,Long work hours and poor pay for the workload,Process Manager,Current Employee,"Haslet, TX","Sep 13, 2022"
328,5.0,job,this place is the best place to not work,its not a good job,Amazon Customer Service At Home,Current Employe,"Toronto, OH","Sep 23, 2022"
329,1.0,good,it was ok and easy,overworked for the pay received,Warehouse Worker,Current Employee,"Reading, PA","Dec 28, 2022"
330,5.0,Enjoyed Working There,"The pay was better than what I was used to.
Great benefits along with PTO, and Paid Vacation.
4 day work week unless you wanted OT.",10 hour work day on your feet for most of it.,Warehouse Associate,Former Employe,,"Aug 22, 2022"
331,3.0,Amazon,Pay is good compared to other,Lots of work compared to other,Software Engineer,Current Employe,"Seattle, WA","Nov 30, 2022"
332,4.0,A good place for engineers,"Plenty of technical trainings and documents.
Big dimension of business.
Nice managers.",Spend much time on work.,Software Engineer,Current Employee,,"Sep 24, 2022"
333,4.0,Great,"Great hours, app lets you pick up and drop shifts, a lot of VTO.",Long shift with hard wirk,Anonymous Employee,Former Employee,"Detroit, MI","Sep 24, 2022"
334,4.0,Great job to accelerate career,Good pay and networking. Accelerated career,Depending on team the culture can be challenging and highly competitive,Recruiter,Former Employe,,"Sep 14, 2022"
335,3.0,Good,Can work independently Learn new skills Share thoughts /ideas with highly skilled ppl,Comparatively lower Salary Layoff Less guidance for career growth,Forecasting Business Analyst,Current Employee,,"Nov 21, 2022"
336,5.0,Worth the risk,"Flexibility in hours worked
Remote ability
Sense of belonging 
Innovative culture
Growth",Have not ran into many CONs yet of making the jump to Amazon AWS from my former employer,Senior Business Development Manager,Current Employee,"Chicago, IL","Sep 6, 2022"
337,5.0,Amazon,"Rewarding to lead managers and teams each day in our efforts to process/ship packages, ensuring customers have a positive experience.",Can be a challenge for some leaders to adjust to pace and operational expectations.,Operations Manager,Current Employe,,"Sep 6, 2022"
338,1.0,Blah,The benefits are great I guess,Basically just about everything that happens in the warehouse,Trainer,Former Employee,,"Dec 16, 2022"
339,1.0,You are disposable,"Benefits, interesting work, good pay",Treats their managers terribly despite years of service,Area Manager,Former Employee,,"Dec 20, 2022"
340,5.0,Innvovative Work Place,In short: I feel this is the best place to work and grow as a leader.,It is a long on-boarding and learning curve: to undergo various trainings and documents to be an amazonian can be overwhelming initially.,Principal TPM,Current Employee,,"Aug 30, 2022"
341,5.0,Great Company,Great customer service focused business.,Very competitive upward movement. There are not very many cons.,Hub Locker+ Shift Lead,Current Employe,,"Sep 26, 2022"
342,5.0,Pretty Good Experience,"-Friendly environment
-Good exercise
-Recognition for excellent work","-Shifts can be long
-Strict policies on earbuds/phone usage",Anonymous Employee,Current Employee,,"Sep 26, 2022"
343,4.0,LAM,Lots of opportunities & benefits are amazing.,Work odd hours - not your normal 9 to 5,Learning Area Manager,Current Employe,"Austin, TX","Sep 26, 2022"
344,5.0,Challenging and Beyond Rewarding,The ability to work in a quick and agile development structure with actual leadership backup. Came from a company prior that left me consistently wondering when leadership would negatively impact my job. That hasn't happened at AWS and I've only ever been encouraged.,"If you let yourself, you do run short on time and can feel overwhelmed.",Systems Development Engineer,Current Employee,,"Jul 13, 2022"
345,5.0,Great,too many to count. All around great,"none, literally cannot think of a single one",Workers Compensation,Former Employe,,"Sep 27, 2022"
346,5.0,Great job,Friendly managers they work with their employees,Always hiring new workers dont last long,Warehouse Associate,Former Employe,,"Sep 27, 2022"
347,4.0,"Great compensation, benefits, and ambitious goals.",The company is very competitive with compensation and pays it's people very well. The benefits are on par with any of the major tech giants you might encounter. The company was also going places during my time there. It was very exciting to be on the forefront of some big changes in the industry.,Amazon is now a giant company and has grown almost 8x from the time that I started with them. I found myself not being able to continue to have the impact I had in previous years. Not being able to see the value I was contributing and dealing with the challenges of a huge bureaucracy eventually had me looking for other options.,Data Center Operations Manager,Former Employee,"Hermiston, OR","Feb 26, 2022"
348,2.0,Overworked,Clocking in and out on your mobile device.,Too many to name in my opinion.,Material Handler,Former Employee,,"Nov 28, 2022"
349,5.0,Amazing Amazon,No company is pushing the frontiers of business more than Amazon. A culture of doers making the future a reality in the digital and physical world.,Such a large company tends to be more siloed than you think.,Sales Manager,Current Employe,,"Aug 31, 2022"
350,3.0,Good place to work,Set hours and pay. Break room has plenty of food and beverage options to choose from. Everyone is very friendly and helpful.,Very strenuous work. If you can’t lift heavy items above your head this isn’t the place for you.,Order Selector,Former Employee,"Lakeland, FL","Oct 18, 2022"
351,5.0,Good so far,"so far, good experience, team is great.",nothing comes to mind here.,Network Scaling Technician I,Current Employe,,"Sep 28, 2022"
352,5.0,CSA,"Good work environment
Good manager
Great team
Learning 
Clear promotion pathway","Can't 
think 
of 
anything
at this time",Cloud Support Associate,Current Employe,,"Sep 28, 2022"
353,5.0,Amazon SDE salary,"Amazing tech stack, growth, team work","No work life balance, hectic work",Software Development Engineer (SDE),Current Employe,,"Sep 28, 2022"
354,4.0,good,it's pretty good. need this review for 12 mor emontsh,12 months e enoths sqwasd,Software Engineer,Current Employee,,"Sep 28, 2022"
355,5.0,Great place to work for,benefits are great since day one if you are a regular full time,time off is terrible can have any emergencies cause hr will try to fire you,Staffing Coordinator,Current Employe,,"Sep 8, 2022"
356,2.0,management was not engaged with employees,great compensation packages. clean work environment.,no employee recognition. Numbers are all they focus on.,Associate,Former Employe,,"Nov 18, 2022"
357,4.0,"Great benefits ,but  too strict in this department","It’s a very basic job , don’t deal with customers , very good if you like working alone , get your personal space","They time you on EVERYTHING you do while you’re clocked in , they give unfair write-ups and don’t help get them corrected , they expect you to work very fast WHOLE shift",Anonymous Employee,Current Employee,"Houston, TX","Jun 15, 2022"
358,5.0,"Wow- ""Amazon "" A great place to be","Wide range of Technologies to work with.
Always customer Centric.
Most Employee oriented with plenty of benefits
Tools and Technologies
Welcoming team environment",Fully remote losing the opportunity to meet people face to face.,Senior Cloud Infrastructure Architect,Current Employee,,"Aug 25, 2022"
359,5.0,AWSome place to work,"+Great group of individuals to work with
+Compensation
+You get to learn a lot
+Remote/Flexible schedule
+Leadership principles","-None so far as, Pros weight more than cons",Technical Program Manager II,Current Employee,"Austin, TX","Sep 1, 2022"
360,5.0,"Bad reputation, but all depends on the site","-great for college hires
-meet lots of people
- Eswag(free stuff)
- Growth opportunities 
-good pay for college hires","-probably have to work night shift
-if you have bad leaders you’ll have a bad experience",HR Partner,Current Employee,,"Sep 1, 2022"
361,5.0,Great Benefits,If you are not flex and work at least 30 hours a week Amazon has great benefits.,The freezer and the freezer gear. There must be a better way to do it.,Associate,Current Employee,"Portland, OR","Sep 1, 2022"
