Rating,Title,Review Description,Pro,Con,Job Title,Status,Region,Date
4.0,Evil Boss decides everything,The overall culture is good. Unfortunately I had a evil boss who likes to show many patterns and made you uncomfortable and purposely excludes you from some of the jobs.,Big organisation,Evil boss,AVP,Former Employee,CBD,"February 15, 2022"
5.0,Great Place to work,"The management is good and doing a good work
work life balance is also good
good work culture,
work time is very rigid as it is a bank and strict on working time",lot of pros,no cons,INTERNSHIP DETAILS,Former Employee,"Bangalore, Karnataka","March 11, 2017"
5.0,Productive,Very fun to work here . Management was very caring . Job scope is to promote new schemes . Really happy to work here . Was good all the way . Great life - work balance,Free snacks,Politics,Promoter,Former Employee,Chinatown,"March 9, 2017"
5.0,interesting and fun working environment,"a typical day at work is where i would have to follow the schedule given by my supervisor. At DBS Bank is where i first learn the working life. i learn that i need to learn when to say no, learn to manage my time to be considered effective and efficient in doing my work to meet the quota of task to be done in a day / per hour. Everyone was friendly, helpful and understanding. The hardest part of the job is when there is nothing for me to do. The most enjoyable part of the job is everything. From the start to the end of this job was exciting and enjoyable.",,,Intern,Former Employee,DBS Asia Gateway @ Jurong Gateway,"March 7, 2017"
4.0,Dealing with shipping documents,"Was under export bills section
Checking of shipping documents and fiancing them
Calling companies to inform of their payments

My first job and resigned to take care my kids",,,Customer Service Officer,Former Employee,Jurong,"March 6, 2017"
4.0,Good Working Environment,"- People are very helpful and supportive
- Variety of Trust to enrich your knowledge
- As the case would not be the same so need to learn from experience",,,Manager,Former Employee,"Central, Hong Kong Island","March 5, 2017"
5.0,Memorable Sales Role,"The amount of time spent at work with colleagues are long. They are a large part of my everyday life at work.

The relationship between us are amicable. We learnt and worked well together. The toughest part of the role was to manage expectations.",,,Relationship Manager,Former Employee,Central Singapore,"March 1, 2017"
4.0,Excitiing place to work for,"Though I only spent 4 odd months in this bank, it is heartening to see how the bank treates it's customers and is somthing that other customer facing organisations can learn from.

IT ifrastructure is good and processes are getting better each day.",,,Custome Service Head,Former Employee,Delhi,"February 28, 2017"
5.0,Excellent place to work,"DBS being my first workplace is very close to my heart. I have learnt to interact with customers on day to day basis, serve the customers by meeting their basic banking requirements and Managed in-person, over-the-phone & email inquiries in a timely manner to ensure client satisfaction.
I have learned team work,handling pressure as well as time management. DBS is a great place to work and I could maintain a balance between both professional and personal life.
The most enjoyable part was meeting new people each day and building long lasting relationships with the clients. However, I did not enjoy the sales profile and hence quitted my job at DBS. But yes DBS has taught me a lot about the corporate world and I am willing to take any challenge henceforth for my personal and professional development.",,,Associate Treasures Relationship Manager,Former Employee,"Connaught Place, Delhi","February 26, 2017"
3.0,Workplace,"Able to secure knowledge needed , basically on your own in this job.
Needs self discipline in this job to sustain yourself.",,,Relationship Manager,Current Employee,Town,"February 25, 2017"
3.0,got nice exposure on all banking systems,its good to be part of DBS. learnt a lot here where compared to my previous company. got exposure on many other systems and how they work.,,,Lead Engineer,Current Employee,changi business park,"February 25, 2017"
5.0,People at DBS are very nice,"People at DBS are very nice. Workplace is quite dynamic. The line manager is approachable. Colleagues are helpful. Overall, DBS is a great company.",,,Assistant Manager,Former Employee,"Central, Hong Kong Island","February 21, 2017"
4.0,Fun and enjoyable,"Fun and enjoyable place to work in. Dbs has a great worklife balance.
Management emphasise on grooming talent from within and encourage internal mobility.",,,Customer Service Manager,Current Employee,Toh Guan,"February 20, 2017"
5.0,kind people,"colleagues and boss treat you well.
The working environment is full of peace.",,,Intern(Full-time),Former Employee,Singapore,"February 20, 2017"
4.0,productive and funworkplace with trainings,"day starts with greeting customers on their birthday, solving querries, giving brief knowledge about products for investments, work culture gives us a boom,pros are learning curve is not stagnant,",,,Customer Service Executive,Former Employee,india,"February 18, 2017"
4.0,good work enviroment,"i enjoyed my working life in this company.
there were good staff benefits.
good salary
good team bonding
understanding team leaders",,,Bank Executive,Former Employee,Toh Guan,"February 13, 2017"
4.0,Good Place,"Good Project with work as a fresher. Learned the basic of supply chain and ITIL Process, workplace culture was good and hardest part of job was monitoring.",,,Software Engineer,Former Employee,"Bangalore, Karnataka","February 3, 2017"
4.0,Good Company to learn,"DBS has a structured way of helping employee progress.

The workload can be heavy sometimes and with proper time management, completing projects on time is achievable.",,,VP,Former Employee,MBFC,"January 24, 2017"
4.0,Good Benefits,"Its a job that requires commitment as handling of cash is part of the job and day end balancing is required. So if there are any shortage or excess, those involved in the cash operation for the day has to stay and make sure that there is no mistake occurred.",,,Senior Service Executive,Former Employee,Singapore,"January 22, 2017"
3.0,work life balance,Learned to manage time well as multi-task is a necessity. Great co-workers to chill with after work. Good remuneration package and benefits. Well structured organisation.,,,Relationship Manager,Former Employee,Singapore,"January 17, 2017"
4.0,Productive and good career advancement,"Day start with engagement walk in or appointment customer. Engagement involve servicing or financial planning discussion.

Experience gain:
Various investments insights
Consultative sales skill
Relationship management

Co-workers are generally supportive and demonstrate good team spirit.

Challenges face involves customer's demand and odd working hours at times.

Being able to deliver solutions to client's financial needs to be able to deepen understanding of various investment instruments forms the most enjoyable part of the job.",,,Senior Relationship Manager,Former Employee,Singapore,"January 13, 2017"
4.0,Evil Boss decides everything,The overall culture is good. Unfortunately I had a evil boss who likes to show many patterns and made you uncomfortable and purposely excludes you from some of the jobs.,Big organisation,Evil boss,AVP,Former Employee,CBD,"February 15, 2022"
3.0,good,Working in DBS is equally good. The benefits are good too. yes definitely colleagues are very nice people to interact with.,occasionally lunch treats,long hours at times,Bank Executive,Current Employee,Marina Bay,"January 11, 2017"
2.0,Everyday is a sales pressure cooker,"Keep tagging customers and cold calling to secure sales
Learn how to calm angry customers doing banking
Mostly you are left on your own
Co-workers are so busy and have no time for you
To do product pushing and work almost 7 days a week
To be able to secure a sales without product pushing and build long term relationship with customer through excellent servicing",Meet and build relationship with many customers,Product pushing and long working hours. No work life balance at all,Bancasssurance Specialist,Former Employee,Newton,"January 8, 2017"
3.0,salary high,"Provided one-stop financial advisory at the bank branches to customers through cross-selling insurance products, and achieved monthly target of 90000 APE.
Worked closely with team to address customers' financial needs.
Was actively involved in bank-wide campaigns and branch initiatives",,,Sales Associate,Former Employee,Singapore,"December 31, 2016"
5.0,Awesome,A Challenging career as a System/Network Administrator with the prestigious company where there are opportunities for leadership and growth. Quest to work in real professional atmosphere that enable to cope up with emerging as well as latest technology and scope for widening the spectrum of my knowledge.,,,Senior System Engineer,Current Employee,hyderabad,"December 30, 2016"
5.0,Business analyst/test analyst Finacle,"Business analyst/Test analyst Finacle
Learned many new things
Good management
Good and helpful co-workers
challenging jobs for everyday new requirement, many things to learn with new scope
office party and tour very enjoyable",,,Business Analyst,Current Employee,Singapore,"December 27, 2016"
5.0,Amazing Office Interior,"Overall working culture was satisfying but I wasn't seeing myself growing and productive in the organisation due to some reasons.
No fixed working hours was a disadvantage.",,,Sales Executive,Former Employee,"Connaught Place, Delhi","December 17, 2016"
5.0,Cool place with lots of things to learn,"Agile model of development
Lots of things to learn like mobile, web automation
Very supportive and understanding management
Fun coworkers
Flexible work atmosphere",,,Test Engineer,Current Employee,Singapore,"December 15, 2016"
5.0,Business analyst,"Learned meny new things and want to experss my knowledge and experience ,good work culture, team working,good management and business policy",,,Business Analyst,Current Employee,Singapore,"December 11, 2016"
4.0,Define direction by top management,"Daily work comes from a system called OSCA, each person would be assigned a number of cases from there depending on its complexity. On top of that, each person would also need to complete a number of reports assigned for the month. Also, adhoc emails & hardcopy forms would be assigned out to everyone in the team.",,,Senior Officer,Current Employee,Changi,"December 4, 2016"
4.0,workplace that provides great opportunities and work life balance,"Part of the team to grow the equity financing accounts and loan book. Always managing the demands of each customers and maintaining balance with the bank's policies.

I enjoy working the this great team at DBS.",,,Equity Financing Specialist,Former Employee,Singapore,"December 2, 2016"
4.0,great place to gear up,"co-workers are great, can make friends with colleagues.
you will also face many challenges so you can train and gear up yourself to me all-rounded staff,
good benefit.",,,Assistant Manager,Former Employee,"HONG KONG, HK","December 1, 2016"
4.0,Good working environment,"I have learnt a lot from working in DBS Bank.. From recruiting staffs, training, managing teams, powerpoint presentation to meeting daily, monthly and yearly targets and KPI.",,,Unit Manager,Former Employee,Changi Business Park,"November 30, 2016"
5.0,A great Organisation,"DBS is an organisation that put efforts in developing its main asset -employee. Training and support is always readily available to help employee achieves goal and target.

DBS is also a family-centric organisation. Work-life balance is encouraged.",,,"VP, Investment Counsellor",Former Employee,MBFC,"November 22, 2016"
2.0,Culture is very aggressive,"The people there are very aggressive and rude. They don't like share knowledge and information to new employees. You will have a lot of work to finish everyday, and they expect you to work overtime until 9 to finish.",,,Junior Analyst - Credit Control Unit,Former Employee,shanghai China,"November 22, 2016"
5.0,Environment,Overall DBS bank culture is friendly and eco-friendly. Colleagues are friendly and helpful. The location is convenient and easily located by bus or car.,,,Executive,Former Employee,Changi business park,"November 9, 2016"
4.0,management,Working at DBS gave me more perspective about what working in a bank is like. DBS provided good staff benefits as well and a nice salary package. however working hours was tiring as it was shift work and takes a lot of energy to keep adjusting to erratic working hours.,,,Senior Officer,Current Employee,Jurong East,"November 7, 2016"
4.0,Yet to work on a TTC assignment,Yet to work on a TTC assignment but the company is in good hands. Tosca is a very smart tool that has been adopted by TTC and is the future of testing. Its ease of use stands out amongst other tools in the market.,,,"UAT manager, Test Automation Lead",Current Employee,Changi,"October 31, 2016"
4.0,Stability and Digital Progress,DBS Bank has proven that the stability of any company can be achieved with the use of digital advancements in the service provided and offered by the bank. This allows the employee to look into the future and gear towards a modern age of business. I have learned a lot of skills from the bank with the various training courses that are provided to employees.,,,Social Media Relations Manager,Former Employee,Singapore,"October 29, 2016"
5.0,Productive and pleasant environment to work in,"Typical day at work includes investigation of erroneous cheques and track cheques for suspected money laundering activities.

I have learnt to analyze the cheque and draw conclusions for the reason behind bounced cheque.",,,"Intern, Technology and Operations",Former Employee,Singapore,"October 28, 2016"
5.0,Productive,"Am full satisfaction working on this company.
Because am enjoying my job.
Colorful Memories for Team outing.
Definitly i am so happy.
Interest is the more important of this carrier, i feel that...",,,Admin Screen and Batch Channel,Former Employee,"Coimbatore, Tamil Nadu","October 17, 2016"
4.0,Evil Boss decides everything,The overall culture is good. Unfortunately I had a evil boss who likes to show many patterns and made you uncomfortable and purposely excludes you from some of the jobs.,Big organisation,Evil boss,AVP,Former Employee,CBD,"February 15, 2022"
4.0,very good place to work at,"Is really good culture in DBS where you will not feel isolated while working in DBS.
Very compliance bank that protect all the sales staff while we are hunting for sales.
Reward sales person with good incentive and is a very good place to learn all the necessary soft skill as a sales person.",,,"Senior Relationship Manager , associate",Current Employee,Seletar,"October 10, 2016"
4.0,Productive and Fun workplace,"Its a great place to learn new things and enjoy working everyday. Management bestows ownership on all DBS employees. Ideas are considered and everyone's perspective is valuable.

Incredibly smart and friendly people.",,,Banking Executive,Former Employee,"Pune, Maharashtra","October 6, 2016"
4.0,Great Environment to work,Great place to work and to enhance the skill set of the employee. there are trainings is everywhere and work life balance is part if the company's culture.,,,Senior IT Infrastructure Lead and DEVOPS Engineer,Current Employee,Changi,"October 3, 2016"
5.0,Productive and good learning place for Team skills,"*A workplace with good routine and new learning that helps to Improve Communication skills .
* Learn the process of Client Acquisition.
*Event Participation.
*Coordinating with the Team.
*Toughest part of the job is to achieve the monthly targets in Client Acquisition.
*Enjoyable part of the job is the work life balance that we gain in the organisation.",,,Management Trainee/executive,Former Employee,"Chennai, Tamil Nadu","September 27, 2016"
5.0,Productive and fun environment,"I have learned a lot during my time in Group Audit, DBS. Not only my professional skills have sharply improved, but also my personal skills, such as team-working, communication, have a vigorous growth.",,,"Intern, data analyst",Former Employee,Singapore,"September 26, 2016"
4.0,Fast-paced and challenging,It is a face-paced and challenging job but there is always one colleague seated next to you that can help you. All the staff there are nice and supportive.,,,Customer Service Officer,Current Employee,Changi City Point,"September 26, 2016"
4.0,Excellent Company,Its a very laid back environment. They're ever flexible with my schedule. I am only temping here so looking for another job they have been very accommodating.,,,Receptionist,Current Employee,Los Angeles,"September 19, 2016"
5.0,Rewarding and challenging,"I enjoyed my time working in DBS as it rewarded me handsomely based on the effort i put in. It is a good start in my working life and personal life where i picked up essential life skills about how to manage my finances and how to plan out my life financially. It also satisfies me when what i have learnt can help others in so many ways (e.g for educational planning, retirement planning, legacy planning)

The hardest part of the job is to get the customer to understand and see the need to save/invest. More often than not, there is always a huge inertia towards saving as people are only accustomed to spending. But what is the hardest part of this job is also the most enjoyable part as through this dilemma, we are able to help customer understand, that to be able to reach their financial goals and achieve their wants, planning early is essential. It is very satisfactory when we can provide the right solutions for customers to make their life just that much better.",,,Relationship Manager,Current Employee,Bishan New Town,"September 13, 2016"
5.0,Fun workplace with great colleagues and TOP management.,Fun workplace to work in with many great colleagues. Top Management is brilliant in bringing the company to new highs every year; with infusions of new digital platforms.,,,"Centre Manager / Business Manager, DBS Treasures",Former Employee,Marina Bay,"August 16, 2016"
3.0,Fun workplace,"I've learned and experienced a lot of people management, managing expectation from direct superior and also clients' needs.",,,BANCASSURANCE SPECIALIST,Current Employee,Singapore,"August 8, 2016"
5.0,Fun place to work and understanding how the debit team works,"Working out the initiatives of the marketing department.
The processes of the marketing department.
Management is Good
Co-workers are friendly and helpful
Keeping up with tight timelines.
Launching a new campaign.",,,Marketing Assistant,Former Employee,Marina Bay Financial Centre,"August 2, 2016"
5.0,Productive and highly motivating,"Everyone knows their role and does them well, whilst at the same time willing to lend a hand if a colleague requires it. Close-knit environment.",,,Senior Associate,Former Employee,Marina Bay,"August 2, 2016"
4.0,Balanced and healthy working environment,"A typical day at work would including updating clients on their investment portfolio and reaching out to new clients to grow the business.

I have learnt how to manage my time more effectively and picked up a lot of investment and portfolio advisory skills.

Great co-workers throughout my career at DBS Bank.

Most enjoyable part of the job is meeting new people and adding value to a client's portfolio.",,,Treasures Relationship Manager,Current Employee,MBFC,"July 23, 2016"
3.0,Frontline Job,"The bank is a fast paced job which i enjoyed at times. It is sad to leave the bank because it is definitely a stable company with lots of monetary benefits for me. However, i could not continue further due to the long working hours till late night and no work life balance at all. I start to realise that I prefer working in back end jobs than frontline and would like to pursue better on my passion for office jobs like areas in Human Resource, admin or finance. The bank has also lack of manpower that requires most staff to be recalled back on their off days because of the high turnover rate. Hence, i am interested now to find an office hours job like mon to fri and continue to excel in that kind of career in years to come.",,,Bank Service Executive - Consumer Banking Group,Former Employee,Parkway Parade Singapore,"July 13, 2016"
4.0,Engaging and Fun Organization,"The most enjoyable part of my current job is to be able to engage and work with people from different departments. Throughout my stint with the bank, I managed to sharpen my knowledge on banking operations as well as the various products offered by the bank.",,,Customer Experience,Current Employee,Marina Bay,"July 13, 2016"
3.0,Stressed enviorment,"The working culture differs from different compartment, on whole a good environment. aaaaaaaaaaaaaaaaaaaaaaaaaaaaaaaaaaaaaaaaaaaaaaaaaaaaaaaaaaaaaaaaaaaaaaaaaaaaaaaaaaaa",,,Relationship Manager,Former Employee,Central Singapore,"June 9, 2016"
5.0,Team spirit,"Our team are one of the most united team that leads us to bag multiple awards for ourselves.

We are like family,not colleagues.",,,BusinessCare Analyst,Current Employee,Jurong East,"June 8, 2016"
5.0,Great place to take challenging opportunities,"Good place to work ,
we have great career growth.
Have good work culture to work with international employees.
but no balance life",,,Business Analyst,Current Employee,Singapore,"June 6, 2016"
4.0,Productive and fast pace workplace,"Typical day...
Do up employees' schedule adjustment in the morning. I would help out with real time analysis during the peak hours of the call centre to manage the flow. Follow up with employees on call timings. From time to time, i would also take in customers' email and resolve them according to my superior's request.

I have learnt how to...
Handling internal customers
Organizing customers’ data base.
Real Time Analysis
Schedule adjustments
Admin roles
Handling external customers’ complaints

The hardest part of the job is real time analysis. I would say this is the hardest as this is the time whereby every one in the call centre is at their busiest time. I would need to track on which service sector is taking long period calls and need to review on what topic is it on by consulting them immediately. Then i would also need to report to my boss thereafter and so on.",,,Workforce Management (Internship),Former Employee,Changi,"June 4, 2016"
4.0,Professional environment,Excellent company to work with in terms of work culture and professional colleagues. Learning opportunity is enormous,,,Sr. Associate,Current Employee,Mumbai,"May 21, 2016"
4.0,Evil Boss decides everything,The overall culture is good. Unfortunately I had a evil boss who likes to show many patterns and made you uncomfortable and purposely excludes you from some of the jobs.,Big organisation,Evil boss,AVP,Former Employee,CBD,"February 15, 2022"
3.0,Typical workplace,Routine desk bound job. There is starbuck in the building and free coffee dispenser. There is culture known as 5 at 5 whereby DBS staff can leave work at 5pm on every friday.,Free coffee,Might have OT,SALES INCENTIVE ANALYST,Current Employee,Marina Bay Financial Centre Tower 3,"May 18, 2016"
4.0,Organization for High Performing Individuals,"Overall, it is a good organization to learn and grow.

But work life balance is definitely compromised due to the long working hours and challenging deadlines etc.

Great place for high perfomring individuals who can afford to run at top speed without having to worry about other aspects such as family, leisure etc",,,"Assistant Vice President, Commercial Cards",Former Employee,Marina Bay,"May 8, 2016"
4.0,Work through agent,I worked in DBS bank as contract staff from Kelly services. So I don't have all the benefits of DBS banks staffs. My payroll paid by kelly service. My work location is marina bay financial center tower 3. It's a great place to work and the view from the building is excellent. I had the really good team to support and work together. I worked there for 2 years and it's expired April 2016.,,,Web Master & Content manager,Former Employee,Marina Bay,"May 5, 2016"
5.0,Great management with handsome rewards.,Every day is a different day. I learn new things on a daily basis. This was one was the best jobs I ever had. I am thankful for the opportunity given to be groomed in every aspect as a customer service officer especially to handle customers and to understand what customer service involves. This job made me learn that I am actually emotionally resilient and is determined to find quick ways to resolve any situation. My team manager and team members make the environment vibrant and lively. Their constant encouragement and vast knowledge makes my learning process quicker. Compliments from customers make this job very enjoyable knowing that your efforts are paid off.,,,Customer Service Officer,Current Employee,Changi business park,"April 28, 2016"
3.0,Efficient and Fun Workplace,DBS is a local bank that can be considered to be the most high-tech bank whereby mostly the processes in the operations side is the most simplified way. Working in the bank has been joyful especially with the very helpful colleagues that are always open to cross-train readily.,,,Bank Executive,Current Employee,DBS Asia Hub,"April 20, 2016"
3.0,Overall Nice Place to work,"Overall Nice Place to work. You will get good co-worker here and a good learning curve, I enjoyed my tenure here. The only negative point is long working hours here.",,,Software Test Analyst,Current Employee,Changi Bussiness Park,"April 17, 2016"
4.0,Strong established local bank,"Well and strong established local bank with good controls
and managements.
Staff benefits are good and there are work life balance.",,,"Associate, Team Lead",Former Employee,Jurong,"April 8, 2016"
