Rating,Title,Review Description,Pro,Con,Job Title,Status,Region,Date
4.0,Evil Boss decides everything,The overall culture is good. Unfortunately I had a evil boss who likes to show many patterns and made you uncomfortable and purposely excludes you from some of the jobs.,Big organisation,Evil boss,AVP,Former Employee,CBD,"February 15, 2022"
5.0,Fun experience and good place to learn,"Everyone in the division was very welcoming, good place to learn because my teammates were really welcoming, gained lots of exposures and good remuneration too.",,,Intern,Former Employee,Jakarta,"March 16, 2023"
5.0,Productivity And smooth,"I am working in gold loan officer and smooth. Good working environment , I am in working in sales and operation management , focused on new customer and NPA customer and recovery",,,Sales Officer,Former Employee,Tiruchirapalli,"March 13, 2023"
4.0,Great work life balance,"Good work life balance, interesting projects to work on, friendly colleagues. Overall good experience. But not very competitive pay compared to internet companies.",,,Data Scientist,Current Employee,Singapore,"February 24, 2023"
5.0,productive,"good working enviroment, freind and nice people around that helps you get by. pay wise can be better. even though the economic not as good. alot of young",,,General Worker,Former Employee,Central Singapore,"February 11, 2023"
5.0,Great learning place,"I enjoy my time at dbs as a treasures RM. Bank
Offers a great culture to work in and lot of
Open architecture. No
Close doors and all
Top
Management is appreciable. Your concerns are resolved and freedom to work and deliver",,,Private Banker,Current Employee,Maharashtra,"January 26, 2023"
4.0,Good overall but can be better,"Worked here for about a year. Ambitious top management but middle management and ground is mostly average. Good attempts to stay ahead of the technology adoption curve. Organizational culture is open and transparent with frequent townhalls. Compensation is decent and my team has good work life balance. Company is a ""sweet spot"" for salaried employees except for the hungry and ambitious.",,,Software Engineer,Current Employee,Singapore,"January 25, 2023"
3.0,Good workplace for fresh graduates,The area is good if you are looking for advancement. However it is hard to shine when you do not know the right people. The management only promotes people who are sociable,,,Business Analyst,Former Employee,Marina Bay,"January 23, 2023"
4.0,Most are friendly and nice,Good place for an internship and most of my colleagues were open and willing to teach. They also allowed me to try performing tasks in areas i was not familiar in as a learning experience.,,,Intern,Former Employee,Singapore,"January 9, 2023"
4.0,Great pay and benefits,Work can be boring and repetitive. You might find yourself doing a lot of work if you are capable. Other people might still get paid as much even though they are not as competent.,,,Programmer,Former Employee,Dbs,"January 4, 2023"
2.0,"More like a bank, less like a tech company","Engineering culture took a turn for the worse. GANDALF is but a pipe dream now.

The emphasis is on cutting cost, instead of return on investment. Products end up being riddled with tech debt, and are of poor quality.

It is no wonder that bugs and glitches occur in DBS apps from time to time.",,,Software Engineer,Current Employee,Singapore,"December 9, 2022"
4.0,Fast paced environment,"Poor management, no system in place to teach new hires. Not understand manager, no room for mistake. However, colleagues are friendly and willing to teach.",,,Contract Staff,Current Employee,Marina Bay,"December 7, 2022"
2.0,I feel the top don't listen,Long hours no work life balance. Management i feel don't really heed feedback. Seems to just direct and expect everyone to follow. Very rigid system to follow.,,,Contractor,Former Employee,Mandai,"December 3, 2022"
3.0,Former Contractor,Nothing to fault as i came in as interim hire only. Perm staff benefits is definitely better than contractor. Enjoyed the work with supportive team. No chance for conversion though but still not bad if you were to join as a perm staff.,,,Former Contractor,Former Employee,MBFC,"November 24, 2022"
5.0,I feel PROUD as part of DBS-er during my career.,"Working in DBS is a proud decision to me. People there are energetic, professional, up to the world class standard, prompt response as always! Management there responded to changes well and with clear direction!

True that it was not a easy job when working here, thus work-life balance is not in full star. But trust me, you would treasure the time as being part of them! You would never regret!",,,"Vice President - COO office, IBG",Former Employee,Hong Kong,"November 24, 2022"
4.0,Fun workplace,"Good environment and nice colleagues. The office environment is good and quite flexible in term of working time. Happy to work here. However, you must have strong technical skills and presentation skills.",,,Business Analyst,Former Employee,Singapore,"November 2, 2022"
5.0,Productive work,"developers are valued
Work-life balance is good
Awesome ambience in office
Health insurance and i-flex benefits are the best.
Free Cab facility is available",,,Analyst,Current Employee,Hyderabad,"October 13, 2022"
3.0,Not worth the pay,Better commission paying jobs out there. Pay not worth your effort. Furthermore selling insurance is facing stiff competition from fin tech platforms which are much cheaper,,,Wealth planning manager,Former Employee,North Singapore,"September 28, 2022"
4.0,"Fun,Easy, extremely fast paced .","need to have a good attitude , dont be discouraged or demoralized easily and the job will be a breeze for you . be independent dont always rely on others and you will be fine. if u are introvert this is perfect, 0 interaction with colleagues cos u will be on the phone all day . good and bad depends on how u see it . satisfying when customer compliments or writes in to the bank to recognise your service / patience",,,Customer Service Officer,Former Employee,Changi,"September 14, 2022"
3.0,Good name for your CV and that’s it,"Stressful and fast paced. Not much career advancement. The pay is low and will only give more bonus to senior management.

Great company culture where there will be social events to take part in.

Can use company’s name as a springboard for better package at other banks.",,,officer,Former Employee,Hong Kong,"September 4, 2022"
3.0,Productive no work Life,"There is No work Life balance .very good salary and other benefits.
A lots of leave present in their policies. Cab facility is provided to all employees",,,Analyst,Current Employee,"Hyderabad, Telangana","September 1, 2022"
4.0,Evil Boss decides everything,The overall culture is good. Unfortunately I had a evil boss who likes to show many patterns and made you uncomfortable and purposely excludes you from some of the jobs.,Big organisation,Evil boss,AVP,Former Employee,CBD,"February 15, 2022"
4.0,Fun colleagues but stressful due to infra,Deal with infrastructure migration. So your work challenges arises. Competing department also creates politics for the projects with similar agenda. But team mates are generally fun..,,,Data Analyst,Former Employee,Changi,"August 29, 2022"
3.0,Good strategy but not executing well,"Nice company policy, but depend on management preference. Nice to work proactively and hard working. Work hard is better than work smart to work here.",,,Analyst,Former Employee,"Kwun Tong, Kowloon","August 17, 2022"
3.0,Fast paced,Need to handle difficult customer and routine job duties which make the job quite boring. Fast pace environment and long standing hours. Must be due diligent,,,Customer Service Officer,Former Employee,Raffles Place,"August 13, 2022"
3.0,toxic environment,"Toxic working environment, all colleagues are unfriendly, they talk behind your back. Worst working environment I have ever worked in. They have people staring at you doing work, making sure you do not exceed your toilet break timing, there are a lot of products that we need to remember, especially when they have different deals and promotions during that period of time. My first week of work was a promotion week and I almost wanted to quit. I had to smile through every call even though I feel like crying.",,,Customer Service Officer,Former Employee,International Business Park,"August 10, 2022"
4.0,Fun workplace,Its a good place to work. Increament and bonus is slim. Good benefit and facility. People are nice. Local management is average. Solid organization. Fine overall,,,Relationship Manager,Former Employee,Jakarta,"August 8, 2022"
4.0,Productive and fun workplace,"Fun workplace with nice colleagues, great place to learn about the banking industry. May be challenging at times due to meeting target and handling customers",,,Bank service Executive,Current Employee,Central Singapore,"July 31, 2022"
3.0,Stress free and fun workplace,"pros: good staff benefit
a lot of annual leave and dbs staff is good
management that listen to feedback
system are very advance

cons: low pay
slow progression",,,Trade finance Associate,Former Employee,singapore,"July 21, 2022"
4.0,Good benefits but management wise can be stressful,"It's a fun place to be at. Colleagues are great. Managers, depend on your luck. Good bonus if performance is good. Covered dependant for medical benefits.",,,Customer Service,Current Employee,Dbs Asia Hub,"July 12, 2022"
5.0,Very good,"Good environment and skillfull people around you , good amenities in the offc and trasport facilities.
Happy to work except compensation is not competitive",,,Software Engineer,Former Employee,Hyderabad,"July 8, 2022"
5.0,"Humble, neat, spirit","I think i'm the lucky one.. Because I can learn a lot of about team work, handling problem solving, and many more. I'm happy and comfortable work at dbs",,,Admin Support of Agency Services,Former Employee,Jakarta,"July 7, 2022"
4.0,Good Place to grow,"Excellent atmosphere , supportive management, not much politics , cafeteria missing, great support on IJP, relaxed work culture, no extra work load, look upon personal growth",,,Assistant Officer,Former Employee,"Pune, Maharashtra","July 1, 2022"
3.0,stressful when it comes to delivery. long hours,"stressful when it comes to delivery. long hours work. management help is less. weekends work will be in place and you cant expect to learn anything other than project. self learning ZERO bcoz you wont get time. as weekdays are tiring, you will try to rest on weekends where you can find refreshment?",,,Senior Associate,Current Employee,Changi,"June 20, 2022"
1.0,Worst job ever with toxic culture,"- Toxic and unprofessional middle management, forever criticize, whining and gossip about colleagues and team members
- Meetings always got no focus and no outcome
-Instead of focusing on work, people like to poke their nose into team members personal matters and privacy
- Poor leadership, often have different directions on dealing with projects, confusing the entire team
- Manager often say one thing but do another thing, then blame the staff for doing it",,,AVP,Former Employee,Singapore,"June 17, 2022"
5.0,REward,"Rewards and big bonuses, good teammates. have a townhall to hear senior management update. skip level. feedback to CEO, there is a check for junior management to make sure senior management direction are done.",,,Senior Customer Service Executive,Former Employee,Changi Business Park,"June 13, 2022"
1.0,Bad management and culture,"Stressful environment, management not supportive of representatives, work very long hours (even on AL/PH) no work life balance, really bad experience",,,Wealth Planning Manager,Former Employee,North Singapore,"June 11, 2022"
4.0,Good culture,People are very friendly and salaries are fairly compensated. Good CEO and management style. Many fresh graduates and a fast-paced environment to learn from each other and good seniors.,,,Intern,Former Employee,Singapore,"May 24, 2022"
5.0,Wealth planning manager,"Good starting pay
Culture depends on branch colleague and manager
Overall the company cares a lot of benefit
Will come back to DBS again if I can….
Yesp",,,Wealth planning manager,Former Employee,Singapore,"May 18, 2022"
2.0,"DBS contact centre is worst. Poor pay, no growth and pathetic employer behaviour","DBS contact centre is worst. Poor pay, no growth and pathetic employer behaviour.
They only exploit employees at the call centre.
No fun at work, no access to any extra skill development tools or activities.
Increment is equal to nothing.",,,Assistant Officer,Former Employee,"Pune, Maharashtra","May 6, 2022"
4.0,the environment good,"the environment is good, still work life balance. the people really kind, humble, want to help each others. a good place to learn many things. corporate but feels like start up",,,Business Analyst,Former Employee,Jakarta,"April 21, 2022"
3.0,Poor management,"Poor management who do not know how to tap into the value of staff. Lots of differentiation between contract and perm staff.

Toxic culture. Some colleagues are nice and some likes to boot lick",,,Business Graduate,Current Employee,Changi,"April 19, 2022"
4.0,Evil Boss decides everything,The overall culture is good. Unfortunately I had a evil boss who likes to show many patterns and made you uncomfortable and purposely excludes you from some of the jobs.,Big organisation,Evil boss,AVP,Former Employee,CBD,"February 15, 2022"
5.0,Fun workplace and good hikes based on performance.,"Overall it's very good company.
1. Employee Benefits and culture is very nice.
2. Free transport and dbs cares the employees a lot.
3. New technologies used here.",,,Analyst,Current Employee,"Hyderabad, Telangana","April 15, 2022"
1.0,better off elsewhere,"management needs to review people in leadership positions
friendly colleagues is the most enjoyable part of the job
workplace culture can be quite toxic",friends,leaders not the most competent,wpm,Former Employee,Singapore,"April 6, 2022"
5.0,Coop,"Best bank in world v good colleagues only problem is too cold aircon sometimes below 20c, should give all staff a free parka sometimes people are good with sales",,,Admin Assistant,Former Employee,Singapore,"March 30, 2022"
3.0,Management should improve,Management doesn't seem to be clear what they want and team culture is very untransparent. It is difficult to do proper data analysis work when the boss does't quite understand and doesn't show appreciation.,,,Data Analyst,Former Employee,Singapore,"March 23, 2022"
5.0,"Great company, management and culture","Great company to work at. People are generally and genuinely helpful and collaborative. Senior management is well-respected in the industry and listens to employee feedback.

Only thing is some departments are siloed, yet there are many job overlaps between teams. Also, career progression is slow, and increments are minimal.",,,AVP,Current Employee,Singapore,"March 15, 2022"
5.0,Good manager,"Worked with individuals that know their responsibilities well, managed to learn things and manager will guide us throughout the journey. Work in office for 2 days and the rest remotely.",,,HR,Former Employee,Changi,"March 14, 2022"
4.0,Good starting place to enter the banking industry,"A good starting ground to understand banking operations for fresh graduates. Met alot of helpful colleagues who will assist you should you meet any issues with your work, overall a very stable company",,,Graduate Associate,Former Employee,Singapore,"March 13, 2022"
3.0,Interactive,Good culture staffs are helpful . Able to work in teams and work towards common goal. Work life focused but most of the time things evolved quickly in the department.,,,AVP,Former Employee,Changi,"March 2, 2022"
5.0,good place to work & Perform,"good place to work & Perform
friendly environment
good facilities
excellent managers
all the fest are organized
excellent managers
pick and drop facilities are available
helpful staff",,,Front office executive,Former Employee,Hyderabad,"February 21, 2022"
4.0,"Stable environment that empowers you, opportunities to grow and learn. Patient supervisors.","Had a good experience because I worked in a small team that collaborated cross-functionally with internal and external stakeholders. Hence, I managed to receive good exposure in a short amount of time.",,,Project Manager,Current Employee,Changi,"February 11, 2022"
5.0,Good place to work,"Good place to work. People work hard. Expectations are high, however, the worklife balance seems to be ok. Salary is ok, can be competitive. Bonus seems to be optimistic.",,,Vice President,Current Employee,Singapore,"January 15, 2022"
1.0,"Biased, inhuman but well paid","DBS IBGT at CBP was a nightmare. People are ready to walk all over you at the slightest opportunity. you name the type of discrimination and this place is a breeding ground for it. Racial, language, age, gender. Meetings are full of inappropriate jokes.",,,Senior Associate,Former Employee,Changi business park,"January 14, 2022"
5.0,Great place to work,"Very good learning.
Free transport.
They have iflex benefits for gym reimbursement, health checks etc.
Good work life balance.
Good benefits.
Work is on latest technology and follow agile methodology.",,,Associate,Current Employee,"Hyderabad, Telangana","January 7, 2022"
5.0,No micromanage,"just a trainee but i like it when there is no micromanagement.
so far i am enjoying my time here and looking forward to extending to full time",,,sgunited trainee,Current Employee,dbs asia central,"December 28, 2021"
5.0,Forward-looking and employee-centric,"Very good culture, fast and open minded adoption of new technologies, learning and growth opportunities are very much encouraged. Bosses on the IT side are generally friendly and push you to constantly upskill. Overall a very good experience.",,,SRE,Current Employee,Singapore,"December 4, 2021"
4.0,Low trust environmet,"It takes a lot of work to get even single things done. Work environment is modern with great facilities. Too much of bureaucracy, politics and heavily relationship driven.",,,Executive Director,Current Employee,"Los Angeles, CA","November 5, 2021"
4.0,Hectic but productive,"Hectic but productive
Supportive managers
consistent growth
nice environment
great benifits
fun place to work
have fun activities and townhalls regularly",,,Senior Officer,Current Employee,"Hyderabad, Telangana","August 28, 2021"
4.0,Overall a good place to work in on balance,"DBS overall is a good place to work in. If you put in the effort, am sincere and work as a team you will be recognized. Just like any big organization, there are many politics. Just the nature of things.",,,Product Controller,Former Employee,Shenton Way,"August 14, 2021"
4.0,Good place to learn,Good place to learn.Provides iflex benefits which include gym reimbursement.Provides free transport.Supportive team.Follows agile methodology.Gives vouchers on various occasions like festivals etc.,,,Technical Associate,Current Employee,"Hyderabad, Telangana","July 20, 2021"
5.0,Work life balance,"Have many opportunities to explore your career
The salary is very interesting which also have bones If your performance is good
All people works as a term and helpful",,,Assistant Manager (Full Time),Former Employee,Hong Kong,"July 18, 2021"
4.0,Evil Boss decides everything,The overall culture is good. Unfortunately I had a evil boss who likes to show many patterns and made you uncomfortable and purposely excludes you from some of the jobs.,Big organisation,Evil boss,AVP,Former Employee,CBD,"February 15, 2022"
3.0,Very very stressful work life,"- No process
- Work without detailed requirements. Have to rework lot of times because of no clarity on requirements
- Management don’t bother about employees. They give 6 months work to finish in 1 month. They believe employees should work 12-14 hours in weekdays and again on weekend’s. No weekend no public holidays. Looks they give good money at the time of joining. But it’s not for 40 hours/week. It’s 80 hours a week of work.
- Have good leave policy but managers won’t ready if you want to take block leaves.
- Works on all age old technologies.
- Heavily stressful life. Employees get sick and still have to work.",,,"Specialist, Application Development",Current Employee,"Hyderabad, Telangana","June 12, 2021"
1.0,Work life balance,It just ruin your career life. You can't learn anything from here. It's a process oriented company. They have lot of process but no solutions. Management always shows favaoratism.,,,Corporate Portfolio executive,Current Employee,Hyderabad,"June 4, 2021"
5.0,Very nice place to work and learn new things.,I am very happy to work in this organization as it has given me many things to learn and also have great opportunities for future growth and good team with supporting management in each and everything.,,,Customer Relationship Manager,Current Employee,"Pune, Maharashtra","May 29, 2021"
4.0,Learning ground for fresh grads,"Mostly involved in meetings to ensure projects are developed and on track for deployment. The work environment is OK with occasional late nights. Was hired by the bank as a contractor, so don't expect the same benefits as a perm staff. Discrimination of entitlement is quite jarring and frankly demoralizing.",,,Business Analyst,Current Employee,Changi,"April 4, 2021"
5.0,teamwork and muitasking,"need to be fast pace and communicate with the team mates, if don't understand need to seek for help, I have learn a lot from this 1 year contract and went through the training.",,,Customer Service Executive,Former Employee,Bedok,"March 20, 2021"
4.0,Productive,"Nice to work with dbs bank as customer sales executive and good impression in the on the bank I m working from last ,3year dbs bank only this company",,,Customer Sales Executive,Current Employee,"Hyderabad, Telangana","February 17, 2021"
3.0,All of DBS staff very friendly and help full to each other,"Friendly staff and good environment working place,and we work as a team,every year the management will arrange a oversea company trip and will ensured all the staff will join",,,PERSONAL DRIVER TO REGION DIRECTOR,Current Employee,Kuala Lumpur,"February 9, 2021"
4.0,Benefits too common,"Benefits are too common, other competitors have it as well.
Would appreciate it if benefits are differentiable and unique.
Competitive pay and good workplace culture.",,,Manager,Former Employee,Bugis,"February 7, 2021"
5.0,very much intelligent staff,"very nice bank for employees
very much supportive to employees
polices are well set to get the desired results form the concerned staff
very well enjoy work life balance",,,Analyst,Former Employee,"Kolhapur, Maharashtra","December 27, 2020"
3.0,In dbs bank we more focus on revenue part,I have join dbs on 9th march2020 as a cpe we are open digital salary acount and during the lockdown dbs more focus on insurance in terms of revenue and we sale the insurance every month and try to achive my target,,,Customer portfolio executive,Former Employee,"Mumbai, Maharashtra","October 25, 2020"
5.0,Nice place to work,"Nice place to work, a lot of challenge, a lot of experience, a lot of fun, a lot of friends, a lot of study, available place to work, available office hours, nice work in DBS Indonesia Bank",,,Save document keeping,Current Employee,Jakarta,"October 21, 2020"
4.0,Na,"Good co to work with
Nice
Good mgmt
Amazing office
HR policies are good
Leaves are good
Lot to learn for someone switching to MNC
#################################################",,,Associate,Current Employee,"Mumbai, Maharashtra","September 5, 2020"
1.0,Racist and toxic boss,"My jobscope was changed suddenly on my first day of work. I did not have the expertise and experience in the new role. Ex-boss was racist and only cared for his staff who had the same nationality as him. I was treated unfairly. I was involved in 24 hr work shift, doing production support. I was asked to work in the afternoon shift from 2 pm to 11 pm. I was not allowed to make transport claim after work. Then I realised that I was the only one who could not make the transport claim. My ex-colleagues who worked in the same shift as me, could claim their taxi fares. I asked my ex-boss about this discrepancy. He denied whatever he had said. This is not the only instance when I was treated unfairly. And I am a Singaporean, while he was only holding a Work Pass Permit. I am one of the 3 Singaporeans under him. The rest are all Work Permit Holders from the same country. I wanted to complain to HR but I could not as I was a contract staff.",,,Senior Systems Analyst,Former Employee,Changi Business Park,"September 2, 2020"
2.0,Hectic work,Contractors would be treated like a work slaves. Employees are expected to work on weekends. They take it granted without concerning about developers burnt-out,,,Senior Java Developer,Current Employee,Changi,"August 25, 2020"
4.0,Productive and good working environment,"Great working environment, fair and good opportunity given.
People are overall friendly and helpful.
They have a very good technology initiatives suited for modern banking",,,Customer Support Trade Specialist,Former Employee,Singapore,"August 10, 2020"
3.0,Productive but not as comparative to other banks,"Bank was very good and work culture also good but not productive as other bank not good for new learner, there is no one ask for creativity and trying to complete the job within the TAT. Everyone just want to enjoy in DBS culture. One more thing there are HR department are very strong.",,,Specialist Operations,Former Employee,"Mumbai, Maharashtra","August 4, 2020"
5.0,High-paying but stressful,"High-paying but stressful, offers longer annual leaves and fair amount of medical leave.

Negative side is hard to find the balance between work and family due to amount of time-dedication.",,,Customer Service Officer,Former Employee,Jurong East,"July 15, 2020"
