,Rating,Title,Pro,Con,Job Title,Status,Region,Date
685,2.0,It’s alright,"Good benefits, banking hours are nice","Not many raises, upper management have no idea what actually happens in the branches",Personal Banker,Current Employe,,"Feb 17, 2021"
686,4.0,Good place to work.,"Great perks, highly international workplace","Rigid structure, very structured career advancement.",Vice President,Former Employe,"New York, NY","Mar 1, 2021"
687,4.0,An excellent company to work for,"They care about development, pay well, good benefits, and a lot of vacation time.","Very focused on off-shoring to Asia, and therefore, employees always concerned about team being off-shored. Mass layoffs in 2020.",Senior Business Intelligence Analyst,Former Employe,"Chicago, IL","Jan 5, 2021"
688,4.0,Great benefits,"Great company benefits 
Great team","Big workload, usually work longer hours",Bank Manager,Current Employee,"Bristol, CT","Mar 4, 2021"
689,3.0,Company overview,Good work-life balance but it varies by department,It's the banking industry. It suffers from economic downturns so layoffs are often,Senior Manager,Former Employe,,"Feb 12, 2021"
690,4.0,sale,"(1) HSBC has a relatively high global reputation in bai, and the collection speed is relatively fast;

(2) HSBC has the ability to deposit and withdraw cash, which can be withdrawn from ATMs in mainland China or at the counter in Hong Kong;

(3) HSBC has the function of RMB exchange through online banking, which can directly exchange RMB.","(1) The handling fee is relatively high;

(2) If it is difficult for mainland customers to operate the letter of credit, the documents must be courier to Hong Kong;

(3) Slightly insufficient contacts in China",Sales Associate,Former Employee,"New York, NY","Sep 5, 2020"
691,5.0,Good place to start your career,Good culture and training at the beginning,"Lots of hours, expect to work some weekends",Analyst,Current Employe,"New York, NY","Feb 11, 2021"
692,3.0,Constant restructuring,"Global franchise, large balance sheet",Shifting priorities and changes of focus and strategy,Managing Director,Current Employe,"New York, NY","Feb 16, 2021"
693,3.0,Decent,Learn a lot quickly through multiple business lines.,"Very large company, easy to get lost in the shuffle.",GDP,Current Employe,,"Feb 18, 2021"
694,3.0,Won't get rich,Flexible work/life balance. Challenging projects.,Lack of share price growth.,Software Development Manager,Current Employe,"New York, NY","Mar 3, 2021"
695,5.0,...,Good pay and great benefit,Huge hit with pandemic but things are turning around,Collections Specialist,Current Employe,,"Feb 22, 2021"
696,5.0,Good company !,Generous Salary great 401k plan,Comp plan needs work bad systems,Vice President,Current Employe,"New York, NY","Feb 23, 2021"
697,4.0,Good place to work,"Work life balance, flexibility, a lot of time off, and nice culture","People tend to work in silos, certain processes and procedures need development/updating",Anonymous Employee,Current Employee,"New York, NY","Jan 25, 2021"
698,2.0,Okay place to work,Good Financial and Accounting Experience,Little to no employee loyalty (US),Senior Financial Analyst,Current Employe,"New York, NY","Feb 27, 2021"
699,4.0,Fair and Flexible,Work is interesting and can work from home,Things take a while to get done in such a big company,Senior Pricing Specialist,Current Employe,"Buffalo, NY","Feb 2, 2021"
700,4.0,Operations Specialist,Great place to learn about banking,A large organization easy to get lost in,Operations Specialist,Former Employe,"New York, NY","Feb 17, 2021"
701,5.0,None,The benefit is good and colleages are great.,None that i can think of at the moment,Sales,Current Employee,"New York, NY","Feb 10, 2021"
702,4.0,Good place to learn,"High learning curve, many opportunities","Work-life balance is less, job responsibilities were ever evolving",AVP-Business Analyst,Former Employe,,"Feb 12, 2021"
703,3.0,Global Bank,Work with top CRE borrowers.,Big bank means lots of bureaucracy.,Commercial Real Estate Finance,Current Employee,"Washington, DC","Feb 24, 2021"
704,4.0,It was okay,Good pay and benefits. Poor evaluation system,Struggling in the United States. Poor cross departmental communications,Former Vice President,Former Employe,"Rochester, NY","Feb 8, 2021"
705,3.0,Lots of sales pressure,"good benefit, high 401k match",needs to do a lot of referrals,Personal Banker,Current Employee,,"Feb 5, 2021"
706,2.0,.,people are nice to work with,"no advancement, no incentive other than to keep your job",Product Owner,Former Employe,"New York, NY","Feb 16, 2021"
707,5.0,excellent colleagues,lots of very smart people here,none really to share now,Vice President,Former Employee,"New York, NY","Feb 18, 2021"
708,4.0,Associate Position at HSBC,Good salary and benefits for employees,Lots of steps for approvals,Associate,Current Employee,"Houston, TX","Feb 15, 2021"
709,1.0,constant review,global experience with clients from all across globe,"Compliance nightmare, main focus is to catch employees in situations to then fire for cause.",PRM,Former Employee,"New York, NY","Apr 6, 2021"
710,3.0,Culture is laid back,"Good benefit, insurance, flexible overall, people are really nice (vs. Aggressive)",Very complicated operational structure. A lot of admin work.,AVP-Analyst,Current Employee,,"Jan 28, 2021"
711,3.0,company has changed a lot,"global company, good benefits, local","culture issues, work life balance",Human Resources Manager,Former Employee,"Chicago, IL","Feb 17, 2021"
712,5.0,Great place to work,Best bank in the world,"No cons, truly a great place",Product Manager,Former Employee,"New York, NY","Feb 12, 2021"
713,3.0,NA,"Pay well, Work life balance","Boring, no increment, boss was mean",Business Analyst,Current Employe,,"Feb 23, 2021"
714,5.0,"Challenging Work, Great Benefits","Great people, benefits and bonuses!",Sometimes had to sacrifice work/life balance,Senior Analyst,Former Employee,"Tampa, FL","Feb 11, 2021"
715,1.0,Senior management sucks,Great way to make connections. Middle management will support you but senior management will not,Screw your over. They don't pay you. Make promises they can't keep. Company will go under.,Anonymous Employee,Former Employee,"New York, NY","Mar 11, 2021"
716,5.0,Great place to work,Management is connected and strategic. Many opportunities for advancement,Cannot think of a con.,Senior Vice President Product,Former Employee,"New York, NY","Jan 12, 2021"
717,4.0,Great Company,Great people and decent benefits.,Banking is a slippery slope in todays world. Branch banking is almost becoming a thing of the past. HSBC is no different.,Personal Banker,Former Employee,"New York, NY","Jan 12, 2021"
718,4.0,Good Job,Good work environment and good people,lack of innovation and timidness towards making changes,Vice President Strategy,Current Employee,"New York, NY","Feb 10, 2021"
719,4.0,GREAT BENEFIT,Outstanding insurance benefit and generous vacation time,great products among other international competitors.,"Vice President, Premier Relationship Manager",Former Employe,"Elmhurst, NY","Nov 5, 2020"
720,1.0,Poor company,"Good pay, room for movement.","Awful management, terrible systems, micromanagement, poor structure, lack of support.",Senior Relationship Manager,Former Employee,"New York, NY","Jun 24, 2021"
721,5.0,HSBC rating,Diversity is a big piece of why I like working for HSBC.,HSBC has been in the new lately.,Credit Manager,Current Employe,"San Francisco, CA","Dec 1, 2020"
722,5.0,Excellent employer,Very international and open to diversity.,"Despite the wonderful international culture, new managers are trying to make this bank be more like the domestic banks.",Vice President,Former Employee,,"Nov 4, 2020"
723,4.0,Different culture to your local banks,"Job allow you to work autonomously, if you are self motivated and don’t need people to micromanage you then this is the right place for you","Very demanding clients, staff turnover, pay",Branch Manager,Current Employe,"San Francisco, CA","Oct 21, 2020"
724,4.0,One of the Best Callcenter in the Philippines!,"I worked for almost 6 years at Hsbc .. I never regret   a day in my Life that I invested my time,energy, mind and effort to work for this company! They value their customers and value the employees as well, there are lots of extra curricular activities inside the workplace that makes work enjoyable and they always look ways to make it the best place to work, from 2-3 weeks vacation with pay , DCI,shuttle service, Quite room for commuters, internet cafe for employees, gym,outreach program and parties in and out of the office, Family Day  and web based training,yearly performance salary review for employees! These are the things that motivate you to be the best that you can become! and its always a pleasure to know that this company value you its people from bottom
up!","Its very hard to move up.. and be promoted! ive been a performer from day one and i see only few people including myself though they are proficient in their job and have been with the company for years to move up..I see there is inconsistency with promotion because most people that got promoted are either close to manager or friends with people that makes the decision, most of them are not as good as other assosciate that aims to be promoted and sad to say some doesnt have any  leadership skill at all.",,Former Employe,,"Mar 9, 2014"
725,4.0,N/A,It is a good learning environment,The hours are not too great,Personal Banker,Current Employe,"New York, NY","Dec 17, 2020"
726,5.0,Good company,"Employee friendly , fair comp and great culture and work",All good can’t think of anything,Vice President Analytics,Current Employee,"Arlington Heights, IL","Dec 2, 2020"
727,3.0,Hsbc,"People, flexibility, values, opportunity, fast paced","Poor annual performance payouts, salary inequities",Vice President - Commercial Card,Current Employe,,"Apr 29, 2021"
728,4.0,Lots of opportunities across world,Ability to move different roles across continents,Continuous change in the strategy,Vice President,Current Employe,"New York, NY","Dec 1, 2020"
729,4.0,Like it,Well Established Career Advancement Channels,Complex process and team structures,Corporate Banking Manager,Former Employe,,"Dec 17, 2020"
730,5.0,Good place,Work life balance is big,Sometimes slow to adapt and update system,Senior Analyst,Current Employe,"San Francisco, CA","Dec 9, 2020"
731,5.0,Good,All. Good. Complete. Beach sun mointain,Nothing yet nothing just yet but we'll see,SFE Analyst,Current Employe,,"Dec 6, 2020"
732,3.0,It is a good company to work for I just do not like  it is not stable.that there is no sa,"Great culture, love my co workers",Not stable company in USA,Vice President Premier Relationship Manager,Current Employee,"New York, NY","Feb 24, 2021"
733,3.0,peopel,people are the best here,compensation is lower than competitive firms,Analyst,Current Employe,,"Apr 23, 2021"
734,4.0,Great Company,"benefits, pay, engagement, people oriented, career development","comfort zone, abrupt changes in work procedures and policy",Assistant Manager,Current Employe,"Phillipsburg, NJ","Nov 19, 2020"
735,5.0,Best company to work,"Opportunities to grow, friendly environment",No downsides. Have to work late hours.,Senior Business Analyst,Former Employee,,"Nov 23, 2020"
736,4.0,Working at hsbc,The people are great. Family like setting,"Systems are terrible and needs updating. 
Business in wealth is failing
More products should be offered to clients",Senior Administrative Assistant,Current Employee,"New York, NY","Oct 15, 2020"
737,3.0,Decent,Decent to explore the retail banking industry,"Lack of growth 
No opportunity to move up",Customer Service Representative,Former Employee,"New York, NY","Apr 6, 2021"
738,5.0,Very favorably.  I would go back to work in my unit in a heart beat.  Treated very well,The bank will allow you to personally develop your skills sets as far as you want to go.  It will support you in acquiring all the licenses and registrations that you need.  It also has a decent tuition reimbursement program.  My particular unit (24 Hour Execution Desk-Chicago) has an excellent desk manager and branch manager.    I was treated as a professional and with respect.  Insurance benefits weren't bad compared to other shops at which I have worked.  I would return to that group in a heart beat (see below).,"When you're receiving company wide e-mails from high ranking bank officers alluding to impending layoffs you should probably give them credence.  They announced a 13% across the board head count reduction and I, along w/ one of my colleagues and the Co-Head of North American Futures Sales, were all ""separated from the firm"" in the same morning.  When they want to cut fixed costs competency, a good work ethic, and loyalty didn't really mean much.  They didn't offer us a chance to apply for positions in other units in the Chicago area.  We have to go on to the company website and apply for those positions ourselves... just like outsiders.",Vice President-24 Hour Global Execution Desk,Former Employe,"Chicago, IL","Dec 8, 2011"
739,4.0,Interesting organization,"Challenging, fast paced environment where an open mind can be quite engaged",Culture struggles with presentation vs contribution at times,Looking for A Job,Former Employe,"Boston, MA","Oct 8, 2020"
740,3.0,Average,Big international company although not sure whether it's growing,Slow moving company. No innovation,Software Developer,Current Employee,"Los Angeles, CA","Feb 2, 2021"
741,3.0,Call centre,good environment to work in it,multiple work you need to finish,Senior CSE,Current Employe,"Egypt, TX","Feb 2, 2021"
742,4.0,Good employer,Great benefits for staff at all levels,Management are slow to execute,Head of Compliance,Current Employee,"New York, NY","Jan 30, 2021"
743,5.0,Great company,Great culture and rewarding experience,Don’t really have any cons to add,Credit Analyst,Former Employe,"Chicago, IL","Jan 27, 2021"
744,3.0,Hsbc,I am Not available to give,The bonus is not as high as other banks,Premier Relationship Manager,Current Employe,"Cupertino, CA","Jan 27, 2021"
745,4.0,Good Company,The firm offers very good benefits,The firm is a global firm and looking to consolidate in the U.S.,Management,Former Employe,"Carpentersville, IL","Jan 13, 2021"
746,1.0,Not good,Good good good good good,Not bad not bad not,Anonymous Employee,Current Employe,"Coppell, TX","Apr 15, 2021"
747,4.0,Not a bad place to work,Inclusive culture. Generally positive atmosphere. average pay and benefits.,They like to pull in and out of North America like Ron Jeremy,Contact Center Representative,Current Employee,"Buffalo, NY","Dec 18, 2020"
748,4.0,Limited opportunities in USA,Good Global bank with great benefits and opportunities abroad.,Very small footprint and limited opportunities in USA,Vice President,Former Employee,"New York, NY","Jan 11, 2021"
749,5.0,Full time personal banker,Good people to work with,They are sales heavy you will be making calls constantly,Personal Banker,Current Employee,,"Jan 11, 2021"
750,2.0,"Vice President, Premier Relationship Manager",This company have more PTO,Poor upper management and culture flavorist to Indian,"Vice President, Premier Relationship Manager",Current Employee,"Oakland, CA","Jan 20, 2021"
751,1.0,Lowest point of my life. Do not work here,"Work from home 
Low hours","Sense of purpose
No human connections
NYC office is trash",Product Manager,Former Employee,"New York, NY","Mar 1, 2021"
752,4.0,Great place,"Great income, diversity and leadership",The closures and layoffs of our HSBC family.,Senior Business Consulting Analyst,Former Employee,"Brandon, FL","Jan 22, 2021"
753,1.0,Move Out To Move Up,Not for the faint of heart,Perfect if you love a good challenge,Product Manager,Current Employe,"New York, NY","Mar 29, 2021"
754,4.0,"Good company, massive","Too big, culture is conservative",You can only be exposed in certain aspects of company,Associate,Current Employe,"New York, NY","Jan 15, 2021"
755,4.0,Good,Good work and life balance,Work efficiency could be better,Manager,Former Employe,,"Jan 31, 2021"
756,4.0,Large International Bank,"Wide range of products, services and expertise to serve international clients.","Primary focus is international and not domestic,",Senior Relationship Manager,Current Employee,"New York, NY","Jan 7, 2021"
757,1.0,Toxic environment,There are no pros whatsoever working for this company,Constant pressure to sell/ refer products to customers. Managers will micromanage you and inquire about your sales goals multiple times throughout the day. Everyone at the branch was visibly demoralized as a result of this toxic environment,Customer Service Representative,Former Employee,,"Jan 18, 2021"
758,5.0,Simmer intern,Great very very cool vibes,No free lunch and tight on expenses,Summer Internship Program,Former Employee,"New York, NY","Jan 18, 2021"
759,5.0,super,super easy on your own,low pay long working hour,Senior Accountant,Current Employe,"Boston, MA","Jan 24, 2021"
760,3.0,okay,pay is good and the people are nice,bad software crashes often causing delays,Teller,Former Employe,"Milford, CT","Jan 19, 2021"
761,4.0,Good Starter Company,"PTO, Good Management, Team friendly","Saturday hours, clients treat you like dirt sometimes.",Personal Banker,Former Employe,,"Jan 14, 2021"
762,5.0,Great place to work,"Culture, people, location, lifestyle, cafe",Pay structure and growth timelines,Internship,Former Employe,,"Jan 15, 2021"
763,4.0,HSBC Technology & Services a good place to work,"Global, challenging, large scale, autonomous","Financial / operational challenges, loss of jobs to overseas low-cost locations",Senior IT Manager,Former Employe,"Skillman, NJ","Dec 23, 2020"
764,5.0,good,good to work here at,none at this point in time,Business Analyst,Former Employe,"Detroit, MI","Jan 19, 2021"
765,2.0,Not the best,higher base pay than most banks,bonus is not as good,Personal Banker,Current Employe,"Cupertino, CA","Jan 21, 2021"
766,1.0,Bait and Switch,Global Bank with potential for exposure abs learning opportunities,Completely decentralized and disorganized. Mean managers.,Senior Account Manager,Former Employee,,"Mar 2, 2021"
767,4.0,HSBC review,The benefits are good. Work life balance as a group policy is quite matured.,There is a continuous cycle of downsizing. No stability.,Senior Analyst Business Systems,Current Employee,"Arlington Heights, IL","Dec 22, 2020"
768,3.0,I worked at hsbc part time,Good time off paid benefits,old and outdated software system,Teller,Former Employee,"New York, NY","Jan 13, 2021"
769,4.0,Salary,Everything and everyone is nice,Long hours due to volume,Processing Associate,Current Employe,,"Jan 22, 2021"
770,5.0,Financial Advisor,"An amazing workplace, best management I worked with","None I can think about, it was good",Financial Advisor,Former Employee,,"Oct 12, 2020"
771,5.0,Awesome Company to work for,Great Pay and Great Teammates,Poor work and life balance,Project Manager,Former Employe,"New York, NY","Oct 5, 2020"
772,3.0,HSBC,"International, interesting work, blue chip clients","Strategic direction, pay, reducing balance sheet",Director,Former Employe,"New York, NY","Mar 12, 2021"
773,4.0,hoping for a turnaround,The bank hires and retains great people,they are searching for a US identity,Managing Director,Former Employe,"New York, NY","Oct 12, 2020"
774,3.0,Going thru many changes,Good people to work with. Used to be better.,Disorganized. Too many rules and hand cuffs,Financial Consultant,Former Employee,"San Jose, CA","Feb 23, 2021"
775,1.0,Never try this place,Salary is paid in time.,"Most disorganized company ever. System is complicated, even trainers say HSBC stands for how simple becomes complicated. Simple transactions take a long time. Customers are never the priority.No work life balance. No lunches or breaks guaranteed in time. Manager sits in room and is not involved with team building, however is an extreme micromanager. Traditional strict hierarchical structure which will suffocate you and these people are proud of this culture. Sales focus is such that they would expect unethical practices. Scheduled time is never the time you will leave from work. Planning to sue them.",Personal Banker,Current Employee,"Pleasanton, CA","Aug 3, 2020"
776,3.0,Global corporation,Very Good pay and benefits,"Too big, too much bureaucratic nonsense",Database Administrator (Database Administrator),Former Employee,"Buffalo, NY","Mar 9, 2021"
777,3.0,Not as expected,"Benefits, work life balance, nice people to work with,","Senior management, slow, disorganized, bureaucratic, bonuses",Sales Associate,Current Employee,"New York, NY","Feb 24, 2021"
778,2.0,It’s alright,"Good benefits, banking hours are nice","Not many raises, upper management have no idea what actually happens in the branches",Personal Banker,Current Employe,,"Feb 17, 2021"
779,3.0,Company overview,Good work-life balance but it varies by department,It's the banking industry. It suffers from economic downturns so layoffs are often,Senior Manager,Former Employe,,"Feb 12, 2021"
780,4.0,.,remote job opportunities are available,disjointed it strategy in place,Senior Software Engineer,Former Employe,"Chicago, IL","Oct 22, 2020"
781,4.0,A good place to work with a lot of growth potential for young hires,"Learned a lot, opportunity to take on a lot of responsibility, global, good salary, well-known brand","Bureaucratic, long hours, lack of flexibility",Associate,Former Employee,"New York, NY","Aug 20, 2020"
782,3.0,Constant restructuring,"Global franchise, large balance sheet",Shifting priorities and changes of focus and strategy,Managing Director,Current Employe,"New York, NY","Feb 16, 2021"
783,3.0,Decent,Learn a lot quickly through multiple business lines.,"Very large company, easy to get lost in the shuffle.",GDP,Current Employe,,"Feb 18, 2021"
784,3.0,Won't get rich,Flexible work/life balance. Challenging projects.,Lack of share price growth.,Software Development Manager,Current Employe,"New York, NY","Mar 3, 2021"
785,4.0,Manager,Great colleagues to work with,Not enough opportunity and clarity of startegy,CDO Manager,Former Employe,"New York, NY","Oct 14, 2020"
786,2.0,Okay place to work,Good Financial and Accounting Experience,Little to no employee loyalty (US),Senior Financial Analyst,Current Employe,"New York, NY","Feb 27, 2021"
787,4.0,Good place; Good leaders,"Transparent and thoughtful leadership, benefits are good",Missing some key parts- more pto/unlimited,Senior Credit Analyst,Current Employee,"Chicago, IL","Sep 29, 2020"
788,4.0,Good place to work,"Interesting work. Good people, advancement opportunities, working internationally","Big workload, long hours, lots of meetings",Senior Director,Former Employe,"New York, NY","Sep 24, 2020"
789,3.0,Global Bank,Work with top CRE borrowers.,Big bank means lots of bureaucracy.,Commercial Real Estate Finance,Current Employee,"Washington, DC","Feb 24, 2021"
790,4.0,Like Any Other Banks,Great pay compared to other retail banks,Needs to update overall system/operation platforms,Branch Relationship Banker,Former Employee,"New York, NY","Sep 14, 2020"
791,3.0,Lots of sales pressure,"good benefit, high 401k match",needs to do a lot of referrals,Personal Banker,Current Employee,,"Feb 5, 2021"
792,2.0,.,people are nice to work with,"no advancement, no incentive other than to keep your job",Product Owner,Former Employe,"New York, NY","Feb 16, 2021"
793,5.0,Great,HSBC is a Great employer,There are no cons here,Business Management Analyst,Current Employe,"New York, NY","Oct 7, 2020"
794,1.0,constant review,global experience with clients from all across globe,"Compliance nightmare, main focus is to catch employees in situations to then fire for cause.",PRM,Former Employee,"New York, NY","Apr 6, 2021"
795,3.0,Culture is laid back,"Good benefit, insurance, flexible overall, people are really nice (vs. Aggressive)",Very complicated operational structure. A lot of admin work.,AVP-Analyst,Current Employee,,"Jan 28, 2021"
796,5.0,Excellent place to work,"Good managers , work culture",No Cons for the company,Software Engineer,Former Employe,,"Sep 29, 2020"
797,3.0,company has changed a lot,"global company, good benefits, local","culture issues, work life balance",Human Resources Manager,Former Employee,"Chicago, IL","Feb 17, 2021"
798,5.0,Required,"Environment, vacation time and colleagues","Communication, constant change, lack of job security",Operational Risk,Current Employe,"Buffalo, NY","Oct 1, 2020"
799,3.0,NA,"Pay well, Work life balance","Boring, no increment, boss was mean",Business Analyst,Current Employe,,"Feb 23, 2021"
800,1.0,Senior management sucks,Great way to make connections. Middle management will support you but senior management will not,Screw your over. They don't pay you. Make promises they can't keep. Company will go under.,Anonymous Employee,Former Employee,"New York, NY","Mar 11, 2021"
801,4.0,The way it feels in 08.,"Global brand for those who want international opportunity this is one of the best opportunities that offers domestic US presence and a large number of choices abroad. For those who always believe in drinking the company Kool Aid a pretty decent culture overall. Corporate goals to be ""green"" are a start at a positive impact.  We're big too on a global scale so we aren't going to go and disappear either.","Technologically challenged like many financial companies, more so with banks than any other group. Due to size of the organization you can feel lost too. Working hard and being smart is no guarantee of climbing the corporate ladder either. Some unfocused strategies due to changes in leadership in recent years.",Vice President,Current Employe,"New York, NY","Aug 20, 2008"
802,4.0,Good company,"work environment, colleagues are cooperative and knowledgable","Stressful environment with lots of work, need to be extremely detail oriented.",Administrative Associate,Former Employee,,"Sep 9, 2020"
