,Rating,Title,Pro,Con,Job Title,Status,Region,Date
1370,4.0,Decent company to work for,"Good learning opportunity, if you work in Commercial Banking.",I heard retail banking arm of the firm is not the place you want to be.,Assistant Vice President - Risk Management,Current Employee,"New York, NY","May 10, 2015"
1371,4.0,Customer service executive and trainer (Loan department),I have Learned a lot in the bank and I have got promoted It's a good bank to work in.,Just Some of the manager are not qualified enough but not all of them.,Customer Service Executive and Trainer,Former Employee,"Aiea, HI","Dec 21, 2015"
1372,4.0,Typical Banking Environment,"Salary tends to be higher than most institutions.
Access to international jobs, because of their vast international footprint.",Very goal driven. Unrealistic goals. Training not as great as some of it's competitors. Hard to move up through the ranks.,Anonymous Employee,Former Employe,,"Feb 10, 2016"
1373,4.0,I Like It Here,I like HSBC. Tough but fair place to work.,Wish they still had a cafeteria with the reduced coporate meal plan. Wish they had a gym on site in NYC like UK office. Too many money scandals.,Senior Production Support Engineer,Current Employee,"New York, NY","Apr 15, 2017"
1374,5.0,nh,great place to work with  a highly competitive environment for growth,too many hours which leaves you with no social work,Ymhfutf,Former Employee,"Fort Worth, TX","Nov 4, 2017"
1375,3.0,Good place to work,Business users are awesome and very supportive. Good work/life balance. Challenging work environment. Bank is positioned for growth in the next few years.,"IT is going thru internal ""Transformation"" (i.e. changes).  The goal seems to be to transfer IT work to offshore/consultants and only keep leadership/supervisor roles onsite / inhouse. Too much stress on the bottom line and operating costs.",Senior Business Systems Analyst,Former Employee,"Chicago, IL","Oct 23, 2019"
1376,5.0,Associate Fraud Prevention Specialist,"Excellent benefits, culture, and values.",Some departments in the US are laying off employees and moving positions to offices in India.,Associate Fraud Prevention Specialist,Former Employee,"Depew, NY","Nov 8, 2019"
1377,4.0,"Enjoyed it, good benefits, but can be demanding",Good benefits and fast paced.  Lots of different opportunities.,Can be demanding at times.  Process restricting change. De-centralized and communication gaps.,,Former Employe,,"Apr 29, 2009"
1378,2.0,HSBC is Changing for the Worse.,People in the ranks are great to work with.  International opportunities.  Flex-time.  Casual Dress.  Standard corporate benefits. Remote work support. Tuition Assistance.,"Less than honest senior management.
Lack of support for North America.
Outsourcing almost everything to India or using H1Bs.
Does not value your MBA.
Management does not know what is really going on in the departments.
Pushes the limit on legal/ethical treatment of customers.","Senior Manager, FSA",Former Employe,"Prospect Heights, IL","Sep 29, 2009"
1379,5.0,N/A,HSBC has a great benefits package and great opportunites for advancement,Don't have any cons- general stuff,,Current Employe,"Chicago, IL","Sep 18, 2010"
1380,3.0,"mix of good and bad, too frequent management shuffles change the direction of work every few months","good friendly atmosphere, hierarchy doesn't come in way of putting your idea in front of others.","career path is like a dead end (specifically talking about HSBC GLT), they look at years and an internal exam to judge candidates for promotion.",Senior Software Engineer,Current Employee,,"Apr 13, 2013"
1381,5.0,Great company overall to work for.,This company provides great benefits,The only thing I am too fine of is that its hard to get promoted,Bank Teller,Current Employee,"New York, NY","Sep 3, 2013"
1382,4.0,Great company culture and benefits,"Excellent benefits, great location and helpful employees.",Promotions within are usually overdue and often given to those who are least knowledgeable.  Location will be rerouted soon.,LSR III,Current Employee,"Brandon, FL","Oct 30, 2014"
1383,4.0,Campaign manager,They have a process to get projects done. Nice benefits.,Can be political at times but what company isn't? Not as flexible to work from home when I worked there.,Campaign Manager,Former Employe,"Mettawa, IL","Sep 28, 2015"
1384,4.0,Great place to stay,The project advisor will actually lead to do some finical analyzing work instead of doing some trivial excel basic data computing.,Not having a great flexible working environment to pick more perferable project to develop yourself.,,Former Employe,,"Nov 7, 2015"
1385,5.0,Great Company,"Great atmosphere, excellent working environment with lots of potential for growth and becoming a manager. You can always enroll in training to learn more about financial facilities.",I didn't really have any,Personal Banking Advisor,Former Employee,"Cincinnati, OH","Dec 26, 2015"
1386,4.0,"Good Secure Company, Good Benefits",Good secure company with well established procedures for how work is to be performed,Can be a little bit rigid around adherence to processes and procedures,Anonymous Employee,Former Employee,"New York, NY","Mar 4, 2016"
1387,1.0,Consultant Business Systems,Very large financial group. Varied experience,Work! work!! work!!! for employees. Fine! Fine!! Fine!!! for the Bank. Need to work in hours starting from Hong Kong time to Chicago times. Managers expect work seven days a week. Projects are too aggressive. Management pushes unreasonable targets and finally projects get cancelled or not promoted to Production or undergo extensive changes. Always Damocles sword is hanging about moving position to offshore or outsource. Higher management does not care about employees. Management has made so many issues and keep paying billions and billions in every country. Sorry a bad employer!,Consultant - Business Systems,Current Employee,"Buffalo, NY","May 8, 2016"
1388,4.0,Truly International Bank,"Given global footprint, there are many opportunitites across the bank if candidate is mobile.",Not the best in class in terms of compensation.,Senior Risk Manager,Current Employee,"New York, NY","Sep 20, 2016"
1389,4.0,Relationship Support Associate,enjoy working on kyc/aml reviews; liaision btwn depts; enjoy colleagues,for my position the salary could be better; at times politcal decisions (cliches),,Current Employe,"New York, NY","Oct 21, 2016"
1390,4.0,Great while it Lasted,This was a great place to work for the pay is great the benefits are excellent. I really enjoyed moving up the ladder.,"All good things come to an end, unfortunately my time is closely approaching,",Loan Servicing Representative III,Current Employee,"Brandon, FL","Nov 8, 2016"
1391,4.0,Solid Company,"Great benefit package (5-6 week salary, 401k matching, back-up daycare allotment, etc)
 Flexible work environment (largely dependent upon LOB)
Opportunity for advancement","Efficiency implementation = increased job duties (doing the work of 2-3 people)
Band-aid solutions",Kyc Specialist,Current Employee,"New York, NY","Mar 13, 2017"
1392,2.0,Working life,I’m not sure what to say ... decent pay .. good medial ...,Not considerate especially when you are sick .... manager calls you to come in on your sick day or refuse to pay you .... if you don’t make your goal you will be fired and the cold calling sucks.... we all have the same leads to call ... so 5 people calling the same customer and then the customer gets annoyed ... the system is the worst ....,Personal Banker,Current Employee,"New York, NY","Jan 11, 2019"
1393,2.0,Insincere and Deceitful,Best part was the personnel but that changed with the times as they must but  the trade off was terrible.,"Nepotism, Advancement of managers very severely under qualified, conflict of interest with managers and HR ( Meaning HR will side with management about 95% of the time). Employee makes error it cost the bank money and all alarms go off, write up, possible termination. A manager makes an error 3 times the amount employee made they get a slap on the wrist and even get promoted.",Anonymous Employee,Former Employee,"New York, NY","Mar 21, 2019"
1394,4.0,Great micro culture but too bureaucratic,"Lots of learning opportunity and mobility
Strong management for card business unit
Good recognition of high performers 
Decent benefits","Too bureaucratic that can stifle creativity 
Too focused on commercial banking",Senior Manager,Former Employe,"Chicago, IL","Mar 5, 2015"
1395,4.0,RM,"international, many opportunities, decent benefits, decent pay, right mindset","slow to innovate, internal hire policies are weak, poor tech, too much control from 
uk in other markets, weak training program",,Current Employe,,"Aug 6, 2015"
1396,5.0,Great company for a career,"Global company providing ability to work and live in multiple locations across the world
Dynamic changing environment with a focus on delivery and implementation",High expectation for workload - could better support work/life balance,,Current Employee,"Chicago, IL","Aug 30, 2015"
1397,2.0,Don't.,"Big name recognition. I can't come up with more, but there is a 20 word minimum. ATM onsite? Restrooms were usually well maintained. The parking lot never swallowed my car.","Management was generally incompetence moved around.
50 levels of bureaucracy to get an expense of $25 paid, but they don't understand regulations. Please see also ""HSBC fines"". 
No pay increases or bonuses anymore.
Make staff work in remote and undesirable locations.
Mass layoffs. 
Everything smells of fire and brimstone.
I think my boss was the biblical Satan.",,Former Employe,,"Apr 26, 2016"
1398,5.0,Great company that truly concerned about their staff,Everyone is friendly in hsbc and willing to mentor you on work. Managers provide advice not only on your work but also on mental issues.,Job can be relatively boring.,Anonymous Employee,Current Employe,,"Apr 11, 2017"
1399,4.0,Slow but steady,"Collaborative culture, solid balance sheet, stable outlook in a difficult industry
Generally helpful people across the board","Bureaucratic red tape slows down innovation
Consensus decision making takes longer
IT can sometimes get in the way of getting things done",Trader,Current Employee,"New York, NY","Jul 5, 2017"
1400,3.0,Life balance and culture,"Culture, diversity and life balance are practice and serious about them. Enjoy having a couple of days working at home. Also a good place to advance in your career and continue your education.",Salaries are low and transferring internally won’t get you a desire salary. No too many options for medical benefits including dental and vision.,Compliance Manager,Current Employee,"Jersey City, NJ","Dec 2, 2017"
1401,5.0,Great place to work!,The work life balance here is wonderful.  Obviously it depends on your manager the level of flexibility you have. *Most* departments allow remote work schedule. There is opportunity for advancement. Great work is acknowledged and does not go unnoticed.,"Seems like every year right around bonus/raise time, upper management discloses bank “downfalls” and gives excuses why raises or bonuses won’t be too great.",Analyst,Current Employee,"Buffalo, NY","Apr 21, 2018"
1402,4.0,Great work/life balance.   Healthy deal flow,Work life balance.   Love the people I work with.  Flexible with remote work.  Opportunity to move around.  I would recommend HSBC as a place to work.,Systems are not the best.   Back office operations moved to India and it’s just riddled with errors.   Management listens but is ineffective in solving this issue.,,Current Employee,,"Jul 29, 2019"
1403,4.0,"A good place to work, depending on management","Great benefits,  good colleagues and opportunity for growth","Bonuses are discretionary, work/life balance is poor, high turn over","Vice President, Premier Relationship Manager",Current Employee,"New York, NY","Jan 2, 2020"
1404,3.0,Had a good time while working at HSBC,Always had new portfolios to work and was able to continually learn a new process. Flexibility with hours,I felt if you were not part of the good boys club than promotions were difficult,Collections RepII,Current Employe,"Pomona, CA","Feb 18, 2011"
1405,1.0,The ship is sinking...,"Relaxed atmosphere, good bonuses, lots of overtime available, not open 24/7, cafeteria, clean, ample parking, good location, nice lobby, security.","I was hired as a collections rep II.  From what was blatantly said by senior management HSBC is liquidating their mortgage portfolios and there are no plans to generate new ones.  They have been fined for regulation violations (predatory lending) and are looking to sell the portfolio altogether.  This has already been done w/ their credit card portfolio.  The time frame given 'long term' was three years, so don't plan on being there long.  I believe HSBC is a wonderful company to be employed with, if you are in a higher up position.  For  collections and customer service they're simply hiring bodies at this point to help liquidate the portfolio before it is sold.  This has led to very lax employment requirements, in my training class I witnessed racial slurs ""that's just one more white person I can check off my list, I don't like them anyway"", obscenities, markers and such being thrown, passing gas loudly and purposely in the elevator, and sexual comments as well.  I believe there would be less disorder in a prison yard.  The employees who have been there for a while seem to be equally disgusted in the new-hire classes.  One last thing, the dress code is neither interpreted or enforced, much of the time I felt as if I was in a club; abundances of cleavage, spandex, six inch platform heels, bamboo earrings, bright orange hair, tattoos,etc. (see posted pic).  If you are at all looking for a job that utilizes skills or education go elsewhere.  If you're looking to get in and out and make some fast money in the next couple years then this would be a good place for you (the job itself isn't that bad if you can make it through the god-awful subjugation of the training class).",Collections Representative II,Current Employee,"Brandon, FL","Sep 24, 2012"
1406,3.0,Rewarding career,Very large financial institution with global systems.  Keeps up with technology.,Too distributed of a management team.  Good people but not all work in the same direction mostly due to several Sr. Management teams working independently.  Overall global direction was not communicated or managed as a team.,Senior Director Facilities,Former Employee,"Chicago, IL","Nov 12, 2013"
1407,3.0,Business Analyst,"Nice work environment and good benefits and also great opportunities to advance your career.  Also, the diversity of the staff is a plus for this company.","Company constantly cutting jobs and laidoff, so this is the bad part of the company.  You must be willing to re-locate when you look for another position within the company.",Anonymous Employee,Former Employee,,"Mar 23, 2015"
1408,4.0,tenured employee,"Work-life balance, remote work, opportunities for advancement are the best part of working with HSBC the flexibility and time management vary depending on the department","benefits have declined, customer facing roles standards change too often to meet expectations",,Former Employe,,"Jul 10, 2015"
1409,4.0,Sr Consultant,Fortune 500 company and great place to work. Recognized globally and offer wide variety of opportunities all over the world.,More presence is required in the US especially in the banking area. Opportunity to expand credit card market in developing countries. Improve customer service.,,Former Employe,,"Sep 10, 2015"
1410,4.0,VP,was good a good place to work,"Tough times, you can't continue to cut costs and not lose talent",,Current Employee,"Hillsborough, NJ","Aug 12, 2015"
1411,4.0,Great Company but low pay,Work life balance is good and there is great exposure to senior management and good projects,the salary is terribly low when compared to the peer group,"Assistant Vice-President, Portfolio Administrator and Pricing Analyst",Current Employee,"New York, NY","Nov 11, 2015"
1412,5.0,Great Company to Work for!,"They really invest in their employees, great environment and support for graduates",The working environment was not as well supported when you are in the network,Anonymous Employee,Former Employe,,"Mar 14, 2016"
1413,4.0,company has changed a lot recently,"time paid off , easy access to top management",in 2015 company changed a lot they are more focus in cost cutting than anything else. a lot of good talent has left,,Current Employe,,"Apr 4, 2016"
1414,2.0,Senior Customer service,Good benefit and paid time off.,Not enough opportunities for advancement. Too much pressure to sales product and get put on final warning after a bad sales month. Too many unhappy customers because of the fees and policies which makes it even more difficult to sale them products. Company is focusing on SALE SALE SALE!! if you're not an a very aggressive seller don't bother work for this company,Customer Service Representative/Teller,Current Employe,"New York, NY","Jun 25, 2016"
1415,5.0,Governance,The people were great. Flexibility in regards to time off.,Not as organized as other organizations. Uncertainty within the environment.,Assistant Vice President,Former Employe,"Brooklyn, NY","Jan 25, 2017"
1416,2.0,Run Like a Government Agency,Pay; Paid Time Off; Holidays,"I worked in Compliance in the US; my comments are related to that Dept. This is a big organization and that comes with it's own issues, but I have worked at a number of big banks that did not have these problems and to the degree HSBC Compliance (in the US) does. 

Here are some quick hits: 
• ""Tone at the top"" is lacking coherent strategy, planning and execution. This causes (1) management to run from one fire to the next; and (2) everyone to confuse activity for achievement
• Compliance is fundamentally unaware or out of touch with the line of businesses they support.  
• Technology/Data Integrity is poor. There is no attention to detail, no questioning of data integrity, causing people to accept what is put in front of them. 
 
As a result, work product is relatively poor and key deadlines are missed. In order to fix it, management hires more people to do the same tasks (thus no real value is being added) - much like govt agencies often do. Consequently, they rely HEAVILY on contractors and junior level personnel to complete all tasks. As you can imagine, this causes contractors and jr. level people to quit more often.",Compliance,Former Employee,"New York, NY","Dec 17, 2017"
1417,4.0,Sr Business Analyst,Great way to expand your career.  Some managers are empowering and help you build your career.,No longer in FL.  There was a lot of gaps in processes that needed to be addressed.,,Former Employe,,"Jan 24, 2018"
1418,4.0,Good preparation,"Compensation, overall benefits, development opportunities, structured work but encouraged to perform job duties outside of role","Site closure, layoffs, could be political but that's to be expected in a corporate environment",Senior Risk Analyst,Former Employee,"Tampa, FL","Oct 1, 2018"
1419,3.0,It is a OK place to work,"Great Staff, Great Group of people to work with. Management tries very hard to make sure everyone is treated equally and fairly.","Under Staffed
Under Compensated
It is very difficult to get days off, even to ask for one day off, you must ask a month ahead of time.",Customer Service Representative,Current Employe,"Rye, NY","May 16, 2011"
1420,5.0,HSBC Bank was a fair employer.,The pay you received was wonderful. You had opportunity for advancement.,You were provided the chance for advancement.,Senior Supervisor,Former Employee,"Buffalo, NY","Mar 10, 2014"
1421,5.0,A forward thinking Company.,Everyone was treated with respect and equal,"Daycare, was not open to match the hours of the business.",Acct Manager,Former Employee,"Las Vegas, NV","May 6, 2014"
1422,4.0,Good company,Salary and opportunities to work abroad,"Political environment, lots of preferred people. You need to be part of the ""trust"" circle.",Senior Business Analyst,Current Employee,"Tampa, FL","Oct 4, 2014"
1423,4.0,Great Company,Easy work. By far the best company I've ever worked for. Benefits are amazing. Incentives are amazing. The way the company treats the employees are amazing.,Closing sites. Layoffs. No stability.,,Former Employe,"Elmhurst, IL","Dec 4, 2014"
1424,4.0,HSBC is a good organization with good cultures and best people.,"Good work environment.
Connected worldwide.
Very good learning environment",One idea is not fit for all country small or big.,Global Reporting Analyst,Former Employee,"Buffalo, NY","Apr 2, 2015"
1425,4.0,"HSBC BANK USA,  N.A.",Excellent benefits; 30 days paid days off and holidays plus an excellent 401K,Limited opportunities for advancement and not much recognition from Senior Management.,Assistant Branch Manager,Former Employee,"New York, NY","Mar 1, 2017"
1426,4.0,Personal banker ... take care of clients basic banking needs ...,Benefits are good .. medical is good,90 days on boarding process ... a lot of miss communication,Personal Banker,Current Employee,"New York, NY","Sep 21, 2018"
1427,3.0,Decent place to work.,Great benefits. Decent pay. Career growth within company. Paid time off is 3 weeks. 401k match is 6% as long as you contribute 4%.,"Burocracy!! Talk about inability to change quickly. The layers of managment present a good opportunityfor advancement, bu with so many it hinders the abilities of the company. Interview process is long and arduous.",,Former Employe,"Birmingham, AL","Dec 10, 2009"
1428,4.0,neutral,"good life and work balance. A lot of personal time, and lot of exposures to the line of business.",a lot of bureaucratic in such a big corporation. Especially it is during a acquisition period,Senior Financial Analyst,Former Employee,"Chicago, IL","Oct 20, 2012"
1429,2.0,If you seek career development and fair management -- keep looking,"Benefits were pretty good, although employee portion starting to get more expensive
Holidays and paid time off were nice (although not as nice as in Europe -- especially France)
Remote working allowed pending role and manager approval.
Decent technology implemented for employees including wireless phone headsets, VPN, and instant messaging","Culture of good old boys
If you're not British nor a minority (sex, race) don't count on promotions
Work/life balance with global timezones
Funder of international terrorism and money launderer",Information Technology,Former Employee,"Mettawa, IL","Sep 10, 2013"
1430,4.0,Solid corporate environment,"Good people, management attempts to do the right things",Typical red tape of a large corporation,Project Manager,Current Employee,"Las Vegas, NV","Feb 5, 2014"
1431,5.0,Always learning,I worked for fair and honest people who invested in me and my future.  I had a wonderful 20+years.,Closed my division but with plenty of advance notice,Vice President,Former Employee,,"Mar 7, 2017"
1432,5.0,HSBC Review,Work from home option is awesome.  I feel there is an open door policy there with management.,"Some of the processes are time consuming, but I know in place for security reasons",Anonymous Employee,Current Employe,,"Aug 24, 2017"
1433,5.0,Awesome Company,"I loved the people i worked with, I loved my role, and i loved my paycheck",Some of the downsides were getting no to little notice of overtime,Anonymous Employee,Former Employee,"New York, NY","Nov 2, 2017"
1434,4.0,Teller,"Great hours, holidays off, understanding management",repetitive. Felt like a midway job. Sales quotas were nearly impossible deepening on how busy branch was.,,Former Employe,,"Dec 8, 2017"
1435,2.0,Location over skills,"Decent pay and vacation time, health benefits are decent, encourage working at home which saves money on commuting, thats all","Unorganized, reactive, cares more about location of employee than skills & experience of employee, promotions are few and far between, constantly outsourcing to unqualifed India employees, lack of communication across departments, lots of known inconsistencies",Compliance Officer,Current Employee,,"Apr 24, 2018"
1436,4.0,Good place to work overall,"Good work life balance, pay is good, good PTO",Hard to advance and organization changes dramatically quite often so it can leave you feeling insecure about your position in the company,,Former Employe,,"Feb 11, 2019"
1437,2.0,Great Goals no Business Plan,"Coworkers, they are the best in the business, HSBC takes good care in hiring people for the positions at their company","Management has no idea how to set attainable goals for bankers
Management is under the illusion that all branches perform the same.
Computer system stuck in the 80's DOS anyone?",Personal Banker,Former Employe,"New York, NY","Sep 25, 2011"
1438,4.0,Good place to work at!,"Large multinational with diverse economic exposures.
Diverse roles and internal movement is possible
Good leadership
Merit based culture","Hierarchical and bureaucratic
Longer times to get things approved",Lead Credit Policy and Risk Analyst,Current Employee,"Tigard, OR","Jun 8, 2012"
1439,1.0,Corporate culture in a steep decline - View of 20+ year employee,"Good benefit packages (although has been shrinking over time)
Work from home program
Comfortable work enviroment","Atmosphere has changed from creative to punitive
Moral very low due to constant layoffs 
Bonus and pay schemes have become miserly",Senior Consultant,Former Employee,"Salinas, CA","Oct 3, 2013"
1440,5.0,I enjoyed working at HSBC for 18 years.,The people I worked with.,They closed the mortgage units and my job was out sourced.,Records,Former Employee,"Elmhurst, IL","Jan 8, 2014"
