,Rating,Title,Pro,Con,Job Title,Status,Region,Date
0,5.0,PDO - GO,"Amazing place to work, great offices, amazing people, good vision",Most people are remote now so not much coworker interaction. Layoffs,Project Manager,Current Employee,"Sunnyvale, CA","Mar 17, 2023"
1,5.0,"Open, fast, no bs","It might be easy to roll your eyes when people from Facebook say how open their culture is, but it's true; it's more open than any other place I've worked at. At a company wide-level, secret projects, public incidents, important non-public business metrics and the like are all openly discussed. You can ask questions about them directly to Zuckerburg at the weekly Q&A. I think the idea is that if everyone is on the same page or at least, differing views are heard, the company will be stronger, and solutions may be offered from a place you didn't expect. This is much different from previous companies I worked at, where discussions on internal email lists would be shut down by some lawyer saying that there's certain things that can't be discussed, and important data is divided up to groups and individuals on a ""need to know"" basis, etc. 

This culture applies at a lower level too. You feel comfortable giving feedback to each other about each other, about product decisions, about management, etc. The flipside of this openness is that you of course, have to be willing to receive the feedback, you have to recognize that while openness and feedback is highly encouraged, decisions have to get made, and actions and data are more valuable than words. At the higher level, since the company trusts employees with access to so much information, keeping such info confidential from the outside world is taken seriously.

It's a great place to work as an engineer. You're given a lot of freedom, but it's also a responsibility to make sure you're doing things that are valuable. You don't get much credit for working hard or being smart if you don't produce valuable output.

One cool thing about Facebook, in contrast to other comparable companies (Google, Amazon, and Microsoft, though in truth, FB is much smaller), is how they have a pretty singular focus. Even with the differing areas (including advertising and such), they do a good job of keeping their eye on their mission of connecting as many people as possible. I also think they are way more empathetic to their users than most people give them credit for. It seems like popular opinion has it that FB is arrogant and only cares about its users insomuch as they represent $-signs. From within the company, it didn't feel this way at all. I saw a lot of empathy towards users, and a lot effort spent to improve or things or fix broken things with no direct financial benefit. The strategy is not complex. The thinking is that if they can make FB easier and more fun to use, then more people will use it for more time each day (which will also have a network effect of attracting even more people to use it), then the advertising dollars will follow. Of course, it is true that FB wants to make the audience more accessible to advertisers as well, but there are a lot of people at FB who care about privacy and security.

They have really good infrastructure and really great ways to share the infrastructure and code. They have a lot of cool internal tools, and what they've built is really impressive, and more importantly, it helps your team build products faster without having to solve problems that someone else already solved. Every software company tries to do this, but FB seems to have been more successful with it. Perhaps it's because they're still relatively small, but if anything, I can at least say it is very cool while it lasts.

The perks and work environment are great, unless you're one of those types that can't stand open office spaces. I've worked in both a private office and open offices in multiple companies. While I do think a private office has some benefits, I mostly think it's a personal luxury for the employee and a huge waste of money for the company. I'd much rather have the money go into other areas like salary, benefits, and other workplace improvements rather than the added real estate necessary to have offices.

Of course, you've heard about the food and snacks. They have an amazing selection of great stuff, and what I like about it is that it sort of goes above and beyond expectations. Sure, some days, lunch is better than others, but I really can't complain, and the selection of drinks and snacks is amazing. It's not like you should work at FB just because of that, but it demonstrates FB's desire to make work as fun and convenient as possible.

You'll be surrounded by people who like being there. I can't think of a better environment to work in. If you have a giant ego, you may not like it as much. Respect is definitely given to those that have deep experience in the industry, and they are expected to lead others and mentor more junior employees. However, if for whatever reason, you can't perform at the level expected, no one is going to care if you did this and that at Google or shipped ten things at MS, etc.

FB also has a lot of fun events, and I made a lot of friends working there, so going to the events was fun. Also, if you're older and worried that FB is just a bunch of 22-year-olds, and that you won't fit in, I wouldn't worry about that. FB does have a lot of young employees (who are really smart btw), and it does hire a lot of people straight out of college, but it also attracts a lot of experienced engineers from other top companies like Google, MS, Amazon, etc.

Work-life-balance seemed totally normal to me. It may be different depending on your team, but I felt you could do 40-50 hours of work a week for the most part and you would be totally fine. It's about what you produce, not how hard you're working. Other team members who had children would work normal hours and go home at normal times. I didn't see any of these folks have a problem when they left early to take care of their child or things like that. Of course, there could be times that people are expected to work extra if something critical happens, but for the most part everyone wants to avoid this and this happens sparingly, from what I observed. Now, there were many times where I chose to work late myself, but I never felt any pressure to do so. The caveat is that there are on-call rotations, and in addition, even if you are not on-call, you are expected to be reasonably available if the on-call person needs your help. However, again, no one wants this, and your team will work on ways to avoid these situations.

The best thing I can say is that working at FB is about productivity. I didn't experience and political bs and it was a pleasure working with a group of people who were all concerned with producing a good product and making the best of the time spent while doing it.","FB expects a lot out of engineers, and you can't slack off. Of course, you shouldn't slack off at any job, but since FB is pretty fast-paced, there is a risk that you'll have trouble adjusting at first.

FB has a lot of custom infrastructure and tools, and prehaps more impressively, it works great. It makes doing your job really great, but on the other hand, you'll end up learning a lot of stuff that won't be applicable elsewhere.

FB's code-base is very good in some ways, but in other ways, it's not as great as some of the existing engineers think it is. I don't think this is that big of a deal, but the important part is that as an engineer, you need to quickly learn FB's values and practices and ""get with the program"" so to speak. If you don't like some things, then you just have to deal with it, as it's not likely you're going to change people's minds at this point. The nice thing is that things are at least very consistent.",Software Development Engineer,Former Employee,"Seattle, WA","Mar 17, 2014"
2,5.0,"Fast paced company with high expectations, but incredibly fair. You won't a place that cares more about it's people.","- Incredible benefits 
- Excellent compensation that rewards strong performance 
- Lots of autonomy 
- Tons of room for growth
- Very transparent from the top down
- Strong leadership
- Intelligent and caring colleagues
- The most fair and well thought out review process you will find everywhere 
- Exciting work","- If you don't learn to make the work life balance work for you, it can be exhausting. But you'll also be given lots of support with this if you ask for it. 
- It doesn't matter how good you are at your job, chances are you're going to be surrounded by a ton of other people who are just as good if not better. Imposter syndrome is real, but if you got an offer, you probably belong here too.",Anonymous Employee,Current Employee,"Menlo Park, CA","Feb 16, 2017"
3,5.0,Pleasantly Surprised,"I'm a 55 year old working in a company where the average age is 28, and I've never been happier. I have always wanted to work in a company where I wasn't the proverbial square peg, and after nearly 30 years in the work force, I believe that I have found the company that complements my ideology for how a company should operate. Here are the ""Pros"" as I see them...

- Leadership:  Mark Zuckerberg, Sheryl Sandberg, Chris Cox and the rest of the leadership team. Inspiring, smart and totally real.
- The Culture:  The openness is a real thing, we're trusted to do the right thing, mistakes are expected, being yourself is important and encouraged, humility is encouraged and expected, building trust is paramount, the mission of making the world a more open and connected place isn't just a cool phrase because it guides everything. It's not about us, it's about everyone else.
- The People:  Smart and nice is what I find. The diversity is better than any other company I've worked at and it's getting better. Those that are figuring out how to make what we do better for everyone are really good at implementing their ideas. Two years ago I didn't know what this company really was or if it had a secure future. I can clearly see now that they have what it takes to last, and it's sincere.
- Management:  Managers are hired because they're good managers and not because they're good at something else. The management track is different than the contributor track and they're equal in importance.
- Benefits:  Working in the Valley it's hard to differentiate all the benefits employees receive and Facebook is at least equal to all the major tech companies, but coming from Seattle the benefits are nothing short of incredible.

Granted, I haven't been with the company for very long and I'm still in the honeymoon period, but I can tell what's real and what's not; this place is for real.","Like any tech company, the work is big and complicated so work/life balance can suffer from time to time. The difference is that it's the passion within the individuals that drives them to work long hours and forego time off. Of course there can be times when schedule demands force the imbalance, but it's not such that 10-12 hours days become commonplace and expected regardless. We do what we do to get the job done; no one is killing themselves because there's an order to do so.

Being able to eat to your hearts/stomachs content can be dangerous to the waistline, but that's a self-control thing and not the company's issue.",Site Selection Program Manager,Current Employe,"Menlo Park, CA","Feb 16, 2016"
4,2.0,Wanted to love it,"* salary/perks/401k contributions 
* A lot of really smart people to learn from and grow your skills. Well-seasoned ""engineers at heart"". 
* Access to incredible scale (of systems) not present outside of FAANG * If you get lucky, you'll get a good manager who has your back and maintains integrity and helps you grow. If you're even luckier, you'll get into a functional team with reasonable expectations.","* lots of toxic senior people and management that will use any excuse to cut you down and lie to your face repeatedly without consequences 
* Lots of insufferable politics that leave services in a terrible state and the team ends up with really high turnover rate because no one wants to stay
 * Extreme, constant, and unnecessary pressure to ""perform"" that may leave you with poor mental and physical health. 
* If there's no metrics to back anything you've invested effort into in order to do it right/better for the long term, it didn't happen and it doesn't matter. 
* Be prepared to constantly defend your entire existence and worth, especially if you're an early-career engineer. There's no trust in engineers, only engineers who become at least part-time politicians. Be prepared to become a blogger so you can advertise everything you're doing to people who don't care by posting to internal groups so that it looks good in front of management and is easier to ""sell"" during performance evaluations. An introvert's nightmare. 
* There's no ""bottom-up"" culture anymore, you do what you're told, or else.",Production Engineer,Current Employee,"Bellevue, WA","Mar 10, 2023"
5,5.0,People Focused,"Facebook deeply cares about its employees and has built a compelling culture around support and growth. Career growth opportunities are plentiful. If you don't like the team you're on or don't get the support you want from your manger, Facebook empowers you to find new teams or projects. Facebook wants its employees to be invested in their work and to feel connected to its larger mission. If large scale opportunities and growth are important to you, Facebook is a fantastic place to work.",Facebook's culture is demanding and fast paced. The greatest aspect of working at Facebook is that everyone is very motivated and very smart. The problem with this is that they all expect the very same of you. Holding a very high bar for excellence can certainly be demanding so it's important to make sure you're always carefully paying attention to your own personal work/life balance.,Engineering Manager,Current Employee,"San Francisco, CA","May 24, 2020"
6,4.0,it's fine. the sun will eventually swallow our planet.,"- good benefits (wellness and 401k in particular) - great internal tools - integration between privacy, code review, task management, etc systems is honestly really really impressive. I wish this kind of thing was just open source and available to the general public - new macbook pro and work iphone. Feels nice to disconnect at the end of the day - you can install Ableton Live or Steam or whatever on your work laptop. We've crowdsourced security. Godspeed You! IT People - very remote friendly (at least for now) with support to visit main office quarterly - I really respect the people I work with. Clever and (mostly) patient. - plenty of snacks, drinks, golden handcuffs, etc in-office but all the drinks are loaded with caffeine. Lemme get just a nice ginger kombucha please - really excellent food at MPK. Hats off to the food service folks - everyone I work with cares about writing quality code and doing careful ML work","- why is there so much money flowing to this goofy industry? - why can't we as a society afford to feed and house people, but we can allocate a zillion dollars to Facebook??? - Mark owns an estate in Hawaii? sus. you don't need all that money. I barely need my IC4 money. Grow up. Get a real haircut. - I regularly run into tables without documentation or ambiguous columns with no comments. Sometimes comments just say ""contact jerry about this"" but jerry hasn't worked there for 10 years - I have wrestled with more bureaucracy here than I ever did in academia. I will concede that in some cases this is good for privacy - Mark saying ""Why did our stock price tank? Oh it's because our engineers are too lazy! Time to fire thousands of them. But uhhhhhhhhhhhh I take responsibility I guess"" isn't great. Buddy, the stock market is not God. Money is fake. Stocks even more so. We're all just twiddling our thumbs until we die. None of this is real. Embrace the void. Give someone you don't know $20. Call your mom. Make a nice dinner for your friends. - Zuck seems to use the adjective ""macroeconomic"" every single time he speaks. Weird rhetorical tic. Doesn't make him sound serious. Sounds very goofy imo",Research Scientist,Current Employee,"Richmond, VA","Mar 8, 2023"
7,2.0,"Good colleagues, crap leadership","I have worked with some of the most talented and caring people in my time at Meta. The work is constantly changing, which can either keep you engaged (me) or frustrate you.","The leadership at Meta is completely and utterly terrible, and getting worse every year. The company direction is to chase the next big thing — crypto, short-form video, the meta verse — without putting enough thought or care into how it should be done. There has been no accountability for mistake that lead to the 11/22 lay-offs, and the “year of efficiency” in 2023 has, so far, been a farce as very little work is getting done.",Research Manager,Current Employee,"Menlo Park, CA","Mar 12, 2023"
8,4.0,It's wonderful until it's not,"Meta is very inclusive, I felt very welcome and it certainly is a welcoming place with all the ways to be involved in your areas of interest. This is enhanced because the people are top notch. The software you use at work is similar to FB. I found I liked the various groups and social atmosphere during the day to day grind. It seemed to be a job with stability and a place where you can be yourself. Benefits are great and the people are excellent for the most part.","Unfortunately Meta has over-hired and laid off 11,ooo people. I've had four managers in 8 months. The work flow was so broken we resorted to using google docs/sheets most of the time. The clarity of how you accomplish things is often muddled and it causes everyone to have to re-create the wheel constantly. The performance review process was a disaster in so many ways, They have adjusted it going forward, but overall clear and concise feedback was like vapor, hard to capture anything constructive. It does seem that the sad reality is that the bottoms up culture just means you have to work harder, there's just that many more things that you have to carve out time for on an ongoing basis.",Leadership Sourcer,Current Employee,"Honolulu, HI","Nov 21, 2022"
9,5.0,"Great company overall, just facing hard times","Overall, love the people I work with, love Meta's dedication to DEI in all we do, and we have an interesting value proposition for the future.","Huge lack of planning org-wide. This leads to continous layoffs/uncertainty and lots of duplication of work/inefficient processes. Also still fighting a culture that has been bottom up for so long, which in terms of being impactful and getting things done that benefit the business, not just individuals, makes things difficult as a manager.","Manager, Recruiting",Current Employee,"Houston, TX","Feb 27, 2023"
10,4.0,Good place to work,"Learning quickly Great benefits Good comp/level Great office -food, gym, facilities made you want to stay and get work done",Management focused on technical background vs. actual output. “What kind of engineer are you?” Inconsistent promotion practices,Project Engineer,Former Employee,"Fremont, CA","Mar 15, 2023"
11,4.0,Take Care of Their People,Overall great place to work. They truly invest in their people. Had some of my best managers here. A lot of room to be an entrepreneur and feel a sense of ownership over your career.,"Before their layoffs, the company was also too fragmented in terms of roles and responsibilities. It made it difficult to find your place and feel like you offer value. Company also changed priorities a lot which became discouraging after awhile because it was difficult to feel like you could accomplish anything.",Comms Planning,Former Employee,"Menlo Park, CA","Feb 22, 2023"
12,5.0,Great job if you have a good team,"The culture at Meta is entirely team-dependent. The boot camp process is great because you pick your own team. I was lucky enough to join at a time when every team needed more people, so I was able to choose a team that I meshed really well with.",Not sure if people being hired in 2023 will have the same luxury of picking and choosing teams. Performance reviews can be tough if you can't prove definitely that you moved a metric or some kind of number.,Software Engineer,Current Employee,"Seattle, WA","Mar 2, 2023"
13,4.0,You get what you expect,"You get what you expect - Really great benefits like one of the best healthcare I've seen in the US corporate world, stipends, great 401k match, great in office amenities, supportive ERGs, pretty good work-life balance, the brand name on resume (that may no longer be so relevant in 2023). All the people you work with are incredibly talented and smart. Super inclusive and diversity minded - everyone is open minded and respectful. Career opportunities are abound (lateral transfers and team changes) but you will have to be very sharp, politically savvy, and patient for a promotion. 3+ years wait for a promotion is not uncommon. If you came from start up environment this would be very difficult. Most of very smart ICs with leadership aspiration leave because they don't see themselves climbing or losing their life to compete in the pool. Good thing is I've seen everyone move on to higher paying jobs at arguably more fun companies after 2 years or so if you are fine with job hopping then this should be good!","Same.. You get what you expect from a huge company with lots of 'scandals' ; always being in news for negative headlines and layoffs impact employee morale. Constant org changes and bureaucratic processes impact how fast you can get work done even though you are constantly told to move fast. Getting a tiny change out takes weeks, and because it's tiny even though it can lead to great improvement long-term, it gets deprioritized and every resource gets put in bigger, higher impact projects. So you are building sophisticated castle on shaky sandy foundation, until things break!",Project Manager,Current Employe,"Austin, TX","Feb 23, 2023"
14,4.0,Intelligent colleagues,"You get to work with very bright, very intelligent colleagues who push you on a daily basis.","Given the macro environment, current morale is a bit low and folks are stressed more about job security.",Software Engineer,Current Employe,"Boise, ID","Mar 17, 2023"
15,5.0,Great company,* Hack culture and move fast * Tons of things to learn at your free time * Talented coworkers,"Do not go to Rotational Engineer Program, a couple of the poor guys in my team didn't receive offer at the end even they were doing even much better than me! It's a scam. I feel sorry for them to join this program.",Software Engineer,Current Employee,"New York, NY","Mar 6, 2023"
16,4.0,Great,- Solid backend teams - Great learning experience - Room for growth and leadership,- Low company morale - Layoffs during bad times - Lack of faith in leadership,IC4,Current Employee,"Bellevue, WA","Mar 7, 2023"
17,4.0,Meta treats employees really well.,"Impact, Autonomy, Compensation, Benefits, Management, Flexible work option","Ambiguity. Although needed, the change from a growth company to mature company affecting employees and culture through layoffs.",Supply Planning Analyst,Current Employe,"Austin, TX","Mar 16, 2023"
18,5.0,Fantastic place to work!,- Care for people (despite all the negative news about layoffs) - Amazing technologies - Brighter/smarter people - Benefits - Pay,- Uncertain business outlook - Recent churn in focus/strategy,Technology Program Manager,Current Employee,"Seattle, WA","Mar 14, 2023"
19,5.0,Benefits galore,"They treat you so well, the work is hard and intense but I feel grateful.",Lay-off vibe- people are stressed and feel like they have to over work.,Product Design Manager,Current Employe,"New York, NY","Mar 15, 2023"
20,5.0,Has its challenges but overall a great place for strong performers,"-Highly depends on your team and manager, but overall culture is great helpful teammates, supportive leadership, focus on solving problems vs pointing fingers, recognizes hard work. -Also depends on the team but hybrid WFH/on-site is a huge pro, nobody checks when you're online or in office as long as you get your work done and stay responsive during business hours. -culture of direct feedback and transparency - you'll know where you stand and what areas you need to improve on to accomplish your career goals","-Lots of changes and constant shifts in strategy/org structure add a lot of operational work, but finance has a great centralized function to streamline reporting/data pulls -short staffed after layoffs, work-life balance isn't good during busy periods but that's true for most companies these days",Finance Manager,Current Employee,"Menlo Park, CA","Jan 26, 2023"
21,4.0,can’t move fast any more,benefits great coworkers fancy campus nice desserts,career development depends on your potin the team hard to get bigger scope,Software Engineer,Former Employe,"Menlo Park, CA","Mar 17, 2023"
22,5.0,Great place to propel your career,"work-life balance, talented teams, visibility, a friendly environment, diverse workforce, opportunity to learn","restructuring at the moment, job instablity",Product Manager,Former Employee,"New York, NY","Mar 15, 2023"
23,5.0,Changing company,Great benefits and comp and great people in the compay,Challenges with restructuring that are necessary,Senior Engineering Manager,Current Employee,"Seattle, WA","Mar 16, 2023"
