,pros,cons,advice
237,"- Good pay - Good benefits (insurance, convenience service)","What was once a bottom-up engineer driven company is now incredible top down and bureaucratic. It's expected at this scale, but as recently as 3 years ago I felt like engineers played a huge part in driving team/org direction. The org leads now can't decide what they want and don't consult engineering for scoping estimates, leading to tons of churn and frustration. Overall there's been a huge shift to monetization focused efforts, but even with that the leads will panic and pivot frequently, leading to a really difficult culture to actually get anything shipped",nil
238,-High compensation -Challenge you to do your best work -High performance culture,-Chaotic with constant change -Burn out is real -Too much bureaucracy,nil
239,"Good perks, transparent, talented colleague","Work life balance, peer pressure & psi",nil
240,Great benefits and pay is good,Work life balance is not great,nil
241,"Good pay, food, and culture",Need better management. Immigration process.,nil
242,"Company tries hard to provide for employees, but the demands are high","Inexperienced, immature management, lots of folks started their careers at and “grew up at FB” but do not have varied experience. Lack of diversity or any significant, robust programs to increase diverse representations.",nil
243,- all meals are provided on-campus/in-office - team is very accommodating and willing to help - generous PTO - room for growth in career + outside as well - wellness benefit can be used for other things besides Fitness reimbursement,- declining stock price - lots of ambiguity / make your own schedule (which can be a pro to some),nil
244,"Excellent perks, health and wellness benefits, work life balance, compassionate people, impactful work.","Room for more business efficiencies (ie less redundant people managers, less subjective spending) and transparency from leadership.",nil
245,"Diverse culture, great campus and wonderful perks!",There are no cons that I can think of.,nil
246,Outstanding people to work with. I had the best manager and worked on the best team doing the most important work for DEI recruiting.,Meta was too aggressive in hiring during the pandemic which resulted in laying off most of the recruiting team,nil
247,"working remotely, participating in different projects","promotion is based on IC, manager does not initiate this conversation",nil
248,"What brought me here was the brand, what keeps me here are the challenges we face and the talented and fabulous people that I get to work with and learn from. In the two years that I have been here I have learned more than what I have learned in my entire career. I have learned from how others process information and look things, their approach to solving problems, how they structure information and the flags they raise. I have been able to see 'in action' different perspective that have brought awareness and growth, personally and professionally. The people I work with, is the number one reason I am still, and will continue to work here. A second important factor is the flexibility and multiple options that employees are given for returning to work post-pandemic. We have the ability to request remote work and relocate. Every employee has the option to tailor their work schedules and adopt to suite their life styles. Fair and competitive compensation and benefits are secondary.","Every workplace has opportunities for growth and while not everything is perfect at Meta, no one has said that we have stopped growing. The constant changes indicate the pains of growth and bring hope that things are being looked at and that feedback from employees is being applied. My advise to those who flag issues and are passionate about specific changes is to stick around, work internally and drive change. Don't leave, work and make a change!",nil
249,I trust the ceo and like the people,nothing really to mention here,nil
250,"Insane amounts of care for employees between unlimited sick days, cheap but world class benefits, advisors, free meals on site, and tech disbursements","Everything moves slow here. While work life balance is incredibly reasonable and fair, expect to work after hours on personal work if you want to make sure you do not stagnate as a ""meta employee"" as opposed to being relevant in your industry as a whole long-term",nil
251,"Employee well-being, pay, flat organization, diverse team background, perks!","Redundant infra, slow internal tooling, peer pressure, short-term goal driven",nil
252,"Benefits, Culture, Growth, People, Offices, Training resources","Overinvestment in Metaverse, a lot of consensus building, products with poor product market fit",nil
253,Good flexibility benefits culture transparency,A lot of work to manage,nil
254,"Opportunity to work remote, good pay, great benefits","Company is currently a bit volatile with the layoffs happening, it is hard to move up in your role",nil
255,Everything. From benefits to culture to management to growth opportunities. Best job I've ever had.,None I can think of.,nil
256,"Severance was 4 months which is amazing. 2 months of ""still an employee"" so visa status is fine. My coworkers where amazing people, coming to work was a blast.","You can get spontaneously laid off. Internal communication from leadership is incredibly bad and/or misleading. Work and life balance can get bad. Internal communication tool, Workplace, creates a very competitive and sometimes toxic working culture.",nil
257,"Good worklife balance, pay and culture","Lots of reorganization happening, need to take initiatives in everything",nil
258,"Amazing benefits, and fun company to be a part of.",Lots of changes that it's hard to keep up with at times.,nil
259,"High pay, visionary leader that is passionate",Very burnt out after November layoffs,nil
260,I think it has the best work environment,No major problems but sometimes I feel less work life balance,nil
261,"Awesome culture , benefits and ability to push thro ideas.",Leadership immature but empowered. Makes for potent combination to frustrate employees.,nil
262,"Fast promotions for junior engineers, good benefits, good talent at the company.","High performance expectations, moderate-to-low WLB.",nil
263,"Salary, company culture, pay, benefits","return offers rescinded, difficult economical times",nil
264,"Great technology, great pay, great conditions",Screw in the mega machine,nil
265,It's a celebrity company so you get the exposure.,"Too much red tape, very structured.",nil
266,lots of smart people to work with,Long hours depending on the team,nil
267,Work-life balance Autonomy Great community to share ideas and experiences Opportunities to collab even in a remote setting,None that come to mind,nil
268,Money is good for me,Lay off when I joined Meta in the 2nd month.,nil
269,The culture encourages you to share your knowledge for success and you are able to work autonomous and as a team with the same goal in mind.,"There is Information overload at times, but having great leaders to help you focus on what's important helps.",nil
270,It's a celebrity company so you get the exposure.,"Too much red tape, very structured.",nil
271,lots of smart people to work with,Long hours depending on the team,nil
272,Work-life balance Autonomy Great community to share ideas and experiences Opportunities to collab even in a remote setting,None that come to mind,nil
273,Money is good for me,Lay off when I joined Meta in the 2nd month.,nil
274,The culture encourages you to share your knowledge for success and you are able to work autonomous and as a team with the same goal in mind.,"There is Information overload at times, but having great leaders to help you focus on what's important helps.",nil
275,"My engineering team is research adjacent, and we have a lot of creative freedom to solve our problems. Problems are always fresh and challenging, also have no production oriented deadlines and thus good work life balance (unlike the average team).","Stock price volatile. Depending on how ARVR takes to the market, there's really no lower bound to how low stock prices drop.",nil
276,-String team environment -Great pay -Valuable skill growth,-Workload -Fast pace -Upholding brand identity,nil
277,"Salary, offices all over the world, flexible working pattern","Peer pressure, Calibration pressure, bad WLB",nil
278,fast paced if you're into that strong culture--everyone is very approachable great benefits + healthcare,"""refocus"" toward the Metaverse which won't have a payoff for years (if at all) the moral quandary of working with facebook products",nil
279,"-flexibility -no micromanaging, get your job done and you're good -People - smart smart smart people -Healthy balance between professionalism and normalcy -Work life balance -3 meals a day",-Communication from higher up will not always be delivered the right way but it has to be done this way because of media. They try their best.,nil
280,Great perks and benefits... they have the best in the industry.,"Take a look at Meta's stocks... I blame that not just on the economy, but also Zuck/senior leaders lack of strategy. Recent mass layoffs and exodus of talent to to blindly over-hiring during the instability of a pandemic. Not to mention the constant hot water the product strategy ends up facing in media and politics. Not a company for the relaxed or faint of heart.",nil
281,"Good pay, food, and culture",Need better management. Immigration process.,nil
282,- all meals are provided on-campus/in-office - team is very accommodating and willing to help - generous PTO - room for growth in career + outside as well - wellness benefit can be used for other things besides Fitness reimbursement,- declining stock price - lots of ambiguity / make your own schedule (which can be a pro to some),nil
283,"Excellent perks, health and wellness benefits, work life balance, compassionate people, impactful work.","Room for more business efficiencies (ie less redundant people managers, less subjective spending) and transparency from leadership.",nil
284,"Diverse culture, great campus and wonderful perks!",There are no cons that I can think of.,nil
285,Free food and there are some good people,"Toxic environment driven by a sense of false elitism. People in recruiting think they are better than they actually are, which is the furthest thing from the truth. This was the worst job ever. My colleagues would often talk bad about each other, including me, and it was very cliquey. It reminded me of middle school.",nil
286,Outstanding people to work with. I had the best manager and worked on the best team doing the most important work for DEI recruiting.,Meta was too aggressive in hiring during the pandemic which resulted in laying off most of the recruiting team,nil
287,"What brought me here was the brand, what keeps me here are the challenges we face and the talented and fabulous people that I get to work with and learn from. In the two years that I have been here I have learned more than what I have learned in my entire career. I have learned from how others process information and look things, their approach to solving problems, how they structure information and the flags they raise. I have been able to see 'in action' different perspective that have brought awareness and growth, personally and professionally. The people I work with, is the number one reason I am still, and will continue to work here. A second important factor is the flexibility and multiple options that employees are given for returning to work post-pandemic. We have the ability to request remote work and relocate. Every employee has the option to tailor their work schedules and adopt to suite their life styles. Fair and competitive compensation and benefits are secondary.","Every workplace has opportunities for growth and while not everything is perfect at Meta, no one has said that we have stopped growing. The constant changes indicate the pains of growth and bring hope that things are being looked at and that feedback from employees is being applied. My advise to those who flag issues and are passionate about specific changes is to stick around, work internally and drive change. Don't leave, work and make a change!",nil
288,I trust the ceo and like the people,nothing really to mention here,nil
289,"Insane amounts of care for employees between unlimited sick days, cheap but world class benefits, advisors, free meals on site, and tech disbursements","Everything moves slow here. While work life balance is incredibly reasonable and fair, expect to work after hours on personal work if you want to make sure you do not stagnate as a ""meta employee"" as opposed to being relevant in your industry as a whole long-term",nil
290,Great place to learn and grow,Impact culture is not for everyone,nil
291,Impact on billions of people,Always being in the news,nil
292,- People. Some of the best in the industry - Lot to learn. Respect in the industry - Switch teams if the current one doesn't work out - Best compensation (before stock value nose-dived),- Mark is risking a lot for Metaverse. Reduce the risk associated - Dont expect WLB,nil
293,Benefits. Move fast culture. Insane scale and learning opportunities,remote work is challenging. can be difficult to navigate the internal structure,nil
294,"Flat organization structure, not a lot of politics",Hired too many people and now with the layoffs I'm afraid that original culture is gone for good.,nil
295,IC driven; mostly standardized systems; move fast culture,A lot of churn recently,nil
296,High performing teammates and challenging projects.,Moving further into a high corporate environment has significantly changed the culture.,nil
297,"Work with modern technologies, interesting problem set","Lack of documentation, lack of communication, lack of direction",nil
298,Lots of opportunities for gaining experience.,Too much red tape slows progress.,nil
299,"Amazing benefits, extremely smart and collaborative colleagues, remote work",Operates like a startup so lots of swirl,nil
300,I think it has the best work environment,No major problems but sometimes I feel less work life balance,nil
301,"Fast promotions for junior engineers, good benefits, good talent at the company.","High performance expectations, moderate-to-low WLB.",nil
302,Meta is only great for engineers,Not respecting non-engineering culture; Massive wasting resources on no-value project; Over hired by at least 50%;,nil
303,"Salary, company culture, pay, benefits","return offers rescinded, difficult economical times",nil
304,"Food, snacks, amenities are amazing","Work isnt impactful, a lot of the stuff done was very mundane",nil
305,"Great benefits, competitive salary, lots of opportunities for growth","Poor direction, lack of team motivation. Ratings and Sales quotas are completely gamified",nil
306,company benefits are very good for covering family care,people work in a nonefficiency way,nil
307,Impact is huge A lot of smart people around you to learn from Work life balance is great,"Everyone are optimizing for their yearly review and salary, this is the culture. The mission is not to bring people together or at least nobody cares about it. It’s about getting the best performance rating and hacking your way around it.",nil
308,Work-life balance Autonomy Great community to share ideas and experiences Opportunities to collab even in a remote setting,None that come to mind,nil
309,"Work environment, cultural, compensation, food, benefits","Leadership, politics, Leadership, PSC, Leadership",nil
310,"Food, pay, people, benefits, just about everything","Layoffs, Mark Zuckerburg, the media",nil
311,good to work for for the time being,not anything I could think of,nil
312,"- You get to work with really smart, kind, hardworking people on products that impact the world. - Great perks, delicious in office food and a fun work culture that feels like an extension of college. Great for extroverts and people looking to make friends at work.","- Stock price constantly fluctuating - Metaverse bets, uncertainty regarding the company's future",nil
313,Benefits Comp Autonomy Work Life Balance,"Leadership has to sugar coat everything due to leaks, pressure from external shareholders, and they also have to give themselves an ""out"" in the event decision making leads to poor business results.",nil
314,"Good place to work, takes care of employees and great work-life balance.","As an analyst, if you are in teams that don't focus on technical projects that call for advanced skillsets (e.g., ML) you won't have much opportunity to learn.",nil
315,* Flexible hybrid work * Great comp * Everyone is very smart and hardworking,"* Difficult to enact large-scale change, lots of focus on small optimizations * Some groups are more willing to accept DS help than others",nil
316,- hard and interesting problems - very talented people around you,- PSC driven mentality making it annoying to do long term meaningful work sometimes,nil
317,"- tremendous amount of flexibility with location, schedule - inclusive & collaborative culture - great WLB - amazing company perks & benefits (e.g., health insurance, 2 choice days per year in addition to PTO (same as PTO basically), choice budget that can be used for wellness expense, family care expense, pet care expense) - People are fun, smart, supportive and respectful.",This is the best place I've worked for thus far.,nil
318,The food was good The co-workers were nice,The work place was not good The management is always at your head,nil
319,"Great benefits, great pay, nice culture","Bad business decisions, lack of streamlined data documentation or tables",nil
320,* Flexible hybrid work * Great comp * Everyone is very smart and hardworking,"* Difficult to enact large-scale change, lots of focus on small optimizations * Some groups are more willing to accept DS help than others",nil
321,"Good place to work, takes care of employees and great work-life balance.","As an analyst, if you are in teams that don't focus on technical projects that call for advanced skillsets (e.g., ML) you won't have much opportunity to learn.",nil
322,- hard and interesting problems - very talented people around you,- PSC driven mentality making it annoying to do long term meaningful work sometimes,nil
323,"- tremendous amount of flexibility with location, schedule - inclusive & collaborative culture - great WLB - amazing company perks & benefits (e.g., health insurance, 2 choice days per year in addition to PTO (same as PTO basically), choice budget that can be used for wellness expense, family care expense, pet care expense) - People are fun, smart, supportive and respectful.",This is the best place I've worked for thus far.,nil
324,The food was good The co-workers were nice,The work place was not good The management is always at your head,nil
325,"Great benefits, great pay, nice culture","Bad business decisions, lack of streamlined data documentation or tables",nil
326,"Best People, benefits, work culture and cool tech","fast evolving projects, volatility, no clear direction from leadership",nil
327,good benefits I like Mark Zuckerberg Team mobility Team mobility - Choose any team once you are hired,Hard to change teams in the first year,nil
328,"Amazing team, pay, benefits, culture and work life balance!",I do not have any Cons at this time.,nil
329,Perks and culture and campus is great,very competitive and high expectations,nil
330,"Good benefits, clear career growth path.","Poor work life balance, rushing environment.",nil
331,"- Good pay - Good benefits (insurance, convenience service)","What was once a bottom-up engineer driven company is now incredible top down and bureaucratic. It's expected at this scale, but as recently as 3 years ago I felt like engineers played a huge part in driving team/org direction. The org leads now can't decide what they want and don't consult engineering for scoping estimates, leading to tons of churn and frustration. Overall there's been a huge shift to monetization focused efforts, but even with that the leads will panic and pivot frequently, leading to a really difficult culture to actually get anything shipped",nil
332,-High compensation -Challenge you to do your best work -High performance culture,-Chaotic with constant change -Burn out is real -Too much bureaucracy,nil
333,Pay is the best. Free food. Great benefits overall.,No opportunity for growth once you hit IC4. Extremely metric focused.,nil
334,Top notch benefits Open culture WLB,Bad management Bottom up culture leads to lots of scope clashes,nil
335,"Benefits, Team, workplace perks, office locations",culture took a dip after company cuts,nil
336,large company with lots of different opportunities and benefits,i was laid off during my training period,nil
337,"Great benefits, extremely supportive people, lots of resources for training/learning",Team matching process is not very well structured,nil
338,"good compensation, nice offices, quality food","not good work-life balance, always pressure",nil
339,Good perks and nice pay,Bad management and strategy for the company,nil
340,Good perks and nice pay,Bad management and strategy for the company,nil
341,"pay high, learn quickly, well-known","competitive, move too fast, no work life balance,",nil
342,Learnings and Experience - The challenges and problems you get to encounter are unique and will make your evolve better.,"Meta has a bottom-tops culture. While some may find this interesting, some may struggle with alignment and direction",nil
343,Some of the kindest and self driven people to work with! Benefits are amazing if you’re not entitled!! Competitive wages for the role and industry.,"The original values and culture are no longer sustainable and scalable. We aren’t solving root causes and are vastly over staffed because of this. Refocusing on structure, process creation and implementation, reducing amount of “free reign” and long term planning at a team level vs short term sprint planning, could lead to more value add long term, better headcount planning and scaling, reduce financial stress during economic uncertainty and empower teams to create efficiencies vs looking for the next shiny object.",nil
344,"Culture, team, and benefits are amazing","Such a big company, and with working in the recruitment world, you have to stay on top of the media coverage to know what to say to candidates when they bring it up",nil
345,Pay Benefits Smart people Interesting products,"Misaligned goals across teams People/managers too PSC focused to get promoted Leads to unnecessary, pointless work Promotion is political",nil
346,"Flexibility, great problems to solve, amazing people","Changing priorities, large company with bureaucracy",nil
347,- smart people all around - pretty much some of the highest tech you can see in the field - perks - salary,Lots of stress if you're on a high profile project. Performance reviews are nightmares. Company direction is getting awkward. Too much external politics in the office.,nil
348,Collaborative team Free onsite food Relocation paid for and paid for apartment for duration of internship,Onboarding was challenging (too much recruiter overturn and lack of communication between intern and upper management),nil
349,"good company, with really smart peers.","hectic work, and little work life balance",nil
350,* nice benefits * opportunity to work on high impact project * very talent people,* metrics driven culture * less great WLB,nil
351,High pay for sure. And very good perks.,Not much autonomy. The work does not feel satisfying.,nil
352,- Tons of PTO - Supportive Team,"- For a gaming partnerships department, not many people on the team are gamers.",nil
353,Great benefits for its employees. I would say the best company I've worked for when it comes to how it treats their employees,"Nothing to say at the moment, great org",nil
354,"Innovative concepts, brilliant colleagues, great benefits",Very uncertain decision making and a sense of thrash.,nil
355,- Great benefits - Awesome projects - Huge independence,- Lack of respect for leadership - Very burocratic - Bad PR,nil
356,"Benefits, compensation, great people to work with",Too many leaders for few people actually doing the work,nil
357,"Perks and benefits are good, with a competitive salary Work is straight forward with not a lot of micromanagement",Some processes are redundant and you don't always know the direction the company is going Performance review cycles,nil
358,Meta has the best benefits. Most Talented HR Team and the best resources. Everything you need they have,"If you like to be more hands-on and get more into the weeds it can be difficult to identify where you can be most impactful. Most of the teams are pretty self sufficient so you find yourself in search of meaningful purpose with your team, which was difficult during COVID. Busiest time is during PSC for sure",nil
359,"-good benefits including $3000/year wellness benefits, $260/month commuter benefit, free food, gym, good insurance
-supportive managers and colleagues are generally nice to work with
-easy to transfer between teams","-unsure if the company direction is good. Are we really just going to copy TikTok? Is Metaverse really the future? 
-moves very slowly for certain teams. A lot of pushback from legal and policy. Always need a lot of 'alignment' from a bunch of people (too many people)
-the data scientist role is restricted to mostly analytics. we don't build models or do data engineering work since every role is specialized. As a result I haven't learnt anything new ever since I started working at Meta
-frequent re-orgs",nil
360,- Great benefits - Awesome projects - Huge independence,- Lack of respect for leadership - Very burocratic - Bad PR,nil
361,"Benefits, compensation, great people to work with",Too many leaders for few people actually doing the work,nil
