,Rating,Title,Pro,Con,Job Title,Status,Region,Date
538,2.0,"LOW BASE PAY & NON-TRANSPARENT COMMISSION,","-Flexible working hours but you need to have strong performance, else the manager will micro manage you.
-Good commission score card ( before COVID) but now you can only taking base pay (which is very low) because the new 2021 scorecard is insane and almost impossible for you toget commission even though you hit 100% target and submission, because there are alot multiplier.","-NOT transparent for Wealth referral payout. There is no report/breakdown that you can refer too
- all staffs are taichi master (esp Management) , they would never help you. You need to fight for your own",Senior Client Acquisition Manager,Current Employee,,"Nov 17, 2021"
539,4.0,Fun,"Employees are kind, fun working environment",Made to do jobs out of my job scope,Digital Associate,Current Employee,Singapore,"Jan 15, 2022"
540,4.0,Salary,Established bank with rigor processes.,Innovation come with higher level of risk,Business Analyst,Current Employee,Singapore,"Jan 20, 2022"
541,3.0,-,No micro management. Bosses generally ok. ,"Not so good remuneration, don’t expect good bonuses.",Business Banking Relationship Manager,Current Employe,,"Mar 14, 2022"
542,4.0,Good work environment,I was guided all along and my mentors were very welcoming and open to teaching me. The staff are very easy going and i make me look forward to work!,"Busy at times, need to make quick and informed decisions",Digital Associate,Current Employe,"Ang Mo Kio New Town, ","Jan 26, 2022"
543,3.0,Local bank,Good colleagues and good biss,Long working hours no work life balance,Anonymous Employee,Current Employee,,"Mar 13, 2022"
544,4.0,Company Review,Up to market benefits for staff,No cons for this :),Anonymous Employee,Former Employee,,"Mar 14, 2022"
545,5.0,Long hours,A very close knitted family bank,long hours and lots of paperwork,Service Manager,Former Employee,Singapore,"Mar 9, 2022"
546,3.0,Toxic Work Culture,Decent pay and good staff benefits,"Toxic work culture, no work life balance, lots of leave but what is the point when everybody is working and expected to work when on leave.",Vice President,Former Employee,,"Feb 3, 2022"
547,2.0,Average,Number of Annual leave quite decent,"Long working hours
Lots of manual processing",Senior Manager,Former Employe,,"Mar 16, 2022"
548,4.0,Good reward for working hard,Management appreciate your work with good bonus,A bit stress and super face pace,Data Analyst,Current Employee,Kuala Lumpur,"Mar 3, 2022"
549,1.0,Poor culture,Not much I can think of.,Poor leadership. No genuine interest in staff.,Vice President,Former Employee,Singapore,"Apr 28, 2022"
550,3.0,UOB,quite a good amount of leave days,"lower salary range compared to other banks
long working hours with no OT pay",AVP-Finance,Current Employe,,"Mar 1, 2022"
551,3.0,workplace,Nice easy going culture and friendly colleagues,Conservative and lacks empowerment for the staff,Vice President,Former Employee,Singapore,"Mar 10, 2022"
552,4.0,Senior officer,Excellent learning journey for newbie,Long hours and stressful days,Senior Officer,Current Employee,,"Mar 11, 2022"
553,2.0,Challenging,"Clear SOP, Target, Awards
In house training","MM
Long hours
Challenging 
No work life balance",Pwe,Former Employee,,"Mar 14, 2022"
554,5.0,Good employee's benefit,"Generally, UOB is very concerned about its employees. It is reflected in its handling of Covid-19 situation, and it truly cares about the welfare of its employees.",Work/Life balance is not ideal for those who have personal commitments.,Manager,Current Employee,,"Jan 22, 2022"
555,4.0,depends,a stable environment to work in,some team faster pace than other,Vice President,Current Employe,Singapore,"Mar 10, 2022"
556,2.0,management loves prata,"office near raffles mrt station, convenient if you need to go back to office.","only basic is real, other than that dont think too much on whatever they say.",Business Financial Manager,Former Employee,Singapore,"Feb 6, 2022"
557,4.0,Personal wealth associate,Good company benefits and guidance from managers,Long working hours. Work almost everyday with no time off,Anonymous Employee,Former Employe,,"Feb 25, 2022"
558,1.0,Bad culture and bullying from the top,"Being a local bank, stability and retrenchment are very very rare
On the working level, people are generally very collaborative and nice","Culture of blame and immediate response by management up to MD level and even CIO is to find someone to blame instead of learning what's wrong
Rather hire externally than promote internally
Your work is only judged between September to November each year during ranking season.",First Vice President,Former Employee,Singapore,"Nov 2, 2021"
559,1.0,Bad,Good benefit for fresh graduates,Highly pressured environment given the ease of covid,Senior Officer,Current Employee,,"Apr 23, 2022"
560,5.0,Great place to work,Nice & friendly colleague and boss,Do not even think of getting higher pay if u work as normal worker,Anonymous Employee,Current Employee,,"Feb 15, 2022"
561,3.0,Forces you to be independent,"1) Trains you to become self-reliant

2) Trains you on investment knowledge

3) Decent training program","1) You might be more competent than your manager

2) Your manager might not know anything about processes

3) You wonder why your manager earns more than you",Relationship Manager,Former Employee,Singapore,"Feb 10, 2022"
562,3.0,-,Safe job decent hours s,Slow moving corporate culture rigid,Analyst,Former Employe,,"Apr 13, 2022"
563,5.0,"Good benefits, fast paced",Very good benefits and colleagues,Fast paced and low work life balance,Customer Service Associate,Former Employe,Singapore,"Dec 26, 2021"
564,3.0,Conservative culture,No retrenchment even during downtime,Off time at 630pm even on Friday,AVP-Analyst,Former Employee,,"Apr 8, 2022"
565,3.0,Bias Review,acceptable working life balance and leave benefits,"bias review base on boss favoritism
bad system",Manager,Former Employe,,"Apr 4, 2022"
566,2.0,Ok for the hardworking,Good benefits like leave and flexi,"Prepare to give long hours, bosses take it for granted",Anonymous Employee,Former Employee,,"Mar 30, 2022"
567,2.0,Personal Banker,"The harder you work, the faster you can promote.",Stressful environment however bosses are helpful. Have to work on Saturdays also.,Personal Banker,Current Employee,,"Mar 24, 2022"
568,1.0,Commercial Bank Credit Analyst,Good number of annual leave and company benefits,Very toxic environment at commercial banking credit analyst,Commercial Bank Credit Analyst,Former Employee,,"May 5, 2022"
569,4.0,UOB,Good for building your career,Local bank with generally local client base,Anonymous Employee,Current Employe,,"Dec 29, 2021"
570,3.0,KYC,Flexible working hours at UOB,Systems & certain processes are too manual,AML/KYC Officer,Former Employee,Singapore,"Apr 6, 2022"
571,3.0,Decent,good progression if you are looking for a fast tracked progression,long hours at work depending on location,Personal Wealth Executive,Current Employee,Singapore,"Feb 16, 2022"
572,3.0,Salary,Relax and not busy working environment.,Traditional culture and old systems. No career development.,SOC Analyst I,Current Employee,Singapore,"Feb 22, 2022"
573,3.0,Nice place for freshers,"- Working Environment 
- Great colleague 
- Comparative benefits",- Slow career growth and progression,Senior Officer,Current Employe,,"Feb 15, 2022"
574,3.0,no work life balance,generous bonus and number of leaves.,No work-life balance due to too much task to complete,Vice President,Current Employee,Singapore,"Feb 12, 2022"
575,5.0,Great Company to Work For,"- Good Work Life Balance
- Well Structured Company",- Too many reporting and redundancies,IFRS9 Analyst,Current Employe,Jakarta,"Feb 11, 2022"
576,5.0,challenging environment,good place to have personal growth,huge workload and high pressure work,Legal Staff,Former Employe,Jakarta,"Feb 18, 2022"
577,3.0,Ok,Lots of projects. Exposure is excellent.,A lot of processes are bureaucratic,Anonymous Employee,Former Employee,,"Feb 22, 2022"
578,1.0,Worst company to work for,There are no pro's when you work with this company,"* No growth
* No learning
*No Money
*Weekend Work
* Non-sense management
*Stupid people including the management",Vice President,Current Employee,Singapore,"Mar 13, 2022"
579,5.0,Good working environment,"Great culture and good people. 
Management is understanding and supports the staff well.",Slower and manual processes. But gives room for innovation and improvement.,Assistant Vice President,Current Employee,Singapore,"Jan 24, 2022"
580,4.0,Service executive,Promotion is fast if doing sales role,Salary is low compare to other bank,Customer Service Executive,Current Employee,Singapore,"Feb 7, 2022"
581,3.0,-,Learn a lot cause a lot of paper work,Low pay than the market,Anonymous Employee,Current Employee,,"Feb 16, 2022"
582,2.0,Mass,Good training ground for people new to the work force.,Hierarchy to get things done,Bank Manager,Former Employe,Singapore,"Feb 15, 2022"
583,5.0,Good working environment,"- good commission tiering
- healthy workplace culture",- Takashimaya vouchers as commission payout,Business Finance Manager,Former Employee,,"Feb 8, 2022"
584,5.0,Great Place,Great Place to work very neutral environment,No control over your own schedule,Senior Customer Seevice Representative,Current Employe,Singapore,"Jan 25, 2022"
585,3.0,Low benefit for Junior Officers,"Medical insurance, well known bank, additional sales reward.","Low Incremental wages, teamwork, leadership",Relationship Manager,Current Employe,Jakarta,"Feb 8, 2022"
586,4.0,good,boss is very kind and good,the pay could be better,Personal Banker,Current Employe,,"Feb 16, 2022"
587,2.0,No work life balance,Great working environment. Remuneration is reasonable,Long hours and no work life balance,Service Manager,Current Employee,Singapore,"Feb 10, 2022"
588,3.0,Ok,Can earn if work hard,Can be quite toxic sometimes,Personal Banker,Former Employee,Singapore,"Feb 8, 2022"
589,3.0,Good,Welfare and benefits r good,Long hours. Expected to ot,Anonymous Employee,Former Employee,,"Feb 16, 2022"
590,1.0,Worst place I ever worked - slavery,"Pay is decent according to market standards 
All requirements are documented properly","Managers are dumb and racist. I worked with FE managers, they have 0 knowledge on information technology. 
Managers need puppet to say yes. For what ever they say.
Treatment is different for Citizen /pr and contract staff.
Contract staff are just slaves.

Typical Indian racist culture. 
Managers will request you to work on weekends and holidays",Senior Applications Consultant,Former Employee,Singapore,"Dec 9, 2021"
591,5.0,Great working env,"Get paid in time, very comfortable and understanding",Have to ot when needed,UAT Tester,Former Employee,Singapore,"Dec 8, 2021"
592,1.0,Local bank culture,"Knock off on time, good work life balance","Local bank culture
Slow at implementing change",Vice President,Current Employee,,"May 4, 2022"
593,3.0,review,good medical benefits for employees,"challenging, need to be adaptable",Account Executive,Former Employee,,"Mar 24, 2022"
594,3.0,Culture,Stable job and family oriented culture,Lack of push to improve on existing workflows or processes,Assistant Vice President,Former Employe,,"Mar 16, 2022"
595,4.0,Worked in a dev team as a senior developer,"Worked in a Development team, great team and the team lead and manager is also good, easy to work with them.","Always on a contract, no direct employment available. Contract given through agencies, always agent gets the bonus",Senior Software Engineer,Current Employee,Singapore,"Oct 11, 2021"
596,3.0,UOB,"Supportive team, hardworking employees, opportunities to progress","Rigid processes, hierarchical, tedious workload, overly obedient culture",Business Manager,Current Employe,,"Mar 16, 2022"
597,3.0,Not much work/life balance,"People are friendly, smart and nice.","Can get messy sometimes. Especially with WFH situations, often have back-to-back meetings from 9am - 6pm.",Digital Marketing Specialist,Current Employee,,"Feb 27, 2022"
598,4.0,Good,Good place to work and job security,Slow to change and adapt,Anonymous Employee,Current Employee,,"Dec 10, 2021"
599,3.0,Good Employer Overall,"High Salary and Bonuses, Stable job and permanent",Highly stressful environment to some departments,IT Vice President,Current Employee,Singapore,"Feb 15, 2022"
600,3.0,good job tough work,not alot of toxicity found in the banking world.,OT can be very excessive,Graduate Student,Former Employe,,"Mar 10, 2022"
601,1.0,"IT system backward and very lag, what u See outside May Look nice, insides Internally really backward.",Decent Pay because handling High volume of works and Hight customer bases,"Higher volume works and paperworks alot, no much backup plan and the system unstable too. Non stop Sales chasing figures, High staff turnover, toxic environment and mostly those are senior employees with much attitudes.",Customer Service,Current Employee,Singapore,"Dec 23, 2021"
602,1.0,Okay for short-term entry level employee,Okay if you're looking to get into the industry with little to no experience,Can't expect much growth. Salary is uncompetitive and not worth staying long term,Anonymous Employee,Current Employe,,"Feb 22, 2022"
603,5.0,"Helpful supervisors, regular job hours","Supervisors are helpful, job hours is largely fixed (ie 9-5)",Could be quite stressful due to difficult customers,Customer Service Officer (Call Center),Former Employee,,"Jan 13, 2022"
604,4.0,Employee Benefits,Organization made conscious effort to continuously improve based on employee feedback.,There's some overlapping in function which often leads to delay in projects and decision making.,Senior Vice President Analytics,Current Employee,Singapore,"Jan 6, 2022"
605,5.0,delivery manager technical,good area to pick up skills up the chain,stressfull life need to cross boundries at times,Technical Delivery Manager,Current Employe,Singapore,"Jan 16, 2022"
606,1.0,Dated systems. Manual processes. HR practices not ideal.,People are cordial and generally stable.,Archaic systems. Poor alignment. Political.,Portfolio Manager,Current Employee,Singapore,"Mar 4, 2022"
607,4.0,One of the best bank i ever worked with,Better benefit. Competitive good salary in the market,Some people are racist and very high turnover for sales staffs,AVP-Sales,Current Employe,Kuala Lumpur,"Jan 2, 2022"
608,4.0,Head,Not as fast paced and family oriented,Lagging in pay and increment,Head Product Management,Former Employee,,"Jan 26, 2022"
609,5.0,Good bank with great Culture,Slow. Sometimes can be hierarchical.,Commercial and result driven. Ambitious.,Managing Director,Current Employee,"Bedok New Town, ","Jan 21, 2022"
610,1.0,Personal Wealth Executive,Good employees benefit as it’s a big firm,You seldom get to enjoy the off day,Personal Wealth Executive,Former Employe,,"Mar 10, 2022"
611,4.0,Family oriented,"Understanding, shows empathy and flexible. Treats you like family!",Long working hours due to overwhelming workload.,Merchant Relationship Manager,Former Employee,Singapore,"Nov 11, 2021"
612,2.0,Challenging,"Clear SOP, Target, Awards
In house training","MM
Long hours
Challenging 
No work life balance",Pwe,Former Employee,,"Mar 14, 2022"
613,4.0,Overall stressed but with good earning,Package is not bad for technology comparing to other banks,Stressed with less guidence and feedback but subject to the manager,Vice President,Current Employee,,"Sep 22, 2021"
614,5.0,Good,Good and best benefits and salaries,None of it. I love it,Anonymous Employee,Current Employee,Johor Bahru,"Nov 28, 2021"
615,5.0,"Good environment, supportive",supportive bosses and great colleagues,"very happy working there, no cons",Anonymous Employee,Current Employee,Singapore,"Nov 26, 2021"
616,4.0,Branch service manager,"Branch has nice family oriented environment, people are all generally nice with nice bosses, but alot of opportunities for internal switches","Pay increment is little
Bonus not fantastic and hard to get promoted",Senior Officer,Former Employee,,"Oct 21, 2021"
617,5.0,Nice place to work,Good progression in a big company,Hectic and busy in fast paced environment,Bank Teller,Former Employe,,"Nov 20, 2021"
618,5.0,stress,"everyone’s nice and helpful, allows you to have more banking exposures","too stressful, time constraints for each outward and inward bound calls",Customer Service Associate,Former Employe,,"Nov 9, 2021"
619,2.0,management loves prata,"office near raffles mrt station, convenient if you need to go back to office.","only basic is real, other than that dont think too much on whatever they say.",Business Financial Manager,Former Employee,Singapore,"Feb 6, 2022"
620,5.0,"Good company culture, opportunity for career progression","- Family oriented company
- Good bonus before COVID 19
- Lots of benefit for staff (transport to & fro branch during circuit breaker etc 
- Career progression > 3 years
- Early go home (work life balance initiated)","- Long hours (depends on location) 
-",Customer Service Associate,Current Employee,Singapore,"Sep 19, 2021"
621,4.0,-,Good salaries and benefit also really support the employer to growth,There is no working life balance,Relationship Manager,Former Employee,Indo,"Jan 14, 2022"
622,2.0,Disturb,Hand on learn curve steep with zero assessment,Nobody know what is going on . Objective cascaded down always get distorted. Too many snipe and jab,AVP-Sales,Former Employee,,"Dec 14, 2021"
623,5.0,Amazing working and learning culture,Great learning environment with healthy working culture.,No cons that I can think of.,Corporate Banking Intern,Former Employee,,"Jan 9, 2022"
624,4.0,Good,Good employee benefits and welfare,However No work life balance,Customer Service Executive,Current Employe,Singapore,"Jan 25, 2022"
625,4.0,Fun,"Employees are kind, fun working environment",Made to do jobs out of my job scope,Digital Associate,Current Employee,Singapore,"Jan 15, 2022"
626,4.0,Salary,Established bank with rigor processes.,Innovation come with higher level of risk,Business Analyst,Current Employee,Singapore,"Jan 20, 2022"
627,1.0,Environment,The pay matches market norm.,Unsupportive leaders. You have to be extremely self-motivated.,Senior Vice President Product,Current Employe,,"Feb 22, 2022"
628,1.0,"Bad boss, really bad bossess",No pros. work till 10pm everyday all day,"Bad boss, really bad bossess",Debt Capital Markets Analyst,Current Employee,Kuala Lumpur,"Feb 16, 2022"
629,3.0,A Singapore Bank,Employees medical benefits and flexible working arrangements,Typical Singaporean culture of the 3Ks,AVP-Operations,Former Employe,,"Jan 13, 2022"
630,5.0,Personal Banker,Good commissions and basic salary,Keeping mind of sales target,Personal Banker,Current Employee,Singapore,"Jan 17, 2022"
631,4.0,dadasdas,UOB is a good place to grow,the payment is too minimum,RM - TRADE FOREX,Current Employe,Pisanganlama,"Jan 15, 2022"
632,4.0,Undergoing Transformation,Caring Organisation culture; stabe job,Pay may not be as competitive,Team Manager,Current Employe,Singapore,"Jan 16, 2022"
633,3.0,"The work load depends on the team, some could be quite heavy","The benefits are good, got OT pay if you work until weekday or weekend",Is not every team is good,Anonymous Employee,Current Employee,,"Dec 16, 2021"
634,3.0,Pb,Colleagues are nice and helpful,System slow and micro management,Personal Banker,Former Employe,,"Jan 19, 2022"
635,3.0,No life-job,"Good work time, Sunday off and even half day off.","Thanks covid. If it werent for covid, you probably stay at the branch doing unecessary useless things. I remembered the time they call ""team building"" making people stay in branch until 10-11pm to do DIY miniature stuff. If you dont join in, you are considered not socialising with your colleagues.",CSE,Former Employee,,"Aug 19, 2021"
636,3.0,Positive,NA NA NA NA NA,Limited work life balance and.,Personal Banker,Current Employee,Singapore,"Jan 19, 2022"
637,4.0,Senior Application Development Manager,good working environment and great leadership,tight timelines and less career growth,First Vice President,Current Employee,,"Jan 7, 2022"
638,5.0,PWE,Good environment Good culture Good benefit,Slow career progression for fresh grad,Anonymous Employee,Current Employe,,"Jan 10, 2022"
639,5.0,NA,"A lot of benefits eg allowance, annual leave, etc","long working hours, toxic culture",Relationship Manager,Current Employee,Singapore,"Jan 5, 2022"
640,4.0,Growth,Help to Train thought process,It might be quite stressful,Insurance Product Manager,Current Employe,Singapore,"Jan 13, 2022"
641,3.0,Salary,Relax and not busy working environment.,Traditional culture and old systems. No career development.,SOC Analyst I,Current Employee,Singapore,"Feb 22, 2022"
642,3.0,Nice place for freshers,"- Working Environment 
- Great colleague 
- Comparative benefits",- Slow career growth and progression,Senior Officer,Current Employe,,"Feb 15, 2022"
643,5.0,Good benefits long working hours,Good benefits and good environment.,Pros: really long working hours,Anonymous Employee,Former Employee,Singapore,"Nov 8, 2021"
644,3.0,no work life balance,generous bonus and number of leaves.,No work-life balance due to too much task to complete,Vice President,Current Employee,Singapore,"Feb 12, 2022"
645,4.0,Good place to start banking career,"- Managers who are invested in your growth
- Company benefits (eg. healthcare, medical, flexible claims etc)
- Regional exposure, had the opportunity to cover Southeast Asian markets
- Brand name","- IT and technology can be archaic 
- Internal politics, hard to get work done across teams and departments at times
- Some managers are not well-trained
- Limited career opportunities and internal mobility opportunities, especially across functions and countries",Manager,Current Employee,Singapore,"Jun 10, 2021"
646,5.0,GOOD,"Overall is good 
Good benefits",It depends on which department you stay.,Anonymous Employee,Former Employee,,"Nov 9, 2021"
647,3.0,Ok,Lots of projects. Exposure is excellent.,A lot of processes are bureaucratic,Anonymous Employee,Former Employee,,"Feb 22, 2022"
648,4.0,Stability,Good place to work for stability,Don't expect too high salary and it would be a good place to work at,Assistant Relationship Manager,Current Employee,,"Oct 25, 2021"
649,1.0,Worst company to work for,There are no pro's when you work with this company,"* No growth
* No learning
*No Money
*Weekend Work
* Non-sense management
*Stupid people including the management",Vice President,Current Employee,Singapore,"Mar 13, 2022"
650,4.0,Good leadership,Building new platforms and supportive managers.,Long hours and plenty of meetings that overruns.,API Architect,Former Employee,Singapore,"Nov 2, 2021"
651,3.0,-,Learn a lot cause a lot of paper work,Low pay than the market,Anonymous Employee,Current Employee,,"Feb 16, 2022"
652,4.0,Work Life Balance,Provide different programs for work life balance,Needs to upgrade their off-site connectivity,First Vice President,Current Employe,Singapore,"Nov 1, 2021"
653,2.0,Mass,Good training ground for people new to the work force.,Hierarchy to get things done,Bank Manager,Former Employe,Singapore,"Feb 15, 2022"
654,4.0,Good benefits,"high turn over, but great benefits",some politics will be played out but if u are in an international department it will be less,Client Manager,Former Employe,,"Oct 12, 2021"
655,3.0,Low benefit for Junior Officers,"Medical insurance, well known bank, additional sales reward.","Low Incremental wages, teamwork, leadership",Relationship Manager,Current Employe,Jakarta,"Feb 8, 2022"
656,5.0,UOB,"Good culture, people are accommodating and kind.",The salary is lower than other banks,Manager,Current Employee,"Jurong West New Town, ","Oct 20, 2021"
657,4.0,Good working environment,"Good synchronisation with other region.
Care about the staffs.",Sometimes having long working hours.,AVP-Finance,Current Employe,Kuala Lumpur,"Oct 28, 2021"
658,4.0,Good Company,"It is indeed a good company with good benefits such as medical, insurance can claim. Management is good in following the necessary HR procedures and employment rules as well as SOPs.","Stress levels are high but at the end of the day, all jobs are stressful. Systems can be slow. Other than that nothing much on the cons of the company.",Senior Officer,Current Employee,Kuala Lumpur,"Jul 29, 2021"
659,2.0,No work life balance,Great working environment. Remuneration is reasonable,Long hours and no work life balance,Service Manager,Current Employee,Singapore,"Feb 10, 2022"
660,4.0,administrative,excellent local bank big name,challenging busy stressful achievement wellknow,Relationship Banker,Current Employe,Singapore,"Nov 5, 2021"
661,5.0,Okay,proactive great good manner attitude,Internal promote is very low salary,Relationship Manager,Current Employe,Ho Chi Minh City,"Nov 2, 2021"
662,4.0,Job review,"- Job Security
- Insurance for some miscellaneous expenses","- Resistant to Change
- Work-life balance",Credit Reporter,Former Employee,Singapore,"Oct 27, 2021"
663,3.0,Ok,Can earn if work hard,Can be quite toxic sometimes,Personal Banker,Former Employee,Singapore,"Feb 8, 2022"
664,3.0,Good,Welfare and benefits r good,Long hours. Expected to ot,Anonymous Employee,Former Employee,,"Feb 16, 2022"
665,1.0,Worst place I ever worked - slavery,"Pay is decent according to market standards 
All requirements are documented properly","Managers are dumb and racist. I worked with FE managers, they have 0 knowledge on information technology. 
Managers need puppet to say yes. For what ever they say.
Treatment is different for Citizen /pr and contract staff.
Contract staff are just slaves.

Typical Indian racist culture. 
Managers will request you to work on weekends and holidays",Senior Applications Consultant,Former Employee,Singapore,"Dec 9, 2021"
