,Rating,Title,Pro,Con,Job Title,Status,Region,Date
0,5.0,Great Starting Company,Nice team Work life balance Decent salary Good values,Old technology Multiple layers of approval Its a bank not a tech company,Software Engineer,Current Employee,,"Oct 11, 2022"
1,4.0,Overall Good experience,Nice working environment and colleagues are very friendly.,Monthly sales target to achieve,Business Finance Manager,Former Employe,,"Aug 25, 2022"
2,4.0,Na,No opinion yet for now,The environment there is good,Personal Banker,Current Employee,,"Aug 14, 2022"
3,4.0,Nice,"Working environment is friendly, colleagues are willing to help.","The system is old, still print and scan.",Anonymous Employee,Former Employe,,"Mar 29, 2022"
4,4.0,Good place to work. Recommended,"The company headquartered in SG, with everything implemented well. Overall, not a bad place for starter. Recommended.",The conservative family-owned taste restricted a lot of opportunities,Manager,Former Employee,,"Mar 6, 2022"
5,2.0,Super conservative and highly political workplace with below-par peers,"Job is more stable than the average of the industry.
2 hours' lunch break.
Good sick leave policy.","Super conservative because it is family-owned.
Highly political culture which is counter-productive.
Qualifications of peers are generally quite low, comparing with average industry standard.",Anonymous Employee,Former Employe,,"Mar 2, 2022"
6,4.0,current employeer,"good company to work , flexible work hours","have not seen yet , no cons",Lead Consultant,Current Employe,"Houston, TX","Jan 12, 2022"
7,4.0,Okay,"- Good Salary
- Good Location
- Additional benefits","- Work Life balance
- Tight deadlines
-",SVP-Technology,Former Employe,,"Jan 1, 2022"
8,5.0,Risk Priority,People first. Not only take care of customers but also employees.,UOB is a regional bank.,Internal Auditor,Former Employe,"Seattle, WA","Feb 26, 2021"
9,5.0,you'll got your promotion based on your work,they promote an organic growth,"they have a long working hour,",Business Banking Manager,Former Employee,,"Feb 8, 2021"
10,,,,,,,,
11,5.0,Great company to work with.,"Professional and well-equipped office enviornment, Well-trained employees, Reasonable compensation and other offers. Company has global network to share market comments.",Might need to work overtime sometimes. Detailed work division might cause always focusing own duties and lack of bigger picture.,Dealer,Current Employee,"Los Angeles, CA","Feb 6, 2017"
12,4.0,Strategic Communications staff,Bank has integrity in providing products and services to customers.,"Singapore-centric, resulting in marketing communication processes getting stalled in local markets.",Assistant Vice President; Writer and Regional Copyeditor,Former Employee,"Cambridge, MA","Jul 14, 2016"
13,4.0,UOB AB,continued employment for those who perform well at their work.,"low salary,
limited chance for promtion",Analyst Programmer,Former Employee,"Milpitas, CA","Jun 26, 2015"
14,4.0,Not a bad experience!,The people there were very friendly and ever willing to teach you. Workload was very manageable.,Technology wasn't very up to date. Things seem to be moving very slowly.,,Former Employe,,"Sep 27, 2016"
15,3.0,financial officer,"good culture generally, people are nice",salary and benefit are under average,Financial Officer,Former Employee,"Rochester, NY","Jul 22, 2015"
16,5.0,Great experience,"-friendly environment, great company culture",-no mentorship program available during my internship,Risk Management Intern,Former Employee,"Seattle, WA","Nov 3, 2015"
17,5.0,Intern,"Good Work Dynamic, very nice colleagues",Non. Everything I experienced was very good!,,Former Employe,,"Dec 27, 2017"
18,3.0,Revenue is only way to prove your value.,Good employee benefits. Good training provided. Colleagues are nice.,"No work life balance. Endless cold call. Although they mentioned not hard sales, but actually it is still... depends... if you don't hv number for the month. The only blaming are you why don't push harder and convince your customer deeper. So, if you are a soft heart person, you're not welcome to take this job as well. It's not a bad job, just that if you are not a sales mindset people, you won't able to bear the stress. If you are seeking for continuously improve you value, I don't think this position suit it. For this position, only number/revenue defined your value in the bank.",,Former Employee,Singapore,"Mar 16, 2023"
19,1.0,"Bad culture, Not recommended",Good benefits and decent amount of good colleagues,"Pay wise is nowhere as high as European/US banks. Few things to highlights in the technology side: 1) If you're unlucky, you’ll get an old-timer manager who micromanaging a lot and scrutinizes unnecessarily instead of growing the team. 2) Always ask for process improvement including presentation of how other banks (if you’re from another) do things but never accept different perspective. Almost waste of time presenting. 3) They do catch up to other banks like DBS in terms of customer facing applications but lack of centralize systems for internal use. Very behind that of DBS and still using excel like a database. Excel is only as updated as someone willing to update it not a live info. 4) Brought in new technologies to play catch up but always stuck in one or two team because every team is so silo and there’s a lack of direction to cascade to every division. 5) A lot of old timers who doesn’t understand the importance of collaboration between teams. Full of back-stabbing instead. 6) A lot of long working hours in various teams can be reduced significantly if automation is in place. The problem is many people lack exposure on how things are automated in more advance banks, and they think that they must work this long to complete it. 7) Some old managers so call “know-it-all” mindset is actually “know nothing” in European/US banks or even DBS. These people doesn’t even have a Linkedin profile or understand how the modern management works. The list could go on but these are the key problems.",AVP-IT,Current Employee,Singapore,"Dec 29, 2022"
20,3.0,Suitable for junior entry looking for mass affluent segment,"Good brand, decent benefits, good support and tools available for market analysis and updates",tough to earn a commission. Need to achieve at least 5-6x rev of basic salary in order to see a little commission. Confusing scorecard. Products and solutions not segmented properly for mass affluent.,Relationship Manager,Current Employee,Singapore,"Mar 27, 2023"
21,4.0,BANCA,Good team lead and many training,"BANCA is the main target… need to sell BANCA to clear penalty, small error in submission will deduct your achieved sales by 5% by case count with no capped.",Trade Financial Manager,Current Employe,Singapore,"Mar 27, 2023"
22,2.0,Languishing,Off days and medical benefits A few rare gems of co-workers with great work ethics,"Your boss won’t bother to invest in your career development, you won’t be able to speak your mind, your contributions will be of little value to the leadership team.",Analyst,Current Employe,,"Mar 13, 2023"
23,2.0,Nil,Struggling to think of one,Low Base Pay in banking industry,Treasury Specialist,Current Employee,Singapore,"Mar 28, 2023"
24,4.0,Software Engineer in UOB,Good managers and team mates,Must provide training to employees to get updated with new technologies.,Software Engineer,Former Employee,Singapore,"Mar 27, 2023"
25,4.0,work life balance,good boss stable job and good colleagues,low pay compared to market no diversity in job function hard to move up,Senior Officer,Former Employee,Singapore,"Mar 26, 2023"
26,1.0,Not recommended at all.,OT Pay. Max out for approx 22 days a month.,OT is a norm. At least 9pm daily. Sometimes dont even have the time to go for lunch. Bosses spend hours on minor stuffs while there are more important things to concern. Will def not go back there again.,Custody Operations Specialist,Former Employe,,"Mar 25, 2023"
27,2.0,Stay away if you're looking for a workplace with good work-life balance,"*Major banking institution in ASEAN region (Top 10) so it would be good for your resume

*Stable. Once hired and provided your are capable, you won't need to be afraid of getting laid off anytime soon

*Proper documentation and workflow. Everything here is so coordinated. They even user JIRA to log any issues or request and the business team also abide this.","*Dog eat dog world. Let me give you an example. The PMs don't care if you're doing improper testing. All they care is you sign the signoff form so one misstep and it's going to come back to haunt you later hence the need of this ""dog eat dog"" mindset else you get trampled

*No work-life balance. Yes, 100% agree. You are expected to work long hour sometimes till 10PM. Even weekends if need be including Sunday. At least in my previous workplace, Sunday is a sacred rest day.

*One bank concept. UOB is unique in a sense even with their overseas branches, they still consider them as one UOB. Everything is centralized. Development has to be coordinated and done with UOB Singapore. While in theory it's good, the reality is not. It's bureaucratic nightmare. Most of the time, you have to liaise between in-country team and Singapore team during testing. Let's not forget due to this centralization putting a lot of strain to Singapore which resulted me, an oversea team, being neglected until the project due date most of the time",Project Support,Current Employee,,"Nov 17, 2022"
28,4.0,good working experience so far,"job security, a lot of thing to learn, getting promoted base on your performance not seniority","quite many paper work and policy, which reduce the work efficiency",VP (1),Current Employee,Singapore,"Mar 21, 2023"
29,4.0,Business RM,- Variable Pay/ Commission is decent given hard work - Bonus transparent; good if you put in effort,- Basic Pay lower than average across banks - Have to grind hard and work for variable payout else not worth the pay - Hardly can rest - Increment lower than average,Business Banking Relationship Manager,Former Employee,Singapore,"Mar 16, 2023"
30,1.0,bad,employees' benefits are quite attractive,"working hour more than 12 hours per day, toxic working environment",Senior Officer,Current Employe,,"Mar 27, 2023"
31,2.0,Nil,Struggling to think of one,Low Base Pay in banking industry,Treasury Specialist,Current Employee,Singapore,"Mar 28, 2023"
32,4.0,Good but can be better,"Great and helpful training 
Great suite of financial products 
Willing to share 
Ample amount of resources/materials","Not enough time to complete CMFAS or CACS papers before training graduations
System a little outdated 
Laptop is quite lagggg with low spec 
HR recruitment can improve on processing speed and provide more accurate schedule / what to do before on-boarding",Anonymous Employee,Current Employee,,"Feb 17, 2023"
33,1.0,Not recommended at all.,OT Pay. Max out for approx 22 days a month.,OT is a norm. At least 9pm daily. Sometimes dont even have the time to go for lunch. Bosses spend hours on minor stuffs while there are more important things to concern. Will def not go back there again.,Custody Operations Specialist,Former Employe,,"Mar 25, 2023"
34,4.0,Good,"Work life balance, pleasant working environment.",Slow progression (though it might depend on your function),Vice President,Former Employee,Singapore,"Mar 10, 2023"
35,2.0,Stay away if you're looking for a workplace with good work-life balance,"*Major banking institution in ASEAN region (Top 10) so it would be good for your resume

*Stable. Once hired and provided your are capable, you won't need to be afraid of getting laid off anytime soon

*Proper documentation and workflow. Everything here is so coordinated. They even user JIRA to log any issues or request and the business team also abide this.","*Dog eat dog world. Let me give you an example. The PMs don't care if you're doing improper testing. All they care is you sign the signoff form so one misstep and it's going to come back to haunt you later hence the need of this ""dog eat dog"" mindset else you get trampled

*No work-life balance. Yes, 100% agree. You are expected to work long hour sometimes till 10PM. Even weekends if need be including Sunday. At least in my previous workplace, Sunday is a sacred rest day.

*One bank concept. UOB is unique in a sense even with their overseas branches, they still consider them as one UOB. Everything is centralized. Development has to be coordinated and done with UOB Singapore. While in theory it's good, the reality is not. It's bureaucratic nightmare. Most of the time, you have to liaise between in-country team and Singapore team during testing. Let's not forget due to this centralization putting a lot of strain to Singapore which resulted me, an oversea team, being neglected until the project due date most of the time",Project Support,Current Employee,,"Nov 17, 2022"
36,1.0,bad,employees' benefits are quite attractive,"working hour more than 12 hours per day, toxic working environment",Senior Officer,Current Employe,,"Mar 27, 2023"
37,4.0,Stress,The managers and supervisors are good and are willing to teach,-Handle too many calls a day -Have to overwork if you are a good employee - No work life balance at all You will be tagged for calls that you are not trained for too sometimes,Senior Officer,Former Employee,Kuala Lumpur,"Feb 9, 2023"
38,4.0,Ok,Company is okay. Benefits is good,Work life balance is missing,AVP-IT,Current Employee,Singapore,"Mar 7, 2023"
39,4.0,UOB,Good Techincal Role Allowed for hands-on experience to script,Was not a very co-ordinated internship program,Bank Trainee,Former Employe,,"Mar 5, 2023"
40,3.0,Standard bank benefits & culture,Shift and OT allowances who are working on shift. Standard bank benefit.,Traditional systems and working environment.,Operation Engineer,Former Employee,Singapore,"Mar 21, 2023"
41,4.0,Good but can be better,"Great and helpful training 
Great suite of financial products 
Willing to share 
Ample amount of resources/materials","Not enough time to complete CMFAS or CACS papers before training graduations
System a little outdated 
Laptop is quite lagggg with low spec 
HR recruitment can improve on processing speed and provide more accurate schedule / what to do before on-boarding",Anonymous Employee,Current Employee,,"Feb 17, 2023"
42,4.0,Good,"Work life balance, pleasant working environment.",Slow progression (though it might depend on your function),Vice President,Former Employee,Singapore,"Mar 10, 2023"
43,3.0,Company Culture,"Nice colleagues and bosses, willing to cover each other's duties needed. Great communication between managers and subordinates for my dept, there is daily feedback session and solutions implemented.",Long working hours due to high trade volume and some manual processes which could be improved,Manager,Current Employee,Singapore,"Feb 16, 2023"
44,3.0,Mixed Feelings,Good work life balance and pace of work. Salaries and bonus is competitive. No real threat of the “up or out culture” some other banks tend to have.,Horrendous internal processes. Truly stunning for an organisation of this size. Culture in some parts of the organisation eg tech can be quite difficult/ non conducive to working together,Anonymous Employee,Current Employee,,"Feb 17, 2023"
45,4.0,Stress,The managers and supervisors are good and are willing to teach,-Handle too many calls a day -Have to overwork if you are a good employee - No work life balance at all You will be tagged for calls that you are not trained for too sometimes,Senior Officer,Former Employee,Kuala Lumpur,"Feb 9, 2023"
46,4.0,Ok,Company is okay. Benefits is good,Work life balance is missing,AVP-IT,Current Employee,Singapore,"Mar 7, 2023"
47,4.0,UOB,Good Techincal Role Allowed for hands-on experience to script,Was not a very co-ordinated internship program,Bank Trainee,Former Employe,,"Mar 5, 2023"
48,2.0,Incompetent bosses,"Majority of the colleagues are great, very “family-like” culture. Nearly impossible to get sack “iron rice bowl”.","Management is incompetent - managers are very inexperienced and they would rather hire outsiders than promote internally. Eats you dry - pays low but expects you to do beyond wonders. Always preaching about reducing overtime, yet if you are even able to leave on time (which is nearly impossible) they fault you for it. IT dept is beyond hopeless, does not resolve anything. Can go on with months till forever to resolve simple issues. Welcome to UOB.",Senior Officer,Current Employee,Singapore,"Jan 13, 2023"
49,3.0,below average employer with slightly salary that is slightly higher than average pay.,better than expected salary even though not that amazing.,Very poor network and technology features together with very long working hour.,,Current Employee,Singapore,"Feb 10, 2023"
50,1.0,Rot from the top,Almost zero to none except the flexible benefit.,One of the worst working culture that permeates from the top. Management self centred play politics Archaic working process.,Portfolio Manager,Former Employee,Singapore,"Mar 8, 2023"
51,5.0,Risk Management,"Great people company, good culture",Employee benefits and staff benefits,Risk Management,Current Employe,,"Feb 21, 2023"
52,3.0,Friendly working place,Mostly friendly people and culture,Processes involved to get things approved.,Senior Credit Analyst,Current Employee,Kuala Lumpur,"Mar 15, 2023"
53,4.0,Good place to work,Bosses and colleagues are supportive,"Depending on role, progression might be slow",Manager,Current Employe,Singapore,"Feb 19, 2023"
54,4.0,-,Good working environment with work life balance,Career progression within the company is limited,Credit Analyst,Current Employee,Singapore,"Feb 18, 2023"
55,1.0,Not recommended,"Nth to share, unpleasant experience",Micromanagement Extremely underpaid but workload overloaded Biased management,Senior Officer,Former Employee,Singapore,"Mar 22, 2023"
56,3.0,Banker,"Flexible, good money if hit target",Long working hour and technology not advancd,Personal Banker,Current Employee,Singapore,"Mar 15, 2023"
57,4.0,Ok,Benefits ok 23+3 AL Heal$,Very old systems /process /culture,Senior Officer,Current Employee,Singapore,"Feb 17, 2023"
58,4.0,Good Organisation to be in,"Good culture, colleagues and bosses",Not competitive when comes to salary,Vice President,Former Employe,Singapore,"Feb 14, 2023"
59,5.0,Family oriented stable job,"Family oriented, standard annual leave, things can be discussed, stable job, visionary leadership.","Certain level of micromanagement, reporting. Sales focus heavily on Bancassurance. Focus on external hire.",Client Advisor,Current Employee,,"Jan 28, 2023"
60,4.0,Career Progression,"A good place for you to learn, train, get new knowledge and acquire new skills",Promotion is slow to come and depends on your superiors,Vice President,Former Employee,Singapore,"Feb 4, 2023"
61,2.0,Ma program,Easy transitions Co workers are easy to work with,"Old systems technologically Old systems in place with higher ups Overly traditional, not even addressing a Morse nosed society needing modernised work space/ and arrangements.",MA Program,Former Employee,Singapore,"Feb 15, 2023"
62,2.0,"Traditional, old school management and lowballed salaries","- lots of leave
- generous health insurance","- low salary. (~20-30% lower than market average for any given skillset). The HR is snobbish, delusional and awards way too much prestige to the bank's reputation as an employer than its worth
- bureaucracy all day, err day
- ""yes boss"" is the favourite phrase at the bank",Anonymous Employee,Current Employee,Singapore,"Aug 15, 2022"
63,5.0,Overall good company to be with,Stable. Rewarding place. Work life balance.,Slow pace. Not super structured,Senior Vice President,Current Employee,,"Feb 18, 2023"
64,3.0,No hire and fire culture so far,"Once hired, can be assured to not be fired for trivial reasons",Lack of proper process. Too much emphasis on pleasing boss than on the real work.,Asisstant Vice President,Current Employee,Singapore,"Jan 12, 2023"
65,4.0,Good working environment and corporate culture,- Annual leaves are offered reasonably to employees in accordance with the corporate rank (VP - 26 days) - 2 hours flexible hours per month - 2 days Work from home arrangement available every week - Good office working environment,"- Asian corporate company working culture, less relaxation in the office environment - Roles and responsibilities are too granular with less flexibility and limited control over the headquarter arrangement",Vice President,Current Employee,Hong Kong,"Jan 11, 2023"
66,4.0,Nice Environement,Colleagues are friendly and the working environment is nice.,Counterparty turnaround time is long.,Relationship Manager,Current Employe,Hong Kong,"Feb 23, 2023"
67,4.0,no comment,"good environment, and friendly boss",lack of work life balance,Compliance Analyst,Current Employee,Singapore,"Feb 23, 2023"
68,5.0,Risk Management,"Great people company, good culture",Employee benefits and staff benefits,Risk Management,Current Employe,,"Feb 21, 2023"
69,4.0,Good place to work,Bosses and colleagues are supportive,"Depending on role, progression might be slow",Manager,Current Employe,Singapore,"Feb 19, 2023"
70,4.0,-,Good working environment with work life balance,Career progression within the company is limited,Credit Analyst,Current Employee,Singapore,"Feb 18, 2023"
71,4.0,Good benefit but average lower salary,"Environment is good, facility and benefit is good as well",Salary is somehow relatively lower than the market,Personal Wealth Manager,Former Employe,,"Jan 30, 2023"
72,2.0,Incompetent bosses,"Majority of the colleagues are great, very “family-like” culture. Nearly impossible to get sack “iron rice bowl”.","Management is incompetent - managers are very inexperienced and they would rather hire outsiders than promote internally. Eats you dry - pays low but expects you to do beyond wonders. Always preaching about reducing overtime, yet if you are even able to leave on time (which is nearly impossible) they fault you for it. IT dept is beyond hopeless, does not resolve anything. Can go on with months till forever to resolve simple issues. Welcome to UOB.",Senior Officer,Current Employee,Singapore,"Jan 13, 2023"
73,3.0,below average employer with slightly salary that is slightly higher than average pay.,better than expected salary even though not that amazing.,Very poor network and technology features together with very long working hour.,,Current Employee,Singapore,"Feb 10, 2023"
74,1.0,Rot from the top,Almost zero to none except the flexible benefit.,One of the worst working culture that permeates from the top. Management self centred play politics Archaic working process.,Portfolio Manager,Former Employee,Singapore,"Mar 8, 2023"
75,3.0,good place to work,basic salary will be paid on time,clients will contact you anytime including non-working hours,Client Advisor,Former Employee,,"Mar 2, 2023"
76,3.0,Flexible working hours,The great is about UOB is the flexible working hours,Staff compensation is rather low,Compliance Officer,Current Employee,Kuala Lumpur,"Mar 1, 2023"
77,3.0,Good Company but many politics,Very nice on your resume if you got into this job,It is a financial/banking industry so you have to be accurate and can't escape politics and policies,Bank Teller,Former Employe,,"Feb 12, 2023"
78,5.0,Great Job,"Great Pay, Easy, Low experience needed","Stressful, very monitored, extra workload",Customer Service Representative,Former Employe,Singapore,"Jan 30, 2023"
79,4.0,Good TL and Co workers,Double pay on PH. TL always be supportive. Got OT pay,"Stressful heavy workloads , being rushy",Call Center Agent,Former Employe,,"Jan 20, 2023"
80,2.0,Ok,"Colleagues & friends, pay & bonus","Back dated processes, lack of proper IT infra and hierarchical",FBA,Former Employe,Singapore,"Mar 1, 2023"
81,5.0,Good team,Good team work and nice people,Always busy and very challenging,Senior SAP Consultant,Current Employe,,"Feb 13, 2023"
82,1.0,NA,Good salary Competitive environment Career growth,No work life balance Long working hours,Manager,Former Employe,Singapore,"Feb 28, 2023"
83,5.0,Great Company,- super great benefit - career advancement,- less work life balance - poor job segregation (at least for our department),Customer Service Agent,Current Employe,,"Jan 28, 2023"
84,4.0,Policy,"Company benefit, environment everything is good",Company politics is not friendly,Sales Executive,Current Employe,,"Feb 12, 2023"
85,4.0,Good for a start,good team and colleagues too,lunch time too short. too crowded in the vicinity.,Management Associate,Current Employee,Singapore,"Feb 7, 2023"
86,5.0,Good process. Friendly interviewers,Good environment and respectful teams,Not much to complain about,Global Wholesales and Retail Marketing Executive,Current Employee,Frankfurt am Main,"Feb 8, 2023"
87,3.0,The work is very tiring but the pay and incentives are very nice,- Good Salary - Teamwork really good - Conducive working environment - Up to date technology,- Long hours : 9.5 hours just too long la - KPI very high and management keep pushing to the limit - High pressure and super stressful,Senior Officer,Current Employee,Kuala Lumpur,"Jan 14, 2023"
88,4.0,Good,Good colleagues in the bank,Work life balance is not followed,Data Engineer,Former Employee,,"Feb 9, 2023"
89,5.0,Very good place to work,Genuine care among colleagues & bosses,Lower salary package and benefit,SVP Product,Former Employee,Kuala Lumpur,"Feb 6, 2023"
90,2.0,N/a,Helpful colleagues. Many challenges to look forward,Systems are out dated. Slow processes. Must have patience,Wealth Banker,Current Employe,,"Feb 6, 2023"
91,5.0,Personal Wealth Executive Review,Quite rewarding and can commission are not bad,Super long hours and have to work on Saturdays as well,Personal Wealth Executive,Former Employee,Singapore,"Jan 31, 2023"
