,Rating,Title,Pro,Con,Job Title,Status,Region,Date
1519,4.0,Tough at first breaking into the community but getting better as the years pass by and the relationships are developed,Recognition is not bad if you are doing well. People are also helpful after you get to know them better. Growing bank so get to do many pioneering stuff.,It's not a very professional place working place. People re cliquish. Some bosses are rude and discouraging. No employee satisfaction survey.,First Vice President,Current Employee,"Pasir Panjang, ","Mar 18, 2017"
1520,1.0,"People need to feel that their work matters, by accurately evaluating their performance.",Being in a small branch means you can be part of a close knit community.,"1. Actual work does not roll up or reflect in KPI/OKR. In branch operations, about 60-70% of the time is devoted to handling day to day transactions and customer requests which means a lot of paperwork(I will get to that later). The scores that’s reviewed at the end of each month/quarter/year only covers 20% of the work that was done, but has an overall weightage of 80% of the total performance of an employee. That 20% is: up-selling/cross-selling of loans/cards/...and wait for it... Personal Internet Banking. 

2. Company direction not aligned with overall company focus. Overall, UOB wants to be a tech savvy financial institution and in Group Channels, it manifested mostly as “selling Personal Internet Banking”. This placed most of the responsibility on the branch employees to find ways to up their numbers. Some by resorting to cancel active account and sign these users up a second time. A better option would be to look at the time consuming and paper dependent workflows that all customers are required whenever they step into a branch. I presume things are much better now but back in 2015, everything had to be filled in pen and paper, and one spelling mistake or bad handwriting would be your worst nightmare.

3. People managers not equipped with the right skills. This may not be applicable to all branches, but in the particular branch I worked for, the manager was promoted simply because she was superb at sales. She failed miserably at people management and thus made everyday miserable for everyone and herself. Looking back, I wouldn’t say she was intentionally breathing down everyone’s neck or manipulating people to control them, but I think these are the methods that she was aware of/exposed to. Another reason could be that people’s welfare or overall satisfaction with their managers were not measured, and thus does not contribute to her overall performance review. Without this feedback channel in place, managers are not getting the right help to help their employees.

4. Too much importance placed on frivolous activities. This is purely my personal opinion and may be very skewed given the environment I was in. The channels group often had completions for cheerleading, dancing and other performance which are affectionately named “CCAs”. I understand the well meaning - to build relationships between branches and to promote life outside work- but it clearly has backfired when people started realising this is the only way to climb the ladder quickly (and not by doing a good job at work).  Also it’s almost impossible to feel that you have a balanced grasp of your life and work when there is a ton of paperwork piling at the branch, while your manager is calling you to go down for dance/cheerleading practice. Good intentions, bad execution.

5. Lastly, I just HAVE to add, the fake surveys. How UOB measures customer satisfaction is pretty intriguing. Every month employees will collect feedback forms from the walk-in customers. Given that this is a hard target and you have to have at least 2 per month (or you will be deemed as incompetent and disqualified for the Quality Awards), not all of the feedback forms were actually filled by actual customers. Most were signed my gullible and unknowing customers, and then later filled in by the employees themselves. Some were written by actual customers of course, maybe 10% of all submission. Again, another good intention scheme, execution gone wrong.",Service Manager,Former Employe,"Los Angeles, CA","Apr 26, 2018"
1521,2.0,Toxic environment,Some colleagues are very nice people and very dedicated,"- Constant over-time, and it's ""given"" (i.e. you're supposed to)
- No matter how many hours of over-time you've clocked the previous day, you're expected to be in the office on-time
- Management continues to assign tasks without considering the effort required, if you are unable to cope and leave, the tasks will be assigned add onto another person's workload while they look for replacement
- Excessive processes created by different teams to ensure that they are able to answer to audit",Anonymous Employee,Current Employe,,"Apr 3, 2017"
1522,5.0,Best Local Bank ever A++++,"Customer-oriented, innovating, forward. Maintains the highest standards - ethical, moral and legal - in all dealings with the customers.",There is no perfect company or perfect bank. UOB always makes sure to redeem itself whenever there's a customer issue.,Senior Bank Officer,Current Employee,Singapore,"Jul 28, 2018"
1523,1.0,Data Management Office - Senior Management not open to feedback,"Good working hours and leave on time. 
Generally friendly at the working level. 
The office is new and modern compared to other departments.","Cannot concur more to the comment posted here on 5-May-19 by the ex-staff.

DMO management is not interested in the people on the ground. They are more worried about their bonus.

DMO management is preparing the department for the up-coming UOB Staff survey. We have been told that if we scored the department badly in the survey our year-end performance bonus will be affected. We were also told that these surveys are not really anonymous, they will be able to track down or isolate who gave a bad review.  SERIOUSLY!!!",Anonymous Employee,Current Employe,,"May 17, 2019"
1524,4.0,A bank trying to stay relevant and keep up with the competition,Forward Looking with an Ethos of doing good,Long Working Hours and not hiring enough local young talents,Vice President - Technology,Current Employee,Singapore,"Apr 3, 2020"
1525,2.0,Senior officer,Cannot think of any. What I can think off is the word BANK is your resume. So what??,"Under Paid. Company pay based on the employee last drawn salary. Despite many years of experience from the previous company doesn’t help you to explore in this company. Being initiative and passionate to the job, ended up get the sarcastic from the manager. Leader here just don’t sharpen their employees.",Anonymous Employee,Current Employee,,"May 2, 2020"
1526,2.0,Great visions but poor corporate culture,Great place to learn your likes and dislikes in a company culture and the co-workers make the job tolerable. Most are aware of the situation and are compassionate towards their fellow colleague. Some flexibility in job movement within the organisation.,"Organization, management commitment and communication was terrible and frustrating. Clique-ish working environment (almost like high school all over again). If you are a performer, more responsibilities are piled on you but without any pay increase and you are expected to be thankful for the extra work.",Senior Manager,Former Employee,Kuala Lumpur,"Jan 5, 2013"
1527,4.0,Simple but Repetitive Job,Cash incentive given upon hitting performance targets on a monthly basis.,"Not allowed to bring personal electronic devices such as mobile phones, tablets, USB connected musical devices for fear of storing sensitive client particulars.",Cheque Processor,Former Employee,Singapore,"Feb 14, 2016"
1528,4.0,"good boss, hard working environment","good prospects, result oriented, good bosses, my boss was good. good culture. positive environment.. good colleagues. happy place to work.","no result then you are out. politics. they may post bad branch, with no walk in.",Personal Banker,Former Employee,,"Oct 31, 2012"
1529,5.0,"Im working in project based, so some are good and some are bad.","The bank is catching up with the technology, hence there are alot of opportunity to learn","In some cases, the project timeline is not properly thought through",Vice President - Technology,Current Employee,Madurai,"Apr 21, 2018"
1530,5.0,Vice President,"Excellent working culture, good values, encourage learning, supportive and career progression.",Remuneration package not up the market norm.,Anonymous Employee,Current Employee,Kuala Lumpur,"Jun 15, 2018"
1531,5.0,I worked at UOB Global Banknotes  I T,"Good Staff benefits ,  Well reputable bank",Management and Manager surfing Internet by bank pc during work hours cheating travel allowance cheating on-site visit record,Vice President,Former Employee,Hong Kong,"Jul 30, 2014"
1532,3.0,UOB Associate Officer,"You get a performance bonus, about 3-4 months on average. 5 and above for those who did well. There's also medical benefits, and claims up to 1k a year which you can take on holidays, or dental etc.",Not sure about the comparison on other banks but I heard that UOB pays lower than other local banks...,,Current Employe,,"Jan 7, 2016"
1533,2.0,Personal Banker,"Good benefits, high pay, just like all other banks. There is career opportunities anyway.","Toxic, backstabbing everywhere, from top management all the way to the bottom. All other banks' banker will try every single way to sabotage you  if you need to meet your client at their branch instead of yours. Life-less job, work almost 24-7, traditional and old method of engaging clients, hard-sell, force sell etc.",Anonymous Employee,Former Employe,,"Nov 28, 2019"
1534,4.0,Like a Family,Family-oriented culture and collegues are easy to work with. Plenty of training and development programs for staff.,Business changes too fast for the older staff to adapt. Expectation of management and staff not met in the changes. Not the best pay master and pay structure in the market.,Senior Officer/Business Banking Associate,Former Employee,Singapore,"Sep 10, 2012"
1535,3.0,Offers job stability for employees who perform well,Job stability - there were no retrenchments or mass layoffs even amidst the financial crisis and even when other banks and organisations were doing it.,"Some departments tend to be bureaucratic and very traditional which could limit the creativity and freedom of the employees. 
Limited training and self-development offered for employees.",Assistant Vice President,Former Employee,Singapore,"Feb 19, 2013"
1536,3.0,Legacy that needs some refresh,"The general work-life balance and employee benefits are pretty great.
Company culture is family-like and warm (depending on department and team).","No real culture of meritocracy therefore breeding a culture that looks to their staff doing ""non-core work"" to gain career advantages.",Assistant Vice President,Former Employee,Singapore,"Feb 3, 2016"
1537,3.0,Sales role update,Provide job stability. Colleagues are generally helpful and willing to share tips on how to get things done. Opportunity to learn from senior from other department.,Wayang culture. Need to do a lot of ECA to get in good books of the bosses. Be prepared to participate in all kind of events that are outside your job scopes.,Business Manager,Current Employee,Singapore,"Mar 26, 2017"
1538,3.0,Low progression but can be comfortable (depending),Bonus pretty good compared to many other companies in general. Can be comfortable to stay for long term depending on department,"Career progression (promotion) is very poor. Can be very toxic if landed in the wrong department. Old values, lots of older generation employee, low tech firm, very paper based environment. Limited benefits other than bonus.",Senior Officer,Former Employee,Singapore,"Mar 12, 2019"
1539,4.0,Good company offer job stability,"job stability, lots of opportunities to learn and improve, decent pay and bonus, reasonable work life balance","backwards system, everything is manual, culture is not receptive to change as many employees work for many years stay in their comfort zones",Fvp,Current Employee,Singapore,"Jun 3, 2017"
1540,2.0,Non Singaporeans,Bonus structure is appealing as an employee who is receiving an average rating will probably receive 3 month's bonus.,"Business culture here is incredibly difficult to adapt to, particularly as a foreigner who has worked for bigger MNCs.",Senior Business A,Current Employe,Singapore,"Jul 9, 2017"
1541,1.0,Relationship Manager,Helps to build character such as patience and resilience,Extremely traditional with processes that are 10 years behind everyone else. Bad culture and no trust between cross-functional departments/ colleagues. People do not take ownership of what they do at all and no drive for improvement. Which results in stupidity.,Relationship Manager,Former Employee,,"Oct 17, 2018"
1542,3.0,Stepping stone into Banking industry,"Manageable work-life balance.
Fun-loving colleagues.
Pretty stable job.","Basic salary below market rate as compare to other local and foreign banks.
Low emphasis on training.
Rather slow career progress and recognition on work performance, and its dependable on the team lead and manager you work with.",Bank Officer,Former Employee,Singapore,"Aug 20, 2014"
1543,3.0,Client Acquisition Manager,Pretty good commission/incentive scheme. Good for entry level candidates but not for experienced professionals.,Negative culture. Cross competition brings much misunderstandings due to the nature of the role. Definitely need to have a proper modus operandi in order for the sales management to look beyond the numbers.,Anonymous Employee,Current Employe,Singapore,"May 3, 2017"
1544,5.0,Trying times a true judge of firm's character,"Always do 'right by you' when the times are tough
Pay-for-performance philosophy
Commitment to upskilling its workforce
Great human beings as colleagues","Typical challenges faced by large organizations (e.g. slower decision making, hierarchical, etc.)",Human Resources,Current Employee,Singapore,"Mar 25, 2020"
1545,3.0,Great place to build experience,Bank that goes after rational and sustainable growth.,Annual salary increment is slow and bonuses are nothing to shout about.,,Current Employe,,"Dec 10, 2010"
1546,1.0,Zero rest,"Local bank. United Overseas Bank has a loyal, wide and established customers which provide a constant stream of potential revenue","If you are under a black-listed manager, you can forget about career advancement. United Overseas Bank is a very traditional bank, hence they are still entrenched in their ways, forward looking employees have to adapt.",Personal Banker,Former Employe,,"May 5, 2011"
1547,4.0,UOB Good employer,it is a growing organisation and gives ample support to employees to perform to the fullest,Since its a growing organisation the operations are not completely set up and also lot of work is manual due to which quite a lot of time gets utilised on manual preparation of reports,Manager,Former Employee,Mumbai,"Jan 11, 2016"
1548,3.0,"truly local bank, values only for advertisement","Stable local bank, ok benefits, good location,","reactive management, businesses are locally focussed",Anonymous Employee,Current Employe,,"Jan 24, 2016"
1549,4.0,good,i feel that it is good working for UOB because it is family oriented and employees are treated fairly and with respect.,Sometimes the management can micromanage too much. the organisation can be pretty hierarchical and things are very slow to change.,Anonymous Employee,Former Employe,,"Oct 22, 2016"
1550,3.0,Relationship Manager,Plenty to learn about all the bank product and services.  Collaborations with overseas branches are excellent. Very supportive business or team heads.,"Too much office politics which affects healthy competition within each team.  Paper work is overwhelming for target  driven roles, therefore be prepared to work long hours. Red tape between departments restrict effective flow of work.",Anonymous Employee,Former Employee,Singapore,"Jun 1, 2018"
1551,2.0,Good learning place and work life balance,Friendly and helpful colleagues. Good learning place for someone who is interested to go into a new area.,Very little training opportunities. Slow progression as there is not much rotation and promotion is based on years of service. Not much guidance given by senior managemet creating a knowledge gap between the senior management and junior staffs.,,Current Employe,,"Oct 13, 2014"
1552,3.0,Summer Intern,"Supportive colleagues, the mentor was very willing to share his experience and knowledge. Was given various kinds of jobs to do, allowed me to learn and understand the operations within the department.",The HR staff were not kind. They sort of stereotyped the interns are immature and they always give out orders and would not allow the interns to express their ideas.,,Former Employe,,"Aug 16, 2015"
1553,1.0,No work balance,"i have learned some skills that are beyond my exterpise, thus, i gained additional expertise that i can use in the future.","too much work for a single employee. i do multiple functions. instead of a manager managing several staffs, as a staff, i am the one managing several managers. i've got a lot of bosses all around me, each with different tasks/projects demanding from me.",,Current Employe,,"May 14, 2016"
1554,3.0,Much more to learn,"Very good and helpful colleagues, good front line team work, driven to do our best. Always learning new things everyday.","Feels underpaid, can be KPI driven, management might use bonus and evaluation performance often as a tool to drive KPIs.",Customer Service Officer,Current Employee,Singapore,"Feb 5, 2014"
1555,4.0,Manager,"Overall good Organization culture, family oriented business, benefits are standard, great support from management when required","High work load with Long working hours. Improvement on work life balance, family oriented facilities N child care benefit.",Anonymous Employee,Current Employee,,"Jan 11, 2016"
1556,3.0,Senior Officer,"Relaxing Atmosphere, nice people, free drinks, close to the MRT. A lot of food nearby. Got company insurance and dont have to pay for your medic.","Boring tasks, no chance to get promote, daily job is repeating and contract worker always feel being treat unfairly, head count fixed, VP onwards salary fixed.",Senior Officer,Current Employe,Singapore,"Mar 8, 2016"
1557,3.0,Too comfortable for your own good,"- Very friendly environment with many workers being long time employees; family culture
- Expected working hours are kept to, less overtime","- Too comfortable for own good
- Out of date management styles and company structures
- Employees inertia to strive for excellence",Employee,Former Employee,Singapore,"Dec 30, 2016"
1558,1.0,"Bad culture, worst remuneration package",Good colleagues (depends on team) as mostly had to go thru bad times together hence you are very united with your colleagues. colleagues are willing to teach.,"Almost non-existence commission remuneration for mortgage bankers, your weekends will be packed with showflats, no worklife balance, low or non-existence of commission achievable.  Extreme micro-management from top down with PIP program that will blackmark you in your HR file, hence you will work for volumes but with little/no commission.",Mortgage Specialist,Former Employee,Singapore,"Aug 2, 2017"
1559,3.0,Good but not great,Team members are great across the bank. Willing to work well together. Many opportunities given if willing to take them.,A little inefficient. Systems are not up to date. Too many legacy issues. System are unstable and we can’t go about doing our day to day jobs efficiently,Front Office,Current Employee,,"Oct 28, 2017"
1560,4.0,Vice President,"Balanced work, senior management directive to adoption of changes as per international market., positive attitude , lot of in company experienced people to learn from","Employees attitude to changes, missing in defined processes, lack of ownership in employees",Anonymous Employee,Former Employee,Singapore,"Mar 24, 2018"
1561,5.0,Relationship Manager,Great working environment to develop the career path,The working structure was complex and the products were not focused on customer. Sometime bonus could down the mood.,Anonymous Employee,Former Employe,,"Mar 31, 2019"
1562,5.0,Long working hr,"nice colleagues, good pay n benefits","Long working hours, may assign u to the beach that is far from ur house",Service Executive,Current Employee,Singapore,"May 5, 2019"
1563,5.0,A good company with culture,"-Very structured organization
-Large project across markets
-Learning opportunity is great","-Employee benefits need to improve
-Work life balance need to improve",Anonymous Employee,Former Employe,Singapore,"May 24, 2019"
1564,4.0,Service Associates,"Excellent Benefit , leaves and medical allowances,   Trying to emphasise on work life balance and empowerment of staff",Promotion  and career growth is very limited,Service Associate,Former Employee,"Orchard, ","Sep 17, 2019"
1565,1.0,Not recommended,Can't think of anything positive except some of the colleagues are really nice and pay is on time.,"Working environment/ culture/ politics are really bad - Didn't think much about it when working for them as it was my first job and at times even doubt myself as being too ""strawberry"" however after i left and now compare to my current workplace, I then see how a proper workplace should be like. 
Regarding work process, people are not taking responsibility in their stuff which issues pointed out are not rectify and are usually swept under the carpet.",Branch Senior Officer,Former Employe,,"Nov 23, 2019"
1566,4.0,Learning opportunity abounds,"Good place to learn everything, and explore your career direction","Compensation is below par, long hours",Assistant Vice President,Current Employee,Singapore,"Jul 20, 2013"
1567,4.0,Good Working Culture,Great learning materials as they call it University of Banking,People are not the most friendly and dont go out of your way to feel welcome,,Former Employe,,"Jul 14, 2016"
1568,4.0,Satisfactory,Not very rewarding but it's a gateway for fresh graduates to see the world of banking,Good mentorship seems to be lacking,,Former Employe,,"May 20, 2011"
1569,3.0,Very outgoing team members who are willing to share their experiences,"Colleagues are very helpful and the environment is very comfortable. They are willing to open up and share their experiences with me even though I am only contracted to the team for 6 months. They show sincere concern about the workload they give me and often ask me about how I feel about my work. In previous temporary jobs, they just try to overload you without any cares",Within teams it is ok but not much inter-department interaction.,Part Time Bank Staff,Current Employee,Singapore,"Apr 9, 2013"
1570,4.0,Good place to work,Good salary and bonus. People are friendly and easy to work with.,Busy working environment and don't have work/life balance.,Associate Officer,Former Employee,Singapore,"Nov 22, 2015"
1571,3.0,UOB Credit Analyst,"nice office, free drinks, helpful colleagues, good benefits (21 AL, medical, flexi 2)","lots of compulsory CCAs, pay is much lower than market rate, some supervisors are there purely due to loyalty and not job skill.",Anonymous Employee,Former Employee,,"Jul 29, 2019"
1572,3.0,AVP,Good working environment with supportive colleagues in the department. Salary ok and bonus is good.,Processes and technology needs to be improved. How to do more with less when technology is so restrictive?,Assistant Vice President,Current Employee,Singapore,"Jul 30, 2014"
1573,2.0,Business Development Manager,Salary increments every year. Good and long time contacts within the bank ensures your survivability,Capped % salary increments. Sometimes it is hard to get things done if you do not know the right people.,Anonymous Employee,Current Employe,,"May 19, 2016"
1574,3.0,Good place to work,"Family like culture,  room to learn and grow, strong values, good work life balance, helpful colleagues and bosses, values long term goals","Conservative, knowledge resides with individuals as opposed to a formal document that can be passed on, change takes quite awhile",Senior Officer,Current Employee,Singapore,"Mar 22, 2018"
1575,2.0,Toxic management. Hardworking people are being overlooked,"Family-culture, cosy environment between colleagues",A management who prizes highly their own recognition and credit than anything else; biasedness is the constant and not everyone who works hard get what they want. Unprofessional bosses who speak Hokkien vulgarities.,Anonymous Employee,Current Employe,,"Mar 30, 2018"
1576,4.0,Manager,Great company to work in.  I have enjoyed my 9 years there.,Never thought of that then while in the bank and now almost 5 years after.,Manager,Former Employee,Singapore,"Oct 30, 2019"
1577,3.0,Just not myself !,- The company looks strong financially that make your job very secure,"- The  operating system is quite old in banking business
- No flexibility in term of initiatives - everything must be approved by HQ in Singapore",Branch Management Trainee,Former Employee,Bangkok,"Oct 4, 2012"
1578,5.0,Client acquisition manager,"Nice compensation, and work life balance office life","Lack of people development, be more diligent to your talent inside rather than outside",Anonymous Employee,Former Employe,,"Jun 18, 2016"
1579,3.0,Training,Family oriented. People talk to one another. There is cooperation in departments,Top management tends to be distant from employees. Human capital are handled as assets to bring revenue. Not much career advancement.,Employee,Current Employee,Singapore,"Aug 30, 2016"
